rating,review
1,Buy batteries from a Retailer you know.  I have purchased batteries that appear to be the Name Brand they say at an extreme reduced cost.  The batteries last a few hours only in any electronic even those not needing much power/usage.  YOU GET WHAT YOU PAY FOR.  I just spent 70.00 on the real deal with an expiration date as so many Xmas products use these batteries.
5,One cannot go wrong for the price. Even if they do not last as long as some others the price and convenience of having them handy are reason enough for the purchase.
5,If you have Pittsburgh tool digital calipers from harbor freight these are the perfect replacment batteries for it. A 10 pack should last longer then the calipers themselves.
5,Happy with
5,Good
5,I tried to find these batteries in several different stores with no luck. I went to Amazon online and found just what I needed for a reasonable price. thanks
5,Perfect!
5,perfect for my tealights!
5,You can not buy these in bulk not saying 10 is bulk but that is the most I have found. More and more are requiring these type of batteries.
5,Great product at a great price
5,Like it should
4,cheapest way to buy batteries
5,Work great!
2,The date on package was 2018. I ordered in 2020.
5,AS ADDVERTISED AND TIMELY SHIPPING
5,Perfect!
5,These batteries work well and are much cheaper than in the store. I will definitely be purchasing these again!
5,Exactly as expected.
5,I love you and these batteries they keep my things working and alive. I usually bury my products after it dies but batteries saved their lives. TYBG
3,The batteries seem to be O.K. but I don't like the packaging. There is no expiration date so I can't tell how long they will last. The voltage seems to be too low.
5,Great price. I bought more batteries than I needed because the overall price was cheaper than 1/2 or less batteries from other sources.
5,... And they work. They arrived in a blister pack and have a current freshness date... Perfect for my key chain light and my grandson's Monster Mutt!!!
2,These must be old. This is the second time I have bought them and they do not last long. Will not buy again.
5,I needed these for my jewelry caliper and I couldn't find them in any store.  Thank you so much.  The 10 pak is perfect.
5,The batteries were packaged well and I had no problem with them.
5,Not much to say except it does the job.  The time of delivery was great and it matched the item that need the battery perfectly.
4,fixed up my birds
4,They work
5,As described.  Fast delivery.
5,l Name Brand and Price
4,It works
5,Great batteries fast delivery
1,14 month expiration date (usually 7 year)Slow to ship. Took 10 days.Chinese crap. Possibly fakesI guess you should have let my 2-star rating stand. I received them & now I really know they are junk. This is Amazon’s fault because there are several people reporting the same thing & they are still marketing these things.
3,I was hoping on getting them sooner then they arrived.  Haven't tried them since they were for something Christmas and I won't need them till next yr.
5,Again I had a lot of Christmas things that ran on this size battery so I bought a card of them I feel it was a good-buy!
5,Actually the batteries arrived on time.  I am very happy with the purchase. My last experience was not a good one.
5,I've ordered many times over many years. Radio shack have similarbatteries. But they are cheap and expensive. Highly recommend thisnon description bulk brand from Amazon.
5,They work!
3,Very handy battery size.. Can beat the price.. I just got them so battery life has not been tested.. Watch this spot IF they turn out poor  Ike
5,Exactly as they are  Energizer batteries & they are great . I would recommend them  yes .
5,Glad I could fine these batteries. The alarm clock I have is very old and I really did not think I could get them.
4,OK
5,I bought the pack for one instrument and it turns out they fit three I use regularly.  I doesn't get any better than that.
5,These work as good as any you can buy in the store their name brand and you get them a lot cheaper by buying in bulk
5,Great product!  Comes in a blister pack. My son loves hex bugs and they eat batteries like crazy!  Great cheap product.
4,AWESOME AVAILBUILTY......EXACT 4 REPLACEMENT BATTERYS
5,great service and product.  arrived in time and was exactly as advertised
5,as anounced
5,Came quick and was exactly what I needed. Would buy again.
5,So much cheaper than ordering them in single or double packs in the store - work great and arrived as promised.
5,They worked.
5,GREAT I havn't used them yet.. But they seemed like a fair price so I ordered them just to have at home for spares
5,great value - just wish I could remember which devices require this battery since I now have a glut of them.
5,Is as advertised.
5,Gret
1,I ordered these one year ago and they are all dead today. They should have a 3 year shelf life. They had “use by 2023” on the package. But they didn’t make it to April 2020. Thanks China and  Eveready.
5,Each cell is individually bagged and contained in a larger zip lock bag.  Makes using the cells and keeping track of the remainder very easy compared to standard retail packaging.
5,Received the 10 pack of batteries. They were as advertised. Was able to replace all the batteries in my electronic devices that were weak.
5,Yes
5,Very good and price was great just what I needed thanks
5,No problems using this in my device.  As I recall all the batteries were fully charged.  What more can I say.
5,Nothing bad to say.They are Energizers and they did - and do - the job. Wish they had a variety pak!!
1,Had 2 of these explode. 1 was in a device when I heard something like a rifle shot. Other was already used in ready to be thrown out. Never had this happen before.
5,Received and worked great in my digital caliper.
2,These did not have lasting power in my opinion
5,works
5,For use in HP12C calculator.  Performs well.  Totally satisfied.
5,Made my 20-plus year old calculator come back to life.
5,just waht we needed to keep our cats happy with the lazer dot
5,Quality Batteries that served my need and were a good value.
3,They didn't work with what I wanted them to work with but I've found other items that can use them
1,Buyer beware. The picture with this item is brutally honest. You do NOT get a card with 10 batteries blister packed on it for ease of identification and storage. What you get is a zip lock bag of batteries. What a royal pain in the nether regions.In addition of the ten batteries three were below nominal voltage. Yes seven batteries measured at 1.6 volts but three (30%) had already lost over 12% of their charge.I really don't need this kind of fustration in my life!
5,Excellent product. The battery life is great especially since I have tried my share of brands. Prompt delivery and a very satisfied customer. Thank you!
5,Was the right battery and did the job.
5,It is a coin cell. It worked. What more can one say? They have more personality than other similar batteries?
5,Product came as described on time and in great packaging. Everything totally as expected good value for the money indeed.
5,Batteries were contained in the shown blister pack and Energizer branded. Arrived on time. I have no complaints.
5,Batteries work great just has I expected that they would in my device.  I can not ask for more that that.
5,purchased on line because much cheaper then in the stores worked great for childrens toys that i was giivng as a gift
1,None of the batteries worked when I put it in my daughter’s toy. The toy previously worked prior to the batteries dying that came came with the toy. Amazon doesn’t allow returns for them either. Mine was packaged as stated in the blister pack.
5,What's there to say?  It's a great replacement battery that arrived on time.  Sure is cheaper than buying from a store like Radio Shack.
3,It is a battery and it works.  There isn't much else to say.
5,good batteries and priced fairly
5,Great deal if you need multiple similar sized batteries.  Much better than paying three times this amount at the local store for one battery.
1,Battery  only  lasted  one  day.  Seemed  to  get  batteries  that  was  left  on  a  shelf  for  a  year
5,Received it as scheduledI plugged it into my calculator and it worked good as advertisedNo complaints for this product.
5,Bought these for my granddaughter very glad to get such a good deal gonna need them for her bird Polly.
5,Nothing beats a good deal for a brand name product. The batteries come individually bagged in little zip-lock style baggies. Strange but effective.
5,Outstanding replacement for watches
5,Exactly as advertised and seem to be holding up just fine.
5,just as described.
5,Excellent.  The worked perfectly and they are still going.  Quality batteries are the way to go.
5,It's a battery...what can you say; it fits...will see how long it lasts; optimistic that all will be good and durable.
5,Good price works great.
5,Arrived promptly; exactly as advertized.
1,I purchased a fold up cane with a light from Amazon. it was supposed to come with battery's. It did not and the l 44 Button Cell's I ordered and just received do not work. Very unhappy with both purchases.
5,very reasonable price
5,I was happy to get  these because individually in stores they are so expensive.
5,Just what my device needed to run properly.  Fair price for batteries and shipping.
5,The batteries were perfect for which I ordered them and arrived before the projected arrival date.
5,A great value lasts as long as name brand batteries.  You won't be disappointed.
5,Wow what a battery!!! It is electric in property how can you wow wow the cow cow???
5,BATTERY RECD ON TIME AND AS AGREED WITHOUT ANY PROBLEMS EXCEPT I ORDERED THE WRONG BATTERY.
1,Each of these batteries lasted 4-6 hours.  After purchasing a more expensive version the batteries are now lasting 30+ hours.  My conclusion is that these are counterfeit or very very old.
5,I use a lot of these and the price is right!
5,They are disc batteries. They replace other disc batteries that have lost charge. They work.
5,had ordered batteries before and some were not fully charged or even dead -- these were all charged and was very happy..
5,Purchased these to fit our clocks.  Fit perfectly and work very nicely.  Will most likely be ordering them again!  Thanks
5,Packaging is very convenient.  Batteries seem to be more uniform but not longer life.
1,Bought these to replace batteries in a child's walkie talkies set only one is working.. only 4good batteries from what I can tell. Put the four in the non-working one and the non-working one worked.. so yeah not very happy
2,Use by date is 2020.  Only 15 months away!
3,You don't know how old these are nor how long they will last.
5,Voltage according to specs on-time delivery good price
5,I have used many batteries and this one by far outlasts the rest.
2,Got it with 2020 expiration date. Usually get 5-7 years.
5,I was a little skeptical after reading some reviews but these have been perfect.
5,Good batterys
5,Batteries work fine.
5,Work Great
5,Totally satisfied with purchase.
5,This battery is used in watches and many children toys. The product was delivered as detailed in the product description.
5,Great
5,These are good quality and last a lot longer than the cheapies!
1,I tested every one of these batteries with an Amprobe BAT-250 Battery Tester which has always been extremely accurate for me.  Only 2 out of the 10 batteries tested good.  Don't waste your time with these.  There is no date on the package but I'm guessing these are either OLD or FAKE!!
5,batteries worked great
5,Totally powers electronics that need one or more 1.5v button batteries.
1,I bought this item because it was "Amazon's Choice".The batteries tested 'low' upon arrival and did not power my clock.Check your sellers Amazon. Buyer beware!
5,These replacements fit well and provided enough power for a book reading light
5,The price is great for these batteries.
5,excellent
5,Work great and shipped fast.
5,much less expensive than the llocal hdw.
5,Just what I needed for a good price!
5,Worked for my daughters singing princesses so it makes mommy happy :)
5,Very cost effective replacement batteries.
5,Thanks for the great price and fast delivery guys  you're the best.
5,Really good value.  It seems every child's toy needs these!
5,They're batteries and they work.  End of review.
5,The button cell batteries worked out perfectly will have to re-order soon.
5,Work as expected with a bargain price
5,Great
5,great to have
5,like
5,All the batteries have worked great with no problems.
5,Works as advertised.
5,Great price!!!  So  much more expensive in the store.
5,They work as expected.
5,Great value. last as long as expensive competition. fast delivery.
5,I go through lots of these it seems
5,Good battery right size good quantity for the price.
5,They came in handy when my unit needed batteries
5,Arrived on time.
5,Item delivered on time was as described
5,Good batteries.
5,Work for what I needed
5,I like to get these in bulk
5,Order came super fast. Batteries worked like a charm.
5,Powers the cats lasers; they love it!
5,works fine
5,It was great to find these batteries so easily.
5,Good batteries.  Quick delivery (as expected).
5,Great little batteries
5,Received as described in a timely manner.
3,received
5,Great price!
5,Works well with holiday lights.
3,Good
5,They are the best !
1,Unlike many other reviewers I received the 10 batteries in the proper packaging. However they are not full-power and measure only 40% right out of the packaging using my ZTS battery tester. Disappointing.
5,Shipped fast and performed as expected.
5,Like to have extras on hand.
1,This battery was listed as a compatible with one I needed to replace but was not.While it fits the spot it was not the correct battery that was listed.
5,They were fresh and work great.
5,Worked like they were supposed to.
5,A++++++++
5,Very good deal fast delivery
5,Good batteries at a reasonable price.
5,Used most of them already.
5,Worked great. Good value
5,Delivered promptly.. and product highly satisfactory
5,Gret product for the price.
1,Loose batteries in a ziplock bag not sure if they worked. Could have been a bad toy I used them in and not the batteries but I won't purchase them again.
2,I bought these batteries as a replacement in a dog toy. After 3 days they quit working.
5,item as described arrived as stated.
5,Excellent value for the money!
5,Good stuff
5,Good price... works fine.
5,Work as is expected!
5,Quick delivery good price.
5,Very Good
5,USED IN TIRE PRESSURE GAUGE
5,This was a super buy!
5,As advertised and good price
5,good deal - no problems
1,batteries are most likely used.  ordered 10 none worked. threw them in the garbage. dont waste your money.  do not buy.
5,They work and that's great
5,GOOD PRICE
5,Came as advertised.
5,Working great
5,Thank you.
5,Received as advertised. Good deal.
2,Was missing 2 of the batteries like someone just ripped them off the package.
5,Couldn't believe the price!
5,Great deal!
5,Works well. Very simple.
5,They are great.
5,Great deal
5,a
5,great
5,great prices
5,Powered up great.
5,Great price!
5,Works great. Great value.
5,They work
5,would purchace again
5,good
5,great batterys
5,Supply ready.
5,Great price!
5,great product
5,Buzz buzz
5,Good
5,Perfect!
5,Great deal
5,Nice.
5,GREAT VALUE
2,It's the wrong size : (
5,aok
2,The batteries seem ok  the package says in bold letters Made in USA but the batteries say made in China. Shame on Energizer.
5,Good
2,Not Energizer as advertised!! On the plus side I got blister packs of Maxell batteries.
5,good
5,Great
5,nice
1,Almost dead when they came. Used in recordable pen. Not enough to power it more than 2 minutes.
1,I got a lot of cheap unusable batteries. "you get what you pay for"
2,Done!
2,batteries went out very quickly
1,Do not buy these batteries. They are fake!
1,I got an empty package today. I didn’t get my order.
1,be aware that LR44 is NOT a replacement for SR44.
1,Received and all were no good!
1,I am trying to email but it isn't finding my last order.  My batteries are already weak.  What can you do for me?
1,First three out of beat-up package were either at low or zero charge.  Big waste of time.
1,They were dead batteries re-sealed or past their shelf life. Did not work.
1,dead dead dead
4,OK
1,What a ripoff! Substandard low performing loose packaged batteries in a plastic sandwich bag. Real piece of crap along with the seller. Buy nothing from this cheat!I received these as a gift from a relative who had no idea of the crap he purchased although he meant well. I only found out as he included his receipt.
5,Replacement battery works perfectly as described
5,Nice price for this style of battery
5,WHat? They fit hearing amplifiers and some remote controls and are cheaper here than buying in a store.
5,I have these for several devices.  Everyone works with a full charge.
5,Just what I was looking for.  Some times these batteries are hard to find.  This was easy.
5,Cheaper to repair toys then replace.
1,1) LR44 is a Maxell number - NOT an Energizer number.2) Where is the Energizer packaging?3) LR44 is an alkaline battery and NOT a silver-oxide battery - alkaline has 1/3 the capacity of silver oxide.4) For this reason many of the applications given  - such as 303 357 - are INVALID !
1,Same experience as other buyers - bad packaging and the batteries did not work for two of the toys that take G13A cell type. Returning..
1,IT"S WORTHLESS.
5,Bought these for a digital tire pressure gauge.  Changed out batteries and have used the gauge quite extensively.  Gauge works fine with these batteries but have not used it long enough to tell about life.  Original batteries lasted about 2 years.
5,GREAT PRICEWORKS JUST FINE.
5,We’ll see if these maid in China batteries last.
5,Great
5,Definitely a money saver. I go thru these pretty quick in caliper at work.
1,They ripped me off for 2 batteries! There were supposed to be 6 in a pack and when I opened them their were only 4 batteries!
5,Great!
1,DOA- I tested mine after sewing three into a plush toy I had to take apart. When the second toy didn't work I checked the batteries. Imagine my disappointment to find that ALL the rest are nearly out of juice. These were Energizers so I thought I was safe. Next time I'll go to a real battery story.
5,The batteries are made by Energizer and each one is individually packed - thus they should last unused for a long time.  The two batteries I used immediately were fully charged and restored the functionality of my device that uses them.
5,Just as advertised
5,Good replacement batteries and they replace many sizes so I buy fewer sizes which saves me needless expense.
5,Très bon prix pour l'original
1,This product has extremely idiotic packaging! The blister is SEALED WITH ALUMINUM FOIL WHICH CONDUCTS THE CURRENT ! From the inside it is covered with a thin polymer film but during transportation it can rub and short the battery. So the presence of dead batteries in this package is not some miracle. I think it's fake Energizer.
1,Looks like an offshore knockoff.  Too many typos and poor English on packaging to be authentic Energizer product. Several dead batteries in package. Disappointed.
1,Would give a zero rating on overall and value for money.  The batteries last for a couple of hours at most.  Used the whole pack (10) in a very short period.  They are not L44 replacements. The old batteries lasted for many hours of use over several Christmas’s.  Very environmentally unfriendly and a waste of $.  Bigger problem is that I do not have batteries to replace the old L44’s!
5,Parfait exemple pour le bénéfice du magasinage en ligne pour élargir l'horizon des possibilités...  Normalement ces piles je les trouvais et d'une bonne qualité/état neuf/pas trop vieilli sur les tablettes à l'unité pour un prix 4-5 fois plus élevé dans notre magasin La Source local.  J'ai eut ce lot de 10 pour le prix de 2...  Vaut la peine.  Réception rapide.
5,I like the blister pack style packaging of these. Nothing to complain about they work just fine and they seem to last a long time. I had tried to buy these at my local pharmacy and hardware store but both were out of this size battery. Amazon is always good for having items like this in their inventory so I'm glad I came online to get these.Always keep extra batteries of all sizes on hand ladies and gents!
5,Got those for Garmin Vector 3 pedals for my bike. Perfect replacement pedals are happy and I can track my power use again when I train. The LR are preferred over the SR for Garmin Vector as per the manufacturer's specs that's why I got those instead of SR.
5,We have used two of the batteries for about 10 months and so far no issues.  It fits our CR44 tools.  No complaints given we paid less than $15 for 10 batteries.  I am not sure how long is the shelf life of these batteries are - couldn't find the "good until" date.  Without the date I wouldn't pay more than $25 for 10.
5,A battery-operated Christmas decoration lost its power and I thought I wouldn’t be able to replace them as they were quite unusual and I couldn’t find them at Canadian Tire. Got them on Amazon and my Star Trek Wrath of Khan is working again. Yahoo!
5,These Energizer batteries are on par with Duracell in quality and a little bit cheaper. I have reordered them twice. Every battery I've used tests at 1.5V and higher. And like the Bunny they just keep going and going and going! LOL.
1,Après seulement 1h30 les piles étaient trop faible pour faire allumer une LED. Sur la photo les piles sont neuvesAfter only 1 hour and 30 minutes the batteries were too weak to turn on an LED. On the picture the battery are new.
5,Jewellery store charged me $20 to change a watch battery $7 for the battery and it was a cheap Mallory battery!  I bought these and can do all my watches myself!!
3,I bought before it’s hit and miss as some batteries are dead and there is no expiry date so you’re never sure if they will work. But it’s much cheaper than in the store.
5,Lots of batteries for a low price. So far the batteries I've used have all worked and lasted a good while.
5,I bought these for work to use in digital calipers and they work great!
4,I go through these like water.  Need them for all the jewelery measuring equipment in the shop.  Calipers scales etc.  these seem to be the longest lasting batteries vs. Maxell Sony etc.  Just wished they lasted longer than they do.
5,Replaced the battery in my son's Thomas and Friends Wooden Railway toys. These fit perfectly.I bought 10 because he has quite a few of these trains that use batteries.Great value. Highly recommended
5,Battery works in my Mastercraft digital calipre.  Have not tested in anything else. Expiry date on the pack I received is 2022.
5,These work as expected and the price was exceptional.  They arrived via Canada Post in four days.
5,I bought these to replace the batteries in the pet alive lady bugs and electronic fish.  They are working well.  No issues
5,Who knew I use these batteries for practically all of my kids toys! These have come in handy more than once with my damanding instant gratification spoiled angels that are a product of my making. Thanks Amazon!
5,Good quality product and "fresh" per the expiry date. A little pricey but again quality name brand.
5,Just as advertised very inexpensive a single battery locally cost about half the total cost of this pack and arrived very fast!
5,Quality batteries at a bargain price and reliable shipping- what more do you need? I needed 3 batteries for a device and got these for less than the price of 3 and now I have spares!
5,Batteries. They work. And appear to be genuine. Running in low power device so it is hard to tell jow they will hold up.
5,So far batteries checked prior to use were good and with no early failure.
4,Works well in my remote starter for my car but not very long (half a year to a year maybe) for the price it's still very good.
4,Good but who needs 10 of them??? Would prefer a single or double pack.
5,Energizer... I trust the Bunny!Package was a little dusty I suppose from warehouse storage. Batteries were fine.
5,Work good for now the package was in good shape and they are working in my meter without any trouble.
5,Only used one for a glow at night LED dog collar then the dogs were playing and ripped the collar apart! The one was used for a 2-3 hours and lasted that long. That’s all I can tell you.
5,These cost approximately $1 each whereas when you need 3 @$5.49 each that is very pricey for a little mini flashlight.
3,I was not able to use the batteries. Although 1.5V they didn't fit the item I needed them for.
5,did as expected. A couple dead batteries no biggy
5,quick shippingfit grand daughters toys perfectly!
5,Exactly the battery I needed and fast shipping !
5,Parfait pour le pointeur laser de mon chat.
4,They're batteries.  Will see how long it will last
5,Great quality batteries well packaged really brought my son's Hexbug toys back to life. Will definitely buy these again as they are very much superior to the Maxell batteries we were buying before.
5,I purchased these for a great price! I certainly didn’t need a pack of 10 but it’s hard to go wrong at this price. Battery life has been good so far. Would recommend.
5,so far seems alright.  Expiration date on the package is 2022.  Very good buy for the price.
5,Nothing to say. Just batteries..... probably wont open the package for another 3 years.
5,comme je pensais bien pour le prix
5,Great product and Best seller +++++
5,Bought this battery pack for multiple kids toys.  They work great.
5,The product was as advertised and delivery was prompt.
5,Exactly what I was looking for
