rating,review
5,always liked the battery. excited to get them at this price.
4,Hard to give it 5 stars because they are not LR44 they are A76 which is interchangeable but not the same thing. They work though.
5,Toys and games
4,Good batteries
3,Battery runs down very quickly.
5,I have two nativity sets for my fireplace mantel.  Had them for at least 5 years and lighting went out this year.  Could not find this size battery at the local stores so thankful for Amazon to get them to me.
5,The batteries came blister package and there wasn’t anything to suggest they were fake but I figured I might as well load test them anyway. All 10 passed at 100% capacity.
2,I received ten individual blister packs instead of one pack of 10 batteries.  I wanted an easy to store single sheet of batteries but I now have store them in a box.  The battery type is correct and they expiration date is 1.7 years from the receiving date.
5,Price was great.
5,Good deal and arrived with all batteries in individual package thank you.
5,Battery Life
5,Works perfectly and has lasted throughout the season
3,Batteries are batteries but the packaging is not as represented.  I received 10 individually packaged batteries instead of the batteries being sent on a card as shown.  Makes storage more difficult. Sucks
5,I ordered a pack of 10 it from "my battery supplier". The packaging is a little unorthodox. It was individually packed in small zip lock bags. Something I would expect if I was packing these at home not necessarily a confidence booster.Now it is possible that the seller is buying these in bulk and creating small packages to offer good value which I of course don't mind and actually like. The only thing is that I don't have a way to test the status of the batteries (I don't have a testing instrument yet).I have put these in some toys and books and will have to make a loose judgement based on how long these last. I'll try to come back and update the review if it stands out (too short or too long).Update Nov 16 2012I finally got a voltmeter (multimeter) to check these batteries. I had already used 3. Of the 7 remaining 5 showed me 1.54 volts and 2 showed 1.48.The three that I did use lasted significantly longer (probably 3 times) than the cheaper ones that I used earlier   3 Pack MAXELL AG13 LR44 A76 357 Alkaline Button Cell battery        . If you're curious I used it for the "Hex Bugs".
1,According to the provided information the LR44 replaces the A76 & several others. Maybe it does but I don’t know for sure. Not sure which is the new version & which is the old. The picture in the original product information is of a 10 pack of LR44 batteries. What I got was 10 single packs of A76. Returned the original order & received the same single packs of A76. If this supplier only has an inventory of A76 batteries then that’s what should be pictured in the product description. If feel I’m a victim of a bait & switch mainly because if the LR44 replaces the A76 then this must be from a supply of old A76 inventory meaning the batteries are old & I have no idea how long they might last. Maybe they’re new & will last but I feel played. Tired of the BS so I’ll keep them & find out but I won’t buy product from this supplier again.
4,What can I say? Batteries are a commodity item.Make note of the 'use by' date on the back of the packages when you receive them.It's only a good value if you'll most likely use all 10 before they go flat.The use-by date on the ones they shipped me is 2023.
5,These are batteries what more is there to say.
4,It works fine on my old point and shoot film camera.
4,Needed batteries for my Laser Pointer. We use the pointers to exercises our cats.  Thses batteries fit perfectly and so far seem to last.  Put the in the pointer and the pointer work.  They were a little less expenses on Amazon then elsewhere.
2,The typical shelf life for Energizer LR44 batteries is 8-10 years. The batteries I received have only 2 years remaining. I wouldn’t mind if the seller were clear about selling old stock but I don’t appreciate receiving inventory with 80% of its shelf life already used up.
5,I thought the batteries I was sent were wrong but I learned that they are a replacement fir my brand thank you I love energizer
5,seems need batteries for everything.  i guess that is green living but still have to be made. just want yhings made in the USA
5,I have two small flashlights that I really like but that require these batteries and I find them difficult to locate locally except for a local so-called battery store where the "help" is virtually non-existent and they don't normally carry this size. They say they don't sell enough of them to justify stocking on a regular basis. I suggested that maybe if they stocked them on a regular basis they might sell enough to justify the stocking. I don't think they got it but enough of my problems.These batteries are priced less at Amazon than the local store and they have them in stock and I had them in 2 days with Prime so all ended up well.You will want to be aware that the LR44 replace at least two dozen other battery numbers...same battery just different numbers.A good battery at a fair price with fast shipping.
5,Ten packs of 1 battery . Still 10 batteries so I am pleased considering how many kids toys take these batteries and you cant find them in stores.
5,Used this for granddaughters Christmas tree ornament. Batteries do no last long if left on for more than 8 hrs.
5,The kids' toys use these batteries three at a time.  At the store I think it cost $5 for 2.  At that rate the batteries cost more than the toy.  I love the batteries I bought online.  They are Energizer and not a generic brand.  They are so nicely packaged in little tiny plastic bags instead of that adult proof plastic.  The quality is great.  This is the second time I have ordered them because I didn't realize how many toys the kids had that used them.  I am the grandma and the kids always bring the toy over that won't work and ask me to fix it.  With these batteries I can fix it quick and a lot cheaper.
1,Got them for Fluent Pet buttons and within a day of replacing them they died.
4,Energizer use to make the best batteries.
5,Used these batteries in my wife's Skagen watch...up to now (1 month) the watch is still going...i suggest you get a watch repair kit from Amazon I've saved tens of dollars for wrist band adjustments and batteries changes.
1,Not only am I now reading reviews of dead batteries from everyone but these batteries are advertised as "watch batteries". The batteries are half the size of the watches and there's no markings on the watches as to what size battery to buy.So this is a waste of money two fold at least dead and wrong size batteries.No wonder Besos is touring space.
5,Needed this size battery for a Disney Slinky Dog toy. Looked all over and couldn’t find them anywhere until I checked Amazon. Perfect. And shipped immediately. My growers so happy to have Slinky working again
5,I wish they came in packages of 12.  Every window alarm in the house uses 4 button batteries each. I've used no-name large packages of these batteries but sometimes those packages contain many batteries DOA.  Energizer is a name I trust.  Please keep these away from children and pets both of whom seem to eat everything they can get into their mouths.
4,Not very familiar with the care and feeding of lithium batteries. But it was easy to replace and seems to be working to my satisfaction. The instructions are a bit intimidating.
1,Bought these because I needed LR44 battery and description said these replaced the LR44 however didn't work at all.
4,Great price for amount.
5,The batteries arrived quickly and I had my baby sharks (came without batteries) working perfectly.  I have no idea how long the batteries last but they seem to have good strength as the shark song is LOUD!
4,Convenient way to buy batteries
4,That is to say there are a surprising number of tools and items I have that use this size.  Note that these are the same as A76 and about 11 other "sizes" - batteries have such convoluted naming!  I have calipers calculators and other devices that use this size so a 10-pack doesn't last as long as you might think!
4,Positives: good price voltage measured at 1.53V on my multimeter.Negatives: Part of bulk package so did not include lot number or expiration date.  Generally brand new and fresh batteries often come in closer to 1.6V so I can conclude that these are not super fresh but at the same time they are good enough.
4,Exactly as described..great price!
2,Not as described or pictured I ordered a 10 pack of LR44 batteries and received 10 individual A76 batteries
5,These batteries work just like the ones they replaced. They look shiny (I have  always been fascinated by shiny things) and they fit into the same slot as the original batteries fit into.But most importantly they produce electric current.This makes as big difference. For example when my device first failed I unscrewed a nut from a bolt and placed it in the slot. It fit and it was also shiny but my device did not work.That is why these batteries are superior.
5,I think for the price its a great buy. I found a few things around the house that actually take these. I hope they last because my kids favorite toy a hatchamal takes 3 of them.
4,Great product for the value!  Thanks
1,These are NOT LR44 batteries. They are A76 batteries! Don't get tricked like I did!!!
5,10 pack was handy my flashlight takes 4 and I have 2 of them  the other one when into my digital caliper
5,Received just what I ordered and the batteries work.  Expect a long life from them.
4,They were correct.
5,As ordered. Good quality and good value.
5,Good value for the money. The charge seems to be sufficient and lasts as long as I expected.
5,Bargain in the 10 pack. These work in placee of A76 also. I have several things these work in- alarm clock Nikon 35mm SLR camera calculator. Pays to buy 10 at a time.
4,Good
5,Had to buy the bulk and received more than I needed but great price. One down side was batteries were in small plastic bags with no labeling but batteries themselves has the Energizer name and number on it.  I had to make a list of all batteries that this particular battery replaces and put in larger plastic bag so I would remember.
5,Energizer.. Duracell...energizer... all good and these prices are awesome
5,Energizer batteries is a good brand name to stick with.  The batteries were long lasting and shone a bright LED light through out the holiday season.  It's a good idea to have spares and at this price better than buying them signally.  They were delivered in two days very quick for the holiday season.  Very happy with my purchase.
4,Nice product
1,All of these batteries have a use by date 2024 which means they have sat on a shelf for over half of their useful life.  A little less than half of the batteries were under voltage by about 20 mV meaning they're useless. So the bargain for price paid and amount of actually useful batteries makes this a terrible deal.
1,All I can say is I bought these batteries to replace the dead ones in an ornament.  They don't work.  I suppose it's possible that something could be wrong with the ornament but I doubt that.
3,The energizer batteries come in a blister pack with Energizer on the front.  In larger letters on the back it lists EVEREADY Battery CoInc. St Louis MO 63164 Made in U.S.A.  Everything else on the blister pack is in Spanish.  Get this. Engraved  on every battery along with the battery number is the word China.  These are either knock offs or Eveready is seriously misrepresenting themselves. Time will tell how well they work.
5,This is a name brand product. I expect it to be excellent. It was.
5,great batteries.  Used them for the audio books that my boys have audio ornaments and other things.  Great price and they work well.
5,I was happy to be able to order these batteries online. They are exactly what I needed.
4,Seem good it is Energizer
3,It was a lot cheaper to purchase these batteries from Amazon then at the store.  I needed these for my daughters car seat toy and didn't want to spend $20+ on them at the store since it needed 3 of them.  I also like that I had extra batteries for when the current one's run out.
5,Delivered on time otherwise what else tosay. They’re Energizer batteries...they keep going...and going...
5,I'm using the batteries for Christmas lights and so far they are doing a great job keeping the lights glowing.
5,Name brand products for a great price. Quick shipping.
5,Yup. Toddler = music toys and trains = lots of batteries. I hate to waste and I wish I didn't make use of so many battery-operated pleasures for my guy but I can at least say that most of these toys have been gifts from others. So I feel less guilty. Long battery life. Good bulk price
5,I used this for my calculator which made it functional again. So far so good.
5,Bought on price arrived in 3 days with Prime. No made or life date came on blister pack.Can't recall which item these batteries go in. I had several products with dead batteries and order 8 different sizes and styles that are coming from different venders. Will up date after I test them for volts.product of China
5,What's to say they are batteries and last a long time lol.
3,I think the price was great but the "use before" date is 2020 and that means to me they have been on the shelf for some time.
5,Bought these for my father and he loves them. This is a good and economical way to buy hearing aid batteries. Will be buying more.
3,Most of the Batteries are either dead or die fast and are not even worth the trouble for the return.  Waste of money
5,I got 10 battries for the price I would have paid for 3
5,From Time to Time We need these Tab like Batteries for Our Acceseries and or Appliances. This is really the most convenient way to Buy them. Energizer Batteries are Long Lasting and reallly do get the Job done. Whether it's a Calculator or a Watch Energizer is the way to go!
5,Very good baytery
5,Bulk price on top quality batteries.  Highly recommended
4,ok
5,Speedy delivery. Song book now plays.
5,This item works as designed and I have not had any problems with it.
4,There isn't a lot to say about batteries but they were fresh packaged conveniently and at an excellent price.  The batteries are packaged in a single sheet but can be separated for convenient transport.
5,Great for the price
5,These batteries work perfectly for our vehicle remote and are hard to find locally.
5,Way better than having to go to the store and purchase! A lot cheaper!
5,These are such a great value ... high quality name brand batteries at the best price I've found. I have a number of small electronic items that use these and a ten pack is perfect.
5,It’s great
5,Very good battery !!
5,I needed this battery after going to a jewelery store to locate this battery and being sold a battery dated 2007 I turned to Amazon.  The price was inexpensive for this 10 pack and arrived quickly.  What more you can you ask for?  And yes substantially cheaper than that jewelry store!
5,Cheap and fast shipping
5,These batteries last a very long time and we probably will not have to buy any for a long time either. Thank you
4,nice
3,Product not as depicted in photo. The batteries came in individual tiny zip lock bags which were placed in a larger zip lock bag. It makes one think that this may be a cheap knock off.
5,Fine!  Stock up so you don't have to look for them in a store every time you need some.
5,At less than sixty cents each the price can't be beat.
5,Great price for a great product! Nicely packaged very pleased:)
4,Needed these batteries to power a laser bore-sighter hoping they hold up to what will be sporadic use.
4,Ordered for wife for one of her gizmos. Can't recall what & I doubt that she can either. Haven't heard any bi&@#ing so I have to assume they worked.
5,These are batteries. They work.  They are Energizers so the rabbit will run for a long time
3,I guess you get what you pay for.  These are good batteries - they all worked etc. - but they don't last as long as the more expensive ones.  I have no real complaints except that I had to change them out more frequently but that's not unexpected when you pay so little.
5,its what i waned and what it claimed to be for a great price win win as with most products from amazon and to top it off when there are problems i can actsully  get to talk to a humam and they take care of it win win win
4,Batteries worked fine as expected.
3,The button cell batteries are exactly as advertised so I rated them 'as expected'.
5,there working and seem to last
5,Fairly recent stock name brand off-shore alkaline. Great value.
5,very good product Thanks
5,Just what I needed couldn't fine this size batteries local
5,does what it is supposed to do
5,Most of my kids toys have this type of battery!
5,Batteries arrived in time installed fine and first is now working.  No muss no fuss.
5,Wonderful deal!  Always great to have some on hand!
5,priced right with a long shelf life
5,Very few times in my life if have been asked to give a review of batteries. This is one of those times. They came to my house upon request and contained the requisite electric charge.
5,So far ok.  Just started using.
5,Good price
5,As advertised
5,They work
5,Look these are batteries that are sold at a very good price. They seem to last as long an any others I've used so what's not to like?
5,Works as expected
5,I needed these to replace the batteries in my kitchen timers. The stores carry the the batteries that are suppose to be an equivalent (303/357) but they didn't work. I'm happy to say I'm back in business with the perfect battery the original no copycat.
4,As expected.
5,These batteries are great.  They are just what I needed to replace the batteries in our stop sign for the garage and it's great it came in a 10-pack package so I won't have to order another set when these no longer work.
5,I ordered more than I needed so I suppose I will be testing their shelf life as well as their equipment performance.This size fit perfectly into the hygrometer I ordered it for and has been working well for the last few weeks.
4,5 x 2 battery tear off package 1 battery per blister. No expiration date listed on packaging though! Working for now!
5,used one it worked. use by 2022 is date
3,I guess these are OK if you don't use the item very much but in a vibrator they do not last very long. I suppose it depends on the size of the vibrator. If it is a small vibrator then these would be fine. Not a fan of Button Batteries.
4,Good price. Can't go wrong with this. Have used a few batteries for weeks now and don't expect to have any regrets
5,great prices. great product.
5,Great value so much cheaper than the stores.
5,Good deal & battery life was ok..
5,I had a hard time finding this size at my local stores and these fit perfectly in my cat's laser light toy. The kittens are happily chasing their laser around my house once again so they give these batteries two paws up.
5,Good as described
4,Great price.  My cat's laser toy works much better with these than the cheap ones from across the pond.
5,i was looking around town for this battery and could not find it but was lucky enough to find it on amazon. and it came in a 10 pack which was even better. i was using them for timmers around my house. very good bargin
5,Great price for 10 batteries. Will last a long time. Work well.
4,The batteries work just fine and I like the packaging as it makes storage very easy.
5,these batterys worked great! full charge.
5,if your using these for anything becides watches these are the ones you want. i've tried 3 other manufactures of this type of battery and these are the only ones that didn't burn out before you get started.
5,It’s batteries
5,N/A
5,I love the packaging. Just like a little pill pack push through foil and use.
5,Great price and fast shipping. I use this size in a red dot hand gun laser. It takes four of them so a 10 pk is great
5,This is the 4th set of batteries I've reviewed. I guess I got carried away with ordering them. Anyway I have tried all batches and I'm very happy with all my purchases. Not had a bad one yet.
5,Batteries work great! You cannot beat the price!
5,Already used these up  they work fine
5,As good as anywhere at a good price.  Only issue is whether you can use them in a reasonable amount of time.
5,The batteries were delivered on time. They do what they are supposed to do. I can not say if they drain any less than any other battery as of yet. But I am happy with price and everything.
5,Bought a 10 pack to be sure I have some extras.  They ended up being "in the battery" box longer than I thought but they held up and provide good service.  What else could you want!
4,they work what else matters
5,Great batteries. Great value .Purchased for a magnet pole detector.
4,Great value.
5,Purfect
5,I found these hard to purchase and amazon comes through agaln.  I needed these for a desk calendar and clock that my wife bought me.  It is working fine now.  It took five of them
4,They seem to run down fast but there's 10 of them!
5,I purchased to have extra batteries around the house.  I put these into action when my daughters wand died.  It worked well with a good fit and did not seem old.  Each battery comes individually wrapped.
5,Brand name batteries at the best price.
3,Good value
4,battery works what else can you say?
3,out of 10 batteries I had 3 that were damaged and acid was leaked into the package. The 7 batteries that was left have performed okay so far. Better packaging where the batteries are in separated areas would help greatly.
5,Other reviewers have complained they got loose cells in zip-lock bags. These came 10 on a blister pack labeled Energizer A76 (LR44). Don't know how long they'll last but the packaging looks legit and price is certainly right.
5,This 10 pack worked out great and the price was excellent. I saw a pack of 3 in store and the cost for them was the same price I paid for 10 pack. Will order them again.
5,Not much I can say 😂 they work
5,revived old laser lights for our cat and dog.
5,Long life batteries
5,Good buy
5,They worked!
5,The price was excellent and the delivery quick. Now it is a matter of waiting to see how long these batteries will last. With the Energizer name behind them I have great expectations.
4,Very nice husband loves this brand & it fits as expected
5,This is a popular size button cell and it has many uses. I always buy in packs. They are cheaper and you have a supplu on hand when needed.  Great prices and fast deliver.
4,Good value.
5,Holds charge well
5,They came in a blister pack. Put a couple in my Nikon FG and everything seems to be working well. Guess there were some unlucky people who got batteries in baggies. This wasn't my experience.
5,Good batteries at a good price
5,Fits the size battery that the electronics calls for.
3,Batteries arrived in manufacturer packaging.  But tested 4 batteries that I needed for devices and found all tested lower than 1.5v.  For the price okay purchase.
4,Just batteries.
1,Out of the 10 batteries three were totally dead and seven had only 40% of charge. When put into the product and it didn’t work we tested all of the batteries with our battery charge tester and found this out. The date on the batteries were 2023. Totally unacceptable and if I could give it no stars I would. We returned the item even though it was minimal amount of money just out of principle.
4,A good brand at a good price. I would buy again.
5,flash lites
3,No review
5,Good deal.
5,My son has a toy that runs on these and they run $4 a piece at the store.  It is a much better deal to buy them at amazon in bulk.
4,Purchased for grandkids' toys. Hope they last a good while.
5,These were not old weird batteries in a sandwich bag as some reviewers wrote.  They came in a new blister pack and are fully charged.  They are a really good deal.
5,It handy to have batteries at home when you need them.  I bought a ten pack so I'd have some extra batteries at home. These batteries work. I have had no problems.
5,Works. Does the job done. Buying these batteries online and replacing my watch batteries is way cheaper than going to a watch repair store and getting my batteries replaced by them.
5,Arrived in small plastic individual pouches (vs. as pictured on Amazon). Great price and they all worked. I use them to power a laser light for my cats to chase.
4,As described and conveniently delivered to my door.
5,Good value for battery good price quick shipping
5,Works absolutely just fine.  My product was up and running in no time at all.  I'm glad I have a 10-pack to keep me ready at all times.
5,I haven't had to use the batteries yet but I expect great things from them.  I bought them because I want the "Energizer Bunny" thing working for me.
5,Works for what I needed for they're batteries.
5,As wxoected
5,Happy
5,These batteries provide electricity in your devices which require electricity and have the appropriate sized battery compartment and proper connections.
5,When you need a good number of these - good price for same thing you get in the store.
4,Works fine.  No problems.
5,great just has shown
5,These batteries were just what I needed--never easy to find specific button batteries locally.  Love being able to get them through Amazon easily and quickly thanks to Prime.  (:
4,Does the job...no complaints
5,work as described. Used for my daughters fingerling
4,Seem to work fine!
5,worked
5,So far so good. Too early to judge lifetime.
4,Good quality and last long
5,Works good  seems to be authentic item  saves you a lot of money over buying them from CVS Lowe's etc.  Individual packaged is a bonus.
5,Great batteries and all worked! Can’t beat the price!
4,quick delivery; good price;
