rating,review
1,I knew before purchasing the item that there were certain limitations with this NAS. Setting up the drive was pretty straightforward. Basically plug in the power and plug in the network cable. You have to set up an account with WD and then download and install the network discovery software on each computer that will be accessing the drive. Once you install the software the drive will automatically show up in Windows file explorer or finder on Mac. The issue I had was the ability to access media files once they were copied onto the drive.  I copied a few 1 gb video files onto the drive and was unable to play them back on my computer without stuttering and stopping. I tried 3 different computers in the home 2 of which have a wired connection to the network and still no luck. In addition to that the drive caused the entire network to slow down. I also have an older version of the original WD My Cloud that has been working fine. I accessed the same files from the old WD my cloud and they played fine. I will be returning the new My Cloud Home unfortunately it was a big let down.
4,It was really easy to setup but it was not as easy to access compared to the older models as it is not setup like a shared drive on the home network but on the cloud server instead. Had to email tech support to find out how to stream my videos onto the smart tv. Needed to install Plex media.
5,Very easy installation has software features that allow you to backup cloud accounts on Google Drive Dropbox and OneDrive and keep them synched. I bought the 3TB Duo version. It is possible to shut the drive down through mobile app or logged into webpage but restart must be done by touching a small button on the back of the drive. There is an Alexa skil in beta. I enable it but could only get drive status With spoken commands it did not find content (.m4a) in specific folders. Hopefully the final version will work correctly. When I sent a problem report the tech guys kept asking for screen prints.. that's difficult for a spoken command :)
2,This is my 5th WD "NAS" device but it isn't a NAS as advertised.  I'm giving it 2 stars only because it's 8TB for the price it is but barely.  None of the options available on my other 4 NASs are available with this "NAS" so much so I'm wondering how they get to call this a NAS.  I need to have static IPs and I only have a Windows PC for emergencies everything is on Linux which isn't native.  I'm probably going to end up returning this unless I find some remedies.
3,File transfer speeds range from 70 MBPS to 7.  Mostly 7 across the LAN.  File transfers hang.  Estimated time to copy is measured in days.  Suggest you look elsewhere
4,Works great but noisy
2,You are not able to access the drive directly through your own network.  You need to go through their host network which means you constantly receive bottlenecks and slow speed.  A 300 meg folder can take 10 minutes to open.  Most of our image files are between 2 and 40 mbs  Previewing images is stressful and extremely time consuming.  Most of the time we transfer images to each other on a thumb drive.  The Cloud is strictly for archiving data.
5,Good little network drive.  Just have to know to install the program to have it show up as a Network Drive instead of a Cloud Drive.  Must faster that way.
2,The actual device capacity for storing my files was 3.5TB or 12.5% less than expected. I was told during a chat with WD's tech. support that this is by design and that the missing space is used for "firmware storage" (go figure). Also the only supported Windows 10 backup software for a My Cloud device is Microsoft's File History which has limited functionality or a version of Acronis TrueImage provided by WD neither of which do what standard 3rd party backup programs do. I'm sticking with regular external disks for my backups and a VPN for remote access to my LAN which amount to more functionality than what a My Cloud device offers.
2,Had high hopes but was dissapointed.  Returning it backPros- All in product- Good Pricepoint if you get a discountCons- SW is EXTREMELY limited in capaiblity- If you have 10000 photos in various folders it jumbles them up into one giant mess- No easy / granular way to restrict access by users- Only filter option is by date- User account setup and permissions very limitedThis is good for simple auto backups ... not for a true NAS setup
2,The hard drive itself works fine but it constantly disconnects from Plex.  Have to restart it at least twice a day. Gets old. Prolly never gonna buy another one.
3,Pros- high capacity accessible by Internet from anywhere as long as network.Cons- very slow uploads and access.  App is limited to pictures and videos. Not all formats.Personally expected more from this company and this generation of device.
5,This is a replacement unit for a My Cloud unit which was 3 years old and was no longer able to access it outside my home network. The set up is quite simple and WD packed a lot of features into this unit. However they have so many variations of this product that their documentation is very generic as they tried to address a number of products with a generic set of instructions. Furthermore the desktop app comes with apps that do not work for the y Cloud Home devices. Why would anyone release apps that are not intended to be used with this mode is beyond me.
2,Like many others my my book live got hacked and erased and thought this was a replacement.It is not the same need to use plex to get dlna to work but if you have trouble they say they do not support third party apps.I did get it to work with plex but it is not what i wanted i will use it till I find something that works the way I like.
2,This product is bizarrely crippled by the manufacturer. Even though it has a USB port you cannot connect it directly to a computer to access the drive. The drive must be able to access the internet in order to function. For a variety of applications this is a critical problem. Tech support will not help as apparently there’s no way to bypass this limitation.For Apple Time Machine use it makes the drive a nonstarter. Apple will not support and address software issues with Time Machine on network drives unless the drive can be directly connected.
1,I bought this drive to use exclusive with Plex I was under the understanding that my cloud home was an upgrade to my cloud and it is not.  WD advertises that Plex can be used and it can but terribly.  To use plex server you sacrifice over half your Plex membership features your load times are super slow and most importantly if you buy the 8tb version for some reason you lose 1tb for software or whatever it is it thinks it needs.1tb of storage? yup and I'm still dumbfounded on why any drive thinks it needs 1tb of space.I would have taken this back or sent it back but by the time I loaded 5tb of videos and got Plex setup it was like 3 weeks and my return time was up.  My WD  cloud is so much better faster and should have bought another one.  I'm very disappointed and would never ever recommend this to anyone using it for Plex or want speed or even don't want to lose 1tb of storage you paid for.
5,Have not needed tech support so far for my cloud home. So far no issues that are mentioned in other reviews. Works better than expected for what I use it for. Would give 5 stars but tech support and WiFi signal are not applicable
1,I purchased this item to replace my old MyBookLive drive.  It took little time to discover that it is NOT the same thing.  Western Digital really pooped the bed with this unit.  I cannot open a shared database stored on the drive nor will Windows recognize it to back up to.  In fact all one CAN do with it is to copy—not back up—files to it for storage.  What good is that?  I expect to be able to WORK on the drive not just admire it like a bookshelf filled with expensive books one has never read.  It went back the next day and I have ordered a "wireless external disk" which Inshallah will function like my old MyBookLive.  To Western Digital you really blew it on this one!
2,The drive access is VERY slow or at least the network connection is very slow.  As in often I just give up waiting.  In any case I am quite disappointed with the following:  Access speed flexibility of naming cell phone auto-backup directories customer support third-party issues (on WD's end) leading to multi-day outages of password server and hence access to the drive.The desktop sync feature does work well as a near real-time running backup.
1,The old cloud drive you could locally manage and static IP.  Create share folder so you can browse from your internal network.  This new version forces you to use there app and seem to be made for the less technical user wanting to backup there phone.  This thing is a huge disappointment because I have used WD for years.....Well I guess i have to fork out a little more money for a Synology or a Qnap.
1,Do not buy the WD MyCloud Home product. All the functionality that made the MyCloud product line great has been removed in the MyCloud Home product line. The only way to access this drive is by creating an account at mycloud.com. You cannot access it via ftp or telnet. It has no user interface for setting up the drive creating user accounts restricting permissions or anything else. WD wants you to populate the drive at Internet speeds by passing your files through their website mycloud.com which is a nonstarter. You can load files onto the drive by copying them with the Windows File Manager or the Mac Finder. That will take weeks. You cannot populate the drive quickly with a utility like rsync.
1,i have been ordering western digital storage devices for a while now.  This is the first time I have received an item that was completely useless as soon as i pulled it out of the box.  I don't buy an item so i can immediately go online to tech support to get it to work.  I will never again purchase a Western digital hard drive.  This has been so utterly frustrating for me.  I live and work in a foreign country.  It has been hell to get any type of tech support for this item.  Those who purchase just be aware.....
1,I purchased this as a backup storage for my phone and my laptop somewhat hybrid cloud. interface is well designed but very limited and reliability sucks. worked for a month and i have been fighting with WD to get a replacement for over 6 months. first they told me i didn't have an RMA then i sent them a copy of the RMA they sent me and now they just haven't responded to any emails. I sent the device in (you have to pay for return shipping so not only am i out the money for this crappy device i had to pay almost 40 dollars to ship this piece of crap back to them. Now I just get ignored. I wish there was something Amazon could do but they tell me i have to deal with the manufacturer. DO NOT BUY.
5,Bought this to have a back of a back up and pull photos from anywhere. It is much slower than I would have liked but worked well. 2 days to write 2TB using a usb hard drive attached. Overall I am happy with it. Will probably get a second here soon since this one is almost full.
1,This product is useless. It stops working after few weeks. I spent multiple hours and days to upload data from various sources. After few weeks there was a software update and device became offline. I rebooted reset and tried all troubleshooting steps but the device is shown as offline from both the app and web url. Now I can’t access the data anymore. WD tech support says that the only option is to return the device. This issue happened with 2nd device. Now I am not even sure if data from the device is deleted or not before returning the device as I can’t access the device anymore as it shows as offline. Even when it was working fine copy of a TB of data from another hard drive was very slow - It only copied 50GB of data in a week and was work in progress even when I used a USB to copy data. I will never buy this product again.
3,This is easy to set up but I'm still fighting with it to make it more user friendly. Tech support is more of a pain than helpful. Good storage but I think a jump drive is easier to use. This has to many rules cant make changes to saved files and then save it back to cloud. Have to have another medium. Also didnt like that I have to log on via the internet when the drive is hooked to my private hub.
5,Bought this My cloud during Amazon Prime Sale. Been using for 4 months now. Works as expected and I dont see any problems with it. It is very useful for sharing files within all connected devices at home and external network.
3,The problem is that one cannot map it as a drive to back-up with an app such as Acronis True Image.  It is good for storage only.
4,My grandson had to help set it up
3,Can’t get it to back up my Apple computers.
5,We bought the smaller version 5 years ago for the office.  We bought this one for home.  It is extremely easy to setup and to use.  Follow directions and you will have no issue.
1,I have had this cloud for 13 months and it started having trouble about 2 weeks ago.  Thing just started shutting off and rebooting every few minutes.  then in the process of trying to get it to work again my hardrive got erased.  I have tried to re sync my files back on there and re backup my phone pics but it has not worked well.  Hardrive is a lame duck now. Will barely connect and backup my phone pics and still has not fully synced my files and pics from my computer.  More often then not it wont even let me sign into it and when it does it will tell me there is nothing on it and then it will all of a sudden show me the files which will take forever to load one thing. Its garbage. I am going to contact the manufacture to get this thing exchanged but I have no confidence in this product that it wont happen again so I will buy something else.  Oh and I have tried tech support and they were pretty useless as well.
1,I bought this to replace my old MyCloud device which had died. This is NOT a replacement. It is a cloud storage that happens to be sitting in your home. Zero local access available. I am returning it...
4,Very good products  but some JPEG file can’t see the photo in view  ( say file not support ) and music file like mp3 only can store in cloud but can’t play in cloud  this mean you need to download to your devices if you want to play ..
2,First and foremost I love WD. I have a couple drives and they are fantastic. But the design of this product is NOT what it is marketed as. The fact that I cannot view all folders on the device when I am the owner of it it absolutely ridiculous and a horrible design flaw. What is the point of a family shared drive that I cannot access the files stored by my family members? I share a folder to my wife (who is a user on my device) and it does not get added to her account and she cannot access it via the app. This is all possible with a regular MyCloud but the Home it is not? I really hope i’m Missing something or else someone needs to reconsider their role at WD. This is absolutely pathetic and infuriating that this simple feature is not available on an expensive product like this.
5,Easy installation. I have two computers two mobile phones an iPad and a Surface Pro all interfacing. No problem using the drive on any of them. I have not used all available tools yet but so far so good.I am eliminating all online cloud services.
3,You are paying for 4 TB of storage for example but you actually only get 3.5 TB of usable space...  Ripoff !!WD touts a simple setup "right out of the box"...  There is NOTHING simple about the setup....I'm debating whether or not to return mine to Amazon for a refund....I have owned an Iomega Personal Cloud device for years and it was much more simple to use although it is now outdated and not compatible with Windows 10 64bit....
3,Loses WiFi connection often. Difficult set up instructions. When working correctly it is great to access my files from anywhere in the world. Mobile app works very well. Have to reboot often.
2,This is not a NAS! I can’t access anything by its folders only by WD’s arbitrary and capricious search terms. Those terms are not capable of dealing with classical music - is the artist the performer or the composer?I have multi disk recording in a folder but WD won’t allow me to access them that way - it’s a random hodge podge - garbage.Unless WD allows me to organize my collection the way I want to MyCloud Home is just an abortion.
4,it came poorly packaged though. All they did was slap a label on the box that the device comes in. It made it to me fine but after seeing how it was packaged I am surprised no one stole it.
5,Easy to setup and use. Easy access from PC MAC and iPhones
1,The product stopped working after two days. Worked with tech support online for several days and the result was the product was defective and should be returned. The tech support was online due to the long wait time to talk to a real person. Most of the support was referring to online information that I had already tried. I gave the tech support a low rating due to the response time of the retuning chat 4-6 hours later I was busy with something else by then (work ...). So what could have been a 20 minute conversation took days. Also WD return policy was poor (I was paying in either option) Thankfully I bought through Amazon with such an easy/ great return policy. I am going to try a different company for my next attempt based on research ( I don’t think the error should have happened in such a base product and the tech support)
5,Sirve mucho es tener tu propio servidor en casa. Toda la información de laptop y teléfonos en la nube y disponible siempre. Funciona perfecto y es de fácil instalación.
5,Purchased for my wife due to too many pictures on her phone and three different cloud services she was using now she has all the pictures in one place no more hunting through different cloud services
2,The "12 TB" size has 2x 6 TB WD Red HDD.  In small print on the box it admits this.  A NAS should be advertised as the storage space in redundant RAID who would use RAID 0 on a NAS...
2,It works ok as a picture backup and some file storage but the idiots deleted the media server function of the older systems and it won’t work if your internet is down! Wtf!
1,Get it out of the box. the site it sends you to in order to download drivers is now domain squatted. Take 30 minutes fiddling with it set it up. It's fine.Do not try to read and write to it at the same time or it will bog down. Will randomly disappear from your wifi network. Good stuff.Want to have a second computer access it? Have fun mapping a network drive . The whole point of me paying $150 for this thing instead of slamming some hard drives into a server is so I don't have to do things like map a drive. In 2020. Because Windows changed some stuff so rather than releasing a patch that's the best route to go.I've been a Western Digital customer for a very long time. Since the mid 90s. I'll be giving my business to Seagate now. This thing is a piece of garbage.
4,Does not give good feedback back for estimated length of time on how long a large backup will take.
5,There are too many data breeches and don't want to add another $5 expense for the rest of my life.  This cloud was set up and everything backed up in about 2 hours.  Everyone in my family has a partition folder.  Great to access my stuff while I'm at work or away from home.  Easy app added to phone device or link on browser.You are crazy NOT to control your own data and own your own cloud.
1,Unless you are a networking wizard do not buy this to use for Mac's Time Machine!!!!
4,Backs up phone and computer automatically. Don't need to worry about losing files if computer crashes.  Makes accessing my files remotely quick and easy. Can be physically stored safe location miles away with no notable delay in file retrieval speed.
2,I've used MyCloud products for years having a MyCloud Mirror that has served me well. I needed to upgrade capacity and decided to try the newer MyCloud Home. I expected the same excellent performance and reliability.Unfortunately my experience with MyCloud Home has been nothing close to expectations. I've had problems with speed with simple copy operations slowing down my 2019 MacBook Pro with a 1 GbE wired connector. Some of my copy operations would stall and fail to complete. I would try the same actions on the older MyCloud Mirror with the same network topology without any performance impact nor failures.Stick with a traditional NAS.
1,Horrible experience. Ongoing issues endless drive activity issues...the most recent issue is the drive makes a horrible grinding noise. Never been dropped or bumped. Just started making horrible sounds out of the blue after a year of use. I do not recommend these drives.
4,Works great however I am not too happy it uses Plex ($4.99 to unlock feature) and not iTunes for music streaming. I read it’s an upcoming feature but haven’t really found solid information on it. Would be 5 stars if it supported iTunes like the older My Cloud drives.
1,The cloud does not properly back up your photos from an Iphone (11 or 12).  It makes copies but it makes lots of copies - like 100 photos turn into a 1000!  Then it's impossible to use.  I thought it would back up the photos and be easier to access them.  Not so!  I reverted back to using the ICLOUD.  Initially WD was very supportive and said they would fix it.  Now they stopped answering my emails.
2,The product itself is great. What was not great with this particular package was that it came with an international AC adapter that would not change. I would have returned it to Amazon but I was under a deadline. The package I got said something like "Made in Brazil." If you buy this product make sure it comes from the USA. I ended up buying a new one at Best Buy to meet the deadline. The  product is great. Not the AC adapter in the one I got.
4,Works kind of well. I use it for PLEX but support content is Confusing as WD has competing products with similar names many helps and reviews actually are for the other product. PLEX support for 4TB of content is strained.
3,Works fine but has security issues and no good way to confirm the latest firmware is installed.
5,Very easy to setup a brand I’ve trusted for years. Would highly recommend for someone who wants to save space in their iCloud !
3,Some features only work from internet browser. Doesn't respond as fast when searching for files or pictures. I have 300mb download and 20mb upload. Wish it would be faster and better at organization of pictures. Share feature is something they can work on. Gives access to the file or picture but unable to edit. Maybe more time spent with it and I can give it more stars
5,I bought this to set up a Plex player. Took no time at all and works great.
3,It's slow transfering files from computer.
5,Connected to the network and can not access any file from any computer.  This is a huge help.
5,Good productEasy set upBacked up photos from multiple mobile devicesFast
1,Do not get it! I gave it a shot but ooooohhh my good I regret every Fri day don't expect it to work as a regular NAS you have to download their horrible app and it will update automatically without even letting you have any control. The disk is painfully slow!!! no matter what they claim. Every time you upload ANYTHING to it it will index it and take forever so that you have nice pictures of THOUSANDS of electronic diagrams (in my case). I tried to return it but the "window closed" save your money for something more useful maybe Halloween socks that would be better spent.I run 8 NAS in my network from raspberry pi to pogoplug to lacie etc. All of them outperform this disk by a high mark even a cheap raspberry pi is 10 times faster AND you will have control over the behavior of it. This product is for monkeys who don't know how to turn on a PC.. and need a brick to throw!.
3,Need a recycling bin!!!
5,Wow so easy to install. The app is so simple to use and bonus it is a good plex server. I ripped all of my DVDs and BlueRays and compressed them to format mkv H.264. By doing this I have more than 300 movies and tv shows in my Cloud Home and now I have them with me anywhere in the world with me. Just as a plex server struggles with subtitles and can comfortably do two streams at the same time.
5,Wanted to share files on two computers at work as well as my laptop at home. Quick setup and works everywhere!
1,It is a beautiful piece of hardware but it's too hard to figure out how to use for a Time Machine backup.  I was at it for a couple hours yesterday and a couple more today.  They can refer you to their several various documents on the Internet that are too complex.  Apple's Time Capsule could be frustrating but the beauty of it was the simplicity of doing back-ups.  I've figured out that I have to do it as a guest on the MyCloudHome and it put a folder on it "TimeMachineBackup" but then it says that "Time Machine couldn't back up to "MyCloud-myserialnumber.local".  I look through the various reviews on Amazon.com and I am envious of the many people that have gotten it to work for them.  Seems to be a 50-50 bet and I ended up on the losing side.
1,I was quoted $1500 for data recovery. Not worth it.
5,Muy fácil de configurar y utilizar. Estoy centralizando la información que tengo dispersa en varias memorias usb en HDD y en nubes. Con las dos primeras ha sido muy fácil con la ultima aún no he intentado. Realmente vale la pena.
