rating,review
5,I was a bit skeptical about how easy this drive would be to set up but it actually was as easy as promised. I am testing and using two of these devices a 6 TB model and a 12 TB model.Please understand that in the default configuration the actual usable space is about half of that as the drives are set up in a RAID 1 mode – both drives capture the same data – giving you a redundant safety net. If one drive fails the other saves the data and you can replace the failed drive. The system will then restore data to both drives. These are not hot-swappable drives; you need to turn the unit off to swap drives.As I said earlier setup was easy. Literally plug it in connect to the router and use the app (I actually used My Cloud access from an internet browser on a PC) but the app also connected easily. I also activated the Alex My Cloud Home skill quickly – but learning the syntax to access music on the drive still eludes me.The 6 TB drive is used by a recording studio I am working with. The producer has access to all folders and each artist he works with has their own folder with their own material. In this capacity it acts similar to Drop Box – except you own the drive and don’t pay for access. We also created a backup of the main computer in the studio to be stored on the same drive.The 12 TB drive will be my personal cloud for backing up all my devices (4 laptops a tablet and two phones) as well as storing video photos and music to access from any of those devices. Doing any of this is pretty easy from either a phone or browser.  You can also plug in flash drives to bet them automatically backed up as well.When I first got these I was concerned that the fact that they weren’t a traditional Network Attached Storage device (NAS) and wondered if they would handle a variety of applications but they do what they promised. T will not serve as a traditional NAS but having your own cloud server can be quite handy and these devices serve that need quite well.
1,Total piece of junk both SW and HW.  Buggy user interface and slow transfers - u can forget about using it to stream video content it just pauses regularly.  Get a real NAS - this is not one.
2,I bought one of these to share files with a few friends over the internet. It is a pain because this requires every user to create their own account but then they all have access to the drive and can put their private folders on there and no one can see what everyone is doing. You have to share each individual folder to each account. Ended up just using one account and trusting them with the info-(close friends no worries). For my application it worked but DO NOT expect this to work like a nas. Do not expect Plex to work smoothly. WD could of made this a great device but decided not to it seems. For an individual just storing files to access here and there it makes sense. To give a few people private access to a storage drive too. Any other way is a major pain. I must say the app runs ok.
5,Easy setup very pleased
4,Backup
3,I seriously don't like when an app forces you to leave a review before you can actually use it!
1,The old WD MyCloud was fairly easy to set up and use. It was intuitive: you found it as a device on your network connected to it set it up either through the web or directly through an interface. A little daunting for a new user but fairly straightforward.With MyCloud Home it looks like they tried to simplify it but instead pretty much rendered it useless. I'm a device geek and have a pretty good threshold for dealing with setups but this one had me boxing it back up in 30 minutes.The setup was easy enough. Plug it in go to a website find your device make an account. Looked promising. But that was about it. After that the website the only place to make settings gives "server error" when trying to connect to the settings on the device. The helpful text: Please try again later. No troubleshooting. No status page nothing. Whenever you go to the website it tells you you need to update the mobile app for the latest features. Even if you install the mobile app that popup comes up every single time. Not smart enough to put a cookie on the device with an option of don't ask me again. Their mac and windows apps are useless... you can find your device and then click a button for settings that takes you back to the useless web page. The device unlike the previous version does not show up in network discovery as a device: you have to install the client to see it. And there seems to be no direct access to the device itself.I suppose if you're looking to make a more frustrating Google Drive that you have to support instead of letting Google take care of it this would be a great option. For anyone else... try and find the old version without the "Home" or just use Google.
4,This drive worked seamlessly with both my Macs doing wifi backups.  It was easy to install and comes with some good utilities. The only complaint I have is that it is noisier than I expected.  It sites 3 feet from me and when it is working the noise is noticeable.
3,I wanted a storage unit that could be access locally and over the internet. This cannot be access locally which limits my use a lot.Also uploads to your phone must be done individually. I have a client's file and I had to upload each item instead of the whole file.
3,Why because it forced me to write a review before allowing me to upload today. So there!
4,I think in the hands of someone more tech-savvy than me this would be a really powerful storage device.  I need a whole bunch of instructions spelled out for me for devices like this and does not come with a whole bunch of instructions.  I am probably not the target audience for the Western Digital My Cloud and I feel way out of my depth trying to review this product even after having and using it for two months now.What drew me to this device was the hope of having a huge storage drive to make my Mac Time Machine back-ups automated.  This device isn't meant for that type of thing. So if you know enough about computing to be dangerous (like me) and you're drawn to this cloud device in hopes that you'll have something that'll revolutionize your Time Machine backups this won't be what you're looking for.
2,User interface for sharing could be easier
4,Great
2,I purchased WD My Cloud Home 10 months ago setup went smooth and start moving all family pictures to it (I thought it’s a reliable place to save valued pictures). unfortunately it kept restarting every few minutes and never able to have access for the last 2 months I contacted customer support (incident #: 200510-001282) and the guys ran through very basic procedures of restarting resting and told SORRY we can’t help they refer me to third party to back up my data which expect the cost to be $800-3000 which is way too much specially with current environment.Anybody from WD imagine how much pain they made with this unreliable product and poor support they provide.
2,With Windows there is a desktop plugin that allows the drive to appear in your file explorer which is handy no such luck using Linux everything (desktop) must happen through a web interface which is annoying.  Additionally there was recently a software update which completely changed the way the public folder works and I'm trying to explain to my daughter in law how to use the thing and she's not seeing the same thing on her phone that I am and it became completely awkward and non-intuitive on how to move stuff never mind that I can't copy stuff it has to be moved. And why do the developers just assume that photos is pretty much all I'm concerned with? If the thing were just laid out like a logical file system and let the user decide what to do and how they want to do it it would be much easier to use and navigate.
5,The features and access available on the WD My Cloud Home are comparable to those offered by cloud service providers such as Dropbox Box Google Drive and OneDrive. The only method of accessing the WD My Cloud Home is via WD's web service where the drive connects when provided with power and internet access. In essence the WD My Cloud Home is identical to cloud service providers except that the user has physical possession of the hardware storing their files and no subscription fees. There is no local access to the device differentiating it from traditional NAS storage devices and eliminating the possibility of using it as a standard external hard drive. This device has a niche market: individuals (or families friends etc.; the device has the ability to configure independent user accounts with private access to files) interested in cloud storage that want control over physical access to the hardware.In my case I am using the WD My Cloud Home to continuously backup my existing cloud storage through a service provider. This is made possible because WD has a feature that allows the WD My Cloud Home to mirror the contents from several of the most popular cloud service providers. I have previously achieved this by running a computer 24/7 with the folder for cloud service providers stored on an always-connected external hard drive. The WD My Cloud Home simplifies this by eliminating the need to keep a computer running 24/7 and I don't have to worry about the many updates crashes and restarts that may bring a computer offline. It does come at the cost of losing local access to the drive but serves its purpose well at keeping a continuous backup of my existing cloud storage. It's entirely possible that a cloud service provider offers this feature but the WD My Cloud Home does it well and without the recurring cost of a subscription.
2,Beware! This drive requires it be wired to a wifi router  the router connect to internet and wifi active.  You cannot wire it via ethernet either directly to a computer or via a LAN to control it or access data.  So no wifi and/or internet = no access to your data.  AND even worse ... any search function is limited ONLY to folders - NOT the files in the folders.  Thus it stores lots of files you cannot find by name size type or date etc.
2,If you plan on using it as plex media server then don't bother. Really disappointing I'll detail why- you are forced to use only one file path for each type of media (movies tv shows pictures...) you can't for example split movies into two libraries (kids and adults) no matter what you try.- I haven't been able to get remote access to work at all.- you can't add any agents other than the default ones.If buying neither of these are an issue to you I think it's somewhat fine
1,Its like buying a stripped down flip phone in the era of smart phones.It is NOT an upgrade if you have the previous model My Cloud. The My Cloud Home is so basic and limited that it will make you regret purchasing.My biggest problem with it is that it ISN'T DLNA capable... which means your smart TV wont see it.You have to use some third party app and set up your content there to be able to see it on your Roku or smart tv.They downgraded the capabilities the previous version of the drive you could make private and public folders.Private you had to log in to view and the public were accessible through your smart tv and devices. What it does do is have the ability of creating multiple accounts that are password enabled so everyone can share the same storage.It's big and ugly the design was not very elegant once i unpacked it. The power cord felt like a really cheap wire with very little insulationSuffice it to say I returned it since the whole point was to use it to watch content on all my devices/tvs/tablets while keeping some folders private.WD you have failed me.
1,I dunno if I've ever given a single star review before (actually I am sure ...and I haven't ...I don't do reviews of stuff I don't like). And I hate giving one for a new product like this. Especially one with hardware that is much improved over its predecessor.But.WTH was WD thinking? I mean they took one of the all-time bargains in a NAS (the My Cloud) and *this* is the result? The WD My Cloud Home is a disaster.Essentially WD lobotomized a sterling product. Sure sure the new model is inarguably better HW spec'd. But jeezus: they dumbed it down to the point where it's TOTALLY unsuitable for deployment in a small businesses.Look. It's not a NAS. It's a ...let's call it a cloud drive of some sort. Kind of. And ...if you don't have the foggiest what a NAS is ...and can barely figure out how to attach to your wireless ...and your router is a total mystery to you ...this is your cloud drive. Everyone else? - Go elsewhere. This is too stupid for you.I'm returning the four purchased earlier this week (purchased at BB who had a better price). If you're a techie or you've used the previous My Cloud fair warning: don't bother.(Note: I'm a sys admin with 30 years in the field providing tech solutions to small businesses. Take that how you will.)
2,When it is connected to my network it's fine for my purposes. The issue I have is that when Windows is updated I must sign back in to WD Home again. This is unsatisfactory to me.  I have several machines and so this gets to be a nuisance.  It is also very slow compared to NASs I have seen in the homes and offices of friends and associates.While the quality of the hardware is decent enough for my needs it is just too flaky. You can do better elsewhere.
5,Significantly impressed with this cloud! Syncing is done in the background and is very effortless.
4,I like that we have our own cloud storage rather than having it on someone elses server but if I wasn't technically inclined I would not have been able to setup this item easily.  It took the better part of 4 hours to get it up and running the way I needed it and then it took a bit of time to get each item to connect to it that I wanted to use with it.  Now that it's setup it works like a charm with no issues thus far.  I would recommend it to anyone that doesn't want information out on several other cloud servers around the world.
5,I'm not sure why people are giving this negative reviews.  I read the description provided by the manufacturer and it does exactly what it's supposed to.  Yes you need an internet connection.  That's what "CLOUD" means.  If you want a product to be something it's not you can't blame the product.  Learn how to read first.  This couldn't be easier to set up.  If you're looking for an easy way to access files from anywhere in the world without paying for some cloud service this does a great job.  The phone apps seem fine the PC app also.  My families main use for this product is the overload of pictures in our phone.  Place them on the cloud drive and access them from anywhere.  Then free up the memory on your phone.  I love this thing but having purchased the 4TB version I would recommend purchasing one with even more storage.. I haven't run out of space yet but I'm sure eventually I'll need more space.
2,I purchased one of these at BestBuy to backup my laptop computers with Acronis True Image 2020.  I was able to add a backup in True Imange but I could not get the backup to run.  It would error out early in the process with a device connectivity error.There is some info from WD about using True Imange WD edition.  I have the full version directly from Acronis.The prescribed method is to backup to the public share which has no security.This device does seem to work well to backup photos from iPhones and iPads.
5,The WD Mycloud Home device is as simple as it is elegant. The setup advertises that it can be done from a smartphone and I took that as a challenge. I successfully setup the NAS and configured all the settings I could all from my phone. All the applications that come default to the NAS like Plex also worked seamlessly. From the mobile experience to the desktop app nothing was confusing to use. The UI is not dramatically different from one device to another. Even the difference between JBOD and RAID1 is explained clearly very nice for the non-tech savvy.Accessing the device outside the local network is also simple. The device integrates into WD’s online portal allowing access to files on the NAS over the web. It truly does feel like a cloud service not an on-prem NAS. You sign in with your email can access files through a desktop app smartphone app or web browser.However there is a downside to all of this. First there is a sharp lack of customization. Aside from the half-dozen services offered you cannot add additional functionality. Don’t expect to SSH into this device the port is closed. Accessing the NAS through SMB is possible but it isn’t clear what username/password to use since the only accounts are email-based. I tried a few things but was only able to access the Public folders.In summary this device is excellent for anyone who wants to self-host their files and avoid trusting ‘big cloud’ with their digital existence. Everything about the experience is seamless. But don’t expect anything beyond the walled-garden. This device trades customization for experience. If you want customization or know what SSH is this device isn’t aimed at you.Pros:- Easy setup- Well-designed UI- Simple cloud integration- Quiet device- Very good suite of apps- Easy to use- Simple photo backup from a smartphone/tablet- No extra setup needed to access files remotely- Small device- Front indicator light is not blinding at nightCons:- Not very customizable- No SSH- Could not access authenticated files through Ubuntu file browser
4,The My Cloud Home was fast and convenient to setup; it's as close to plug and play as you'll find and virtually made dummy-proof.  Even non-tech inclined individuals will have no problems hooking this up.  Once hooked up you've got half the storage listed (RAID I is default so one drive is mirrored therefore only half of the total storage capacity) you can change this if you do not require the backup.The ease of setup and convenience also  gets in the way of some function.  This could really be improved by including a local connection.  Plugging this into your router or home PC would add more protection/security and not require all of your traffic to touch the internet.
2,I was sold this at a local Best Buy to use as backup for my  laptop.  Whoops.  It was too late to return it once I discovered my Acronis Backup software can't see it.  You can drag and drop files to it and it is a good backup for your phone but not what I was looking for.  You can download their discovery software that will allow you to drag and drop from windows explorer but it is not a NAS device and backup software cannot see it.
2,I have an older WD Cloud that I love. It is defined to my private internal network and has securely backed up my files for several years. I wanted a another unit that would provide second set of backups that I could move offsite. Warning: primary reason for poor rating is because WD requires you to define the system to their portal now exposing it to Internet! I consider this to introduce a couple potential risks and therefore would not want to store any critical personal data on this system which kind of defeats the purpose of buying a backup system to protect your data. If I wanted my data up on the Internet there are numerous 3rd party cloud vendors to do that.
5,Alright everyone I've read most of these reviews and I have to say I'm quite disappointed. Not in the product but in the technical know how of most of the consumers purchasing this product.1. This is a SIMPLE! Personal Cloud. Keyword is SIMPLE. Don't expect to be able to stream to 10+ users @ 4k with transcoding while transferring 4k footage to it at the same time. This is for the home user who wants SECURITY PROTECTION and ACCESSABILITY.2. I am no IT professional but I do have common sense. Lets look at the rest of the market and see what RAID 1 8 TB NAS boxes are going for....not for 350 - 400$. So to think you're getting a true RAID 1 8tb NAS at this price point....come on. What you do get is 4tb MIRRORED! Which makes it 8tb of storage hence the DUO in the name of the product.3. This is literally plug and play. I don't know jack about the higher levels of NAS I simply wanted something that I could work on my projects at home VIA my desktop and while I travel VIA my laptop. This fits the bill just fine. The transfer speeds aren't the best. Averaging 10 - 45 mbps. Which is not horrible but not blazing fast. I think a weak point might be my internet speed. Verizon FIOS 100mbps however I have a lot of tech hooked up to my wifi so that might be a problem resolved with faster internet.4. Also this HAS to be plugged into the internet to work. Hence the CLOUD. Otherwise get an external HDD and plug that into your router and your set.To bring it all home if you're looking for a simple plug and play NAS that offers protection without a whole lot of frills. This is it. All you gotta do is this.1. Plug in the ethernet cable to your router and your Cloud Home Duo.2. Plug in the power cord3. go to mycloud.com/hello4. follow the instructions download the windows app for the WD Discovery5. you're done
2,This thing was looking great...plug in two wires install the app create an account and you have a shared drive accessible on all your computers (and iPad).  You can access the shared drive even if you aren’t at home on your LAN and you can get to the files when on another computer using the website. Pretty cool!However I had a couple of problems that made this thing an overall disappointment.  First the drive just drops offline on my iMac sometimes...usually when I am in a hurry.  Secod My Drive just doesn’t seem to be able to handle Pages documents.  This is the main thing we want to share between our computers.  The documents can be uploaded and downloaded fine but working with a document that resides on the My Cloud drive consistently crashes Pages or results in error messages.  Finally My Cloud just doesn’t work with iPad.  I actually use Pages on my iPad quite regularly (with a Bluetooth keyboard).  My Cloud is unable to handle document files for iPad.  It is pretty much limited to backing up your pictures (and maybe some other media...I didn’t mess with it any more once I figured out it wasn’t going to be useful for me).Bottom line if you are a Mac/iPad user who wants a shared drive for Pages documents you should try something else.  Since I have the My Drive now I use it for general backup and media files; for Pages Documents the Dropbox app seems to be working fine.
4,Very easy to install. The app works smoothly and automatically backs up photos from our cell phones. There is also desktop access to backup and transfer files that way. Though it is 12TB it's really 6TB of backup space since the drives are mirrored. That's still plenty of space for us. We are primarily using it to backup photos since we have an infant and take lots of them. It is a bit slow to upload. My wife and I are each able to backup our phones through separate accounts but we cannot access one another's backups unless we log in under that account. There should be a setting to give permission to other users to access their files.
2,I bought this from Micro Center as a general network storage device and Time Machine backup device.  In short it doesn't effectively do either of those things.  The drive slows to a crawl when loaded over half capacity.  The Time Machine share is horribly cheaply implemented and becomes useless after a few uses.  WD's management capability is nil...you cannot fix these problems using their "cloud" interface.If you only want to be able to share photo libraries with people over the "cloud" maybe this thing is for you...if you know what Network Attached Storage is and want those features this thing is NOT for you.
1,I followed the (probably too basic) directions.  The light came on steadied and then what???  I didn't know what to do after that.  How does the transfer happen????  There were no directions on how to actually transfer the pics and videos to my computer.  I went to my computer looking for a symbol.  A folder for My Cloud finally appeared but only 80 pics transferred on their own from my phone.  The app is a JOKE.  No help at all.  I just needed it to work.  It should have been super easy but It was perpetually stuck in "PREPARING BACKUP"  for HOURS!!!!  I went to a message board and nobody had an answer.  Forget it I said.  I literally did not want to spend hours on message boards and you tube trying to do something that should have just happened automatically.  I returned the mess and bought a plain old hard drive.  So much for that foolishness.  Do better WD!!!!  Either get with it or get out the game!  Wasting folks time!!!
1,I was hoping that WD would get their act together but after reading these reviews I see nothing has changed.  I own a WD My Book Live that worked great for years.  It is still functioning today but I can only use the accessing features from the app and other computers when I am at home only and on the same network.  Which is one of the main reasons I bought it.  These clowns at WD decided to not support the software anymore a few years back.  At first I thought it was broken but after reaching out to tech support that was the answer I was given.  I get it sometimes businesses cannot support all their products after their life cycle but there was no warning or notification from Western Digital which kind of upset me.  Anyway I am going to save my money and not buy this product.
2,Doing a TM backup to this device is a great way to grow old. Been trying to back up a 250GB SSD with wired Ethernet connection from Mac to My Cloud Home. After 3-4 days it's still not complete for first backup. This is not an appropriate use for this device.
