rating,review
5,Ok
5,Works perfect.
1,Nothing about this is usable.
1,Extremely limited functionality. Do not recommend.
1,Don't buy if you have any desire for a product that plays nice with iTunes or Sonos.
1,You cannot setup and use without Internet.I hate products like this and I am returning it.
5,Never failed until the moment very easy to use great back up
1,Right from box was defected
1,Its not the best thing WD has made. BUT IF YOU UPDATE IT WITH THE NEW release.... ITS AWESOME
1,not compatible with Catalina OS
1,Apparently it doesn’t work well with videos taken on the iPhone. What’s the point?
1,I had one of these drives fail (an earlier version) and I lost all my data because it didn't have a backup to my backup....thats on me.So I go buy the 2 bay of the updated model: First SURPRISE it doesn't work on the new macs with the integrated chips but they PROMISE they will fixit by july 2021. Instead WD discontinues support for this drive and I still can't get it to connect to my mac or network.It's shows up every time but only has 5mb of space available on it.What tomfluckery is this?Buy mine used from me. I'll give you a real deal
1,Caution: does not work with Catalina
1,Very slow software is horrible. I would not recommend this for photos or videos.
2,The above photo of albums is misguiding. When you create an album to share the only thing visible of the content are icons. You have no control of the icons. Videos show the first frame as an icon. IMPOSSIBLE to determine what videos to select. Beware if you plan to share content with family and friends. They will be unable to decipher the icons. It took many calls to WD support before they would admit that it is impossible to display video or photo names in a shared album. Look for another solution.
1,The most confusing piece of computer hardware I have ever seen.
1,It can’t run like NAS!
5,The media could not be loaded.                                                                                 I’m really impressed with how easy it was to setup and that it has 4 TB of storage
1,Have had this for over a year. Of 2 laptops it has shown up on one most of the time. It has never worked with the other one. When it doesn't connect you can find many things to try online. This is apparently not unusual. I have spent countless hours going through procedures that claim to make it work sometimes successfully and sometimes not but always 100% frustrating. If it connects it's great but it is so inconsistent and frustrating I have come to distrust and hate it. I just want to get the data off of it and get a reliable portable hard drive. I don't know how some people seem to think this works. Look up "can't connect to mycloud"  or "can't find mycloud"  and you will find countless links. I will never trust WD again. I would not recommend this!
3,WD please continue to improve it.
3,so got a message to update to OS WD 5 but found out the my 4tb version of this device is not compatible and no longer supported it still works as a local has drive which is fine but no support or updates security or otherwise. so just consider that before you purchase this also bought mine 4 month ago brand new and already discontinued.
4,I currently have three different WD drives of varying sizes and ages that are used for Windows back-ups for computers and mobile devices. This My Cloud Home Duo (MCHD) drive has the capacity to consolidate into one place and because it has mirrored discs it protects against loss of back-ups something I’ve had happen in the past--for that purpose it works well. I am able to store my most valuable data—back-ups music photos videos etc. and access them from anywhere through my network or the internet.Setup is straightforward connect to a Wi-Fi router with the supplied two foot Ethernet cable and plug-in. When the light on the drive glows steadily white the device is ready to use. To control the unit a computer is not necessary. Go to the website on a mobile device log-in or create a My Cloud account and then after the device is detected follow the steps to configure. Next download the My Cloud app from Apple App store or Google Play. I am using an iOS device and encountered no problems.In order to copy the back-ups I plugged two of the drives into the back of the MCHD (there are only two ports on the device) using USB-cables. From the mobile app the drives were automatically detected and an option to copy appeared on the screen. I selected both drives and it began copying in the background. When they finished I connected the third drive and copied it as well. The duplication progress is displayed on the mobile device screen. Copying all three back-ups took almost 24 hours.I did try to copy another brand of drive along with five different USB jump drives and the app did not recognize them. Looking for a solution I loaded the PC app called WD Discovery from the website and once loaded the MCHD appears in Windows as a network drive.At that point I could connect the jump drives and the other brand of hard drive and drag and drop them onto the MCHD.  The disadvantage is that it uses the Windows copy function so it effectively ties-up/slows down the computer. This will hopefully be addressed in future updates.The auto back-up feature for photos and videos from a smart phone worked well. They were automatically added to the WCHD from my iPhone. I also tried the automatic internet cloud storage back-up with Google Drive and OneDrive it works fine.The documentation states that it works seamlessly with Windows Back-Up but I tried it with two Windows 10 laptops and neither were recognized as a valid Windows Back-Up drive. This necessitates creating the back-up on a local drive and then dragging and dropping it to the MCHD which is time consuming and inconvenient. Another issue that hopefully will be addressed in future updates.I also copied music and video libraries to the MCHD and they can now be accessed by any device connected to my home network or internet. The fact that I do not have to open a port from the outside through my internet router anymore to get to my internal data keeps my home network secure. After a week of use no issues.
1,I purchased Western Digital 8 TB My Cloud Home external drive about three years ago. It worked FAIRLY DECENT until about 3 months ago. It has lost connection and can no longer connect. It simply states it's offline. I've tried every solution possible and still no luck. I purchased this product because I thought it would be reliable and I could trust that whatever I needed to store would always be available to me. What is the point of having an external hard drive with a cloud feature if you cannot access the cloud unless the device is logged in? And the customer service is absolutely nonexistent. They want me to collect and send them logs of the device but in order to do that you have to log in. I disregarded many signs while having the device and it was still functioning. It took forever to simply log in it took forever to download what I needed from the device difficulty logging in and having to restart computer multiple times to get the device to finally log in and on and on and on. I will absolutely never purchase a product from your company again. I lost so many personal and professional things and there is absolutely nothing that can be done because there is not a single human being that works for Western Digital that is capable of figuring out why their devices are worth nothing more than a 2.5-pound paper weight. There are a few choice words I have for your company but I will display more professionalism than what I have received. DO NOT PURCHASE ANY PRODUCTS FROM THIS COMPANY.
4,This is my second NAS the first being a much older QNAP 4-bay system. If you take anything away from this review let it be this: if you're looking for something that can operate independently of any given machine on your network something that can be configured via local web interface and mapped as a network drive without any intermediate software doing it for you this may not be the NAS for you. On the other hand if you don't want to worry about configuration and you just want it to be as easy as possible to back up data or to access files across computers and/or across networks and over the internet this might be your NAS.Basically any sharing options require the use of WD software which tends to get in the way more than anything. What I had hoped for was a NAS that I could attach to the internet access via local IP in a web browser configure and map as a network drive on my local machines. That's the way the QNAP works. But the WD requires that you install their software on each computer and phone before you can map the drive. Once you do you'll start getting notifications on the screen every time the drive does something which is annoying.The WD NAS has none of the features that I love about the QNAP. There's no SSH no accessible web server no suite of tools to take the load off of your desktop(s). Raid configuration options are minimal: mirror or not.Here's the thing though and this is why I've rated it four stars instead of less: it's not really intended to be a full-blown NAS. They don't even refer to it as that. They call it "Personal Cloud Storage" which is a much better description of its capabilities. This is for people that want a basic no-fuss way to back up their data locally and still have access to that data from remote locations.As an example my phone automatically backs up the camera roll to the WD every time I'm on my home Wi-Fi (it turns off the backup if you're in battery saver mode or off the wi-fi). So the other day I was at a concert for a band that has a unique thing that they bring out at the end of every show. I pulled out my phone and got a video of it and later a friend wanted me to send him the video. Rather than send him the whole thing directly in an MMS (which I think might have added additional compression) I just opened it from the WD app after it got backed up created a share link to it and sent my friend the link.If I want to I can have documents or maybe software I'm working on sitting on the drive and I'd be able to access it from anywhere while still having it locally on my network. For things like this the WD does the job just fine. I guess the moral of the story is: don't expect functionality from a device when the device isn't designed to serve that purpose. If you want an actual NAS from Western Digital   they have them         marketed to "prosumers and creative professionals". I haven't used them though. I'll stick with my trusty QNAP.
5,The app is great to take things from your cloud to send to anyone else
3,The WD 12TB WDBMUT0120JWT-NESN my cloud home dual drive personal cloud storage made in Thailand comes with the Home Duo Ethernet cable AC adapter and quick install guide.  Installation is simply plugging the unit into the network and power.  Then the cloud storage boots up and is ready for use.    There are android and apple My Cloud Home Mobile apps plus a WD Discovery desktop app which should be installed on all your connected devices.  To prepare your devices install the appropriate app create an account sign in and update desired settings.  The My Cloud Home Dual starts taking backups and manages itself from there.  Also activity can be viewed files and photos/videos can be browsed and settings can be changed.   The iPad app works in portrait mode by default and also in landscape mode.  When the app is opened on the iPad in landscape mode the app oddly opens in portrait mode.  Rotating the iPad around will get the app to reposition in landscape mode. Renaming backup files is problematic too.  I can rename the existing files for organization and consistency but then the app creates a duplicate file with the original name and backups all the contents again.  There doesn't seem to be a way to custom name the backup anywhere.  Additionally the My Cloud Home Mobile app only backs up photos and videos on mobile devices while other file types are not. I use my iPad for productivity purposes if I create a word document on the iPad I want it backed up too.  The only direct option is to save my document to the cloud and manually do so with older documents.  The WD Discovery desktop app creates a networked drive on the desktop for direct access to files.  However the desktop app doesn't back up any files. I can only schedule a backup to save to the drive or manually upload files I want cloud access to.    The apps have a social and Cloud Import tool to gather all your files from various web sources including Dropbox Google drive OneDrive and Facebook.  By configuring for any of the options including some not listed the My Cloud Home Dual will back up those cloud sources as well.  Files will be updated and deleted along with the source so recovery is not an option on the My Cloud Home Duo.  Other service options to expand functionality includes Channels DVR Plex server Alexa skills IFTTT Sonos and Network importing.  The My Cloud Home Dual is set up for 6TB of storage with two disks set at RAID1.  This setup protects your data in the case a hard drive fails.  The my cloud home dual drive can also be set to full capacity mode so that all 12TB are available but the data is at greater risk of loss if a hard drive should fail.  I would strongly suggest that RAID1 be used unless the data doesn't matter or you have an alternate effective backup plan in place.  The my cloud home dual drive compares well with a service like Drop Box which shouldn't be the standard for a personal machine.  DropBox automatically backs up my photos and videos while ignoring other file types.  I can access those files from any connected device as well as any I manually place on DropBox.  The main difference is that I can edit my office documents by accessing DropBox on the web while I cannot do that with the my cloud home dual drive.  Instead I have to purchase the app I want to work with which increases the cost of using this drive.  If you're looking for a way to get away from a hosted cloud and manage your own the WD 12TB WDBMUT0120JWT-NESN my cloud home dual drive personal cloud storage will only get you part way there.  Additionally being a home-based storage drive there should be common NAS functionality included.  This cloud storage device does a lot of things right it just doesn't go far enough.  I will continue to use the WD 12TB WDBMUT0120JWT-NESN my cloud home dual drive personal cloud storage and will also continue to make use of DropBox on the go.  PROS: Simple start-up Auto backs up photos and videos from mobile devices Raid1 option helps protect your files from hard drive crashes Files accessible from all your connected devices 2-year limited warranty  CONS: The app lacks basic functionality Only auto backs up photos and videos from mobile devices no other file types Limited desktop functionality
1,This drive only lasted a few months for me.  Very unreliable difficult to setup and a total waste of money.  Please don't waste your money on this piece of junk like I did.
2,I've never seen a drive function this slowly. All the windows drivers up to date gigabit network 50mb up internet connection and still it is a miserable experience regardless if external or on the same network. I've also tried moving the unit to work to see if maybe it just didn't like my home network and got the same trash performance.A directory with 82 images takes 10-15 seconds to populate. Trying to even open up a 54kb picture can take 20 seconds! I figured i had to have a lemon unit so i returned and the replacement is just as bad.Idk what the intended use for this thing is but it is very clearly not a functional dropbox replacement. Tried talking to the Indian call center tech support WD is using dude acted like he didn't have a clue what i was talking about and told me to just replace the unit. This model is trash.Android app is nice windows integration style is clean and easy. Aside from deplorable access times it seems like a nice setup.
4,To  install and use the  WD 4TB Duo Personal Cloud Storage I have to say first that I am not strongly computer literate and did have questions for my programmer son. Though everything seemed easy and uncomplicated in the installation of the unit and programs I did have a problem.I plugged the unit into my modem downloaded the appropriate programs into my computer and Android phone. Everything seemed to work and I downloaded my picture files into the WD. As I did this I realized that my photos were a mess with nothing organized through the years. I had over 4500 photos. I deleted the photos from the WD and spent the next 8 hours organizing my photos in the computer. At that point I again loaded the files into the WD. This was done and then I went to use Netflix for some relaxation. My internet which is only 3 megs max went to nothing. I did a speed test on the computer and it would not even download the program ( it said not enough speed to test ) so had no way to tell what the speed was. To make a long story shorter it didn't work for about 18 hours.I contacted the internet provider and he said their end was working fine. I contacted WD and couldn't really get across my problem to them (language problem) but did find out that the file did not go into an internet site like Myspace. It only went into the My Cloud unit sitting behind my computer. I contacted my son he had only one possible problem. The large file caused some change on the internet to make it go more slowly but he was not even convinced of this. I could still get email at times but very slowly.I'm not sure if my very slow internet speed does not work well with The WD My Cloud or if it just a coincidence. I would be glad to hear from anyone with other thoughts on this. I did try uninstalling My Cloud programs and unplugging it. No change in internet speed. Two days later all was working.I have all of my organized files now on the My Cloud and can access them easily on my computer or from my phone which is very nice. It came in very handy to have all pictures available on my phone. I have had to manually add photos to My Cloud from my pictures file on my phone and other files on the computer though as I understand it it should do that automatically. In any case it is nice to have everything accessible and saved for the future. I'm not sure whether a greater internet speed is necessary for My Cloud.
3,I have been a long term user of Dropbox. I also pay for iCloud for sharing of photos between my family's phones and iPads. I also use alexa Show. So I got this an attempt to pull together my storage needs and stop with the annual or monthly fees.In the end I think I am going to keep paying for the services I have been paying for because this isn't quite easy enough or robust enough for my uses.There are basically no instructions but it is pretty easy to set up. Plug it in and then create the account and then download the mobile app. I was pretty frustrated with the mobile app not allowing me to sign in. I looked around for a solution and didn't find any real help. What fixed it was restarting my phone. Once I did that it worked fine.I like the autobackukp for phone pictures. It really works better and more naturally that the iCloud sync to my mac does.What I don't like is that there is no good way I have found to stream music from the fileserver to the phone without using plex. This is more a limitation of the iPhone iOS than the mycloud software. But despite that I will continue to use either the Amazon music app or iTunes. I pay $25 a year for iTunes Match to give me all of our family music. It isn't much and it is a much easier system than the mycloud using plex.The backup speed was pretty reasonable. Not as fast as a wired connection but quite good for a wireless one. You can also connect dropbox to the drive to import your dropbox (or GoogleDrive or Box etc). This makes importing data easy.Mycloud works differently from dropbox. You have a sync section and then the online/server only section. Dropbox allows you access everything and keep everything synced whether you want it on your computer or not. Dropbox is better for syncing multiple computers but the mycloud system is fine for a backup/storage system for a single computer.As part of the same system that will import dropbox you can import photos from Google Photo or Facebook which is a nice backup idea but that should be duplicate of all of the photos I already have.I tried to use alexa to play my music because I am not paying for amazon music to have a full copy of my music to play on Alexa. This never worked for me. I turned the skill on but could never link accounts. It just hung. I tried on two computers and three browsers. So not sure what was wrong there.If you are thinking about an online storage system I think this is probably a good option for individuals or a small business that has some storage backup needs with ability to remotely access photos or simple files. If I had started here I probably would be happy with this. But I am fairly set in my ways with my current system and this doesn't really work as well as the current system for all parts of my needs.I can't stop using iTunes Match (although there is the potential that this will support itunes streaming in the future). I can't play music on my alexa device. It backs up my photos well and I think this is the only part that works better than my current system.As a file backup system this is fine. It does allow me to share files with others. You can also invite others to have a private section of the server themselves. This is a good idea for family to have private areas or for a friend to do an off site backup. This isn't that expensive but you could buy it and share the space with someone else. I have the 2GB system but the 4 GB system is only $40 more and the 6 GB system is about $80 more. These would be a fairly low cost sharing option for a small photographer or designer.I am going to keep playing with it but I think right now at least. I will keep my current system and either use this as a backup or give it away to a friend that is starting their online backup from scratch.
1,Be careful you understand what you are buying.  This cloud solution basically forces all connections to this device to require an internet connection.  Your internet goes down?  This is a brick until service is restored.  So while data transfer at least is local there is always a dependency on western digital's cloud with no local backup.Don't use this for long term storage either as you could lose access if the service is changed in the future and this specific device stops being supported.Further the WD Discovery software causes massive slowdowns on Windows due to the fact cloud based connections will never be as fast as a disk in your computer and having windows look at it all the time (Quick Access's flaw) will cause everything to slow down.  And there is no obvious way to opt out of that link and you must run WD Discovery to access the drive.  So slow Windows ensues.So this is a cloud storage solution that takes the worst of local hardware and cloud storage and forces convenience to kill productivity.
4,It isn't spelled out on the packaging of this device that you MUST log on through their servers to access your own home network.I bought one of these but I'm probably going to return it because it seems like a great opportunity for them to rummage through our data looking for something interesting.I did want to spell how how the device works and get the feedback from the more technical community to figure out how this system works.1. It connect to my home network gets a DHCP address and phones home to Western Digital with it's Identifier code. This identifies you to them through your home IP Address which is uniquely attributable to YOU as a customer through your ISP.2. I log on to their website and enter that same code.3. This identifies me to them ties me to the device.4. When a device logs on through whatever device it connects to that device ID linking me to my data drive at home.Unknown: How does traffic come and go through my firewall at home?Wouldn't I have to configure the firewall with a permit to Western Digital servers to permit me access to the drives on my home network?Again. I'm pretty sure I'm returning this thing b/c I don't trust it and don't like having to identify myself to them to use a piece of hardware.*** Update: I actually really like this device. I got lazy about returning it b/c it's a 2 hour drive both ways so I plugged it in and tested it out a bit and it's really neat!I canceled my Amazon Web server online storage because of this drive.Basic Operation:1. Plug into your home network.2. Log in to the western digital site and enter the code that comes with your drive.3. It couples the two so that you log on to their site to access your home drive. (I didn't like their involvement in the process but it helps with access and security through the internet into your home network.)4. Install the software on either PC or MAC to have the drive appear as a locally-attached disk drive making it super-easy to use.I connected it to a smart home plug so I can turn it on when I'm not at home and access my files from anywhere on earth.I like it so much I might upgrade to the dual disk drive that provides added reliability because the drives mirror each other so that one of the drives can fail and your data will still be available.
