rating,review
4,This unit is nice to have around though the sound quality is not as Rich as many Bluetooth speakers
4,The lettering on the machine is hard to see it should be in Black it should not be in white the sound is decent you get what you pay for
5,Perfect for me to take to the gym where I teach classes!!
5,Good to use in a vehicle that does not have a CD player
5,bought thisplayed once and then  would NOT power on.
3,It’s good to have music or noise in the background at my woodwork shop. However it’s not very loud but I’m okay with that.
5,It plays our CD’s wonderfully. Good sound and easy to use
2,In/ off; am:fm: cd selector is a TINY sliding switch ON BACK if this player!!!!!! How utterly inconvenient!
5,Easy to use
4,I can't seem to get the radio station that normally like to listen to. It is from the FM station.
5,Stopped working after 4 months..
5,I use it for playing cd’s. It works well. I’ve purchased many small players and they never work right. This one does.
5,Thumbs up!
5,Very easy to use.  Love the purple color on the box.  Simple design and great sound
5,My son loves it!
5,The off and on button is in the back of  the CD boombox. I would have liked it in the front.
5,It sounds great for a small player and is light weight so it is easy to carry around.  It seems pretty durable too.
2,Both radio and discs
4,Bought for a gift for my granddaughter she absolutely loves it.  Easy to work and sounds goodLove that they come in different colors
5,Everyone needs a little music in their life
5,This Magnavox boombox has terrific sound quality. I bought it solely for the CD player and it hasn't disappointed. It's nice and loud with clear smooth sound. It's small but sturdy. The on/off switch is tiny and place on the back which isn't the best. So I simply leave it set to CD and unplug it when I'm done and plug it back in when I want to use it. Other than that I have no complaints. I'm very satisfied. I highly recommend this boombox. High quality with a low price what more can you ask for in a stereo?
5,I liked that this cd player can be taken anywhere .  The sound is great and it runs on batteries.  I love it.
5,Is what I expected it to be. World well .
2,Radio and disc player do not work. Power shows on but that's I will be returning .
5,The sound quality is good. It’s portable and easy to use.
5,The sound is great. the only thing I don't like is the little flat slide 4-position switch is pretty tiny and the increments to move are so close together.
5,Happy all the way around quality function manufacture and design. Perfect product for my needs. Ordering and delivery excellent.
5,it was great
2,Literally the first use of this the first button my daughter pushed on this sunk in and wouldn't come back in place. The buttons that do work feel cheap and likely to do the same eventually. Will return this and pay more for a Sony.
2,The media could not be loaded.
5,Easy to use good sound portable...perfect for an older relative that wanted "simple"!
5,Lightweight. Easy to tune
4,Cute boom box but the sound quality isn't the best.  No FM 'Stereo' setting!
5,like price and everything works as advertised
2,This product lacks an antenna. Reception is very poor if at all.
5,Easy for your cd’s
4,Product mostly plastic . Good for CDs but radio does not distinguish between AM and FM with tuner knob on product. Basic product.
5,Love this little radio/CD player am looking forward to listening to all my Christmas CD'S this year the tone quality is great it's easy to use. The only draw back that I have found is that the on/off switch is on the bottom of the back of the radio and this is inconvenient wish it was on the top of the radio but it works great just not easy to switch on and off.
4,Gift for special needs girl.
5,It is perfect to move around and set up where you go.  The sound quality is good.
5,I am old school and I approve of this radio.
3,Did not have to wait a long while to get it
3,Got for a 10 year old. Perfect for their small bedroom. Sound is fine  nothing to brag about.  At first I didn't think there was a power cord but there is. No antenna AM FM radio reception is trash. Bluetooth is a plus. Hoping to let my kid explore all our old music c ds so this will be perfect.
5,Nice little radio/cd player.
4,KNOBS A cheaper plastic. Overall sound good bought as a gift for my father
5,I like the station dial og
1,This is so cheaply made it’s almost useless to use. I guess you get what you pay for.  I donated it to Salvayion Army.
1,Purchased my Magnavox. 8 weeks later it would not start. Still under 180 day warranty the manual said to send to Craig electronics in Miami. Sent UPS it was refused by the receiver. Sent again Craig had moved and it was forwarded and received at "the dock". Have not seen or heard from it since. Online search indicates that the company may no longer be in business NO other information is given in the manual for this company. Magnavox is a subsidiary of North American Philips. A letter sent to and received at their corporate address to their CEO asking for assistance  has not been acknowledged.
3,not happy poor fm reception  and no place to add external antenna!!
1,The slider for what you want to do is way too small. The CD player doesn't work. I'm sending this back tomorrow.
2,Maybe this would be great for books on CD but I have gotten used to how good even a cheap Bluetooth speaker sounds. It doesn’t even seem like they’re trying to make some thing that sounds good.
3,It has no antennae so I only can get 2 FM stations on the radio and you have no idea what station you’re getting because there isn’t an indicator that lights up and let’s you know! I am not impressed with it at all!
3,I use this but the sound is tinny  dialing radio stations is not easy as they are hard to read.  Power button is in an awkward position and I actually use a mini flashlight to be able to see what I am doing when turning off and on.
5,I bought this for my grandson for his 14th birthday. Where he goes this ‘Boom Box’ goes with him. He absolutely loves this gift
4,Could not make Bluetooth work for phone. With auxiliary cord works great.
1,It’s a “boom box” but the sound it puts out is very disappointing. I work in a noisy environment and I can’t begin to hear my music over the noise. This Magnavox is softer than either of my two blue tooth speakers that I would otherwise pair to my phone. I really thought I’d get more sound out of this unit.Now I have to return it.
5,The stations I can pick up come thru very well....basically bought this for a local station and to play my CD music....it's a great little radio for the money....I wouldn't expect an acute stereo sound but it works just fine for me.  Thank you for sending it early....came sooner than expected and the packaging was done so it was well protected.
3,I  bougth this produt for use AM but AM band do not is working I was trying for long time thinking maybe is the whether but no works on any way. I want to return this product . Please let me know if you can help me. Thank you.
5,My own personal pleasure.
2,Sound is barely ok.On off is around back. Very clumsy.Does not have cassette function.Looks like I was not paying attention when I bought this.Ok I wanted something quick to play some CDs. It did.
3,Got this as a powered BT speaker for my phone to Spotify on. Needing to switch to Bluetooth every time is a bit cumbersome. And the max volume is disappointing for what I'd hoped.
4,We like the small size.  The sound is good quality for a reasonably priced boombox.  Like the red and black design. The on-off switch in the back is inconvenient but works fine.  Would prefer that it was on the front of the machine.
1,I had to write a review to counter all the people who said this had great or amazing sound quality.  I think too many people are used to cell phone audio.  This is definitely louder than a cell phone but I would say the audio quality is the same or worse.  It's a very piercing sound.  It's sure loud but it's tinny sounding and not robust and round.  Won't fill a room--will pierce the air in one direction.Also Cd player worked on one song and then started this weird skipping and running fast thing.  And I was using a newer CD--only a month old and no scratches--and store bought.This thing looks nice but is a hunk of junk.
5,It is easy to use not expensive and just what I was looking for.
5,has a retro vibe. easy to use.
5,Esta muy bonita grasias
5,Clear sound easy to use. Small and portable.
5,
5,CD player in vehicle
4,The new Boombox I ordered is perfect for intended uses. It is a little to sophisticated to be left for independent usage.
1,Everything was fine for first 4 months. Then a few weeks ago the tuning would change on its own. You would have a station coming in clear then it would randomly go to another station and then come back to original. This would occur nonstop. It would happen no matter what frequency it was set to. Tried to power cycle the unit but that didn't help. Going to contact Amazon but I doubt they will do anything. BTW.. I had originally thought the unit was a Bluetooth broadcaster. It turns out it is a receiver.This is my 3rd radio of this style from various manufactures with each unit having problems after a year or so. This was the worst one yet.
4,The only thing I dislike is the small knob on the side to turn the unit on & off.
4,I like that it’s lightweight and the vibrant red. The sound quality is not the best but okay for the cost. Hard to see the selector from am to fm to cd. Not East to find radio stations.
3,Not worth the money the sound quality sucks so I can turn it all the way up and it's still not very loud don't know about the CD player yet
1,Didn't like that the control button was in the back of the radio but more importantly with out an Antenna the reception depended on you you location. In my house the radio was fine but when I took it to my Mother in laws who I bought it for it didn't get any stations.
1,I purchased this CD/Radio boom box on May 112022.  It no longer plays anything.  When you turn to radio it just clicks click clicks no music.  The CD player doesn't spin to play the CD.  I would not recommend this product and I cannot return it for a refund so I now a useless product.
3,It's alright but the knobs for volume and radio stations are thin plastic and the radio one is so sensitive I've yet to find my station two times in a row.
1,I previously posted that I received  this radio and it didn't work...found out it had a button on the side of it that I needed to turn on..please delete my further comment..very happy with it ..good quality for the money..thank u and sorry for posting the previous comment.
5,This radio is excellent for its good sound and easy use.
3,We have loved this boom box for our seven year old. So fun and so convenient BUT the speaker has blown in less than a month of having it :( I feel they should replace or fix :(
5,Great for my work shop
2,No happy no program indicator
5,It was easy to Bluetooth the phone to. She liked that she can also get radio stations.
5,One sleek unit. Nice looking easy to tune plays nicely and good sound for its size. Time will tell if the quality was built in along with its good looksand initial performance.
5,I like the CD player
1,Very poor quality sound. Bluetooth is limited to receiving input from outside sources. With no headphone jack either there is no way to connect the unit to higher quality speakers.  Returned.
5,use in my kitchen nice red color plays cds well live in a difficult area to get radio stations but this picks them up with no problem. Score!!
1,This player was treated gently at all times. It was a replacement for a previous unit from a different brand which suffered  the same issue. Tested the unit when it came out of the box. Worked. A few months later went to use the cd player. Did not work again. The cd player was the reason it had been purchased. Avoid. If you can pay a little more and get a stereo that sits on a desk or table. Maybe it will actually do what you bought it for.
3,THE COLOR AND SOUND ARE GREAT  WHAT I DISLIKE IS THE TURNING KNOBS TO GET TO THE STATION YOU WANT TO LISTEN TO.
5,Nice
5,Great product
2,The radio just looks cheap and the sound quality is okay at best.
5,Home entertainment
1,This is not worth the $$$ reception is slim unless you place it in a window.  WOULD NEVER PURCHASE AGAIN!!!!
1,Stations quit they don't stay in sync... Fade in and out.. So bad I wouldn't bother to ship it back!!!!  Should be taken off the market !!! Thanks for the rant!
3,I like it because it's light weight but the bass sound is weak
4,Sound quality is fine. That just do not make them like they use to. Handle was hollow.....
1,Reception very bad. Bought another radio works fine. Very hard to turn off and on with the small buttons
5,it works great
5,sounds great for the price
5,The media could not be loaded.
4,the only thing I didn't like is that the "switch button" for switching from AM/FM/CD/Off is located in the back and the letters are so small you need a flashlight to see them.
5,I bought the radio for playing CD's . love it but the buttons for cd radio ect are in the back and hard to use!!!
3,The boombox is compact easy to use as described.  The sound is not great with no way to increase bass etc.
2,CD's would skip while playing.  Tried several times with different CD's and they all skipped.  FM tuner difficult to fine tune not very good reception either.
5,Attractive good sound easy to use
4,News
5,Bought for my 11 year old daughter.  She met up her phone thru the Bluetooth and enjoys Spotify thru it. Easy set up and instructions were easy to follow. The radio is super light too.
1,I liked the speakers around the front and the side but within 6 months all of the CD's sounded like they were getting scratched. I would like to return it because it was a gift as it's aweful how it now plays my mom's CD's.
4,I bought this to use out side
4,Sound quality is very good. There was no remote so I could not real rate that capability.  But battery cover is extremely tight I had to use screwdriver to slide cover open this is not a complaint just observation
3,The sound is very grainy but it is ok for my use. I bought it to listen to my Christmas CDs and it served the purpose.
1,She production on off button is our home to see for a Partially sighted person I got disgusted with it and threw it away
1,No antenna.Stations don't come in clearly
5,This is perfect for a small area needing some music. I use it to leave on for my dogs when I leave the house. The sound quality is good.
1,Can you imagine a Boombox that is hard to figure out how to use (all signage impossilbe to read)  and has a non existent FM radio when it was billed as a CD Boombox with am/fm radio  Really.guys.  I threw out the box otherwise this baby would be heading back to China.
5,Very sleek great sound and look. Highly recommended. Replaces one I bought at WM for $10 less that worked for 1 week.Would recommend to any music lovers.
2,It has technical problems
4,good sound needs more volume needs a external antena
4,Nice size nice sound
1,This is a piece of junk. It quite working on July 23 I purchased it July 2 and it’s now not returnable??? Really?? Less then 30 days!
5,A Xmas gift
1,This arrived and I could immediately tell it was pretty cheap. But it played the discs and that’s what we needed it to do. Within a day however we discovered that this had no anti-skip protection. That was a standard feature back when I was listening to CD’s - and that’s 15-20 years ago. Makes no sense that a modern CD player would not  have it. Every time we walk past the table it’s sitting on it skips. Annoying but we could live with it. Then after having it only a month a weird crunching sound started coming from it when we would first put a disc in. Sounds like some gear teeth in the motor that moves the optic sensor are already bad and now it will no longer read any CD’s. We didn’t mistreat it or do anything that could have damaged it. Very subpar quality.
1,Every CD skips and wont play. I dont even think it's made in China probably outsourced and double outsourced
2,This "boom box" or sterio or whatever you call it is not good at all. Sound quality is very poor and it skips when you touch it. I mean if you press a button it will skip for sure. I wish it was still within the return window. Very poor quality for sure.
1,power switch hidden and awkward.  very narrow am/fm bands.  not worth it.
2,This item had clearly been used before but was sold as new.It still worked fine but had little people finger prints all over it so I'm sure it was enjoyed by children before I ever received it.
1,I was so excited to get this product so I could listen to books on CD. However it was hard to understand what was being said due to the poor quality of the speakers. Then it stopped working completely after less than a month. How disappointing. I didn’t keep any of the information so I can’t return it. Ugh!
4,I bought this boombox for my 16 year old. He can listrnxto his music from his phone via bluetooth and the sound is soooomuch better. He will also be listening to books on cd with it in his room
2,Cheaply made
5,I l love the size and the red and black color. The stereo and CD player sounds very good.
1,Disliked quality.  Only lasted 5 months with minimal use.
1,When the item arrived to my place of residence it was broken. One of the speakers was inside of the radio. Very disappointing and a item that was very much needed for my personal account.
3,Works fine playing music over bluetooth or cd. Sound is good for the size and price of the unit.Tuning knob tough to read and very sensitive. No antenna so signal can come and go.
5,Needed a cd player since my car doesn't have one and i had no place to play all my cds.  I use this when I'm out by our pool.  We love hawaiian music and it makes u feel like you are in the islands.
1,I am just using it for the radio.CD player never worked!!!The sound system is poor!I wasted that money!
2,I received it a week ago. If I could I would return it. It is too tekkie complex. I cannot just put in a cd amd have it play straight through as a regular cd player works. How it works for me makes me want to give it away to a younger generation...and find one that works simply without all of the confusing technical steps and requirements. Ahh to put in a cd and simply play it! Want simplicity!
5,Purchased as a gift for someone. Very nice and good sound for the price. Highly recommend.
2,This CD player was very difficult to use even with a poorly written users manual.
5,We use it out by the pool and turn on a playlist. It’s fabulous!
3,Works ok but sound is not too good if you want to hear heavy bass or treble.  You basically get what you pay for.
2,sound system and on off switch too hard to read
1,I was pretty excited about the boom box . Brought me memories when I used to have one as a teen . Unfortunately once I plugged it in it didn’t work . But I’m waiting for a replacement this week . So hopefully it will work
5,It plays both my cds and is a radio so it is perfect for me.
4,Exactly what we wanted but doesn't have a headphone jack....guess we could set up bluetooth but that's fancier than my nine-year-old needs....
3,Sound quality is worse than my phone speaker. Volume is also low. Kinda bummed. I had higher expectations from Magnavox.
5,This was a great gift for my daughter. She loves the way it sounds. And is very easy to use.
1,It was broken had to be returned
3,Sound quality it pretty good. Connects wireless to devices with easy. Buttons/controls cheaply made and hard to press.
5,So easy to use to get a good sound right off of your iphone/ipad.
5,This little boombox has worked out perfectly for us in the space that we need it big bonus is that you could hook up to it with your phone and play Spotify Pandora whatever you need  Plus has a CD player so you can play all your oldies but goodies
5,Works great not to loud but does the job when rocking out.
1,The boombox has no power in spite of being plugged in to a power source.  When the power button is pressed it does not turn on. I am returning this item.
4,A little bulky in size otherwise a good product.
5,This boom box has great sound is light has both am and fm radio with the CD player. It is just what I was looking for.
2,Home use.  Not acceptable.
5,I don't  like that the switch to turn on and off is in the back
1,Skips on brand new cd’s. Cheap and is cheap. Radio doesn’t work. Returning.
5,Very good for a small portable CD player.  I purchase it as a gift and the receiver loves it!
5,I like the size and portability of this product. I have a pool so I put it on my outside table to enjoy I y music while I swim. It's perfect
1,The CD player did not work and that was the main reason I bought it.  Never would play just kept showing an error message.  Sound quality was not good either on the radio.  Very disappointed in Magnavox.  Sent it back for a refund
5,I  gave it to my brother as a gift! He loves it & said  it sounds great!
5,GOT IT AS AGIFT FOR MY SON AND HE LOVED IT.
1,beware i used this a few times and it just stopped working! no replacement so beware
1,Great price good sound now if it would only work. Followed directions all prompts showed up CD spun up pushed play worked well once. After that followed directions all prompts showed up CD spun up pushed play nothing. Went through procedure again pushed play nothing. Holding okay button got Blu Tooth search function. Now on the way to recycle after one use in thirty days. Not recommended.
5,I have really enjoyed this product.
1,Purchase for ah relative in Jamaica when it got there realise that cannot work  due to the fact that it doesn't have an antenna attach so wasn't able to work will not get any radio station only works on the cd s not ah happy shopper
5,Chose the Magnavox MD6949 CD Boombox with AM/FM Radio & Bluetooth Wireless Technology for a relative whose CD player wasn't working in his truck.He was content with his CD Boombox for having all the now day amenities--and being able to play his CDs.
5,We enjoy listening to music on our porch. This is perfect for us.
3,Tuning is very sensitive. Difficult to lock onto a FM station.
1,It is not clear in the product info but please note you cannot use headphones to listen to audio. Unfortunately for us we didn't read the Q&A which does make this more clear. I didn't realize that it couldn't do this within the first 30 days so unable to return it. It is very disappointing that it lacks such a basic function.
1,I am having the hardest time getting the CD player to work I have tried several CD's it's not working.Now I have to ask Amazon if I can send it back to them.
4,There's no boom. But still a good buy.
4,Sound quality could be better but I just use it for bluetooth or as an aux speaker.
4,We like the WFI connect from your phone but with no entenna radio reception is not good...
4,It will play most CDs
1,I was sent a used Boombox! Not happy at all
1,Can't say if it works well or not. Arrived with NO POWER CORD!
3,No headphone jack
4,This unit is what is needed here at this time4.
5,Great sound. Doesn’t take up too much room
5,Lightweight. Easy to take places with because of batteries. Can plug in also
5,Great little radio/cd player and decent sound for its size
2,I bought this as a gift--very disappointed and had to return it.  First it was CHEAP feeling thin plastic.  Sound seemed good but soon realized that there was no headphone jack.  My bad for not understanding this before I bought it.
4,Got them for my kids and one of them had a cracked screen. Just taped it.
1,Sound is not good dial is difficult to settle on a station channel is not digital so it's hard to know what channel you are on.  Too expensive for a crap radio.
5,Simple controls. Decent sound quality. Priced reasonably.
5,Not anything i dislike.  Would order again
1,Unable to tune into radio stations….so I paid for a CD Player/Radio with no ability to listen to the radio
2,It was alright. There is no antenna on the radio so the radio stations has pretty bad reception. I bought it for my older mom she is okay with the radio but for me personally I wouldn't buy it.
1,I've had less than 2 months and cd player has quit working already. Just because its magnavox doesn't make it good. It's a piece of crap. A waste of good money.
5,The sound is a little muffled.
1,have to tap on product before it comes on
4,There's no antenna so receiving radio transmissions is hit or miss. The CD player works great and the Bluetooth connection is easy.
5,Great in a group setting
3,not sure what to do with the Bluetooth can't use the cd player or the radio if you turn on the bluetooth
2,This Boom box was a disappointment due to I couldn't get but 4 radio stations on the FM band  this unit needs an antenna. I don't recommend buying it that why I returned the unit
5,Compre este producto para mi abuela de 82 años.
1,CD player will not work even followed instructions. CD just spins nothing else. The whole thing is very cheap. I'm returning it the same day it arrived.
4,I love it
1,The Bluetooth never did work. The radio completely quit working after a couple of weeks and I didn’t have a chance to try the cd. It sat on a shelf the entire time so abuse was not the issue.
5,Es fácil de usar y el precio super económico.
2,You get what you pay for - bought this for a shop radio and was very disappointed - the old not very accurate dial in station knob sucks - would not even pick up the fm station I listen to - cheap crap that will rapidly make its’ way to my “give away” box
4,Delivered as depicted
5,Works wonderfully.  Can listen to the radio or pop in one of my favorite CD’s to play!
1,Lame analog tuner this is not 1950.
5,Nice little radio. Hooks up to blue tooth easy.
