rating,review
4,I like almost everything about the radio.  The only major mistake that was made was the fact that the incorrect color arrived.  I ordered the red/black combination that was featured; I received violet.  Luckily it was a color I could work with in my office.
4,I needed a small inexpensive CD player to practice some dance steps and this worked well.It was easy to use and could be plugged in if you didn’t want to use batteries.Not phenomenal sound obviously but it serves its purpose well.
4,Great
4,No comment
4,For the price this is a great product.  Sound is good and setting up the Bluetooth is easy to connect your phone.As other comments mention it is very sensitive to movement when you are playing a CD so even the slightest bump to the table will make it skip. But using it for the radio or the Bluetooth for my phone works great.You can only have one device "saved" to the Bluetooth but its super easy to connect back and forth between multiple devices.For the price and for the portability/weight/ease of being able to carry room to room or take outside it works great!I haven't used it on batteries - I'm only using it plugged in as I'm using it for extended times.  I wish the cord was a little longer but it's not that short.
4,We are returning the boombox because there are no easy-to-understand instructions for programming the radio.  We really like the color but if my husband can't program it we can't use it.
4,Complacida por la compra.
5,Ordered this for our grandson who loves playing cds.  He loved it and uses it constantly. Also the bluetooth feature is a plus.
4,
4,Appliance works well if you can find the "ON" switch which is very small square black sliding switch on rear of machine. When on a table every little movement causes CD to skip. Otherwise works consistently. Would not remommend for carrying around when playing CDs. Attracting styling. Need longer cord.
4,The product was great in my opinion but I purchased it for my uncle which I rarely use this for any other person and as he described there is no antenna and that's not TRUE at all its an internal antenna and works for basic radio stations and is a cd player as well but he is older and I wasted my time and others as he had no idea what new technology is out ! But it's all good my mother ordered him a older model for more money as he wants a very precise fm tuner but this model is perfectly acceptable for general purposes!
4,As wife is recovering bed rest she like to listen to recorded books on CD. Delivered June 9 started skipping June 28th. Used cleaner disk blew out dust numerous times and still skips even with disk that have never skipped before. Tried different disk from local library and still have same problem. Have old CD player and the disk that skip play fine on that one. Problem is unit will not fit area required in.
5,I really like this radio!
4,Love it very much! Except you have no indicator to know what radio station ur on. Took a long time to find my fave.
5,rock and roll
3,Bought it for camping and for if we lose power.  Sound quality is fair.  I don't like that there is no digital read out for radio stations.
4,Thank you
4,I still like to play CDs so i got this boom box. The quality seems very good. You can either plug it in or use 6 D-cell batteries. Ok battery power I was able to play CDs or listen to the radio. You can connect your cell to it via Bluetooth and play music from your cell. Everything in it works great. I have two complaints that keep me from giving it 5 stars. For one it does Not have an output for headphones. That really stinks. By having that I could have bought a Bluetooth transmitter and played music on a larger speaker system. Also the radio tuner is analog so you get a slight static every so often and you can't exactly tell what station you're on. The sound is just ok but that's reasonable for the price
5,It's an okay CD player not what they used to be.  Skips badly during car rides.  But if you are looking for decent CD player this one is a good choice if on a budget.  Wish the sound was better.
4,The best thing it plays my old C d's And non copyright
3,Incredibly somebody in design came up with the idea of putting the on/off/fm/am/cd switch on the back of the unit with very small same color print...........I mean how dumb can one be to make the on/off switch practically unusable....
3,Loved the Color and how it was made . Couldn’t get the cover back on after trying install the batteries !
5,Recommend.
3,Worth the price this was a nice boom box to take to lake of beach for music 🎶.  Sound quality is not that great if you turn up too loud but this will work great for some music outside at my pool and I love that it was easy to connect to my Bluetooth and use the speakers to play music from my phone plus can play my cd’s!!
4,Sometimes hard to get reception on the radio. CD player work great easy to use
4,Sound quality is fine - I've had better ones in the past but this was right in line with my expectations for the price - and I needed to get something to play all of the CDs that I still own and don't want to get rid of.  I'm listening to it within a few minutes of receiving it .Setup was quite simple:  It was simply a matter of removing the packaging plugging it in and switching it to the proper mode.  Note that while it can run on C batteries I haven't tried that yet (nor do I intend to) so I cannot comment on battery longevity in this device.
5,The sound quality is good and very easy to use.
3,The price was definitely great - all I needed this for was for NPR and maybe occasional music however important controls were very small at the back - had to keep picking it up and turning it around to make changes.
3,The sound reminds me of the little hand held am/fm radio I used as a kid in the ‘80s…I’d wait for a song and record it on my cassette tape recorder… this boom box has the exact same sound quality as that cassette player. It’s unfortunate that Magnavox has not figured out how to improve the speakers on these smaller boom boxes. I just needed something to play my old CD’s onand to hear local radio stations…  just to have music going in the background… when I really want to “enjoy” a song I hear on a CD I find said song on you tube Amazon music Apple Music sound cloud whatever…. and listen to the song on my Bose Bluetooth speaker. That’s some quality sound. This boom box is nothing special. Not surprising for $39.  Don’t buy this if you value good sound quality.
3,does not stay on station static
4,Purchased this boombox as a Christmas gift for my elderly mom.  She loves this radio/cd player.  The only problem for her being a senior is that the on-off button is in the back (hidden for her) and it is really small.  She cannot see to slide the button to - on/cd player/tuner.  We leave it on and just turn the volume down.  I would recommend this for a younger person.
4,Would have been much much better if the LED shows the radio frequency
4,This stereo is smaller in comparison to the vision i had from the images. But that happens with images. The price wasn't bad. It is a simple cd player with am/fm. The sound is ok. I mean what more can you expect from somethimg as small as it is.
5,One of the best CD platera around.The sound quality is very good.and it is easy to use.....which is why i gave it 5 Stars.
5,Worth every penny spent.
3,If you want to get your girl back playing in your eyes in the rain this is a hit
5,Just what we needed ..great listening to music on our porch this summer…easy to use and good sound..reasonable price
3,So cheap looking
5,Good size . Ease of use .
3,This radio was rather lightweight. The antenna is built in so no way to adjust and have stations come in clearer. Picks up very few stations. Cannot see the actual station you are dialing in. I would return it but the box was thrown away.
5,Received one that had a problem and was quickly replaced with a good one.
4,Love it.
3,My husband wanted music in his garage and this little guy fit the need perfectly.
4,We bought this for our son for Christmas. He loves to listen to music it's very calming for him. He also enjoys listening to books on CD. He shares a room with his younger brother so I wanted to get him some headphones so he could listen to things when his brother was sleeping.It says bluetooth so I bought some wireless headphones. I should have read more of the reviews and questions first. This can only be connected to bluetooth input meaning I can play music from my phone through the speakers on the radio. You cannot pair bluetooth headphones to it.Basically everyone gets to listen to what you are listening to unless they leave the room. I'm pretty disappointed. I have a CD player that my son can't listen to by himself and an needed pair of wireless headphones.
3,We used this to provide music for a birthday party.
4,I prefer to use the cd player. The radio turner is mediocre. The sound quality is ok. It's just basic.
3,Doing good so far for 40$
5,I’ve always had one with an antenna but the reception is ok.
5,I got tired if my daughter always being on her phone so I bought her a music player. Now when she listens to music she just listens to music. Like we used to back in the day. No more music pictures insta texting etc. just chilling to the tunes. I’m happy and she loves the purple color. She hasn’t complained once about not getting to multitask
5,Great little boom box.. brought for my mother to listen to her church music..she loves it
4,Fácil de usar.
5,This came quickly and we are enjoying it every day . It has great sound and we use it outside
2,We had this cd player for 6 mo and used it a dozen or so times.  Now the cd part no longer works-- something in the cd sensor is messed up so it spins slowly but doesn't read the cd. So frustrating!
3,This product hasn't worked since I got it no radio one channel I can't return it because I'm handicapped I can't walk I don't know what else to do
3,Only thing I don’t like is how sensitive dial is. Numbers are so close you can’t tell what station your on. I miss read and thought middle square displayed station number. Other than that I love it
5,Like it’s sounds great and easy to take around with are with out ue
5,I got the purple one...very cute with its carrying handle.  It runs on 6 C cell batteries and also cord included for AC/DC pluggin.  The sound is not poor but not the best quality...it's a small radio.
5,Purchased this for a friend's birthday.  Was perfect gift.  Well made and arrived quickly.
3,I was disappointed by the lack of features/and effort needed to access the few it has.
2,I purchased this CD player to play for 10+ hours on the "REPEAT CD" feature while I was at work for my dogs. I put in a new CD and for the first 20 hours the repeat feature worked fine but then it started to skip the 1st track...just the first track. I never moved or modified the player while it was in play so I was baffled. But I thought maybe I did something wrong. So I put in another new CD and within 30 hours of it playing consistently the player was doing the same thing to the first track only. I did make sure to ensure there was nothing obstructing the cd scanner (that plays the cd) or it was dirty - nothing was amiss.  It is almost as if the repeat feature damaged these two new CDs. I only had this player playing for 5 days before I said no more. I returned this player for free through and with Amazon Prime.
2,Gave this to my daughter at Christmas( so 8 months ago) she recently told me she never uses it bc it skips. I tried it out on a level surface with no movement and sure enough it skips. Too annoying to even listen to. Wish she had told me sooner doubt I can stillvreturn it.
3,My own fault was looking for a radio with LED radio station display for better tuning read the description of AM/FM radio LED display and thought that it was what I wanted the Radio tuning is a knob with a sticker of about where each station is LED display is for the CD/Aux only. Sound isn't terrible but not great
5,I bought this for my blind brother. The knobs make it really easy for him to use it and the quality and dependability is outstanding
4,would be better if it had ear jack
2,Magnavox used to be excellent quality.  Probably made in china  now.  So it figures the quality went down the tubes!
4,cute radio but hard to read the dials
3,Poor instructions
5,I like this little boom box. I wish it had a cassette player but I guess one cant have everything. At least it plays cds well. I went through two Sony players before I decided to give Magnavox a try and I'm glad I did. I've only had it a month and I hope it keeps working. Like I said so far its great.
5,I needed it for my patio and it works well in the space
5,Bought to play cd’s for an unconscious person. Works well and easy. Would buy again
3,Sound quality....ok....not great...just ok....cd works good...radio is fine...no issues...very lightweight....all plastic....probably not very durable if u move it around a lot...or throw it in the backseat!!! I think it is overpriced...but nowadays...what isnt ?!?!....we will use it minimal ...so it will work for us....
5,Good little radio and cd player for the money
5,Good
4,None
3,Plastic too light
2,Did not pick up many radio stations when it did the sound as not bad. Very light and and does not display radio stations.It has no antenna that’s why it didn’t pick up many stations. Would not recommend the Magnavox MD-6949 boom box.
3,The power switch is in the back. Not good access. Silver controls look cheap. To insert CD top is manually lifted.
5,Satisfied!
5,very easy to use. good sound. very pleased
3,I bought this primarily to use with headphones while listening to audio books. I ASSUMED it had a headphone jack as this is usually a standard feature. It does not. To me it is of little use otherwise that's why I gave it only 3 stars.
5,Great way to make music portable.  Great sound quality!
5,While not the quality of a true boombox or music system (I've had both) this is a very nice portable one. So far it hasn't had any issues playing the CDs I throw at it including ones with some impressive scratches. It can also work as the speakers for other music players by synching via bluetooth. (I don't believe you can send music from the boombox to your other devise though. There is apparently a directionality to these things.)It's also nice having the option to plug it in or use batteries.My only complaint was the radio issue. I never have been able to get it to work. Normally I would attribute this to "user error" but no one else has been able to get it to work either. (None of us have ever had problems getting any of our previous boombox radios to work...) Ultimately we decided to buy a radio specific for emergencies.
4,Nice radio attractive nice sound. The only drawback is that you cannot determine which station channel you're there's no readout to say which channel you've selected...I don't think I've seen that before.  That's why I gave it a four instead of 5.
4,I liked the sound for a small (compared to years ago) boombox. Does sound a little tinny howeer
3,I didn't expect much for the price. I was simply replacing a CD player for my aging mother. Sound quality is not quite fair but the silver embossed play control buttons are more than difficult to read. Perhaps impossible. I had to put DYNAMO labels on every control.
4,Compact style
5,Father's day and baby shower gift
4,we use it to listen to cds and use the Bluetooth.
4,I now use this to play my Holiday CD"s
5,I purchased this radio for my young toddler's  classroom. What I like best is that I can use my phone to find childrens songs for them. The Bluetooth is very easy to use you will get hours of pleasure  out of this radio. Can't forget the regular  radio and the CD player as well.
5,I mostly stream music but sometimes I want to listen to my CD collection.  So in some ways this is old fashion I am used to saying Alexa skip or stop.....which doesn't work of course.  But this is as you would expect and it is nice to listen to my collection....and can still have music even if Wi-Fi is down!
3,The tuning of stations on this radio leaves a lot to be desired. Knob tuning makes it hard to get good reception of channels. Placing your hand on the radio or being to close to this unit greatly affects the reception both good and bad. Also turning this unit on and off is not that easy. The switch is hidden in the rear part of the radio. Would not by recommend to my freinds.
3,I was expecting more.  I was going to use it in my shop mostly for the FM radio - and CD player.  The FM station numbers are so small I can't hardly read them - nor could my wife.  The AM/FM channels are actually on the volume dial!  I'll probably regift this somehow.  A kid wouldn't want it as it would be considered outdated.
5,My 80 yr old father's phonograph finally died so I have been buying him CD's of all his favorite albums on that popular auction site for a few bucks and have them mailed right to his home. I chose this player because it has very few features and buttons that could confuse him. He loves it. His hearing isn't great but says both the volume and clarity of the speakers is just fine. I think there is a headphone jack on the backside as well. It's about the size of a football. Lots of complaints online about longevity of these models so I bought an extended warranty for a few extra dollars just in case but no problems after 6 months so far.
5,Vume is great  took me a few  minutes  to get accustomed to this one however. It's all it said it was. I like it. Especially now that ICan use headsets
5,i would have loved to get more radio stations only get 2 on fm  none on am
5,I love that I can take it anywhere I go.I use it to play my music outdoors.
5,El radio portátil Magnovox tiene muy buena calidad de sonido de acuerdo con su tamaño. Es ideal para escuchar música en volumen bajo mientras se trabaja o estudia.  En cuanto a su uso es fácil de usar con la excepción de que el dial de la radio no se aprecia claramente porque al ser plateado es muy brillante y cuesta mucho sintonizar las emisoras. Por su tamaño y funcionalidad es ideal para regalar. Permite reproducir discos compactos lo cual es una gran ventaja. Además permite reproducir música vía Bluetooth. Su color azul es muy atractivo. Excelente adquisición la cual le obsequié a mi madre a quien le gusta mucho escuchar tanto la radio como discos compactos.
4,It does what I need it to do!
5,Easy to use good sound
3,Otherwise it's ok product.
4,Good enough unit its not incredibly loud but loud enough for close room play i guess. Not much / if any bass however kind of flat all across the board really but If your looking for a unit that will play your CD's and seek your Bluetooth device with out trouble even a home made CD this is the unit you want for the price.  Controls are well made smooth but not overly complicated in function or feel. All and all--- for the price.....  Acceptable for CD and Bluetooth OUT PUT ONLY play.
2,definitely not bluetooth enabled extremely lightweight plays good but not very loud
4,We got this radio for my 90 year old mother.  She loves this product because the knobs are big and silver.  So many electronics are black and have black knobs and buttons!  It’s hard for the elderly to see that.  These knobs are easy to use.  The only negative is the on/off switch is small and harder to use.  Sometimes she just turns down the volume all the way instead of turning it off.  She keeps it plugged in all the time.
5,like it
5,It was easy to use with good quality speakers.
2,Low volume and limited function
5,To replace my Old one they gave out. Great CD player And with Am and FM radio!! Very pleased with my purchase. Keep up the great work!
4,It serves the purpose I bought it for. It plays cds plus it plays my favorite music via bluetooth. If you're looking for something that is high power then this is not the solution. However if you want something that saves space and will play cds radio and has bluetooth and will fill a small room with beautiful music then this will work great for you.
2,I was loving this for 6 weeks but the cd player is already severely skipping.....I know cd players dont last that long  but they usually last at least a year!!
3,Rather cheap built. Radio tuner worked intermittently.
5,I LOVED that it came overnight! IREALLY NEEDED it Right Away!
2,No station markings and Could not dial in stations.
2,This product is VERY cheaply made & confusing to operate. You have to read the little owners manual just to turn it on. I don’t recommend this product
3,What since does it make to produce an AM FM radio with no antenna ?!!!VERY POOR RECEPTION W/ ALOT OF STATIC !!!!WOULD NOT AGAIN !!!!
5,Ease of use/light weight/good sound
2,Speakers do not sound all that great no antenna so good luckwith reception no readout of current channel only channels written in small text on small dial. I know its inexpensive but for a bit more money there are several other selections that offer more options ease of use and better sound. I returned and purchased a Sony with more features
3,Works good except we can't get it to play thru my Mom's hearing aids  it will connect but then disconnects when we try to play it.
2,This started out as a good inexpensive CD player. Less than a month later the track counter will not go beyond 3. Don't recommend.
5,Good sound but didn't like the location of some of the controls.
2,Need Blue tooth to play. No antenna to pull in stations.Not at all what I expected it worth the price to me.
5,The sound is clear and the radio with the cd player is what I was looking for. It is a great product at a fair price
5,I bought this as a Christmas gift for my husband and he really enjoys using it. He has quite a large collection of CDs. He said he likes everything about it; great sound (plus it has an am/fm radio) and a very sleek modern look.
3,The instructions on how to use this item were not at all easy to understand.  Some of us are older and dealing with new technology is not easy.
4,I like this cd player but I wish it had an alarm clock. I had an old player for many years and I used the alarm clock every day. I had to purchase an new alarm clock as well as the cd player----no big deal just a bit of a pain.
3,Cheap construction switch hard to see.
3,Great sound for radio Bluetooth but CD won't play. I'd return it but there is no info on how.
2,The sound didn’t go loud enough for me. Every little bump would make the cd skip. It’s a very sensitive player.  It’s also cheap looking. Made with Flimsy plastic. I don’t recommend. Maybe for a child…
5,Great radio for the price.
5,We put it on our back porch to listen to
3,No antenna so it didn't pick up any stations.
4,It is a nice little radio for the money. Picks up quite a few stations but would like to have a little better sound quality
2,The handle was cheap. I'd hesitate to carry it by the handle.
4,There wasn't anything I didn't like.
4,Thankfully it has a great Bluetooth (the reasoning for the purchase). The FM radio is completely useless why even add it if it doesn’t work?The speakers could be louder.
5,It is good for the money!!
5,Bought this for my Fiancé’s Aunt & she is having a hard time figuring out how to work hers. She was hoping it was going to be easier to understand. She’s 65 and has disabilities
2,You get what you pay for.  It plays fine.  Just don’t turn it up or the sound is crap
5,This CD player/AM/FM radio has a very good quality sound.  It is light weight not bulky or heavy.  Pleased with my purchase.
5,I enjoy listening to cds with grandchildren but also play music for foster dogs.
4,"Maggie" Works well  sounds clear..good little unit no problems with bluetooth receiver and phone hookup.  Cd unit works good great unit for the price.  Not a bass blaster just nice and clear.
5,Christmas gift for my grandson. He’s very happy with it. It’s a first radio for him and it’s easy to use and sounds great. I’m pleased with this purchase and thought it was a good price.
4,Needed something I could play my old CD's on when I'm working in my garage or "she shed" ... Sound is good easy to work....so I'm a happy camper!
5,Had one like it for years.  Love the upgraded version.
3,This unit would be fine for a youngster but not anyone who takes music serious.
3,Dislike
1,When I was young Magnavox was considered a very good product. This boom box was made in China skips at random on any disk I use with it has hard to read dials for the radio portion will not work with a CD cleaning disk. I consider it junk and am considering throwing it away. However the Amazon service was good.
5,Good sound good purchase
5,Very colorful and a great value
5,I bought this for an 83 year old cousin. She is really enjoying it
4,Boom box has to be easy to use.  I am not electronically inclined!!  It was pretty easy to use.
5,It is a nice size with a very modern lookGood sound quality and does not have to be loud to enjoy it
3,This is a very low end radio but for the price I guess that is expected.  Sound quality is easily distorted.  The boombox is very sensitive to position changes wrt reception.  Knobs are clumsy and there is no digital readout of stations so if you have two stations close together that play the same genre you have to listen for a while to see what station you are actually on.
3,Would only operate with batteries. Couldn't get it to play with power cord.
5,My elderly mother is very happy with this CD player. I looked for a CD player that would be easy to use e.g. have only the essential buttons like this unit. She was immediately able to use it and the music makers her happy. As you would expect from the price the audio quality isn't amazing but it's fine.  Recommended if you have a parent that struggles with technology.
