rating,review
5,No issues so far works great for the after school programs i got it for. It gets a lot of use and certainly gets handled a bit roughly at times. Overall still great though holding up well
5,Worked great for using my GC controller with my emulator on my PC
5,Works great for GameCube controllers on the Switch. No lag and no issues!
5,Super easy to use! Perfect for smash bros and Mario 3D all stars!
5,I got this for my switch to use some older Gamecube controlers with and its perfect
5,Worth it for the price. No issues as of yet.
4,Has some issues with button registry after being plugged in very long. If you do not unplug it and replug it will have some buttons that don't map correctly.
4,Good product!!
5,Been using for about 3 weeks now. Great product.
5,It was straight forward and simple works great on PC and switch with almost no input lag. Great overall just no rumble on pc
4,This is good adaptor for the wii u
5,Works great on my switch and pc. I've been using it for about a month or so with no issues.
5,If you want to feel like a kid again definitely get game cube controllers and THIS adapter
5,Works for both slippi on my pc and ultimate for switch good product.
5,Works with little to no problems if you know your way around Dolphin and your computer set up.
5,Solid product. Works on switch as intended.
5,It worked well for smash bro’s on the Wii U.
5,Plugged into the switch and instantly worked with our old gamecube controllers. I ordered a different brand originally and couldn't get it to work thought I was doing something wrong but this was so easy to plug in and play!
5,Very happy
5,Its great for its value and just straight up great
5,Works as expected no problems and was worth the money
5,Works as expected
5,This device was easy to setup and works great! I can now connect multiple GameCube controllers to my Switch to play Smash Bros!
2,I didn't check if it was good on the switch or Wii U so I wouldn't know how it performs (that's why it's a 2 star) I had planned to use this on my PC but it didn't work and I tried doing everything I could to get it to work but no such luck so if you plan on using this for something like dolphin then DO NOT BUY.
5,Very easy to use no issues with compatibility and it is as small as your average controller. Worth it!
5,I was thinking about getting the official one but it was really expensive. So I got this one IT WAS GREAT it was long it wasn’t the easiest to connect but once I got it to work then it worked great
5,Fantastic 3rd party product that is above everyone else! Works perfectly fine with up to 4 players and got it just in time for my Emerald Blue controller! Would highly recommend to friends and already got one of them to buy one as well! S+ job on the adapter!
5,Easy to use no complaints- I would buy again
5,Works great to use my old GameCube controls on my Switch!
5,It works really well with the GameCube controllers I currently have right now. It works well with Smash ultimate on the switch. Nice Product!
5,Works good on switch haven’t used on PC yet
5,Very easy to use with the switch. Just plug and play.
4,This product works as expected but it takes a bit of research to get the drivers working to use it.  This isn't a fault of the product but just comes with the territory.
5,My go-to for connecting my GameCube controllers for Smash
5,It works. Linux did not have a driver for it but it works well on Windows and Mac. Otherwise works quite well.
5,Excellent product works well for smash Brothers on switch.
3,Great price for what it is. Be very careful though I dropped mine from a coffee table and it broke immediately.
5,Works great is great product for a great price
5,Buen producto y versátil lo puedo usar en la computadora tambien
5,Worked as advertised. No complaints.
1,This was easy to setup and plug in for the Dolphin Emulator. It worked fine for the first week but I suddenly had input issues. My thumbstick wouldn't register tilting up and when playing Ultimate would move all the way right on its own. Consistent input lag made timing inaccurate. I thought I had a problem with my GameCube controller at first but it was actually this adapter. These issues happened not only on my Switch but also my PC.I returned this and bought the MayFlash GameCube adapter instead which works much better and hasn't had any of these issues. Purchase the official one if you solely want to use it for the Switch/Wii U but the MayFlash works on PC and is essential for Smash Melee/Slippi/Dolphin.
3,It's not literally plug and play but it seems to work like all the other adapters
3,We bought these for a friend for her birthday. All but one of the ports work really well. One port didn't connect very well and the controller in that port didn't have full usability. The other three are great but it was frustrating that one of the ports didn't work.
5,Works as described. Makes using GameCube controllers for the switch easy!
2,Contacted the retailer with no response. Tried two different WaveBird controllers in the adapter on two different (and current updated) switch consoles but no combination would sync. Lights show the signal is being received but console not recognizing any input.May work great for wired controllers based on other reviews but if you only have wireless look elsewhere.
5,Adapter is very easy to hook up played smash for hours with friends
5,Works as advertised. I appreciate the longer cable.
5,The only reason this thing isn't five stars across the board is because nowhere in this product's instructions does it let you know how to test if it's working (after plugging it in you press a button on your Switch to activate the controller and then it should work fine). A minor nitpick for an overall great product.
5,Works great just as expected and in description.
5,Works as described out of the box for our Nintendo switch.  No issues it’s great getting to use GameCube controllers again.
5,This adapter does exactly what it's supposed to do without any problems. We just plugged everything in and it was ready to go. No muss no fuss. Works great!
3,It works on the Switch (as long as your Switch is in good condition; mine isn't). If it doesn't work on Switch you need a new Switch tbh. However there are some issues with this and Dolphin. Input is detected until you start the game. I would like someone to explain how to make it work on Dolphin. Then I'll rate 5 stars.
5,This is exactly what I needed for playing multiplayer games on the switch without paying a premium on new switch controllers (and frankly I like the GC controllers more). Immediately could play 4+ players on the new smash and I like that it's compatible with my mac as well. No more / no less than what I wanted.
2,This would be a 5 out of 5 if Wavebird controllers worked as it advertises.  My wired GameCube controllers have an unnoticeable amount of lag which is amazing.  However the Wavebird Controllers don't connect at all.  If you only have wired controllers this is a great buy but if you have Wavebird don't waste your money.
5,very good
5,Easy to set up and use!
3,It was difficult to configure and ultimately didn’t work with my emulator so I got a mayflash one instead. If you can get it to work it could save you a couple bucks.
5,I've loved Smash since Melee and have gathered GC controllers since. These adaptors don't come from Nintendo but they work great and are as easy as plugging into the USB ports of your console. I've had no issues so far and have been able to play Smash with friends much more easily since.
5,Very good cheaper alternative to the official adapter. I’m pretty sure the rumble works without having both ports in at the same time( I may be wrong) Very good deal for the price
4,very good.
5,Works well with ssb for the wii u.
5,Works perfectly with my Switch. Worth the buy.
3,If your just gonna use it on the Switch and nothing else then it's perfect. However the problem is it feels cheap and it doesn't work right on PC's the way other adapters work. The analog sticks don't read correctly when using Dolphin which keeps the games from being fun.
5,It works perfectly on my switch!
5,This was a gift for my son. It was easy to use and set up.
5,Works as intended.
5,It is exactly what I needed. The adapter was delivered as promised and in new condition.
5,Worked great  use older gamecube contrillers
5,Was searching for a wavebird after getting a switch but at this price the old wired gamecube controllers work great for mario kart 8 and im sure any other games too.
5,Does what it’s supposed to. I haven’t checked the turbo function. I wish it didn’t take up 2 usb slots but you gain 4 controllers so not too much to complain about.
5,Perfect if you want to use a gamecube controller. I haven't tried it on pc but it works perfectly on the switch with no problems.
5,Does the job for both switch and pc. Just need to download drivers for pc. Little to no lag
5,Fast delivery and easy to use
3,Neutral review. I couldn't get this to work for PC. Don't know about switch. Returned.
1,Do not purchase this item if you are intending to use it on your PC with the Dolphin emulator. There are a lot of positive reviews of this item but I wish I had looked through the 1 star reviews and found the relevant ones which all state this does not work with PC. This wouldn't be a 1 star worthy offense as it does appear that this product works with the Switch and Wii U but the product description clearly claims to work on PC and specifically mentions the Dolphin Emulator.I wasted about 2 hours total trying to get it to work with patches command downloads new driver downloads and every trick and fix I could find. None of these work including the ones found in the product review comments on this page. So just skip it.I'll be purchasing the officially licensed more expensive product because reviews all say it works. I recommend you do the same.Also the product arrived late. So I had to wait eagerly for it only to be incredibly frustrated with its failure when it arrived.
3,Works really well I don’t have any complaints. I use it for my pc emulators
5,Easy to use. Did what it says.
5,Wires on wave birds and wired controllers
5,Great expectations easy to use great value!
5,It’s literally a plug n play. Things got heated during smash soo I’ll rate 9/10
5,Great addition to my sons gaming computer.
5,Works great. Doesn’t work when you play Wii games on the Wii U unfortunately but used it for my switch instead
5,Probado en WiiU Switch y PC funciona a la perfección.Muchas Gracias!
5,It works
5,Exactly what I wanted! It works perfectly with switch.
5,Un muy buen producto la configuración un tanto complicada debería traer un manual adjunto
5,Works perfectly! So happy with my purchase.
5,Works great to play games on PC and Nintendo Switch with original Gamecube controllers.
5,cheap and effective!!! This product is great if you want to play smash brothers for the switch. I would highly recommend to buy this GameCube adapter because it is probably the best on the market.
5,This product worked miracles for using my gamecube controller. This adapter has little to no lag input time and the Nintendo  switch picked up the controller nearly instantly. The instructions were very clear and easy to understand. and I haven't seen any issues after dropping this adapter a few times.
5,Easy and simple to use. Suck that the Wii U only lets you use it for Smash.
5,cheaper than the official gamecube adapter but works just as well. Also works with dolphin emulator which is also a huge plus. Not much more you could want from a game cube adapter.
5,I use this product for Smash Bros (duh) on the Switch. I have not tried this product with the PC or WiiU. Otherwise it's super reliable has a nice cord length of its own and works flawlessly with any old or new corded GCN controller.
1,The second I took this out of the box I was extremely excited to use it because I've always played smash at my buddies house and he had a similar adapter and I have never been able to play without a GCN controller. Less than a minute in I noticed this has extremely bad input lag moments where inputs didn't register and a spotty connection. Do not buy this
5,Work great on my switch vibration even works with just 1 usb plugged in.
5,Easy to use and works perfect!
5,Used on my Switch and PC and everything works great.
5,Simple. No issues after many uses.
5,Exactly what our son needed for his xbox.  He is happy so we are happy.
5,Works perfectly and does what it's supposed to do.
5,Functions like a champ!  Easy-connect and immediately able to use devices that require this to function properly.
5,Works like a charm great product!
5,Connected 2 controllers and played with no input lag. Perfect for super smash bro
5,Works great! We often use this with our switch and have had zero complaint!
5,Easy to use just plug it in! No hassle.
5,This is a great tool for playing with GameCube controllers on the switch. Highly recommend it.
5,I was skeptical at first due to the low price of it but after trying it out I can say that this product works pretty well. I even tried out the wireless GameCube controller and it worked lag free. I highly recommend this if you’re gonna be buying the new Smash Bros Ultimate game for the switch.
5,Muy bueno cumple con su funcionalidad
3,This will work for game cube controller’s but will not work for a DDR mat unfortunately.
5,Works like a charm. So easy to set up and use
5,Product is as advertised no issues
5,Easy to use plug and play. Not much else to say about it
5,Product works as the description said it would. A pleasant surprise was that this allows Gamecube controllers to work with Overcooked 2 on the Switch!
5,Very simple and easy to use this adapter works just as it should.
5,I've used multiple adapters but this one is pretty darn good. Almost like the official Nintendo version. But further testing atm. Thank you.
5,Easy to use  you just have to plug it in the side and my GameCube controller work perfectly.
5,It is great I can use all my old GameCube controllers and I never have problems with it
5,My son likes it he does not have any issues with it
1,I was looking for something like this so I can play lego star wars on steam since it was a full controller support game but I was greatly disappointed 😞 that this is not working at all I first I thought my controller not working or not plug in right but no its clearly the gamecube adapter not working and yes I made sure I read the instructions carefully but...R.I.P
5,Very easy to connect. Perfect for my gaming system. Very inexpensive compared to big stores
5,Works well with the Nintendo Switch. Keep in mind that this is an adapter for GameCube controllers.
5,Mario cart with the squad go vroom
5,Once I got it I was able to plugin and start playing. Really recommend it.
5,Works perfect with my switch and pc really great value for this one.
3,Never used it. It looks nice so I’ll give it 3 stars
5,It works great. No complaints.
5,Super easy to use just plug in and it instantly recognizes the controllers
5,It basically plug and play
5,Works perfectly no complaints and a good price
4,Item was as described
5,Works so perfectly.
5,Works exactly how I needed it to work
5,Plug and play. Really easy and seems durable. Great value
5,Bought it to use GameCube controllers with dolphin it works.
5,Its a decent adapter for the WiiU and PC. All you have to do is plug it in and go.
5,Works perfectly very easy to set up
5,Great product. Easy to connect and enjoy!
5,Bought this for our Nintendo Switch- works great easy to use
5,Worked exactly as advertised. Thanks!
5,Bought this product for my kids they love it and I love that it's so easy to use.
4,Really useful adapter. Recommended!!
5,This product is very good. With a great price and quality it is perfect for gamecube controller needs.
4,It works
4,Pretty good and simple to use adapter.
5,Works great. Good size cord!
5,Used this bad boy on my PC case and it looks pretty cool and works really well!
5,Easy install works flawlessly.
5,Does exactly as intended.
5,This device is easy to use and good value for the money.
5,good product. Just have to see how long it’ll work
5,This works well really helpls alot
5,Good value for money
4,Works as intended.
5,This was amazing! My son loved playing super smash brothers with his friends!
5,Works great I can use all my old GameCube controllers on my switch
3,Does what is says just fair warning you can't open the home menu to my knowledge since that no button for it
5,Easy and convenient
5,It connected to the switch Easily and the controllers Worked great!
3,Despite it being a gamecube controller adapter meant to emulate the Wii U one it does not work correctly with Dolphin. Please be aware of this before buying.
5,Easy to use.
5,Easy to use
5,Value for money
5,Easy to use
5,No setup just plug the adapter to the 2 USB ports on the front of the Nintendo Switch and the plug in your GameCube controller.
5,Great way to use the old GameCube controllers for the Nintendo Switch. Easy set up and good product. Prompt shipping.
5,It works great! No connection issues or problems.
4,Works as expected
5,My son loves this item! He’s now able to play GameCube games on his Wii! Thanks
5,Just as described. East to use. Recommend!
5,Excelente
5,It works great! Plugged it in and started using it with Dolphin immediately.
5,Kids loved it
5,It was easy for the kids to figure out!  Did the job!
5,Works as intended
5,Works well with switch and retropie or dolphin on pc
5,Product works great!!!
4,Works great!
5,Works great! I messed up a driver with it on my laptop so I can’t use it on that but it works perfect on my desktop. I’m very happy I made the purchase.
5,Works as expected.
5,Works great exactly how you would want. Just a side note the Switch only really lets you use this on Smash Bro’s.
5,Great product
2,If you expected to use this with Dolphin or any other emulator look elsewhere. Despite being advertised as such it doesn't work on PC. Works really well with Switch/Wii U little to no latency.
2,This is my second time buying an adapter like this. The first one was a mayflash adapter and worked fine so I got complacent and decided to get a cheaper model for my second one. Dolphin will recognize the adapter until you open a game then no controllers will show up. If you open controller config while a game is open you can see it flash between the adapter being not recognized and being recognized very briefly.Edit: gave a star back as it does seem to work with a first party switch dock so it is isn’t totally nonfunctional even though it doesn’t work for my desired purpose.
5,For $20 it’s a working GameCube adapter... which is what it is meant to be. I’ve already dropped it a few times off the desk and it works perfectly fine so there’s some durability there. Had it for a couple weeks and so far no issues 👍
5,Works great easy to use. Time for Smash with gamecube  controllers
5,Simple and easy to use. Worked as expected.
5,Worked perfect straight out of the box
5,Great product easy to use
5,Easy to use
5,Arrived on time no chips or damages and works perfectly. Will upload pics soon.
5,It works!
5,Worked great
5,Why shell out 60$ for a hard to find adapter? This gets the job done and can easily play PC games as well.
5,It really does work!
5,Works great! Just as expected. Fast shipping
5,Works great!
5,Easy to use and does exactly what it’s supposed to do. Perfect for playing smash with friends
5,This adapter is really great! It's small and easy to use! I have run into no issues while using it at parties I would highly recommend it.
5,Works great
5,Works fine on both PC and Switch. Have had no problems with it thus far but also haven't used it much since I bought it in anticipation of Smash Ultimate just like 9/10 people who buy it. Will update if any problems do occur when the game is released.
5,Works great
5,Has worked perfectly on my Switch in the past two months I've had it! No issues with anything so far. Amazing product and value for money!
5,Works great!
5,This product is a good choice if you are looking for a gamecube controller adapter for the switch. The price is pretty nice and you just have to plug it into your switch and you are good to go. I am very satisfied with this purchase.
5,Used it to play Super Smash Bros with the fellas. Works fine. No problems with several days use
4,so far so good with this product. no issues!
5,Works great
5,It has been great!
5,Works perfectly no complaints
5,Works great!
5,Works excellent! Able to use my Game Cube controllers for my Switch
5,Amazing! We are all Playing Smash Ultimate!
5,Works like a charm for both the switch and pc
5,Works as intended. looks good too.Side note: I ordered one previously but it was stolen from my porch The seller replaced it almost immediately A+++
5,very nice!
5,I used it to connect my game cube controllers to my switch and it works flawlessly. I have been non stop playing smash and the adapter just let me play with others without hassle. Super easy to use and plug in. No issues. No problems. Perfect.
5,Got it for the switch. Works perfectly with no issues.
4,It worked with GameCube controllers I bought online with my Nintendo switch and that's what I needed it to do to get ready for Smash.
5,Ordered this to play some Smash Bros. Ultimate and it works perfectly no issues as of this review. Arrived very much on time and the adapter was not damaged in any way. Very good highly recommend it!
5,Aa described works great!  Good seller.
5,Plug and play. Supports rumble feature of wired Nintendo Gamecube controllers.
5,Good design works perfectly
5,Works perfect when you have large groups of people and not enough controllers.
5,Works great and easy to use
5,Great
5,Amazing controller response with this adapter. Highly recommended. Especially with playing Super Smash Bro’s. Not a single delay!
5,Worked well for me. I used it with third party GameCube controllers on Dolphin emulator.
5,Got Smash for my birthday but I didn't want to buy four $60 controllers just to play with friends when I still have my old gamecube stuff. Easy thing to use saves you money and doesn't cost much at all.
1,Bought 3. Returned 3. All with the same issue one port having issues with one or more buttons not responding or repeating actions.
5,Does just what it was advertised.
5,Zero lag. Very easy to use
5,Easy to use
5,Easy to use
5,Muy buen producto
5,My grandson loved it!
5,Amazing product and works way better than other similar brand products I have owned which broke quickly. Highly recommend
5,Bought this to use with my Nintendo Switch- worked right out of the box.
4,Does the job but inputs on controller seem to lag slightly. Could be an issue with all adapters in general.
5,Wonderful simple product. Works as intended. Wanted to use a game cube controller to play Smash Bros and this adapter works like a charm!
5,Excellent product. Fit really well for controller to play with my Nintendo switch. Very happy 👍
5,Great buy! Easy to use with the switch. Just plug in and play!
5,Works as intended and now I can play smash bro’s the way I’m used to!
5,Works as expected
5,Was what we needed for Gamecube
5,Just what I was looking for. Works exactly as expected!
5,bought it for Mario kart on the switch. Works perfect
5,Easy to use. Straight forward
5,Long cord better than the original adapter.  Works great so far.
5,Good product
1,Being extremely excited for this to arrive would be an understatement. There is nothing like the feeling of getting the boys together on the weekend and playing some SSBM... but unfortunately the boys wont be gathering this weekend...The cheap AF couldfare adapter showed up with AWFUL packaging (an envelope) along with a gamecube controller I purchased (also BROKEN). I've tried everything to get the adapter to work on my PC and in my Wii but to no avail. It looks like I was SCAMMED.Please dont make the same mistake I did. Do not buy from this company.
5,I bought this specifically for Super Smash Bros. Ultimate and I'm happy to say that it's perfect for it. My Gamecube controller was able to be plugged in without any issues and the response time and controls are perfect. Haven't tried it on PC yet however.
5,Purchased to use for Smash Ultimate. Worked with no issues. Played a lot of hours of multiplayer on it. Good price.
5,Works perfectly! Popped in an old gamecube controller to play with on the Switch and was instantly enjoying fully functional gameplay. Good stuff! Also I dropped it (butterfingers) and it still works perfectly :)
4,it does its job thats all that is needed
3,Is okay
5,Really great for playing smash and for a good price.
5,Worked exactly the way it was supposed to
3,The switch dock has 2 usb ports.  The adapter has 2 plugs you need 2 for rumble you need 2 adapters to enjoy smash. The dock needs extra usb ports 3rd party docks tend to brick switches.  Alas we where all disappointed and decided to play mario party
5,Works exactly how it is supposed to. No problems.
2,The only reason this is two stars instead of one star is because it works perfectly fine on Switch but it only worked 10% of the time on Dolphin both with and without the appropriate drivers.
1,Diddnt work
5,Took a minute to set up and started using game cube controllers for my switch right away. This was a great purchase and it does exactly what I wanted
5,Great product and price
5,Just what I needed
5,Easy to use and does the job.
5,Excellent price for people that dont want to buy a bagillion switch controllers and want to occasionally play smash with multiple people.  I had a gamecube so it was nice to be able to reuse those controllers.
5,Plug in and game on perfect gift!
5,I consider this the best option when looking for an adapter it is the best value for your money.
5,Its useful works well for the money.
