rating,review
2,Super easy to setup and use on the Switch.About .35-.5 ms delay with inputs though. Not that reliable if you’re looking to play competitively online or in person.If you’re just using it for casual play or for a group of people who aren’t competitive minded at Smash it works just fine.
4,Arrived on time and works amazing
5,Worked with my Gamecube controller and Dance pad as I needed it to. Keep it set to Wii switch even when using with PC though.
5,It does exactly as I was hoping
5,Camera
5,Works perfectly. Build quality not too good but for the price and reliability just fine in my book
5,It does exactly what I need
5,It works great. Definitely get this.
5,Wanted an adapter for the switch to use game cube controllers. Plug and play it does exactly that.
5,Works great no input lag or anything. Easy to set up just plug and play. Overall good adapter!
5,Very pleased with this purchase. No complaints yet.
5,Bought it to use gamecube controllers while playing smash it's never failed me so far.
5,Lost my old one. Got this one. Works with my gamecube controller with no lag.Not much else to say.
5,Simple to use and working as intended!
5,It does what it's meant to do. Would recommend.
5,Works!
5,I bought this primarily for the Nintendo Switch. Thus far it works perfectly. I haven't tried it for PC yet.
5,It’s pretty good for it’s price
5,Just what I was looking for
5,Works perfectly I've tested a few of my games on the Switch and they work perfectly can't wait for Smash to come out this winter!
5,Perfect for my Wavebird controllers plugged right in and started working. Would highly recommend them!
5,Very simple to set up just plugged it in. Have not had a single problem yet
5,my son enjoys playing the games
5,Great product  works great with my Nintendo Switch
5,works just like the nintendo adapter but is significantly cheaper it's great that is works on wiiu switch and pc.
1,Broke 1.5 months after purchase. Just outside of return window
5,Haven't had issues so far
5,Bought this at the request of my kid. He said it was easy to use to works as expected.
3,Bought this for my son and it has no explanation as how to use.  One connector is gray one is black and who knows what goes where.
5,Works perfectly shipped quickly and arrived on time extremely easy to use.
5,I purchased the gamecube adapter for my Switch. Works out right out of the box and with no problems. Highly recommended.
5,Just plugged in and started playing. Make sure the switch on the adapter is in the right setting. No complaints!
5,Great product exactly as advertised. The shipping said it would take 3 weeks and it came in just over a week!
5,Works sweet
5,Works great on the Switch. Now my son can use his game cube smash controller to play Smash Ultimate.
5,It works! Feels a little bit cheap but it works and is cheap so can't complain
5,Great and easy to setup
2,The adapter doesn’t work on PC. I tried many ways to plug it in and get it to work for an emulator I was using but it doesn’t convert right.
5,Works as advertised no issues
5,Works fine for Wii U. Can't attest to the input lag or anything but it feels perfectly responsive and no issues so far.
5,Perfect! Does exactly as advertised!
5,Very nice
5,Great product.
2,It doesn't work fully. The first port doesn't work at all on my switch and I had to use the second port in order to utilize this.
5,The ports are a little stiff when plugging in the controllers and the fourth port is kind of finicky but it works well overall.
5,Great for pulling out your old GameCube controllers !! Love it
5,Works well for what I need it for.
1,I have had this product for less than a month. It has not left my entertainment center yet my switch stopped recognizing the adapter. The switch recognized other USB devices so I tested it on my computer. Nope! Failed to recognize device. Don't waste your time.
5,Worked exactly as intended. Even received an email checking up on the product. Great for the price.
5,Great
1,Didn't work in thee slightest and honestly I shouldn't've expected it too. I was excited and bought it without hesitation 'specially since Amazon suggested it. Instead got a no-brand (can't even say off-brand) product that didn't work and how I should've known it wouldn't was the fact that in the photos for the product it shows PlayStation controllers and the lovely lady who reviewed it had a branded product. Really upsetting but you can't win ever battle I suppose.
3,It's a cheap knockoff. It'll do the job for casual play but not recommended for tournament setups.
5,Works great no perceived latency easy to connect and reasonably priced.
5,Love it! Works great easy to use.
5,The item arrived promptly as described.  My son is ecstatic to be able to use the Gamecube controller on Wii U.
5,I bought this adapter to use a GameCube controller on my switch and it works perfectly.
5,Works perfectly!
5,Works like a charm
2,Works for the switch but doesn't work for PC emulators like Dolphin.  You're better off buying the actual Nintendo version
5,Worked as intended
5,The product came as advertised and works perfectly. Great value as compared to other adapters out there.
5,Kids love it. So many Smash Brothers battles have taken place because of this piece alone.
1,Lengthy process to use. First product sent did not work. Yet to try the replacement...
5,Good
5,The adapter works perfectly. I have third-party GameCube controllers and there are no issues connecting to the Switch.
5,Looks to be a high quality product can't wait to use it
5,Great for GC controllers!
5,Works great! No issues
5,It still works great and was very inexpensive.
5,Works perfect!! Thanks
5,I mean i got it on time. Thing was just fine. Easy to use.
5,Worked as it should. Shipping was fast. Thank you.
5,This product gets the job done for a fraction of the price of competitors
5,No issues at all
5,This product was exactly what I wanted. It works perfectly fine and I couldn’t be more satisfied.
5,Great product. Does what it says and does it every time.
5,Really needed this for a smash turny I was having and it works great!
5,I like how quickly I received the adapter and how easy it was to use.
5,Hi! This is a Christmas present for my son so I don't know how it is yet.Sorry
5,Great product easy to use and was delivered fast.
1,It stopped working a week after I bought it
5,great for what it is
5,Great!
5,Very good product works well with the switch a great investment for a nice price.
1,It worked fine for over a year but suddenly started disconnecting my controllers and adding drift to them for some reason. It could have been something I did but I highly doubt it considering I would never really move it from my switch. Do not recommend.
5,Got the adapter and used it right away. It's literally plug and play!
5,As described arrived as promised. Works GREAT!  Competitive price. Item used for Switch.  Thank you.
5,Great product!  Like new!  Excellent customer service!
2,It was made of a nice plastic material and immediately worked when I plugged it in but it was not screwed together. The plastic shell came apart after picking it up after one use. It would not be a problem if I had little screws.
5,Worked well no discernible lag connects instantly great cheaper adapter!
5,Connected to my Linux distro no problem. Gaming like it's 2001.
2,I bought this based on reviews and Q&A answers that verified this worked with MacOS. I tried many different things but could not get the controllers to be recognized on my Macbook with either Dolphin or OpenEmu. Watch out!
5,This works perfectly. No problems.
5,Good so far. Use it for Smash on Switch and I have had no problems thus far.
5,Dont pass on this adapter  it works with with switch  wiiu  and pc flawlessly.
5,Great item worked as it was intended to
5,This product worked exactly like I needed it to.
5,On pc you might need to download a software to play on Dolphin
5,Works very well  good price! glad I bought it.
1,I did quite a bit to try and get this device up and running on PC and it just doesn't work like all of these other reviewers said. To be honest I suspect foul play.I tried both modes available out of box and when that didn't work I proceeded to try several different drivers and launchers to get it functioning. Ultimately my conclusion is that your PC will indeed recognize the adapter however no controller ports actually function.This has been a very frustrating experience and I will probably be doing as others recommended and trying a Mayflash. Do not waste your time like I did.
5,Works great! Haven't noticed a difference with turbo button but works great anyway!
1,This item claims to work with the Dolphin emulator on PC but does not. Tried in both PC mode and in Wii U mode and while the device is recognized by the computer it is not recognized by Dolphin.Typical method is to download Zadig and install the correct drivers for the device which should be recognized by Zadig as "WUP-028". However the adapter is called "Gamecube Adapter" instead.Once opening Dolphin 5.0 the adapter simply is not recognized whether trying to use in PC mode as a Standard controller or in Wii U Mode as a Gamecube controller.
5,Does what you expect
5,Wanted to use this for SSBU as a longtime Melee player and it works perfectly!
5,I got this for my nintendo switch and it works just fine!
5,I had no problems hooking it up the price was ideal and have experienced zero input delay.
2,Didn't work tried using it on pc/wiiu/switch and plugging in multiple controllers and I couldn't use any of them on any console.
5,Perfect
5,It works with my switch for both wired GameCube controllers and wavebird. No problems.
5,I purchased it for my grandson.  Received the item in a short time. Would definitely buy again.
5,Works as intended
5,My son enjoys using the controller on his Switch very much!
5,Bought it for smash and seems to be performing just fine.
5,Its a very simple and straight forward product to use. Works well and I am very satisfied!
2,This thing worked for a bout three days and in the middle of a gaming session with my family the third port started glitching and now every time you plug any controller in it it makes your curser go to the left. The thing feels really cheaply made. Sucks but what can I do about it?
1,The adapter worked for a good 3 days before it just decided to not want to identify as a adapter on my PC anymore. I tried everything and even reinstalled windows before I just gave in and bought a offical adapter. SO PLEASE FOR THE SAKE OF YOUR WALLET DONT BUY THIS FOR PC USE THEY LIE.
5,Bought this for Smash Bros Ultimate on Switch works perfectly with new and old Gamecube controllers.
5,I get to enjoy playing Smash Ultimate like how I fell in love with Melee.
5,Adapter works great no lag and has good cable length highly recommendable product.
5,My son is very happy with this product
5,Product is dope! Not entirely sure on what the turbo button does but it works.
5,Works perfectly the only setup is plugging it in and the cord is long.
5,Delivered to me just like it said. Pretty good
5,Product works great so far and for a great price
1,I had bought this for the purposes of playing smash melee on the PC. i tried everything wasting hours trying to get it to work. downloading drivers messing with the settings. looking at other reviews saying it's worked for them on PC and how they did it etc. extremely frustrating seeing how it clearly says it can work with PC when it does not.
5,Does the job and is easy to use.  The quality is perfect for the price.
1,Absolute piece of junk. Windows stopped recognizing it less than a month after I bought this. Stay FAR away from this adapter because it will die on you. I noticed other people weren't having this issue and it works for them which is fine. But mine stopped and I have to give it a 1/5. It was fine before hand and did it's job but not anymore.
5,Works as intended and arrived quickly
1,i have a wavebird wireless gamecube controller and it does not work with this. the light on the wavebird receiver lights up but the switch wont recognize my controller or even react to it being plugged in
2,The product worked perfectly for my switch with no noticeable lag. However when switched to the pc the adapter didn't work for the Dolphin Emulator although says its compatible. If you are just buying it for switch use its perfectly fine but for PC it doesn't work.
5,No issues with this product.  I use it on my PC.
5,It's an amazing product and easy to use especially since I don't use a gamecube anymore.
1,This adapter worked for 3 seconds... I followed several YouTube videos to make sure it was not an error on my part or on the controller's part. Nope. This adapter sucks for me at least. Maybe you'll get lucky and get a working one but when I attempted to connect my controllers for Smash one of them showed up for three seconds and then disappeared and never came back after multiple attempts. It feels cheap and is cheap save your money and buy a different brand. I just purchased a "Old Skool" brand adapter and it works great although a little more expensive. Good luck!
2,It is easy to use but the connection with I insert the game cube controllers into the slots is very lose and doesn’t work good. The connection isn’t consistent enough to play a game with
5,Whooooooooped Brian Nicols ass for days in smash with this adaptor.
5,As advertised
1,This didn't immediately work for me after troubleshooting for some time so I decided to give it some time maybe a driver needed to be updated or something. No this thing simply doesn't work with dolphin probably something that should be listed in the product title instead of assumed and not found out from other unsatisfied customers. You're better off buying a legit one that doesn't omit such an important feature 1 star.
1,I received the item but it didn't work. I tested all 4 slots and only slot #2 worked for a minute if the plug was kept perfectly (and unrealistically) straight. It is also made of very cheap plastic that didn't feel at all durable. Huge disappointment for me and my siblings. We were looking forward to playing together.I've requested a replacement and will update my review if the replacement is in working condition.
1,As title says I got the adapter and pluged it into my PC and pluged my controller into it and it didn't work at all tried all the ports and checked all the cables and it just didn't work DO NOT BUY
5,Works perfectly...
5,Works exactly as it should and easy to use
5,Works just as it should good price and fast shipping.
5,Good
5,Very easy to set up and so far work well!
1,DOES NOT WORK FOR PC OR DOLPHIN EMULATOR. Why even advertise it with a "PC" switch if it wont even work for PC? Even when trying to use third party drivers it still did not work. Do not recommend if you are trying to use for PC/Dolphin.
5,Works right out of the box on the switch
5,Use it to play Smash Ultimate with gamecube controllers works great
5,Works perfectly fine super worth it for the price.
5,Great for value
5,Item came on time and as expected. Works with Switch and Smash.
5,Fast turnaround time to my 🏠Works like a charm.
5,Works great on PC and Switch. Worth the buy if you plan on getting smash ultimate!
5,it is a christmas present so i just dont know much about it yet
5,Works great for smash.
5,Does just what it says no issues with it so far.
5,It works
5,Must have for any smash player. Makes those old GameCube controllers useful again
5,My son was really satisfied with the product. It arrived earlier than expected.
5,Loved it !! Now we can play smash bros on the switch
5,Left it in switch mode and it worked with Zadig like my older adapters.
5,Solid alternative to the official Nintendo GC adapter for a fraction of the price.
5,Worked as described
1,Do not purchase this product if you are using dolphin emulator it does not work it misleads you to believe it does and you can damage your original drivers by trying to make it work.
5,great
5,Works great! No issues.
5,Product shipped quickly worked properly was new and at a good price...no reason to pay more
5,Exactly what wanted
5,Works perfect
5,Works with dolphin sets up easily all is good.
5,Product shipped exactly as advertised and works like a charm. Would purchase from this group again.
5,Great for smash
5,Just as great as the Nintendo version no problems what so ever.
5,Not much else to say other than it works exactly as advertised.
5,This is a gift for my grandson who requested it. Came in perfect condition.
5,Needed it for massive play of Switch Mario Kart 8. Worked like a charm!!
5,Does just what i needed it to do great for smash ultimate
5,I love this adapter as it works perfectly on both PC and the Switch!
5,Works as intended
1,DO NOT BUY THIS ADAPTER TO USE GAMECUBE CONTROLLER ON PC. DOES NOT WORK.After attempting to install the drivers in multiple ways and on multiple websites the adapter was unable to work with my computer (Windows 10). I have read on other forums that this adapter does not work. The Mayflash adapter was the common adapter that was suggested.DO NOT BUY THIS ADAPTER TO USE GAMECUBE CONTROLLER ON PC. DOES NOT WORK.
5,does exactly what i needed it for. I have only tested it with PC.
5,Exactly what we needed
5,Just bought this. Getting ready for Smash on Switch. So far it works!
5,Fantastic!
5,Great product for a great price!
5,Works great for switch delivered pretty quick for such high demand.
5,House of four boys this is the go-to purchase
5,Bought one to use for my switch and had no issues.
5,This adapter works on WII U Switch and PC. Glad I got it!
5,Great price. Received very quickly. Works well. Good product.
5,Works perfectly
2,The product didn't work with the Wii U as advertised!!!
5,It works as intended easy to set up
5,Works great so far using for smash bros. ultimate on switch.
5,Got my fiance's valentine gift set with this! Works great!
5,It works perfectly and came on time.
5,Does exactly what description implies. Couldn't be happier!
5,Easy to use and arrived quickly!
1,Got for a time up at the mountains with some friends. After we go there had it hooked up at night time for when we relaxed on the switch to play smash. The delay this device causes between the moving the joy stick and the corresponding move on the screen was at least 1 full second. Made any game we tried with it UNPLAYABLE.0/5 would not buy again
1,Got this thinking this would be a good/ easy device to use to play games on Dolphin Emulator on PC but it will not work with Dolphin. Any reviews saying this works with Dolphin Emulator are lying straight to your face. You should spend the extra bit money on a Mayflash that will work with Dolphin Emulator on PC and not this garbage
5,Perfect adapter. Tested on Super Smash Bros Ultimate. Working great!
5,This is what everyone playing Super Smash Bros Ultimate needs!!!
5,Great product thanks!
5,Arrived quickly and only required being plugged in to work
5,It's a good buy.
5,yeah
5,Not bad definitely makes a difference in smash
5,Inexpensive shipped quickly still works a month later.
5,It works for Switch with Smash Ultimate! Everything works great!
1,"Make sure you have it plugged in!" Oh gee thanks... This thing is garbage and doesn't work as intended and has since been returned.
5,Just as good as a Nintendo product
5,I plug in the Gcube controllers they work. A+
5,Excellent!
1,when plugged into pc i get warning on boot saying it cant turn on to prevent damage
5,Works great using it with a gamecube emulator on pc.
2,Despite being advertised to work with emulators it does not function with Dolphin one of the most common and popular emulators
5,Good value for your money.
5,Arrived on time works great. Easy set up
1,It's my own fault for not reading all the reviews because several people did mention it. If you are getting this for PC then find something else. It does not work with Nick Brawl on steam
5,works just like the Nintendo product with other features
5,Functions perfectly. Good cheap replacement!
5,Is good
5,Cheap and it works
2,I should have looked at the reviews. It does not work with Dolphin emulator even after following the connection directions on Dolphin's site and putting hours into troubleshooting.
1,When I plugged my controller into the port it was hard to get in and when I pulled it out it was hard to get out. The port is so narrow that it pulled the inside end of the cord out. Luckily it snapped back in. I thought I broke my controller so I tested the controller on my Wii and it works perfectly. Thank God. It does work on the Switch but I don’t think it’s worth the risk of damaging your controller. Would not recommend.
5,Great bang for your buck
5,It works perfect!
5,Plug and ready to play. :D
5,Awesome product would buy again!
1,Tried to use this with the switch but it didn't work. When I tried using a wave bird the controller connected to the receiver as the green led lite up when i poweed on the controller. However the switch refused to see the controller.I ordered a mayflash adapter and that worked perfectly fine...tried to save money by buying the pdobq device and it didn't work out...
5,worked perfectly
5,great
5,Nothing to complain about.
5,Works as advertised. super easy to setup..
1,Product does not work with Zadig and it has input delay if you switch it to PC and use Dolphin to emulate the controller. I know a lot of people are buying adapters because of the recent edition of Rollback Netcode for Melee and you will be extremely disappointed if you buy this product for that purpose. I returned mine and went with a Mayflash. Do not recommend for anyone who wants to play Super Smash Bros. Melee!!
1,The Turbo button was not present on my adapter despite it being present in the picture and the description on the box. The adapter itself is shoddy in quality as well. The switch on the back is flimsy and the port connections feel as if they were not made to the right size. It takes more force than should be necessary to connect a controller to the port. Overall don't buy this. There's much better adapters on the market for this price point.
5,Everything works great thus far. No complaints
5,No issues. Does what it says it does.
5,RECEIVED ITEM ON TIME AND AS DESCRIBED.
5,durable easy to use and a very good price!!
5,I liked that it worked just fine.
1,I bought this product for my working Gamecube controller. After a couple months the adapter stopped working on my pc and switch ive trying to fix it and tried reusing it over and over.If u want an actual adapter that will work on Switch and PC use mayflash.
5,Works as expected.
5,Our wireless gamecube controllers work great.
5,As described  great product works great.
5,Works perfectly.  No lag. Good  quality product.
5,Worked wellNice long cableNo issues
5,This one actually works
4,Found one of these in a thrift store for a few bucks so thought I'd pick it up. I can't speak for how well it works with the Wii U but it works great with computers albeit a couple small bugs. For one the unit's native driver does not appear to be very compatible with Windows; in my case 11. The connection is horribly spotty a problem however fixable by using Zadig to replace the driver with a more friendly one. The second issue is interference while using a Wavebird. The receiver must be immediately visible to the controller for buttons to input reliably; having it obstructed even a little (e.g. your legs) can cause input to fail or stutter. Besides that awesome alternative to the official product.
5,Happy with purchase no issues
5,works like a charm
1,DOES NOT WORK FOR PC. I tested on multiple pcs and simply does not work. Maybe there was a different product with some of the other reviews but as of late this product doesn't work despite many attempts and workarounds. The pictures and videos that other users posted don't look like this adapter with text on the top that isn't there with the adapter I recieved. I feel robbed and returning it isn't worth the effort. Don't get tricked.
2,After several tries downloaded files and a few hours of troubleshooting I have came to the conclusion that this adapter doesn't work with Nintendont.It does work with switch with Smash so if that's what you're looking for cheers.
1,I don’t write reviews but this thing worked fine for a week and then just stopped working for no reason. Would not recommend at all.
5,Worked as expected.
5,Works as intended for a great price
5,Easy use quick and simple
5,It works great.
5,Everything works as expected
5,This works better then I thought it would.
5,Nice and easy
5,Worked with out issue
5,Love this for the switch
1,I love this thing. I enjoy the less expensive option and works great most of the time. Sometimes when I re-plug in a controller it will stop sending the bumpers or suddenly have drift. I’m certain it’s the adapter since my friend also has an adapter and I play on that one 50% of the time. This is the only one I have issues with. I’d recommend spending the extra couple bucks to get the Nintendo adapter.
5,No problems with this product
5,Good
1,Tried on my recently purchased Switch with no signs of functionality from the Switch or Smash Bros Ultimate. Tried several ways all the ports - nothing. Thought I would try to see if my PC would recognize it but got an error message from Windows immediately after plugging it in that the USB malfunctioned. Returning it for a Mayflash.
5,Works on the Switch very well.
2,Did not work on PC despite what the product description said. Wishing I bought a different adapter.
5,Worked Great!
5,Works great right price. Thanks
5,it works! no complaints
5,I use for super smash bros
5,Great product
5,works great. thanks
5,Works great! Came packaged well.
5,Great product for your money
5,Does the job with no problems
5,Excelente
