rating,review
5,Re-read the title. It works and easy to switch for pc vs Nintendo Switch
4,This works great overall but causes my controller to constantly rumble when hooked up to the switch for super mario sunshine the whole reason I bought this.
5,Simple and easy to install and use. Just plug and play.
5,Very easy to install and works very well!
5,Worked perfectly showed up on time good value for its price. Not much else to say tbh
5,Took out the ol' GameCube and also used this to play additional games on an emulator on my laptop. Fun times
5,I really like this device and it works perfect
4,Bought this adapter because it claims wavebird wireless controller is suported but none of my two controllers works reciever shows comands are being sent but it's not recognized neither by swith wiiu or pc; tried a normal gamecube controller and even a ps2 to gamecube controller adapter and they work fine though.Tested the adapter with both usb cables connected.
5,Excellent adapter does what it advertises and is well worth the price tag.
5,Works great! Roommates and I love playing on our Switch. Good quality and cord length.
4,Does exactly as intended a bit of a noticeable delay but overall v good.
4,Make sure you plug in the black plug if you’re only using one - otherwise it doesn’t work. Working great to run Dolphin on my M1 Mac Mini!
5,It's a gamecube controller adapter it does what it's supposed to and at a really good price. But what sets this one apart from the others is the above and beyond customer service! When I finally had an issue with mine working with the rep was pleasant as can be and completely painless! They resolved it same day so I can be back at it with the Toon Link in no time! Highly recommend!
5,So i just got this thing in the mail today and I wanted to use it for PC. Well i was beginning to get worried cause it didnt work at first and I saw a couple of 1 star reviews from people saying it'd not work with PC... well i also found a comment saying that you'd need to set it to Switch/Wii U while also going to download "Zadig". I can report that after using Zadig (and youtube tutorial for Zadig) the adapter works with my PC as I wanted
5,Works well
4,Honestly it's not to bad but sometimes it messes up when I jave more the one plugged in.  I have to unplug them and replug them in and it works
5,I would like to clarify this can be used with dolphin with some setup.I used a program called zadig to Inatall the driver. When you use this program make sure wup-028 is selected and the USB Id is 057e 0337 then install or replace the driver.After this configure dolphin controller and select GameCube adapter for wii u
5,Works perfectly
5,Bought a GameCube adapter to use with Switch and WiiU. Works great and shipping was fast.
5,10/10 Exactly as expected
3,This product works for the most part but though my Wavebirds light up on the receiving end when plugged in they do not seem to function in Smash. The Switch does not react in any way to the signal they're sending out. Wired controllers do just fine.*EDIT* The seller was courteous about making things right based on feedback but there is still no Wavebird support.
4,I got this product to make it easier to play with my niece and nephew when I babysit. My nephew is obsessed with my Nintendo switch but we have a hard time playing two player with the tiny controllers that comes with it. I looked up the cost to get some controllers in the old Nintendo  or GameCube style and most of them are stupid expensive. I still have my old GameCube and controllers so when I saw this adaptor that allowed you to use them and was also cheaper I jumped at it. Very simple to hook it up to the device. I was worried that there would be some long installation process or syncing that I would have to figure out but it starts working as soon as you plug it in. You just have to go into the control settings and choose which controller to use. I give this a 4 star for only one reason and I'm not sure it's really the adaptors fault but a difference between the old and new systems. The controller buttons don't take the same actions that your accustomed to. Say you play a game that you play all the time with the switch controllers and the jump button would always be "A" but when you use the adaptor the jump button would be "Y" or something. You would have to get used to a new set of rules for the buttons. Not a big deal for me since I just need the extra controllers to babysit but I was still a little disappointed that everything didn't match up since I grew up with the old controllers and you can't use the buttons the same way you remember. Other than that I think it's a great product.
5,The product itself looks pretty standard but it works as it should. I was a bit hesitant to purchase at first because I was not too sure of the quality but after the first plug and play it did wonders. I thought there would be a lag with the controllers but I didn't experience any. overall very satisfied with my product. (Only have tested on the Nintendo Switch no turbo mode as of yet but am curious to see how that turns out).
5,Easy set up!
5,Some folks are claiming this doesn't work for PC emulation (I've tested Dolphin) with a wireless controller (wavebird style). I too was having difficulty but it's important to connect BOTH USB inputs to your PC. The gray USB when connected should allow power to your wireless dongle plugged into a port. If you only connect the black USB from the adapter the wireless controller will not work (black only works for wired controllers however). To accommodate my laptop (one USB port on left and right side only respectively) I had to cut the adapter cord to accommodate a wide split across my laptop. Once I did that and configured in Dolphin both wireless and wired would work! (for dolphin you don't need the "gamecube adapter" only the "standard controller" from the drop down).
3,The second port does not work properly. When attempting to use a GameCube controller in port 2 the left trigger button is rapidly activating making many games impossible to play. Luckily 1 3 and 4 still work so I can still play four player if one person uses the switch controller.
4,UPDATE: The seller politely messaged me to offer replacement. I had instead requested a refund and they graciously obliged. Very pleased with their customer service perhaps I was simply unlucky with particular item I received.---I had bought this to replace a broken gamecube adapter for my switch. I go to school so within the 3 months I owned it I used it relatively infrequently. It is now broken and will not register any of the inputs on my controllers.
4,just doesn't work when trying to play gamecube games on wii u you'd need mayflash
4,Steps to make this thing work:1. Leave switch in Switch/WiiU position and plug into PC with Gamecube controller in port 1.2. Make sure it comes up as WUP-028 when Windows detects it. If you move the switch over to PC it comes as a generic controller and won't work3. Download Zadig go into Options and enable List All Devices3. Select WUP-028 and then click on Reinstall driver.4. If using Dolphin go under Controllers and change Port 1 to Gamecube Adapter for WiiU. It may auto change it but not sure.5. Happy gaming!
5,This controller was a gift to my grandson. After two weeks he says it is amazing and much better than his previous controller.
5,I thought i had a defective piece at first but after searching online and following the steps so the switch can recognize the controllers it works wonderfully. Haven't had to do any additional steps or set up. Just plug in before the switch is on and you're good.
4,Probably the cheapest and functional 3rd-party adapter I've ever used for PC games and recent Nintendo consoles. I'd recommend the "Wii U" mode for accurate controller function (see screenshot) when using Dolphin.Do note that this adapter is not initially detected by Dolphin until you correct the software driver for this adapter using Zadig (available to download online) or similar methods. Thankfully a guide from Dolphin website ("How to use the Official GameCube Controller Adapter for Wii U in Dolphin") will tell you how to get it working while using the "Wii U" mode on the adapter.Pros:- Controller function on-par with Nintendo and Mayflash brand.- Easy to use Turbo function for constant shooting jumping sliding etc.- "PC mode" for use with other PC games.- Vibration function when the grey USB plug is plugged-in.Cons:- "Wii U" mode doesn't work with Dolphin until driver is corrected by available software online.
4,How to install:plug the black plug in first replace the drivers with zadig set all the controller options in dolphin to "Gamecube Adapter for Wii U" and it should work from thereSome notes:-the switch on the back must be set to "Wii/Switch" even though it is connected to a pc the pc is going to pretend to be a wii-the device should appear as "WUP-028" in your pc's devices and in zadig's dropdown menu (options -> list all devices if it does not appear automatically in zadig)-use matching usb ports (example: if your pc has 2 usb2.0 ports and 1 usb3.0 port use the 2 usb2.0 ports)This took me way too much googling so hope it helps. The device is a little flimsy so it might break if dropped but otherwise it seems good.
5,I like the ease of putting it to work right out of the box. Wish it was a single usb though somehow
5,Every so often I have to replace game controllers now I don't have to worry with Nintendo systems on which one to pick.
5,Came a bit after expected but worked perfectly. Works with both old actual GameCube controllers and modern GameCube lookalike controllers.
5,I bought this not knowing what to expect considering it's only 16 bucks. I had previously configured the dolphin emulator to work with the genuine Nintendo adapter at an overclocked polling rate. I plugged this thing in its place and without even installing any driver it worked perfectly instantly. 1000hz polling rate. Perfectly responsive played using it for an hour with no issues. Make sure to have it set to Wii U mode not PC mode when using the dolphin emulator.I was playing Super smash bros. Melee.
5,para todo jugador de Smash rivals of aether brawlhala y cualquier juego similar es altamente recomendado.Sin contar su conectividad con la Pc y sus 1000 usos que le podes dar en la PC ;)
4,Good product for its intended purpose but if somebody walks by and gives you a static shock it shorts out and you have to unplug it and plug it back in.
5,One of the best adapters i have purchased on a long time i use it for competitive smash and its just like the original but at such a low price thats just a banger a must buy 🙌
5,Cumple con su objetivo buena compra me funciono sin problemas para conectar controles de gamecube al pc y a una Nintendo switch.
5,GreatWorks well
5,Works well I have no complaints I enjoy the product
5,Easy to setup and worked as described. I bought it to be able to add more players in Mario maker 2 and the controller adapter gave use two additional GameCube controller inputs to play 4 player games! See pic for all you need to play 4 players with Mario Maker 2!
3,Cheep and low quality. I would recommend the official one or mayflash but this one does technically get the job done.
4,I had no problems with it when I used it to play Smash Ultimate on my Switch.With Dolphin on the other hand I had to do a lot of digging through the internet to get it working properly. I know Zadig works for a lot of people but I didn’t have to use it when I figured out what to do. Kept it on the PC switch chose “Standard Controller” and configured controls as necessary. Triggers were iffy at first with Super Mario Sunshine but all I had to do was set the analog triggers (soft press on the L and R) and lower the threshold to get it working.It’s not exactly plug and play on the PC but again it may be different for everyone. I haven’t ran into any problems afterwards though.
5,Item was of the most elevated quality! Very swift dispatch. Quality of the wrapping was outstanding.
4,This adapter is sturdy with very good cable length. I've got it plugged into my rear USB ports and it reaches the front with plenty of room to spare. The ports are a bit tight but  it don't regularly plug/unplug controllers from my PC so I don't mind. Latency was impercievable if not non-existent.I exclusively use a pc so I don't know about the Switch/Wii-U compatibility but on pc mode my controller was instantly recognized as a dinput device which made it easy to set up on the Dolphin Emulator but not much good for other games. However I could not get it to natively work with Dolphin in console mode. For those confused there's a way to allow gamecube controllers to natively (with the adapter set to Wii-u/Switch) work with the emulator the largest benefit being rumble support. While the adapter has the right device ID and properly goes through the driver modification process it does not properly communicate with the emulator in this mode. So of you don't care about rumble this adapter is perfect for you.
5,Works very well with pc wiiu and switch
5,It's easy to use and it's aesthetically pleasing.  This product helps me connect my Nintendo Switch to my game cube controller.
4,Está excelente pero no se puede usar en PC en Switch no he tenido problemas.
5,I haven't had much of a chance to try it out but I believe it will work great when the time comes.
5,As title says this worked with my macbook using dolphin emulator perfectly!! I have both legit and knockoff gamecube controllers and theu both worked. It has 2 usb plugs so you might need an adapter if you have a newer computer. No complaints !!
4,I was able to make this work with Dolphin. When I first plugged it into the USB 3 ports in the back of my computer with 1 Original GC controller plugged into it Windows (10) did not detect any of it. Reading a review by someone else that said it works they had 2 controllers plugged into it so I plugged another GC controller into it and replugged in the USB ports (which I hadn't tried originally either tbh...). At that point Windows detected 4 GC controller ports. I loaded up Dolphin went and configured the controller as a Standard Controller chose DInput/0/GameCube Controller Adapter mapped and calibrated Eureka!
5,Works great it gives all features to the controller.
5,Haven’t tried this bad boy with my Switch yet but it work on the Wii U like a charm! The seller reached out to me a couple weeks after my purchase with some tips on how to use it and a reminder that if I have any questions they’ll respond to me directly. I always appreciate a genuine follow up like that! Definitely the adapter to buy if you want to put your GameCube controllers to good use
2,After 2 years of owning this product it finally died. I have been having issues with it for a while before it died too.1. The value for money is good here; it might last you 2 years and it's only $13 as of this writing.2. You don't know which USB plug is for it to work vs which one is for the vibration3. The electrical connections where the gamecube controllers plug in can get undone easily meaning that the controllers will 'disconnect' if not in the EXACT position needed.I really wish it was a more high quality product but it's not. If you need something for a year or two then this should work.
5,I don't have much else to say. It is what it is. Works good.It has a slider letting you adjust its intent so that it can communicate with a Switch or a PC. Switching is painless and easy you just flick a binary slider switch.
5,Purchased 2 of these for use with my Nintendo Switch and they worked perfectly. I would recommend using some sort of USB outlet besides the Switch dock with these if you use 2 due to the Switch only having 3 USB ports.
2,Worked fine using wired controllers but only the signal receive light works with wireless controller.  Doesn't seem to support wavebird controllers.  Wish they mentioned that in the description.  Build quality is really poor connections are loose and easily pull out.  Should have spent the extra money and got a Mayflash GameCube Controller Adapter.
4,Unsure of any latency due to a lack of tools for testing. Works for Smash Ultimate just fine.
4,I bought this adapter and works fine. I’ve only tried it for a couple of days and so far it’s fine. Only one time I’ve had to unplug and plug my GameCube controllers (which are third party controllers) to make them connect to my Nintendo Switch. It wasn’t that big of a deal because I simple unplugged and plugged the controls back to the adaptor and worked as if nothing had ever happened. I don’t know if this only issue I ever had was due to my controllers or the adapter but definitely doesn’t lag mid game. This happened to me when I plugged the controller for the first time in a gaming session. Again this has only happened to me once but so far it does the job. The price is great for the adaptor and and it’s nice that it has multiple options. I would give this product 5 stars but I don’t know if this one issue was because of my fault of not connecting well the controls or has to do with the adaptor or my control. Overall it’s great and does the job
3,Works amazing on Switch and I can use it for games like Smash Ultimate with no problems at all.However on PC it had difficulty detecting it (with the device toggled for PC input and both USBs in) and when it finally was put in none of my programs detected it as either a gamecube controller (I had an official one plugged into the adapter) or a Gamecube USB Adapter. Even after manually binding all the buttons (I had to didn't detect the buttons otherwise) the joystick and C-stick had issues with input.This was not a problem with my gamecube controller- as it worked perfectly fine for my switch and gamecube. This was a problem with the pc side of the adapter itself.
4,I was very worried when i saw the many reviews stating this "ABSOLUTELY WILL NOT WORK WITH DOLPHIN" and "LITERALLY BROKE MY CONTROLLER WHEN I TRIED TO PULL IT OUT!!"To my surprise inserting and pulling out controllers was very easy even has a satisfying click and sound of the port going in/out almost like a high quality product and getting it to work with dolphin took all of 2 minutes worth of driver setup as per *their* instructions. So far this blows away mayflash for a portion of the price. But will it last as long is my concern. That's the main reason i haven't dropped the $25 on a mayflash because *everyone* i know has broken ports on theirs by now and they've been through two at minimum. For $25 i think that's unacceptable. So far i'm getting a bargain.
5,I bought this a bit too early so my return window closed right when the new Smash Bros Ultimate GameCube controllers shipped out today (Nov. 2 2018) which is the main reason I bought this.Thankfully I wouldn't have to worry about that because from my all-day-long testing it works perfectly with the Nintendo Switch without issue. For reference I tested it with Mario Kart 8 Deluxe Super Mario Odyssey and even Okami HD.I also should add that I did not test this on my Windows PC so I can't vouch for the performance on that platform.The adapter itself has a long thick cable that feels durable. The body itself feels a bit more cheap than the official adapter but it doesn't feel flimsy whatsoever.You just need to plug in the black USB in order for the adapter to work but the gray USB is for the rumble feature if that suits your style.The controllers plug into all ports of the adapter and fit snugly no risk of it falling out during play.There isn't any severe input lag which I noticed during my tests.Overall: It's a wonderful well-made and budget option if you can't afford the official adapter. I highly suggest this but I highly suggest dishing out the extra cash for an official controller.**Freely skimp on the adapter not the controller.**
4,I bought these to use with DDR dance mats on PC using dolphin. They were able to be connected setup and detect button presses but seem to have a bad low pass filter or something because it would keep showing button presses/ no button presses when a direction arrow was held down (basically could tell when it was pressed but kept getting false negatives that it was no longer held down) so was unusable.I tested it with a game cube controller(3rd party) and it did work fine.I ended up trying out the 'Mayflash' brand one instead and it didn't have that issue/ worked great with the dance mats.If you just want to use game cube controllers this does work but for dance mats- it was super glitchy/ couldn't accurately detect directional arrow presses.
5,Works right out the box with no crazy setup
5,Does exactly what it's supposed to do. Now we can all play Super Smash Bros. with our old GameCube controllers.
5,Exactly as described and great for older game emulation on a modded setup
5,Works for Smash Bros on Wii U works as a standard controller when plugged into a PC. Works on Linux too. Haven't tested it on a Switch but I assume it works there too. Only potential downside is that it doesn't seem to work with Wii U homebrew applications but this is to be expected as homebrew generally only supports the official Nintendo adapter so the adapter can't really be blamed for that but be aware if that's what you're buying it for.
5,It came right on time now I can play SSBU competitively.
5,Must have if you are trying to play like Super smash on the switch or something. This is one of the best items to get
4,This works with Dolphin emulator but it is not as plug and play as it seems. How I got it to work (Windows 10)1. Plug controller into first slot of adapter2. Turn adapter to Switch/Wii U Mode3. Plug adapter into usb ports4. Use zadig software to install driver5. In Dolphin use gamecube adapter for wii u optionYou have to keep the adapter in Wii U mode for it to work for me I couldn't get Dolphin to recognize this when it is in PC mode but with it in switch mode it is detected and has full rumble support. Can't feel any lag so so far so good.
5,This is working well for Dolphin on PC. There is a lot of discussion about whether or not it works for Dolphin.Here is what I did that worked on Dolphin build 5.0-12247:1. Set the switch to "PC"2. I plugged two OEM GameCube controllers into port 1 and port 2 on the switch.3. Attach both grey and black cables from the switch to my USB3 ports.4. I did not install any drivers like Zadig or other5. Go into Dolphin / Controllers set Port 1 and Port 2 to "Standard Controller"6. Configure the controllers in Dolphin In the Device drop-down I set the first controller to: Device to "Dinput/0/Gamecube..."7. Configure all the buttons in Dolphin8. For the 2nd controller also configure in Dolphin and set the Device to "DInput/1/Gamecube" and configure all the buttons.After this it's working perfectly.
5,Got this to play Smash on WiiU it works flawlessly!
5,The description telssit all. Good buy. 👍
4,Fast shipping. Sturdy product so far.Not as easy to use for PC as you'd expect. If you are using Dolphin you must use Zadig which is not easy to use for a normal user. I had zero problems using it however it isn't the first time I've used it either.So if you are using Dolphin with this emulator you need to put it on the "WiiU/Switch" option and use Zadig.
5,I got this for my Switch and PC and it works with Dolphin emulator! You just have to make sure you configure it right and that you disable the first two controller spots on Dolphin at least that’s how I got it to work. I set it to the 3rd spot in Dolphin and configured the buttons from there. I used to own the official Nintendo adapter and this CLOUDREAM one is every bit as good for less money spent.
4,At first I thought it was just a jank product because I could not get it to work even trying to troubleshoot and watch videos of others using similar products did not help BUT it does work well and is a good product. For those who had issues all I did was disconnect all wireless remotes and use a gamecube controller plugged in to the adapter after going to change grip/order of the remote options of the home screen on switch it seems to recognize the remote if other devices are not connected at least in my case.
5,This is cool and way better than the other adapter I had before. It works well for the Switch I haven't used it for PC yet but that's pretty much it about it a good product and the length of the wire has a good length.
5,I had some difficulty finding a USB-connected GameCube controller that didn’t have problems with stick drift. After a couple of bad purchases I decided to buy a model with better reviews that used the traditional connector and so needed a way to bridge that to my laptop. This adaptor from Cloudream worked great - plug and play controllers recognized immediately no problems with lag or sudden disconnections and no issues handling input from multiple controllers at the same time. My only annoyance is that it takes up two USB ports on your computer even when you’re only using one controller but figure that’s a small price to pay for an otherwise seamless experience. Can’t speak to the turbo function as I don’t use it but would happily recommend for all other advertised purposes.
5,Works as advertised. Don't even have to think about it just plug it into the switch plug controllers into it and it will start working. Game stuff gets banged around at my house but it is still doing its job!
5,I’m old and slow. And even I could figure it out
5,Though I don’t like to use the word perfect in this case the product has a slight lesser quality plastic to it the device has been perfect in its reliability and ease of use. It does come with instructions and the box it comes in is quite durable. I was surprised about the box. For cost it’s absolutely worth it.
