rating,review
4,I got this for my Nintendo Switch in order to play Super Smash Bros. Ultimate and I am very pleased. I have had absolutely no issues so far. One thing that's a little concerning is the overall build quality. It feels like it's made of some fairly cheap plastic and the USB cables are a little low quality so I don't know how long it will last if you're someone who has a lot of people over. Overall very pleased with the purchase!
4,I bought this adapter the same time I bought a GameCube controller. I honestly didn’t know what to expect but when it came in and when I plugged it in it worked like a charm. By having rumble and a medium range cable it was pretty easy to place it next to the switch dock. It’s also worth your money
5,it works perfectly. i use with my PC toplay melee online and with an original gamecube controller. i’m sure it works with other controllers and on wii u no problem
5,It works as intended and has plenty of cord if you have to sit pretty far away from the screen.
5,I bought this adapter to use my GameCube controllers to play Super Smash Bros Ultimate for the Nintendo Switch. It does the job beautifully. I have not experienced any lag and it was extremely easy to set up and start using. Very satisfied with my purchase and would recommend it to others.
5,Was kind of sketched out about buying since I don't usually buy after market stuff for consoles but the adapter that Nintendo was selling was way to expensive so decided to try this out and let me tell you it was the better the decision. Worked right out of the box plugged it in and started playing mario kart 8 on switch and haven't had any problems with it since. Very easy to use and looks like it can take a couple drops.
4,The product was easy to use and simple to install didn’t need to spend on the big name brand adapter either
4,It works if you need/want GameCube controllers for your Nintendo Switch or WiiU to work. Is not compatible with Dolphin Emulator on PC and doesn't work super well for my purposes on PC. If you are getting this for Switch or WiiU it will work fine. For PC and specifically Dolphin emulator get something else.
4,I did run into some issues pairing this with the Dolphin emulator but it will work with it for sure.
5,I was able to play Super Smash Bros on the Wii U with Gamecube controllers which was exactly what I wanted. Thumbs up
4,This took awhile to get set up. And ports 1 and 2 were switched for me when I tried using this for the dolphin emulator. But eventually it worked and at such a low price it’s definitely worth it
5,This GameCube adapter for the Nintendo Switch really is easy to use. The sheerness that it connects with is quite the value for money. We have an old Wavebird controller and adapter and a regular corded GameCube controller and both worked wonderfully when we played Super Smash Brothers! Great purchase!
4,Works well in windows. It automatically recognizes 4 controller inputs. Just make sure to set the switch on the pack to "PC"Tried it with official gamecube controllers. Worked perfectly. But the controller ports are a pretty tight fit you really have to make sure they go in correctly.
5,It work well on the switch and on the Wii u but on the dolphin emulator I couldn't get it to work in the Wii u/ switch mode like how the mayflash can. You can switch it to pc mode and set it up as a standard controller and it feels alright as far as I have tested just a shame that it couldn't work like the mayflash in that regard.
5,For the $16 I paid I am impressed! I was expecting some sort of input delay when playing smash ultimate...nope! This works perfectly! For those wondering I use Jigglypuff and hitting rests with a gamecube controller plus this works a LOT better than a PDP gamecube controller (what I used previously but cracked when I forward smashed)! Do yourself a favor and get this along with a gamecube controller! I guarantee you that you won't regret it :)
5,It worked fine
4,Didn’t work as I expected.  Analog sticks would not work.  No was to adjust no software.
4,This is useful because you can connect your gamecube to the switch without any issues. The only problem is that even though it says it's compatible with PC it actually isn't and it doesn't work with Dolphin. For that the Mayflash adapter is the one to go for but for Switch this is a good product.
5,I use mainly this GC adapter for my switch and pc and it has worked flawlessly. I didn’t noticed any lag or anything major about the unit but I would recommend it for the value and Nostalgia play smash and other GC games with the Original control. I also use the adapter with some original and 3rd party controllers. 10/10
5,I've had this for awhile now it's holding up very well I haven't had any issues with it!
5,Works perfectly just plug it in and you're ready to go. Honestly it's way better than buying a usb controller that only semi works.
5,This product is surprisingly durable. I have accidentally left laundry baskets full of clothes sitting on its cord overnight and it still works perfectly. There is a cool switch on the side that lets you switch from console to PC connection and both work amazing for me. I was skeptical of buying a product like this because I have purchased other brands for other consoles before but this one works like a charm. I recommend this product to anyone who is even considering to get this.
4,Very easy to use and has given my family hours of classic fun on the switch!
5,Cheap price does what i need. no complaints yet.
5,Feels well-built works flawlessly (no obvious latency or dropped inputs using 4 controllers on Super Smash) and the cord length is long enough to extend from our entertainment center to our coffee table where gamers'll hook up to the adapter. Some rubber grips on the bottom would be a welcome addition (would prevent sliding around) but it's cheap and excellent.
4,Definitely easy to use. Great Price and excellent mechanics behind the reaction time with the buttons. Haven't had a problem yet with this practical device. I would highly recommend this to gamers whether for PC or Nintendo Switch
5,I exclusively bought this to connect my original Nintend-licensed DK Bongos to my computer. The bongos work flawlessly including with the microphone. Getting the settings right was difficult but once set I never had issues since. Worth it to recapture the DK Bongo experience.
3,It was plug and play with Slippi on my Mac and it worked fine for Smash Ultimate on the Switch but the main reason I bought it was for using to play GameCube games on my Wii U which it unfortunately cannot do. I returned it and bought the Mayflash instead and have had no issues.
5,This worked great! I wanted to be able to use GameCube controllers for playing smash bros on the Nintendo switch and the product did the job. I read a few reviews about connection delay but I didn’t seem to run across that problem at all. I would say this is a safe bet for your money.
4,Does not work for Linux computers. Seems to work fine on Wii U and Switch.
4,Plain and simple a adapter for the gamecube works perfectly fine aswell love it.
5,Excelente
4,Was extremely difficult to get zadig up recognize this adapter to setup  slippi. Through sheer luck i was able to get it to work.+1  for low cost
5,Works exactly as advertised and arrived quickly
5,I lost my Nintendo adapter while traveling and got this as a replacement and it works just as well as it for way cheaper. If you want to play smash or whatever game that supports Gamecube controllers it works like a dream.
5,Great for using GameCube controllers (super smash)
4,Works well and fairly straight forward out the box.
4,Pretty straightforward. Works everywhere I’ve tried it too. Raspberry Pi 3 & 4 Switch PC. One plug for the power one is for the controller support itself FYI.
5,Works great do not hesitate to buy. Company even reached out to me to check if It was working correctly.
4,Overall a good adapter for the Switch and Wii U (but who is still playing Sm4sh anyways). Only complaint is that it feels that the controller can get a little stuck making it slightly difficult to remove from the adapter but its not a deal breaker.
4,It works great! The only downfall is that it had two USB plugs and it’s confusing sometimes which one to use. But overall worth the price!
5,I’m using it for my switch. I have no issues so far. I was kinda worried it wouldn’t work or it would break easily but nothing so far. I know reviews seem fake sometimes but this is actually a good buy
4,Simple to install and works immediately. No special setup or configuration. Cable is long enough to support gaming from a distance.
5,I like its simplicity. Though it would be nice if the Switch could provide a way for it to use only one USB rather than two USBs (not sure if that is the accessory manufacturer constraint or the switch constraint).NOTE:  You will have to check the games for compatibility regarding if it can be used along with rumble features potentially being lost. (I knew this in advance but not every game is suited for a GameCube controller).
5,My boys love it - they are 17 and 19 so not ‘boys.’  But they say it works well.
5,While the pro controller for the switch is good Super smash brother is best when played on GameCube controllers.This adapter worked instantly with no need to set up on configure with the switch.The cable is long enough that I didn’t have to move the switch closer for a wall mounted tv.
4,Great adapter if you need it for switch. Worked plug and play. Did not work for dolphin on PC. Would recommend a mayflash adapter for that instead.
5,At first built quality was questionable as with all things from Amazon these day. I used it with Switch and emulator playing Mario Cart. It work great. If you play any multiplayer GameCube Games you need to have this one.
5,It’s works much better than expected. would buy again. and again. as long as the price is right. i really wanted the official one but this is just as good. no doubt. Works just like the Nintendo one.
5,Works perfectlyI have used cube controller for a ton of switch games with no issues. Of course great for Mario Sunshine. Package says rumble is not supported but this also works perfectly so far (rumble feels good/ correct in games)
5,I purchased this roughly a month ago and had it delivered that same month and I have to say it was frustrating to setup for my PC at first. Product did not come with instructions for PC but lucky there’s tutorials online for this. The PC switch doesn’t work with the Dolphin emulator. To fix this switch it too the WiiU option and then use a third party program called Zadig to change the driver to winUSB all while the adapter is plugged in to your computer ports and it will work. I’m very pleased with this product works with Wavebirds as well as third party GameCube controllers. I recommend this product!
5,I actually have nothing bad to say about this product it does exactly what it says I’ve been using this for a while now and I haven’t had any delay issues compared to a regular pro controller would recommend for those wanting the most optimal play for a low price
2,Adapter worked for a couple of days. After that it would disconnect the controller and reconnect randomly.It didn’t work for me it might work for you.
3,Now if you are getting this to work on a Wii u or Switch this is pretty good but if you plan on getting it for pc just don't. When I got it I wanted so I can play Gamecube games on an emulator with the actual controller but when I plugged it in nothing worked. I did everything everyone else said but it just didn't work for me. So I returned it and got one from someone else and it works perfectly.
5,Bought this to play Super Smash Brothers Ultimate. In training mode on the slowest setting and with a video camera I compared the frame lag to using a USB controller and the lag is negligible - 8 frames of lag with the adapter and 7.x frames with a USB controller.The setup is easy and the adapter comes with clear instructions if you are confused. The cable that comes with it is as long as the cables on GameCube controllers so it doubles the distance you can sit from your console.Excellent product. Highly recommend it!
4,This adapter is a bang for your buck.
5,An honest to goodness plug and play solution. Worked flawlessly. I would definitely recommend this especially since it’s at such a great price point.
2,It worked well for 3 months then it stopped responding to the controllers.
4,Works fine in HID mode with Linux. Works with the Switch as expected. Not sure why it has two USB plugs. Power when using 4 controllers maybe? Cable is a little obnoxiously long but some might find that a plus I suppose depending on their living room size.
2,Well I can confirm it does work with Dolphin.  Bad news is the 1st port was only semi-functional twice.  When I received my first adaptor I realized the C stick was "sticking" in the calibration.  Did the usual reading tried different drivers messed with deadzone.  And then tried the other ports and they were fine.  Contacted the seller and they send me a second one.  SAME PROBLEM!So being bored and having a soldering iron I cracked open the first one having verified that ports 234 worked fine and moved port 4 to port 1.  Same issue.  Port 1 C stick still goes full right unless you go right and then left to recenter.  Back to port 4 (old port 1) and everything works as it should.Bottom line - if you want to play with 3 people this will be fine.  If you want 4 player action try something else.
4,Tried to use this to connect a wii/gamecube dance pad to the Nintendo switch. Found out the pad was primarily the issue and not the adapter itself. Connection into the adapter didn't feel super firm but might be fine with further testing.
5,Works like a charm.  Only thing to note there are two colored USB plugs and as someone who didn't read the instructions I deduced from trial and error that one USB plug is for PCs the other is for the switch (I think it's the grey one).  Just a heads up
4,Arrived quickly works fine
5,Works with version of dolphin as of 7/21/21.Works with both OEM and third party controllers. Would recommend.
5,Works well. No lag.
5,My adapter came in super fast and works great! So happy with my purchase! We initially bought it for the switch but use it for the computer too. It’s easy to use. It only has a switch to change mode when connecting it to your pcswitch and Wii U.
5,Got this for my 3 boys who play smash bros and like to use their Gamecube controllers on the switch. They love that the cord is so long and they can all connect together and play.
5,This is exactly what we needed to hook up our controllers to the Nintendo switch. Fast service.
5,1st party didn't need a switch to tell it work on pc wii/wiiu etc.Although Works just fine. I won't be using it unless company is over. Just nice to have some stuff around for get togethers and such.
5,My family has always held onto the game cube remotes as Nintendo thankfully allows its systems to continue to use them with every updated or upgraded game console so I’m so happy to have a product like this to connect to the switch that allows the GameCube remote to be used.
5,Was good my emulator couldnt read it but thats to no fault of the product. Nonetheless i didn't read before hand that Dolphin emulators dont work with third party adapters and now i have an adapter but nothing to do with it xD
5,It's very easy works perfectly except for one VERY SMALL flaw. Every now and then I just have to unplug it and plug it back in to have it work. It never disconnects while actually playing.
5,The media could not be loaded.                                                                                             Great value and easy to use adapter for 4 controllers. Only requires one simple plug and is a nice compact and sleek black box that blends in with my entertainment system. It works just as expected no problems at all and makes gaming fun and easy for the family.
4,I personally have not been able to get this to work with my computer setup but for the Switch it does exactly what you think it'd do. Enjoy Smash Brothers!
5,Overall I really like how simple it is to use however I don’t know what to use the turbo button for and it doesn’t state it anywhere as far as I know the cables are long but if they were shorter it wouldn’t matter since h connect it to switch or Wii U or your pc overall it does what it says and does it well
4,Unfortunately it doesn't work for laptop  only. I Don't doubt it works fine.
4,Works well on wii u for super smash brothers but doesn't work on vwii with usb loader gx.
4,It works ad easy as advertised my only issue is the rumble function doesn't work with the Switch.
5,Easy to use works fine with our gamecube controllers and the switch had no problems detecting the controllers. Instructions could have been more specific to the switch as I think they were more for the wii U but end result was good.
5,I've been using this to play Smash Bros with a gamecube controller. Works great! It's long enough where I can still sit comfortably on the couch and not risk someone tripping over it if they walk in front of the TV.
5,So in order to use this device you have to tell the Switch to search for new controller then it should show a USB controller then press the left and right buttons and it will then be in plugging in other controllers press the left and right buttons and they should show up. Exit it out and go Game. We are using this with Smash Brothers Ultimate with our old Game Cube controllers and this is a works great no lag and if you plug up both USB plugs into the Switch you get the rubble. I really like it. Good value for the money.
4,Took a bit of time to make it work for dolphin emulator but it worked out in the end.
5,My sister and I use it to play Game Cube games on our computers. My sister has not reported any problems with installation or after many hours of use. It took me some time to figure out how to configure it with my software but after that I had no problems. Would recommend. 9/10
4,Works very well with Windows 10 and both original and repro controllers.Small niggle in that it takes two usb slots.
4,Plug and play.
4,Easy to use
3,overall it's fine for casual use but I had a lot of trouble dashing in dolphin melee.
5,It's small and light-weight easy to use. I use it with my laptop. At first I was concerned by the two USB cords as I don't have many ports on my laptop but only the black USB cord is necessary for the adapter to work.
5,Got this to use with a Switch works so good! Love being able to use old GamCube controllers again brings me back to my childhood
4,It sometimes doesn’t work but usually does.
5,Works as intended for my Switch's docking station and has been working these last few weeks. A good alternative if you prefer the original ports instead of today's Gamecube controllers with USB ports.
1,If anyone is wondering this does not get recognized in Dolphin on PC. I also couldn't get it working on Wii U either even though Wavebird light is on. Buttons wouldn't work.Also the turbo button looks much different than the product photos. I'm guessing I was sent an older model.
4,I love the product but it is too tight and worries about it breaking my GC controlled
5,I liked that it was super easy to set up! It’s not too lightweight which I also like because it makes it seem a little more higher end. I use this on my Mac to play gamecube games and it works great! No complaints
5,This is an excellent tool for using your old gamecube controllers on your switch.  5-stars.  Only downside is there are no home or +/ - buttons on your gamecube controllers.  Keep that in kind when purchasing this.  Great for same screen multiplayer!
4,Works great with wired GC controllers and Wireless Wavebirds. I even got it to work for an off brand wireless gamecube controller. Definitely reccomend as an alternative to the expensive Nintendo licensed adapter.
4,Came in a timely manner easy to use. Exactly what we were looking for
5,Great but there are two usb plugs one for switch and one for wii. Well one is grey and one is black but there’s no way to know until you try them. Minor nitpicking but fantastic otherwise
4,It’s good now I can play with all my friends on the Nintendo switch
5,Works great. I didnt want to spend money on the newer GC controller models when I had 4 original ones in good condition. I’m glad I decided to go with this rather than new remotes good for parties lol
3,It works mostly fine with my Nintendo Switch however it sometimes would not get input from individual buttons on my controller. This issue was fixed just by unplugging and plugging back in. However when I tried to use my gamecube controller with Dolphin my PC would not recognize the adapter whether it was in PC mode or Wii U/Switch mode. I'm going to try returning this and going with a Mayflash adapter which I hear works better on PC.
4,Easy to use - Essentially plug and play.  No hassle does what it advertises and is reasonably priced.
4,Works great all four of the ports work and I can play smash with my friends and I haven’t had very much input lag!
5,It takes a small bit of setup if you want to use it on Dolphin (the correct drivers aren't included; you have to look them up yourself) but works flawlessly afterwards.
5,I got this to play oot on my laptop. Honestly it works just like an official nintendo adapter I havent had a problem with them yet. I couldn't recommend them more!
5,Awesome product worked right out of the box and I didn’t have to download anything else. If you use this just know you don’t have to remove the drivers for the device it already comes with it.
4,It was a great fit for the original gamecube controllers I had but not the no name cheaper gamecube controller it just wouldn't push in to stay in place but overall a good product for the price
4,You plug it in then plug more stuff in.
5,Works identically to the official gamecube adapter.  There are functionally no differences.  Rumble works no lag even works with my wavebird.  Great to save a few bucks.
5,Thought I was having controller issues but my adapter (different model) was malfunctioning.This new adapter plugged right in and controllers worked perfectly.
4,Works well on the Switch and PC (but if you're wanting it for a modded Wii U for stuff like Nintendont and stuff it won't work. Only works for Smash 4)
5,Very easy to use. Very easy setup. It works perfectly for the Nintendo Switch (and PC). It is a bang for your buck!
4,Took a bit to get driver's right but after that's works great. Thanks
5,Super nice! Just plug in play on the Switch dock. If you're like me and have a ton of Gamecube controllers (4 of them for me) from playing Super Smash Bros Melee in the past this is a must!
3,This ended up working well for me to be able to use multiple gamecube controllers on my gaming PC but it did not work in native mode even after following multiple guides on different websites. When putting in in PC mode it works fine but I would have preferred the setup-free native method. I'd order another one though just for the fact I can have 4 controllers sharing a single USB port.
4,Great product. Works well for Super Smash Bros Ultimate on Switch.
5,Works great for the Switch. No lag between the controller and the buttons and sticks feel just like the original Controllers that came with the Gamecube.
4,We got this for my granddaughter wii it works great
4,The adapter I originally got didn't work. However I was able to get it replaced with a new one free of charge and the new one worked right out of the box. A worker from Cloudream reached out to make sure I was satisfied with my purchase. I can happily play Smash Ultimate. I'm giving it 4 stars because the first adapter didn't work.
5,I was a bit skeptical about it since The Nintendo brand is nearly 50 dollars more but I’m glad I bought it. I have old GameCube controllers that still work and they worked with this adapter. This saved me from buying switch controllers and saved me from dishing out money on the more expensive adapter!
5,Exactly what I wanted. Works perfect got here quick and was a very reasonable price. 10/10 order right here.
5,I honestly didn't expect this adaptor to work as well as it did. Very impressed. It's made gaming for our Switch much more family friendly
4,Works for Switch and PC. Can finally use my Gamecube controller
4,This worked perfect when having multiple players. Easy to setup & use.
4,it wasn't working right away but i was able to get it to work after a bit
4,Easy to use
4,Its works decent
5,I know nothing about this product however after my sons9 & 13 cracked their Wii U gamepad this was a dream come true! My 9 year old researched it with his older brother and they said it would work...I was skeptical but thought it was a reasonable chance to take it was!! Works great and they are happy and so was I to find an outcome to a problem for such a good price!
5,The adapter is plug and play and works flawlessly I mainly use it for my switch so the long cable it has is great so I can move it around my TV setup closer to my couch.
5,I wanted to add that the adapter works amazingly for the MacBook Air 2020 with M1 Chip!
5,It was perfect for what I bought it for. I have had it for a few months and still performs like I just got it.
5,Extremely affordable and does exactly as it should. Much better than spending $45+ for the Nintendo one when you can just save money.
4,Functions the way you expect for a fair price.
5,Works amazingly. I was truly skeched out whether this product before since its not official nintendo but its worked with every official and non-official gamecube controller with no problem.
