rating,review
5,The transaction was very smooth. Thanks for that.I saved $35 on the device over local prices.The player made my "not so smart" older 65" LED TV into a "current" streaming machine!Wifi runs smooth no lag no buffering.It's a WIN Baby!
5,Shipping was quick. Item was as described.Bought this to replace a Samsung BluRay 3D player that took an early dump on me. This unit is small - about the size of a PS4 but half as thick. Simple set up. The 3D playback works well. Good visual and sound playback on 3Ds and BluRay discs. Simple remote.Quite satisfied.
5,After researching several Blue Ray players this unit was the best in the price range for upscaling players. The next level is in the high 200’s- 300’s
5,This dvd player is much smaller than my old one but does so much more. Being that it's a Sony tells me it top quality. I wouldn't hesitate to buy this unit if I was still looking.
5,I haven't used the DVD player yet but I'm sure it'll be okay but I was amazed at the delivery I had it at my front door at 7:00 in the morning Amazon said they would deliver it between 4:00 a.m. and 8:00 a.m. so when I woke up my package was my front door unbelievable fantastic delivery service I wish I could get everything like this I'm sure the DVD player will stand up to it's to its reputation as a Sony product I'm not concerned looks good packed well everything was included I'm sure it'll be easy to install and it'll have great sound and picture as with all Sony products that I have found or purchased in the past thank you Amazon I can't believe I got it delivered so fast !!!!!
4,Remote control unit is slightly too small and buttons aren’t easy to use but it is not bad equipment overall
4,I am very satisfied with the product.
5,Ease of using dvd player.
3,I got this to use with an older (not smart) TV. It’s definitely a step up from the ancient dvd player we were using and I had no trouble connecting it to the tv or wifi. I love that the remote will also power up the tv and adjust the volume so I don’t have to deal with two remote controls. I was disappointed to realize that I can only get Netflix and Prime through this but Hulu Disney+ and any other streaming service is not useable. I cannot get it to connect to Bluetooth or do the  screen mirroring thing. It also decides not to work at least every other time I try to use it. Fortunately I have discovered that unplugging and re plugging gets it back up. I only use this with the small tv in the bedroom and am content to be limited in my options on streaming services. However if you want to access all of your streaming options you should consider a different product.
4,Easy pairing
4,Limited on playback options no A-B Repeat and only 1 slow setting
4,If you have an analog sound system for your TV you're going to have issues with this Player.  The picture quality is very good.  It is extremely lightweight and surprisingly small with only three connections on it: one HDMI one Digital coaxial (RCA) plug-in and and LAN connection.  I have only been using it for a week or so so I can't comment on durability.  Because of my analog electronics it took a long time to get it to work.
3,The machine sent to me in South Africa was manufactured for American use. America use Reion A or 1 machines and South Africa Region B or 2 machines. Make sure the correct Region machine is purchased.
3,Al poner mi 4k Ultra hd CD en el dvd player no quiere leer el formato. Lo intente varias veces con varias películas y nada. Dis que el formato no es reconocido.
5,I like the size I watch a lot of DVD’s
3,Can' t watch firestick  when I have Dvd player plug in and you can't add some of my appps that are on my firestick.
5,Very nice
5,A little bare-bones but small and tight. Remote and device are very responsive.
5,Easy to set up takes up very little space works great and is versatile. Nice player and worth the price.
5,I needed to update my DVD player technology and my purpose with this Bluray Player was to play my existing DVD's and be able to purchase Bluray movies. I don't currently have wi-fi but I thought having a player capable for that might be wise for the future.Reasons I purchased this particular player:#1) the customer reviews were all good; better then on anything else reporting the device as quiet and easy to use.#2) It is quiet and picture and sound is impressive on regular DVD's which is all we have as yet.#3) It does have a power-on indicator light#4) I liked that it came with everything. It included the cable and a cleaning disc two things I didn't have to worry about hunting for and buying separately.#5)  The player was super simple to set up and the remote worked as soon as the player was plugged in. No need for adding code. You click Home to select your function and it's also simple. The Sony directions do include directions for how to connect to a selection of TV Brands with Sony being default so your remote will run both if you want that.#6) The player is small in size perfect to fit on the shelf on my entertainment center next to my cable box with space leftover. Nice.#7) The player package arrived in good condition well-packaged and 3 days earlier then originally scheduled. Plus the seller made it a package deal including everything I need to set up and care for the player making it so much more convenient for me. I have nothing but praise Hot Deals Electronics.
5,IT HAS A GREAT PICTURE FOR 3D AS WELL AS REGULAR VIDEO AND I LIKE THE FACT THAT I CAN ALSO SURF THE WEB AS WELL AS NETFLIX AND SUCH THROUGH THE UNIT.
4,We have purchased Sony Blu-Ray players since the internet feature became a big part of Blu-Ray players. Now most new TV sets have that feature built in but our older TVs do not and still work great so we need that feature in a couple of our Blu-Ray players.Sadly every Sony unit we have owned has had a problem with locking up requiring it be unplugged to restart it. We went to Sam units which also had some minor problems but at least allowed us to adjust the volume on our Sam TV sets. They have their own set of problems plus are no longer available at a price we want to pay.So after a few years and many new models we decided Sony must have fixed the locking up problem. Nope....but admittedly it has only done it once and I haven't lost all confidence in it.Nice picture features easy to navigate. Fingers crossed.
5,Was happily surprised at how compact the unit is. Delighted to have all the accessories I need to get it up and running. Set up was SUPER easy.I see with this unit there’s no reason to go out and replace my non-smart TVs… this DVD player has all the smart bells and whistles I’m going to need.Extremely satisfied with this purchase!!!
5,Set it up in the WFH office. It hardly takes up any space. It plays cds and dvds. It even played an old concert on a Video CD. Very happy with it.
5,Great Blu Ray/DVD player.  Great picture easy to install and to use.
5,I've had this Blu-Ray for three days so I can really only speak to the out of the box experience which has been excellent. Plugged it in turned it on and all seemed to work.It has built in Spotify and I have an account so I was immediately able to connect to the Blu Ray from my PC and Android phone with no configuration on the PC or phone. The Spotify sound is excellent. I was also able to "cast" to the BDP-6700 from Windows Media Player again with no PC side configuration an unexpected bonus which made me very happy since I have an extensive library of downloaded music. (nothing in the materials suggested that this would work!)I own very few Blu-ray discs and the one I have been playing may not have been shot in high def to begin with so the picture quality is not awesome but the colors are quite vivid. The sound of the Blu-ray is excellent. A friend once told me that I would really like Blu-ray for the sound more than the picture and I think he was right. This Blu-ray is a concert recording and plays in DTS-HD. Great definition on all instruments.Hope it lasts!
5,Sprained wrist. While walking dog we went in opposite directions - dog was not hurt. Went on-line to Amazon found right size wrist brace. Came in package of two and was pink color. Best of all it arrived in "next day delivery". Not only avoided trip to ER (20-mile round trip) saved gas money too - really big deal. Thanks Amazon - Merry Christmas & Happy New Year!!
3,First the picture quality is excellent and the remote is fairly intuitive. From the standpoint of the DVD / Blu-ray player it is very good. My disappointment in the reason for the three star rating just because you cannot download additional apps. There's a fairly limited number of apps pre-installed on the DVD player. Missing amongst them is Hulu sling TV and a number of other apps that we frequently watch. TV. Sony no longer supports the site where you could download additional apps. I guess those the 300 plus additional apps that you can download that are no longer available. I selected the more expensive Blu-ray player so I wouldn't have to get another Roku device but now I guess I will. The description from Sony should really be updated oh it's very deceptive.
5,This player upscales regular DVD's to higher quality. I looked in Best Buy and PC Richards first and no one helped me at their stores so when I came home I went right to Amazon to find what I was looking for and ordered it right away. Easy to hook up immediately with a supplied HDMI cable. It replaces a regular DVD player that I have had for a while and is so much better. I have hundreds of DVD's in my collection that will play better on this Blu-Ray.
3,I am happy to have a DVD player since I own several bookcases of dvd’s.  I was hoping that this had an app for Disney+ but it does not.  In the description it says you can stream  Disney+. This has been too complicated to do.  Plus I can’t get the Bluetooth to hook up to any of the devices.  Extremely frustrating.
3,Player likes to lock up a lot . . . at least by resetting the power always fixes it.
3,It does work as intended. However it is noisy and the remote is small easy to use IF you have small fingers and the remote is easy to get lost. It sounds like an old computer fan wearing out. The picture is (to me) is the same as non "Upscaled". But then again I don't really see a difference between Disc and Blueray.
4,A decent player.  Slightly above average picture with my BlueRay DVD's.  Remote control is tiny - this has been commented on before.  Uses AAA batteries.  The "Xtech Blu-ray Maintenance Pack" is simply a piece of micro-cloth enclosed in plastic which isn't even re-sealable.  Impossible to know how much extra they charged for this.  Set-up for connection to wireless wi-fi was quick and easy.  This changes the 'home page' of the player to a screen full of the apps in full color.  The icon to play a DVD is seemingly grayed-out along the bottom of the display but click on it to start to play a DVD.The player is much smaller than any other player I've seen - only slight less that twice the size of the DVD tray itself.  I hope this doesn't impact the reliability of the player.  Time will tell.
3,Picture quality is Good but the player has a mind of its own a lot of freezing pictures.
5,The controll takes some time getting used to but once you do it's super easy to use...even in the dark
3,What I needed was the DVD/VCR Componation.
5,How can you beat a Sony product?
5,I think this was a great buy… haven’t noticed too much in the upscaling dept. I have this on a 75 inch 4K tv… but it works great and is small…
5,I have several Sony players and they have always been wonderful.
3,The unit frequently locks up and needs to be un-plugged and re-plugged back in and when plugging back in the brace point in the front of the unit is where the power button is. Also the buttons are too small for average hands.
4,Not much to say Sony is reliable.  Easy to connect to TV remote is basic and easy to use.  Plays Blu Ray DVD's and music CDs.  Compact size is nice.
3,The product is the Sony DVD Blu-ray player but the description said it came with HDMI cable and cleaning cloth. When we opened it it didn't have either of those things and there was a DVD Movie already inside. The unit appears to work but we are disappointed it wasn't as described and it was clearly at least an open box.
4,Speedy delivery even without Prime. Careful competent packaging with all expected parts extras and straight forward instructions. Was surprised but also grateful for the small footprint of the unit. Quick and easy set-up with an older Vizio TV. Unfortunately this was one brand not  controllable with the player's remote. Connecting to Wi-Fi network and pairing with Blue tooth headphones was just as quick and easy. After the  initial operational setup It was a bit more involved  finding the various adjustment and changes for specific viewing and audio options and while that's true with any new device it's not all intuitive but may become so after a while. So far I've only watched older DVD films (House of Flying Daggers) and listened to music files on a USB stick and am happy with both the upgraded picture quality and the stereo/surround sound transfer with this unit.  Will see how online streaming functions and actual bluray films look soon enough.
3,Sony needs to update this Blu-Ray player only a couple built-in apps YouTube and Netflix and no way to update it for yourself.
1,I've had this product for a little over a month now and it was working great. The picture was good it connected to my internet easily remote was simple and easy to use. Now for the last week it started with Prime video it started to freeze the player now Youtube won't buffer so I can't even stream youtube on this 200+$$$ dollar thing what the hell? I could have just bought an Xbox S with a blueray or ps4 (Even though I already have both still would have been better) and it plays games for this price instead I got a player that won't even play youtube.......... what a joke and of course I'm out of the return window. I've factory reset the device reset my router unpluged the unit pluged it back in uninstalled and reinstalled the Apps nothing works and I can't return it. Go with an Xbox or ps4 its the same price but you get way more.Update: I'm changing my review to a 4/5 instead of 2 because they sent out an update the other day that fixed all the problems I was having. Still think a playstation or Xbox S is a better value though.Edit: Just keep having problems with freezing apps just stop working player isnt saving my playback spots in movies if I pause a movie more than 5 min the player will just shut off then it doesn't save my spot and I have to watch previews/FBI warning which you can't fast forward through again. This player has been a pain in the rear I've had nothing but problems with it since I got the thing. When it works its great but it has way too many and too frequent glitchs/bugs.If I could do it all over again I wouldn't buy it and I'm kind of pissed honestly.Edit/Update: Player is still a hunk of garbage one of the worst 100+ $$$$ things I've ever bought now it ejects the Dvd tray every time I turn it on for no reason and it freezes and crashs every single day I use it at least 1 time.I'll never buy a Sony branded Dvd player ever again this thing has brought me a LOT OF FRASTRATION!!!! I'm actually angry at Sony for selling such a hunk of TRASH.
4,Replacing my old Sony Blue Ray player since it no longer supported Amazon Prime streaming. I have only use the new one for a few minutes (during setup); but was very easy to setup (3 minutes); and then making sure Netflix and Amazon would come up over Wifi. Both were fine; although when trying to setup HULU; it said HULU was not supported by this device (although you do get the logo on the screen). Can't believe you can buy a new device and it does not support all streaming services. Have not played a DVD yet; but unless something is wrong - I expect it should be fine (and if not - i will update my review).
5,Great features and works well!
5,It replaced my 13-year Sony player the new one is half the size half the weight. wireless WiFi smart 4K. and at a great price price. Awesome Great Technology
5,I brought my sister this one because I own 2 of the same. For it to be so little this dvd player has a lot to offer. Capabilities to add to streaming apps and so much more. The remote is easy to use and has many options.
2,Had to return this since despite the prominent reference to 4K in the description it DOES NOT play 4K Ultra High definition DVDs.  Not exactly false advertising and the model number and price should have set off red flags but I think t should be super clear in the description that this plays blue-ray discs (and does it really well see below.)  I bought the player specifically to enjoy 4K discs on my new 4K TV but when I finally got my hands on a 4K disc the player revealed it's little secret.THE OTHER SIDE OF THE COINI was actually a little sad to return this impostor because when I played a regular DVD and a Blu-Ray DVD on it the images and sound were FAR superior to my previous (Panasonic) Blu-ray player. I was  convinced that when I put a UHD disc in this machine it would blow me away. Alas no because it cannot play 4K UHD discs at all.  If you want a really good Blu-Ray player that does a great job of playing regular DVDs and Blu-Ray DVDs this fits the be bill very nicely...but....THE THIRD SIDE OF THE COINI just ordered the Sony UBP X700 (used) from Amazon to replace this return and it was only a few dollars more than this unit.  And based on my experience with this unit I expect it will do a very excellent job with ALL types of DVDs!
5,Love this product! It's too good to be true. I'm able to excess the internet without buying a smart tv. Easy setup good picture quality.  Good purchase!
3,The physical ‘on device’ as well as the  remote eject dvd buttons will not open if it sits. Need to reboot system.
4,Picture quality good not enough quality apps ..remote too small
5,The DVD Player was smaller than expected.
3,When you pay full price for a product updating it to the newest firmware should not turn it in to an add machine now the default front screen is mostly taken up with unneeded and at least in my use case unwanted apps most that can not either be uninstalled or removed from the main screen.A blue-ray player should on the main screen be at least mostly dedicated to blue-ray player functions not add on crap.  With the amount of adds/apps being pushed on the main screen the price should reflect this.
5,Our old Toshiba 5 DVD player died after many years of faithful service.  We picked this up for a reasonable price and it works satisfactorily.  There are a lot of bells and whistles I'm not sure we're going to use but it will work correctly with the small remote that comes with it.  If you ever lose or damage the remote you're out of business.  HDMI connection only but a nice unit overall.  Works well with my Sony TV and Sony receiver.
3,The only working think is the DVD  Netflix and you tube . Nothing more
4,The unit is well built and easy to use. Everything works fine except I cannot now make it control the TV sound. I have to use the TV remote to do that. My old Samsung player worked to control the TV sound.Also the unit arrived in a box that had been roughly  handled. The box had torn open. There was no packing in the shipping box.
5,N/A
5,The unit was compact and simple to use fits on a shelf easily with limited space. Only tested one store bought DVD in it for a few minutes to make sure it operated so It does not have much play time to comment on features.
5,Great little unit .. should have paired with a Sony TV for more Seamless Remote use
4,So the picture quality is good for both Blu-ray and regular DVDs. But the availability of apps is overrated. I bought this to avoid the heavy electric bill for my PS4 but it does NOT include Disney + or Hulu. Was disappointed in that. I don’t understand why all “smart” devices don’t include all apps but whatever. Allows me to play older Disney DVDs for grandkids.
5,Great product
5,I recently bought a 4k flat-screen and wanted a DVD player that would work best with it.  This is the perfect compliment and the price was decent.
3,The Blu Ray / DVD player works well but I was specifically looking for a player that also played VHS tapes. The description described it as Blu Ray DVD and VCR. It does NOT have the VHS capability.
5,After reviewing several models I chose this player for it's features and easy set-up. It didn't disappoint. The player is very unassuming small and doesn't have all the distracting lights in the front to advertise there's something in the tv cabinet below. Setup took less than 5 minutes and the picture is great. For a "simple" device it offers bluetooth mirroring and also plays CDs. This is a perfect little player that packs a punch!
4,My husband's decade-old Blu Ray player took 5 minutes to load up discs and seemingly another 5 to load the video itself. This thing is half the size and load time from power on to play is maybe 15 seconds.The apps are probably pretty helpful for those without a smart TV or some other streaming device but I don't need them so it'd be nice if a list of the recommended apps didn't take up a third of the home screen. Otherwise it's just what I needed!
5,I love this DVD player. I was worried I would not be able to set it up being technically challenged but it worked like a charm.
5,Simple to install and plays right away.
5,I bought this DVD player largely for its internet access capabilities. Several reviewers had mentioned that this unit had the HULU app/access built-in.While the unit does indeed have most of the "standard" apps you'd expect (Netflix Amazon Prime YouTube) it does NOT provide access to HULU. (Though several previous reviews said that it did the unit I purchased June 2020 does not.)Other than that it is a solid performer. Picture quality is excellent and its remote also works great with the Sony TV it's hooked up to. I'm pleased.
5,It's a nice picture easy setup and remote is simple. Wifi works
2,If you have regular blue rays you are fine to watch but it does not play 4K. AT. ALL.Tried multiple. No 4k!! Believe the reviews!Most of what I have is regular blu ray or DVD. But I can’t watch any 4K Blu rays.What a worthless piece of crap to advertise that its a 4K Ultra player.
5,This is a really nice Blu-Ray/Streaming device.We had an older machine that only had access to YouTube Netflix and Vudu. YouTube stopped supporting that old device over a year ago and then recently it just flat-out stopped working. Not even the Blu-Ray player would work. I decided to get this device after reading the other reviews and we were NOT disappointed. It's really compact easy to setup has Wireless (which was an unexpected bonus) and by default it is setup to handle pretty much every major streaming service we could want. It also has some nice Quality of Life stuff like it automatically remembered which profile we watched Netflix under last session so it had that person's profile already highlighted when we started Netflix.For the money this is fantastic. Definitely worth it. And the picture quality is great.
5,Easy to set up good picture
5,Works great easy to program and use.
5,To replace an out dated player
3,The "4K upscaling" is deceptive as it will not play 4K DVD's only standard and blu-ray DVD's and then upscale the output for a 4K TV. At a 4K TV already does the upscaling as do most AV receivers there is not much need for a DVD player to do this with standard DVD's.The remote control is so small that there is little room for the buttons that need to be pushed. If I had kept the player I would have bought a third party remote that was larger and easier to use in the dark as this one has no backlighting for the tiny buttons.
5,Easy set up and works great!
4,very good dvd -blu ray player
5,All good hope it continues to deliver !
5,Sister bought me one
3,It would have been really nice to know that you can only get a few apps (some of which are so obscure that I have no clue who actually uses them).  Apparently Sony ‘broke up’ with some of the most popular apps and therefore you can’t get them.  This is simply a very expensive DVD player.  So if you want an overpriced DVD player then this may be for you.  But if you are purchasing this to use with an older TV to use as a wireless streaming device then don’t do it.
5,It seem with older DVD's the picture can be grainy other wise it's a good value.
5,Would recommend
5,Great product for the price!
5,Came super quick.. hook up was very easy wifi set up easy picture is great and all the apps set up was a breeze.  It is really small and light (technology has come a long way!) Works with Amazon Prime Netflix and others and app set up for Pandora and Sirius.. ALL worked since I had accounts with all above. UPDATE: 1 week in and I have to unplug- plug back in to get it to do anything.  Remote/front on/off... doesn't work.  picture is good when it works but if it keeps up... RETURN very possible.
4,I bought this player primarily for streaming Prime Video movies and TV shows on my TV  via Wifi (and for playing DVDs of course) and it works great. I wish the remote control was bigger. Also the controls on the remote aren't always as responsive as they could be.I like being able to use the remote to control the TV and switch input sources without using two remotes. Also when you power on the Bru-ray player it automatically switches the input source on the TV to the HDMI jack the player is on even if it was set elsewhere before.
