rating,review
5,Very happy so far. Replaced an LG Blu-ray that quit playing discs and had a dongle for wifi that we lost a long time ago. Connected this Sony last night and played DVD and Blu-ray the way it should and connected to Netflix and streamed no problem. Lots of other apps I have not explored yet. Only negative is the remote does not light up but still a good deal for the price
5,Our DVD player died.  I was looking into getting a replacement and after many reviews found this unit.  There was a lot of information and some of it I understood.Once I hooked it up to our old "not smart" TV I noticed that I could pick up my streaming abilities from our modem.Once that was made we were able to use the old tv just like any of the new TVs that connect to the internet.we are very happy with this unit and would recommend it for anyone who wants to upgrade their video system without having to purchase the an expensive TV.
1,Every time I would power down and repower up it was like I was starting the unit the first time. I was constantly entering my password to my Wi-Fi network and it was a tremendous hassle. I returned it the next day.
1,I had bought 2 Sony players.  I brought M mainly to stream Netflix Amazon movies and YouTube The 1st one did not have that app or Amazon movies and can not be added. Too much time had passed to return it. So I brought another one. This when did have the Amazon app. Did have a little problem setting up but after I got it working it seemed to be OK for about 2 months.  Then it started dropping the Wi-Fi signal. And then it was a pain cause everything had to be set up again including the passwords for Amazon and Netflix as well as YouTube. Saw this in other reviews but decided to take a chance hoping the others maybe had a weak Wi-Fi signal.  Beware because I do not have a week Wi-Fi signal. The unit shows is getting full bar signal. It seems to be getting worse as time goes by. I just leave it on all the time now hoping for the best but sometimes it locks up in has to be unplugef and reset. Who wants to do this after working hard all day and wanting to come home and relax and enjoy a movie or watch some things on YouTube.NOT ME !!  I will try to return it but I have the feeling I'm just out of a $150... Buy at your own risk. Shame on Sony for producing such junk...
3,Wanted apps not available with this player.
4,I was skeptical about the "easy to install" sales promise; my skepticism was unwarranted.  Hook up was very straight forward; the brochure provided with the player was user friendly and helpful.  The player did "freeze up" after I read the User Agreement when I clicked on the "I Accept" button.  I went on line with Sony Technical Support and after a simple chat session with Ryan I rebooted the player and it has worked fine since.  I am very satisfied with this product.
3,Nice little unit..Was a little smaller than expected. I was replacing my Sony Blue Ray I've had for a long time..The unit was easy to set up..Has Apps and features but I don't usually do "apps" from my Sony player. I'm not a big fan of DC power supplies..I was replacing something with an AC cord..I had to re-think my power strip use due to the space needed for an AC to DC 12V dc converter. Plus the power connection can come loose if I move the unit some for cleaning and dusting. Last..I didn't receive an HDMI cable or a cleaning cloth as advertised..No big deal I have cords cables and cloths at home. I reused my HDMI cable feeding off my Smart TV..So everthing seem to be good for me..I only gave 3 starts due to the missing items..But I do like the unit..and the DC converter really isn't that big a deal to me..Mave
5,Came with batteries great price and great addition to our rv.
5,Used this device on my home office desktop as a DVD player for a television. I like the small footprint the unit uses on my desk.
5,We had a few DVDS that would not play all the way through and as luck would have it old player died a couple months later.  So we thought we would see if “bad” DVDs would work - not only did they work picture quality was fantastic.  Can I say this player will last no idea as we just set it up.  But so far so good.
5,I am SO happy I bought this. I haven't had an updated DVD player in a very long time. It wouldn't work with my smart t.v. BUT this one does and I LOVE it.
5,It plays BlueRay  and DVD how great is that!
1,Doesnt play pal region.Cant understand why it happens in 2022.why it ahould be region dependable?And how i am supposed to know that i should check it before i make order
3,I bought this boy-ray player because I had another one that was an older model of this one that I got several years ago that eventually broke. It used to include an app to watch Hulu but Sony has since REMOVED that function. While it includes a lot of apps most of them are useless and show up on my main screen when I don’t want them there. And worse the only major streaming services this machine includes are Netflix and Amazon Prime. It does NOT INCLUDE any way to watch Hulu Disney+ or CBS All Access. Profoundly disappointing!
5,This is an incredible blu-ray DVD player. It was very easy to install and I like that it is much smaller. I really like the smaller remote as we have too many that take up too much space. It is perfect for us. Some people have complained that it stopped working and it seemed stuck once for me but I think it was our Comcast as I just unplugged everything and it started up perfectly again and never did it again. Comcast gets stuck or has to be updated often in our area. Great product by Sony! I highly recommend it.
5,Nothing
5,Easy set-up and easy use.  Looked far and wide to find a DVD player I could pair with my wireless headphones.  I was even told that that capability does not exist. Very satisfied with my purchase.
1,I hooked this up and tried to log onto Amazon Prime.  A message on the screen informed me that there was a problem with my credentials and I needed to call the number on the screen.  Keep in mind that I was connecting through the app on the DVD player.  I called and they talked about me having too many devices attached and had me go to Amazon and set a couple gaming gift cards up for purchase.  I have been a system developer for a couple decades and even though my wife was telling me to stop I believed I was talking to Amazon.  They got about $80 out of me before I came to my senses.  I tried to contact Amazon but nobody ever returned my calls and my credit card company could not stop payment so I was just screwed.  I still have not had a response from a single person at Amazon.  Good luck if you order this.  The malware has to be embedded in the DVD’s firmware but nobody seems to care.
5,Easy setup and great picture quality
4,It started off fine but 9 months in the unit started freezing.  The only way to get it to work is to unplug the unit for a second.  The motor started getting noisy about the same time.
5,I had no idea how awful my old Blu-ray player was until I hooked this new one up. I ordered it on Saturday and received it on Monday. I set it up in 5 minutes and then loaded a few DVD's that my last player couldn't (or wouldn't) play properly. I couldn't believe how great the picture looked and how easily everything booted up. The unit is very small which for me is a plus. The remote is small but plenty big enough to do the job. If you're looking for a reliable and hassle-free Blu-ray player that won't give you headaches this is a winner.
5,Easiest Setup great quality picture easy to use. Command response is very quick from device to TV. Very satisfied with price vs quality.
1,UPDATE: This arrived Saturday and stopped working Sunday night. First I couldn’t log into YouTube because it said I had no internet connection I checked the settings and I was online with great reception now the apps won’t open it’s stuck on the menu. Don’t waste your money.I thought I’d be able to download hulu and Disney+ to my apps but you can’t and they have about twenty random unknown streaming services available and a few well known apps (YouTube & Netflix) but you can’t download other known streaming apps. Works otherwise a bit disappointed.
5,this drove me crazy till i figured it out. if you have started to watch a video and then turn the unit back off then on you will be left at the main menu. if you press the button in the middle of the arrows at the top of the remote the DVD will  start over again instead of resuming where you left off.to resume press the 'play' button.
5,I use this player for watching DVDs and some paid channels. I had a similar one from 2009 but wanted to upgrade to this one to get the Bluetooth connectivity. I enjoy lots of music off YouTube and with this player I can transmit to a Bluetooth speaker and take it with me as I’m busy around the house! Works well and has a small remote I like because of arthritis in my hands. A winner for reasonable price!
3,I have no complaints about this as a blu ray player. It plays blu ray and dvd just fine. The fact is I got this as an all in one for streaming services as well as media playback. It has a very limited number of apps. Very disappointing!I just ordered a Roku that I honestly didn't think I would need but turns out I do. If all you use is Netflix YouTube and Amazon Prime chances are you will love it.
5,I purchased this when my older dvd stopped functioning.  I didn't know what to expect but it works great and the upscaling feature on this player makes my regular dvd's look like a blue ray on my 4k tv.  I would recommend buying this.
4,I like the wifi a lot it’s strong easy to setup picture quality is that of an upscale I would rate it “over average”
5,100000 % worth every penny for someone who is not tech savvy i was able to set it up quickly and effectively. I absolutely love that I can use mirror link from my phone to t.v  with my android to have my kids watch disney plus and anything else I'd like to stream! That also was an easy setup !
4,This DVD player works and we hope it lasts since streaming is replacing DVDs.  Interesting in our recent trip to New Zealand they still have DVD rental stores cloths lines in backyards and other things we used to have.
5,This is a high quality player and the 4k quality of picture is phenomenal. Hooking it up was simple and straightforward. Easy to use.
4,Easy to set up and use. Use it mainly to watch my Blu-ray DVDs  It also has a lot of apps like YouTubeNetflix etc.
1,I often discount negative reviews because they are usually too idiosyncratic to be helpful in my purchase decisions. I should have taken to heart the negative reviews on this Sony DVD player.Out of the box the tray would not fully close because it would catch on the dust cover. With its odd packaging I suspected the seller of selling a re-conditioned unit as new. DVDs will simply freeze. Every single time.Then there are the cheap design features. If paused for more than a few minutes it will turn off and will not then resume the move where it was stopped.Others have written about design flaws. I will not repeat them. But they give Sony a bad name. I will never trust this third-party seller again.I made a bad choice. I will not do it again.ADDENDUM. Two months after purchasing the player it has now stopped playing
5,This is an outstanding Blu-ray DVD player and has already provided many hours of viewing. I’m not tech savvy and will never use all of it’s features. I had a little bit of a learning curve. Another great item from Amazons gallery of choices to aid in selection. Thanx!
2,We had an older model of this exact brand.  But when suddenly received a notice while watching our Hulu app on the device it said this device no longer supports Hulu.  So we thought that since we had our Blu Ray for over 6 years and technology is always advancing so fast that we assumed it was time for a replacement unit even though our current one was running fine.  We chose this because it specifically said it supports Hulu one of the only reasons why we made the purchase.  Other than that the unit is great.  Can someone tell us why we cannot get Hulu?  Why is the Hulu app still on the device?  It shouldn't be there if it isn't part of it.  Also we thought we could search and get the Hulu app and add it.  This device doesn't even allow us to do that.  We wasted money getting this.  It isn't worth our time to disconnect and return for a refund.  Very disappointed.
5,This is my 3rd player and since it is the newest it is quicker and is more updated than my previous players. The oldest is a little barebones player....took forever to get ready to play and a Philips which took almost as long. Now I don't doze waiting for the player. So far very happy with it. The price was right and quality is good so No complaints. My seller Hot Deals Electronics provided the service and additional baubles as stated in a very efficient and timely manner. 4 Thumbs up!
5,Sets up easy works great. Wish you could add more apps.
1,I bought this as a gift and unfortunately he waited too long to use it and then it couldn't be returned. No Blurays or DVDs will work. I've gone through the manual made sure the software was updated etc. Nothing has worked. It's useless and I'm out $145. :-(
4,Like it but remote will not work sometime and you have to plug and unplug power then it works for a few days then again plug and unplug .......
5,Thanks great product
5,Not much to say.  I put a video disk in hit the ply icon and watche.  Works great as you might expect
3,I've had the device for a few weeks now but there are a couple of call outs...Prime Video app is present but it always fails at the start or a few minutes into the movie or episode You Tube and NetFlix run very well on the device. It's an ok device but I expected to use Prime video but it never gets through a full movie or episode with out failing.
5,I was tempted to buy an new TV so I would be able to connect to Amazon Prime You Tube and so on. New TVs in my price range may be smart but the quality was not up to the old TV. So I bought this and it connects me to the internet with a super fast and high resolution. Gives me a much better picture than the smart T Vs I tried. And the DVD-Blue Ray picture is also superior to that of my old player. Very satisfied.
5,Very easy to install and get on with Amazon prime
5,I purchased this BluRay DVD player to replace my old Sony DVD player.  I am not using any of the more sophisticated functions.  My hope was that I would be able to plug the player into an electrical socket attach the included HDMI cable and play a disc - and it was just this easy to do.  Up and running in very short order.  I very much appreciated that the HDMI cable was included in the box and I'm very pleased with the purchase.
1,I've owned this for a couple months now and all I can say is this is the last Sony product I will every buy. I had a Sony dvd player which always gives problems but chalked it up to buying a cheap model. So figured would give Sony another chance by buying another upgraded model. It is used on the living room tv and has problems EVERY day - freezing while watching dvds bluerays or streaming on any app. The only solution is to unplug it. And restarting is not fast. Then you need to restart whatever you were doing which takes even longer - and hopefully doesn't freeze again while resuming. And if it freezes after putting in a disc there is no way sure way to get the disc back out. No eject buttons work and there is 'emergency eject' (such as the little hole for a paperclip). After unplugging it and restarting have at best a 50/50 chance it will remain frozen with a black screen and no way to get to the main menu until unplug again - rinse and repeat - with disc still stuck inside. Also just today I signed up for Hulu. I go to this players Main Menu screen and select the Hulu app and get the message 'This app is no longer supported by this player.' Once I find a replacement I'm going to 'Office Space copier' this POS...
5,Compared to my old Sony DVD player this is super fast. Setting up via HDMI is a snap. It turns on fast and doesn't turn off after you leave it it goes into standby. This means it's back in an instant. My old player would not play DVDs after a few months. This I hope will last a long time.
5,Works great. I haven't used the smart functions much because I have a smart TV. However the player works well and it even works in sync to change input from the player to cable TV on its own with a Samsung smart tv
2,Edit: We’ve now had this player about a month and it’s required us to do 3 system updates. Each time it’s a process requiring it to “try” to connect to the internet which takes several attempts until it’s successful. We have a strong internet connect btw. Once it finally connects the update takes about 5-10 mins. The issue I have with this is that the player is unusable until it does this update. The paperwork sent with the player even states that an update is required roughly every 2 months. If your internet connection is even remotely weak good luck! You do have the option to go online and use a USB to download it and then install but this is kind of a pain to have to repeat in my option.So far we’re very pleased with this Blu-Ray player. It arrived the next day was packaged well and literally took 2-3 mins. to set up. We’ve used it non-stop since then and the picture is beautiful it’s quiet and easy to use. I love that it plays DVD’s and Blu-rays and has Netflix etc. available too.
2,When I took it out the box I was shocked at how small it was. First I thought they must have sent me the wrong item but no that was it. It's extremely lightweight and feels flimsy. The remote is crude and not intuitive. Unfortunately you cannot speak into the remote like you can with Alexa or Amazon Fire stick which I love. This seems to be a device that has been altered. The internet is very slow to upload. It takes a couple of minutes for the machine to register the internet every time you turn it on. I feel I spent way too much money on this product. And I do not recommend it I wish I had never bought it
5,Excellent picture and easy to use.
5,The DVD Blueray was easy to install and picture quality is great.
5,Setup is 3 minutes (if you're slow like me!)  HDMI cable included - plug in to TV and DVD player. Attach power cord - you're in business.  Unit practically links to WIFI by itself - just enter your WIFI pass code.  Was watching "Sergent York" in 5 minutes.  So far no glitches or hang ups found.  Solid unit - good Sony product.
2,This wasn’t quite what I thought it was.Amazon returned it no questions asked.This is why I love shopping Amazon because the confidence of being able to return things don’t work out.
5,Super easy setup. All I needed was my wireless password streaming passwords for the Apps and in less than 10 min I had set up the remote to control the TV watched Netflix and a Blu-ray DVD. It’s a small unit but works great.
5,Very easy to install and good picture quality
3,Expected better from SONY. Unit OK in all respects except one: sound sometimes cuts in & out when sound gets loud. Occasional rather than constant just enough to be annoying.
4,Ok DVD/blue-ray player. Have had no problems with this unit. Streams Amazon Prime items ok. Satisfied with the unit for the price we paid.
4,Works well with a great picture.  Only problem with the item is that other apps. can not be added to the programing which is not good.
5,Playback quality of Blu-ray disc is superb.  Extremely simple to set  with WiFi and all the most common apps pre-loaded.  Would certainly buy again if I needed another and do recommend same to anyone looking for a solid player.(This model had excellent reviews on the internet when I was researching new Blu-ray players.  Seller sent it well packaged and everything that was supposed to arrive did when it was promised.)
5,While I'm generally a brand loyal kind of person I bought this Sony player because we've had 3 LG's flake out right after the warranty expired. It has worked perfectly  and was easy to set up. Picture quality is excellent and I would recommend this player to anyone looking for something with similar specs.
5,I wanted to upgrade my bluray/dvd player so after reading a lot of reviews on several players I chose this one. The quality of picture and even sound is amazing. Set up was very easy the instructions clear and easy to understand. I usually have my son help but I wanted to try it first. I even set up the wifi with no problem. It works great I'm so glad I chose this one. Also good customer service. Thank you.
5,Bought it for my RV. Easy set up.
5,Works great thank you!
5,Nice dvd player . Good picture quality . Easy set-up .
5,Bought to replace a much older Sony Blu-Ray player which finally gave up the ghost....is working well with no problems to date...with all the streaming devices available for less money might have gone a different way but still have lots of DVD's and Blu-Ray discs and need the play capability...
5,Nice Machine no issues
5,I bought this to replace my existing Blue-ray DVD player that did not have bluetooth capability.  Now I can watch DVD's day and night without bothering anyone else when I use my bluetooth earphones.
5,Wanted to replace/upgrade on a 10 year old Sony player and ran upon this model.  It arrived in a couple of days easy to set up and the remote so easy to use.
5,Works great!  Use to stream Amazon Prime which it does.  I almost didn't purchase because of reviews saying Sony no longer supported Amazon Prime but I had no problem.
5,Very happy with this blue ray/dvd player. Easy to install.
4,It's a good unit at a very good price.
5,Small perfect size
4,I like it but it doesn’t support a lot of apps. It no longer supports Hulu which was disappointing but it does support Netflix.
5,I really enjoy this player-great picture quality. Only thing I’m not crazy about is the remote-could be made a little stronger-especially the keypad when it comes to typing-otherwise I recommend it
5,Works great! Great price. Easy to use. Small box. Remote is perfect.
4,Blu ray seems to loose place when turned off.  Works well though
5,Perfect addition to my daughters room...ability to watch Netflix and YouTube too!
4,Very easy to setup and it works well.  It is quite a bit smaller than the player it replaced
1,Sigh.... I'm sad to say that this blu ray player randomly stops working and will not respond to remote control. I have to get out of my bed walk to the blu ray player and literally unplug it counting to 30 plug it back up and then manually turn it back on before I can use the remote again. It's disappointing and annoying. I waited too late to return it. Do you think if I went directly to Sony that they'd help me out with this?
4,quality was a bit cheap.
4,The only reason for 4 stars overall is because it is mot Hulu compatible. Otherwise a great device!
5,Been using this player for one week now and have been enjoying every minute of it.Player arrived within 48 hours and was extremely easy to set up.
5,Plug and play. That is how it should be right?
5,Replacing Samsung which will no longer "accept" Blue Ray DVD's or streaming.  Very pleased with Sony though instructions were confusing and hard to follow....
5,I've been wanting  to get myself one for my front room tv that plays DVDs too. I've enjoyed this product since I got it. Very easy to use.
5,I didn't know this picticular unit would not play 4k uhd disks. As soon as my refund is put back on my credit card I'm going to buy another DVD player.. Already have it in cart on Amazon.. AMAZON IS GREAT!!!!!!!!!!!
4,Good product works very well great picture quality sound and with HD clarity. Enjoying my movies more.
5,Small easy to use and fantastic up-scaling. Overall great picture.
3,Unit turned off/on TV while playing DVD. Worked fine playing BluRay. Spent three hours on phone with Sony trying to determine problem. Final advice from Sony was to contact LG to defeat signal line from Sony player. Tried a second Sony unit with identical result. Bought a SamSung unit and it works perfectly.
5,I've only played 4-5 movies so far but it's quick to bring up the movies menu and works well.  The remote is small but not too small like some I'd even say a good fit.  Picture and sound are excellent.  So far I'm really happy with it.
2,Its 'ok' but I have some issues.1.  My 4k tv and it just don't match up with voice and video over an HDMI and I'm limited on audio out options for this player.  The video actually is ahead of the voice so the AV Sync option only allows for slower video to voice instead of the issue I have where the video is faster than the voice.  Therefore I have to just deal with every movie I play from the blu-ray being slightly out of sync like a bad kung fu movie.2.  Why would they not put an optical audio output on this? Everything else I have has optical audio ports but not this player.  That would probably fix my previously mentioned issue.
5,I got fed up with our (cheaper) Sony Blu-ray but wanted to stay with the brand.  I am SO pleased with this product.  It is sturdy and is very very quiet (our cheaper one was noisy and so flimsy that the eject button finally quit working).  Installation was a breeze!I'm very happy with this product!
5,for my local firefighters.  Their DVD player had died over a month ago so I wanted to do something nice for the guys that protect my home and come to help me whenever I need them.  I can't rate the quality but knowing it's a Sony I trust the brand as I have a Sony TV and Blue-Ray myself.
1,Junk waste ofMoney I should get a few years out of one of these now doesn’t work 150.00 dollars later I still need a player for occasional movie night cheap crap expensive price
