rating,review
5,It is built well and works as it should. I did not really need the light functions but my grandkids seem to think grandpa's new disco lights are the bomb. The fan is strong and I am sure this will extend the life of my pc. Satisfied customer so far.
5,Im not an everyday laptop user but for the times ive kinda pushed my laptop for gaming this has kept mine cool.
5,Purchased this fan for my 8 year old who’s totally into gaming. It was the perfect fan for his gaming setup. The fan is very quiet you could barely tell that it is on. It comes with the awesome lights that my son loves very much. The fan is very sturdy yet light weight.
4,i have a gamer laptop and i see people saying is cools it down and helps it run better. For me it does not cool it down my old cooling fan did a better job on cooling it down but it still gets hot. other than that its really cool!
5,I absolutely love this product!!!It’s extremely light weight and the noise level is so low.If I had to write one complaint about it it would be that I wish it was chargeable so I can take it with me outta my room and still be able to turn the lights on.
5,I have purchased 3 of these for different family members. Works great with no problems. Elevates your laptop at several different angles. The RGB lighting is bright and has many different settings including off.  The cooling works great with my laptop and allows it to not run hot.  I would certainly purchase again without hesitation
5,Very quiet cooling pad that fits my 15’ gaming laptop perfectly. The five different adjustable heights gives plenty of options. The RGB colors are a nice touch and they look great on the breathing setting. The pad comes with a USB cord as well. It’s an affordable product that does exactly what it says it does. If you’re looking for a cooling pad for a gaming laptop I would definitely recommend this one
5,Best cooling pad out there my old cooling pad had 3 smaller fan temps were 60c-70c on hard gaming (Alienware R17 16rami7GTX1070) and 51 on neutral with KLIM Ultimate Cooling pad they dropped to 53c-61c on hard gaming and 39-43 on neutral. very noticeable performance! Its a MUST BUY.
1,Everything worked well it seemed to do its job just fine for about a month. Then earlier this week I set my laptop on it and hear a snap. The plastic folding arm snapped with what seemed to be like very little pressure. I know I didn't drop or mishandle the cooling pad because I always store it in a cabinet alone with nothing else in it.
5,I use this on my mining laptop 24/7/365 and it is silent and keeps the laptop cool with nearly zero noise.
5,This fan helped my laptop immensely. It really cools down your laptop in the heated summer. it really changed how my laptop performs. The lighting is quite beautiful especially in the dark. I like how I can change the color of it to whatever the color I want it too. Furthermore this fan is more silent than my old fan. I recommended this product if you have a gaming laptop that easily heats up.
5,This thing is good and quiet but if your laptop is overheating this won't help at all if what you are looking is something to not burn your legs this is excellent... Pretty much I tested it with and without the the heat level was the same not a single change but I can place my laptop on my bed and maintain the laptop apertures free of obstruction
5,This is the best cooling laptop o have been come across. I got it for my sons birthday. He is an avid gamer and his laptop kept overheating. This product has put an end to that. He kept trying to get it to overheat and it never got higher than 38 degrees. It is so quiet that we thought it wasn’t working. 10/10 would buy anything this company was selling.
5,What's there to say cools the laptop well and has great RGB.
5,Perfect
3,I expected more and was disappointed It's more of an overprice laptop stand with LED lights.  Not great for a gaming laptop as it does not cool an RTX3070.
3,Let’s get this straight I bought this item as a laptop stand first and a laptop cooler second. My new desk came with a full desk mouse pad and I couldn’t just keep my laptop sitting on that. I loved the rgb lights and went with this one immediately. The build quality is good but as the title says the fan does practically nothing. It works it’s not broken it’s just so weak there’s almost no air pushed out. So if you want something to actually cool your laptop this probably isn’t the product for you.
5,I got this fan because my gaming laptop was averaging 90C when playing games. The first thing I noticed is how sturdy the pad feels. It's fairly large but nice and sturdy. The colors around it look really cool and really stand out and there are different settings for the lights. It only has 1 fan but it's practically completely silent and generates good cooling. Upon using it while gaming temperatures dropped to around 75-80C!
5,Using on 17in. Fits this size perfect overall design is awesome. Very quiet not a super powerful fan but its good. Build quality and packaging is up there with anything on the lower price range of Corsair and those guys. Uses dual USBs for power which isn't ideal. Only other thing I don't like is that the LED strip isn't perfectly uniform theres dark spots around it. Still gave 5 stars though because its low price point makes this a win all day
5,The media could not be loaded.                                                                                 Looks amazing under my PS5! Haven’t used it long enough to know if it’ll help keep it cool. Not too worried about that I got it for the aesthetics.
5,It arrived on time and was basically a plug in to get it to work.  Very quiet can not even tell that it is running.  The lightning effects are awesome.  With though that it did come with better instructions on how to change colored lights but in then end it was not too hard to figure it out.  Well worth the money.
5,Works well
5,Just ordered this to replace my old one that was going out and it works really well 😩🙏❤ not disappointed granted if your house is without ac it can only do so much
5,Wow it drop allot. I have regular Targus but it still go up the heat but today I test it . It drop allot. I’m impressed this product thank you . Hope it last ! This fans is top notch. Thank you
5,Final addition to finish off my setup :) Very quiet and the fan level adjustment is great. I used to keep a desk fan on my laptop when I gamed and it was really noisy so the change is nice! Highly recommend for those with gaming laptops that get really hot!!
3,I wouldn’t mind paying a little more if it came with a longer and better quality USB cable. The rest of it is fine
5,This devise is very quiet keeps the lap top cool. Does not heat your lap up. The led lighting looks fantastic. I get a lot of great comments on how good it looks. The price was perfect. Fast delivery too.
3,GREAT LOOKING NOT MOVING HOT AIR INSIDE THE COMPUTER ALIEN R15 COMPUTER STAY HOT ... MAYBE FOR MY PLAYSTATION IS FINE
3,Really 80$ for this? My computer still over heats with this fan. U can barely feel the fan when you put your hands on it and yes I know how to turn the power level.
3,Pros:--Very quiet fan at least so far--Cools fairly well--Small enough to use as lap desk--Fits my 13" laptop with room left over--The lights are coolCons:--Very strong plastic off-gassing smell for the first day out of the box--I have a Zenbook and the vents are in the hinge so have to pull the laptop all the way to the front edge to get good airflow from fan--takes 2 USB slots to run lights and fan and no USB port on cooling pad so mostly I'm using it without the lights
5,Wonderful.  Very quiet and keeps my  Asus rog duo gx551qs-xs98 really cool.  It amazed me how cool the bottom was after a couple hours of use
3,The RGB is awesome....... The Fan is TERRIBLE!I run a MSI GS75 9th Gen I9 and I can tell you this fan does nothing to assist with keeping temps down during gaming. It basically has the same effect as just proping the back up the laptop up and nothing more. This unit is best purchased for the RGB only and not cooling. If you are looking for cooling qualities over RGB then look elsewhere.
2,ok look gorgeous the rgb is beautiful  display on my desktop i did a lot youtube  and reviews on amazon for gaming laptops   at first look great  but gaming and video editing  my  laptop  fans work full speed the cpu reach sometimes 92 degrees  never happens whit my old cooling pad the iets gt300 double fans   i change because is horrendous  loud as jet fighters but never cross 80 degreesif you priority is performance this pad  is not for you barely blow airif you don't care about  performance  but looks and rgb show get iti not recommend as cooling pad anyone care about cooling efficient any laptop  and  youtubers give not honest  reviews  about real performance
5,I love this cooler it drops my temps by almost 20 degrees! The rgb is crazy bright and looks awesome on my desk. The only thing I did not like is that it uses 2 usb ports. Great purchase for my 17" gaming laptop.
5,I'm not sure if 5 stars means quiet or loud.. but for me it means it's quiet. It feels cheap but my laptop is very heavy and it holds it just fine. Colors are beautiful and it works wonderfully.
5,The media could not be loaded.                                                                                 Ordered Sunday got it MondayCan’t hear the fan (too quiet)Average airflow (subpar for the price)RGB is mostly reason why you’re buying thisIt’s 5* for me since I read enough reviews for my decision.
1,My item was either defective or its a complete rip off. I'm hoping for the defective part based on the other reviews. First impressions of the cooler was very good. It looks cool was comfortable to use on my lap and fit my 16" Asus Zephyrus very well. However the one thing it did not do is the cool the laptop. I plugged it into the USB port and slid the wheel over to max and the fan barely spun and had no significant or distinguishable airflow coming from it. I even placed a half sheet paper towel to see what it would it do and barley showed any movement what so ever. I've had cheap $20 coolers with smaller fans produce significantly more airflow than this overpriced color changing mat. Again I'm hoping it was just a defective unit but for an $80 cooling pad I would have hoped for better Quality Control and premium materials. especially since the majority of their competitors are selling for more than half of what they charge. I'm returning the item and will be looking elsewhere for a cooling pad that actually cools
5,Playing intensive games usually running 80-90 degrees Celsius. With this bad boy/girl am at 60-65. I also bought a foam filter to put in between this unit and my laptop to catch dust from getting in the laptop and still runs that cool! Excellent product and a awesome email from Klim that made me laugh lol.
5,i bought a top-notch gaming laptop so i figured i needed a fancy cooling pad to ensure its longevity. this thing does NOT disappoint. it is quiet as a mouse!!
5,Got it express delivered and received it in a few days. I'm quite happy with the product; my laptop is generally noisier than the product so I'm glad it didn't add to it. My friends think the laptop stand looks really good too!The only thing I didn't like as much is that the controls/buttons are at the back. The double USB is a bit jank but otherwise still a great product!
5,For the money its worth it. I run a Asus ROG Strix II GL703 17.3" screen and it made a noticeable difference in temperature. I was running hot between 80-86 degrees depending on the game. With the cooler it hovers between 72-76 degrees and keeps my legs cool! :) If it takes a dump i will re-review it.
5,After a few days of using this fan on an Alienware m15 laptop it's definitely safe to say that this is one of the best gaming laptop coolers out there. Not only is this fan incredibly aesthetically appealing and quiet but it also serves as an amazing laptop stand. My favorite aspect by far however would its amazing efficiency and lack of noise when it comes to cooling my laptop.
4,Me gustaría que la inclinación sea más baja de la de inicio. Es decir menos ángulo  porque su primer escalón sube demasiado.
5,This is very pretty in person the colored lights are bright and really quite beautiful. It gives off a nice amount of air flow and is very quiet. Bought this for my teenage son to use with his gaming laptop. He was blown away for the price. Would buy it again. If you want a nice rgb laptop fan this is a good choice.
5,So far so good. keeps my mbp cool.  Fits on my Lap.  Love it.
4,I would love to give this 5 stars HOWEVER having to use 2 USB ports for both the fan and the lights is pretty inconvenient. Otherwise it’s great.
5,like the quiet fans but could do without all the distracting lighting features. Took me a half hour to get the lights to stay still in a single low key color. Do not want to pay for all the lighting nonsense.
5,I love this! It is so colorful!My cat chewed through the cable! Their costomer service is AWESOME! They are very friendly and responded to my request very quickly!
5,This exceeded expectations. Not just a fan but a great stand for a laptop as well
5,This keeps my laptop cool and I like the color leds around the edge.
1,I liked it at first but like the headline says After less than a year it broke. For almost 70$ id expect this thing to last longer. I take good care of my things. This wasn't user error. Disappointed
5,This thing has been running smooth and maintaining temperature for gaming for nearly a year. It matches the keyboard I bought him and he absolutely loves it. We’d highly recommend it!
3,Had device for just over a year. Now the fan stopped working.
5,Came suuuper fast. The email they attached was over the top but it was wonderfully written and gave me a much needed laugh.My laptop was bigger so that is my fault for getting stary eyed at it. Its super quiet unlike my last one.I can see myself buying more from this company for sure!
3,Product works good so far but the box was opened and a bit damaged when I got it so I'm not sure if I got an used product or not definitely not what I was expecting from this company.
5,I have a Dell G7 gaming laptop that tends to get a little hot when I’m pushing big boy numbers on large games. I see at least a 5 degree difference in my CPU and GPU temps while using this product. The adjustable base is nice and sturdy. The lights are adequate but cannot sync with other external RGB accessories.
5,When they said this thing is whisper quiet they were not kidding at first I thought it wasn't even on it was so quiet! Keeps my lap top super cool the lighting effects are awesome one of my best purchases.
1,Propping up the backside of your laptop without this will cool it surprisingly well and using this product adds zero cooling over simply propping it up. Waste of money
5,Before: idle 40-50c load 75-95cAfter idle 28-40c load 55-80cFor real no joke.Edit: just received my second one to finish off my setup. Thank again Klim!
5,I can be a little cumbersome because it cants your laptop up at an (adjustable) angle but with a flip-up stop to keep your machine from sliding off. It runs quiet it keeps my laptop cool it looks pretty and all for a reasonable price. Highly recommend.
5,This is my third cooling pad and is by far the best one! It keeps my laptop cooler than two other ones I have recently used.
5,After going through 4 cooling  pads none compared to this one keeps my laptop cool while working at Max capacity. Would recommend this above all else.
5,Product is much better than expected
5,What a great cooler so far it has been amazing. I bought it used in good condition and I'm happy that I saved $25.
3,Really quiet and sturdy holds my 17 inch laptop no problem  however I it doesn’t do much to reduce the heat in my gaming laptop. It does however work very well on my work laptop which doesn’t generate much heat.
5,Works good. Fits my Dell G7 17” laptop with no problem. I do wish light controls were on the front or side and not the back.
5,I have no bad comments so far. Doing what it was made for. Thank you!!
4,Works well and easy to customize.  I haven't had long to test durability.  However  I haven't had any problems so far.
1,After a year of owning this unit it now wobbles has screws coming loose inside of the fan area and has always been very loud.
5,I have Macbook Pro 13 2015. Lately I had been shut down issue due to heat I have tried 3 different cooler and this is the one who completely solves the problem. Yes looks price but it works very well.
5,I got this cooler since my last one died. The huge fan is great since it moves a lot of air without making a lot of noise. There is a lot of space under the cooler that is adjustable. RGB is really great.
5,Very impressed with this product Worth the buy and have already recommended it to a few friends
5,This is the best cooler. Larger fan is quiet and the performance is excellent. Worth the extra money.
3,Didn't need the lights didn't notices a huge difference in cooling
5,The fan is quiet and the light around the edge of the cooling pad adds a certain amount of creative colors to a computer area that is lacking in bright cheery lights. I really like this pad
5,Looks great!  The Led colors are very bright and much better in person then the pic. Easy to use holds my 17in MSI laptop snug. Fan runs quite and does assist in cooling. I would recommend very happy with my purchase!
5,I really didn’t expect for it to look better than it did in the photos. Nice packaging and came in a day sooner than estimated. Great size very quiet fan buttons and stand are solid. Light looks nice and bright just like the photos!
3,First the good RGB and stand look great.The bad the cooler system isn't good poor air flow the fan speed is too slow.If you want a really good cooler system this isnt your best option. If you want that your laptop look great this is a best option.
5,Bonus: Choose the first option where the colors slowly change and when it gets to a custom color you want you can press the second button and it will stay on that color. Sweet option I figured out while messing with it.Very awesome laptop cooling pad/raise stand.
5,Nothing bad about the lights and fan. It's so good!
5,Works great with my Lenovo Yoga laptop. I had been having issues with it getting very hot but since I got this it is staying cool. I dont notice the fan noise. The colors are cool as well.
5,Expensive but gets job done and looks good doing it.
5,i like it
1,THING DOESN’T EVEN BLOW AIR!!! I have been looking around at cooling pads for awhile now and firstly went with a dual fan targus cooling pad that did nothing here 2 months later I saw this KLIM cooling pad is one of the higher priced cooling pads on the market for a $80 freaking cooling pad you get a to be honestly decently good quality body and the RBG lights increase my ram by 1GB :) as for what we are buying this cooling pad for. The Fan I thought I bought a high quality cooling pad? This fan literally has no air flow almost put my hand over it cannot even hardly feel the air and this is at FULL fan speed!!! I dropped a WHOPPING ZERO yes A WHOPPING BIG FAT 0 Degrees celcius with this stupidly overpriced real title should be  ““just for looks” RBG pad”
5,Great product
5,I purchased this item a couple of months ago and for whatever reason it stopped working.  This item has a 5 yr warranty.  I sent it back and within days received a brand new one!  Great company great service!
3,Works fine but its just extremely cheap breakable plastic. I imagine if i accidentally dropped it a few feet then something would break on it. Lights on it are pretty cool though. I personally would recommend a more durable one.
5,I bought a G7 dell laptop 17 inches.  Fits perfect and actually works.
5,I got this for my boyfriend as a gift and he loves it and the product is really good. Really worth the purchase
5,Was in need of a cooler for my Asus Tuf 505DU Gaming Laptop and this product had great reviews and I was NOT disappointed!
5,Product is great if not better than expected. The fan is so quiet I had to actually make sure it was on xD. The colors are brilliant and goes great with my overall setup! Great product!
5,Quiet as it can gets but powerful fan!It keeps my laptop cool enough!Great anesthetics awesome RGB lighting too.
4,Don’t really know got it for my daughter.
4,Nice product.  Bigger than I expected. Enjoys the led display.
5,It’s beautiful though and cools better than most  other fans I have.
5,The media could not be loaded.                                                                                             It fits my 17.3” laptop perfectly. The lights add such a nice touch. It definitely keeps my gaming laptop cool for hours on end. I seriously love it!
5,The color changing belt around the edge is a little distracting but it can be turned off.  I use it for a lap top computer that is used for productivity and leisure time
5,Being greedy I wish the fan was a bit faster but it is super quiet and gets the job done. Also looks great if you have a full RGB light setup!
5,I ordered it thinking it would be just another normal cooler and I was wrong. It keeps my laptop much cooler than without one and does so quietly and effectively.
5,Literally the best thing that I’ve purchased all year! Highly recommend.
1,I really needed a fan to cool off my MacBook while playing my switch on it. My MacBook is a 2015 dinosaur and it heats up like crazy each time I use it as a monitor for my switch. I saw this and well the lights drew me in…I’m upset I spent this much on a cooler fan that doesn’t seem to blow any air at all as well as not even cool my MacBook down. I did get a replacement to see if it would be any better but unfortunately it seems to have just worked the same. Even if you plug in both USBs (I don’t know why this was a thing) the fan still blew….nothing at all. Yes it’s spinning. No it’s not dusty. It’s just…a really bad fan with a dope set of lights to hold up your laptop.
5,It’s been fantastic at keeping my razer laptop cool. I just wish it was more open so the plastic didn’t absorb the heat but it’s also good so it doesn’t damage the fan.
5,Bought this for my gaming computer and works great. My computer fan is louder than the cooling pad and has kept it from getting too hot.
5,My son loves it keeps the PC cool and freed up space on his desk.  Great investment.
5,Awesome laptop cooler it’s perfect for keeping my laptop call when on skype calls and playing CS:GO. Would highly recommend for anyone with a toasty laptop.
2,The Cooler is beautiful. The RGB lights are super fun and compliment my M15 R4 Laptop well. However I have seen ZERO improvements on my computer's temperature. I know this because I constantly have my temperatures up. Unfortunate because it is a really pretty cooler just grateful I got it on sale...
1,I have been using this product for my dell latitude for quite some time it is really cool but only bc it has tht color bar going around all the edges if this device. but it just stops there.. the main features are really disappointing.. ^^” for one.. the main thing its supposed to do is cool down your laptop.. i am using a dell latitude 2n1 with open vents to the cooling for a fan pad like this. but it doesn’t really work because to much air is escaping from the bottom of the fan.. instead of going to the top... ^^” while its a cool toy bc it glows and flashes lights.. its not very practical.. bc the main only thing ppl buy this for to cool down there open bottom pcs.. it doesn’t well enough... i had been using this for maybe an hour.. and i went to feel the back of my pc.. onky to find out.. it still felt close to boiling hot... ^^” i rly wanted to like this more.. i only wish it worked btr.... ^^”
5,works great i have no complaints except that i wish there was a power button on the thing
5,This is one of the nicest looking laptop coolers i’ve ever owned. Totally worth it. I usually connect my TV as a second display and my laptop overheats because of it. This definitely helps with that and it looks amazing.
5,I have a Alienware M15 laptop and it over heats but  cooling fan does it job to keep it cool all the time  A MUST HAVE
1,This is the$78 fan just look inside is just nothing and a small fan and very small electric unit that controls the fan that’s it. I think the cost for this can not even over 5$ and it sells at $70+  Only got a fancy lighting.
5,Been a great item so far... The problem is that these things need to be used a good while before you can really review them.
5,This is an awesome cooler quiet fan many RGB color adjustments.Connected to a USB hub to save laptop USB ports which was purchased on Amazon.
5,Highly recommend this for your laptop! And its perfect for keeping my gaming laptop nice and cool! Buy this you will not regret it!!
5,Best Fan pad I ever had low noice level while still pushing a good amount of air. Perfect for 17 inch laptops.
5,Better than my cheaper one from that I had a few years ago. (make sure to get a cookie dry rack to make air flow better for cooling pad)
5,Perfecto ideal y necesario!
5,Pros: 99% of deviceCons: Size its huge but it’s worth it
5,Well made solid. LEDs are bright and smooth transitioning. Fan is silent. Makes absolutely zero noise. I dislike the dual USB plugs tho bit of a hassle.
5,Quiet under no long term usage
5,love the fan action of keeping my laptop cool the lights work great  it is a very good working  laptop fan cooling system
5,Very good product in the next version try to put USB Port and working more in the rbg after that very perfect I like
5,It definitely helps me keep my laptop nice and cool!
