rating,review
2,Wenn es um Optik geht dann kaufen. Sieht schon gut aus mit der LED Beleuchtung. Geht es jedoch um Kühlung und das sollte ein Lüfter eigentlich können dann kann ich keine Kaufempfehlung aussprechen. Ich kann absolut keine Veränderungen bzw. Kühlung an der PS4 feststellen…
4,Its good for the money temp. drop by 11 celcius deegres
4,冷却性や大径ファンの静音性は申し分ない。ただ、ノートパソコンを傾けて使う場合、もっと緩い傾斜にできると良かった。また、傾けながらノートパソコン本体のキーボードを使う場合、端にあるキーを押すと、アームや本体プラスチックの剛性が低いため押した側が沈み込んだり、スタンド幅が狭く安定性が悪いので反対側が浮き上がったりする。総じてフラットな冷却台としては期待以上なものの、ノートパソコンを傾けて使用するスタンドとしては不満が残る。
5,Cette table de refroidissement fait bien son job. Pour refroidir mon portable gamer MSI 17 pouces qui surchauffe rapidement... avec cette Klime.... fini la surchauffe.... j ai gagné presque 20 degrés sur le processeur..... qui montait tout de même à 85 degrés.... ouf. Je recommande ce produit.
5,Bin mit dem Lüfter extrem zufrieden. Mein Lenovo Legion 5 wurde schon eindeutig Kühler sowie leiser. Der Notebook Kühler selbst ist auch angenehm leise selbst auf der stärksten Einstellung der Lüfter. Würde es eindeutig empfehlen.
5,(KLIM Ultimate)  Anfänglich war ich etwas skeptisch und hatte mir den Lüfter etwas größer vorgestellt aber hat voll den Erwartungen  entsprochen. Der Lüfter läuft superleise leistet aber genug  Zuluft und Kühlung das die Integrierten  Laptopcooler nicht Scheibe spielen wie bei meinem anderen Pad. Die Beleuchtung ist eine nette Spielereifür den der`s mag und ist zum Glück wähl-/ und abschaltbar. Etwas  doof finde ich  die Zuleitung/ Kabelgestaltung ist das Ding weg schaut man in die Röhre. Ebenfalls etwas hakelig empfinde ich den Aufstellmechanismus bei dem man wirklich immer beide Hände benutzen muss. Sonst liegt ein 17" Gerät gut/ satt auf und  der kleine Aufsteller hält das Gerät souverän an seinem Platz. trotz der kleinen Unwägbarkeiten von mir aber einen ganz klare Kaufempfehlung.
5,è praticamente legge sacra l'acquisto di una ventola di raffreddamento quando si ha un notebook di fascia alta.di fatto senza questo prodotto il surriscaldamento sarebbe inevitabile.questa in particolare è fantastica raffredda tantissimo ed è bella da vedere
5,Pc portable qui chauffe en utilisation Mao l appareil permet une bonne évacuation de l air chaud
3,Der Geräuschpegel könnte leiser sein. Ist schon sehr gut hörbar da sich die Frequenz im unteren Bereich deutlich von anderen Lüfter- oder sonstigen Geräuschen abhebt.Das Licht mit den verschiedenen Modi ist supercool. Allerdings kann man außer dem Standlicht nicht wirklich was anderes verwenden da zu verspielt/ablenkend.Ich hab das Produkt behalten weil der Kühler auch als Laptopstand verwendet wird. Und das ist echt geil. Auf dem Tisch oder dem Schoß es geht alles. Dadurch dass immer Luft zwischen Laptopboden und Auflagefläche durch den Ständer kommt wird die Unterfläche des Laptops nicht mehr heiß. Da braucht man auch nicht unbedingt den Lüfter anmachen.Der Lüfter ist "regelbar" macht für mich aber nicht wirklich den Eindruck dass es da groß was einzustellen gibt. Geräusch/Geschwindigkeit des Lüfters werden nur geringfügig verändert.Mir fehlen weiterleitende USB Slots da mindestens ein USB slot vom Laptop verwendet wird und dieser dann wegfällt. Das gibts bei anderen Kühlern und wäre hier auch angebracht. Schade.
5,Der KLIM Ultimate bietet eine sehr gute Kühlleistung und ist dabei angenehm leise.Da ich im Homeoffice oft auf dem Balkon arbeite kann ich bestätigen dass mein Laptop (ein Lenovo Legion) selbst bei Sonneneinstrahlung eine angemessene Temperatur beibehält.Der Kühler passt sehr gut unter mein Laptop und bietet meinem Rechner einen rutschfesten Stand.Einzige Vorraussetzung hierfür ist eine ebene Fläche auf die der KLIM Ultimate stehen kann.Die Beleuchtung lässt sich ebenfalls variabel einstellen und wem es dann doch zu hell ist kann sie auch ohne Probleme deaktivieren.Fazit: Ich bin sehr zufrieden.
3,Bon produit dans l’ensemble
5,Pros: Fan keeps laptop and legs coolerLed choice is great just discovered yesterday that I can hold a particular colour when it is pulsing through the colours which was a great surprise.USB powered was an issue at first but with a recent aquisition of a powered usb port no longer makes me choose between on or the other.Con: Not designed to sit on your lap for a long period of time (for me anyway)Buy this product!
5,Sehr leise und kühlt gut. Ich habe mir vor die Tastatur eine Stoffrolle gelegt damit die Arme nicht kalt werden. Top - das Gerät kann ich weiterempfehlen.
5,This is really good. I’ve been using it for some weeks. It is so quiet that it actually feels like it’s not even there.  It cools my gaming laptop CPU from 60 degrees to about 35 degrees just in few minutes.  Just one small thing.  The level of it when you put your laptop on makes it on a awkward position when you type where it hurt my elbows. Apart from that. I really like this product
5,Das Produkt habe ich seid 1 Tag im Test.Ohne Kühlung ist die Grafikkarte teilweise bis 98 Grad hoch gegangen. Bei Belastung keine Chance unter 90 zu kommen. Seid dieser Kühlung erstmals geschaft auf 70 Grad das ist sehr überzeugend.Max waren 82 Grad höher ging es nicht.Bin froh dieses Geld investiert zu haben.Dazu kommt das der Lüfter des Laptop nicht mehr auf volle Leistung läuft damit ist alles insgesamt leiser.Der Lüfter der Kühlung ist kaum hörbar selbst auf max. eingestellt hört man diesen kaum.Ich kann dieses Produkt bis jetzt nur Empfehlen.Die Zeit wird zeigen wie die Haltbarkeit sich durchsetzt.
5,Le support est vraiment bien il taille nickel pour mon gros GT060. Le gain en température est d'environ 7° ce qui est satisfaisant.Si je devrais lui trouver un défaut c'est qu'on peut voir l'espace entre les leds (mais bon là je chipote pour preuve j'ai mis 5*)Dernier point un gros point positif. J'ai eu besoin de contacter le sav et ils ont fait preuve d'une efficacité redoutable et c'est une qualité qui devient rare. Bravo l'équipe!
5,The media could not be loaded.                                                                               Me ha encantado. Realmente se siente un producto de calidad.He podido comprobar cómo realmente me ha bajado bastante la temperatura tanto de mi pc como de mi ps4 haciendo que vayan mucho mas fluidos (sobretodo en Sevilla casi en Agosto). Se entiende que tampoco es milagroso pero ayuda bastante. Los materiales se ven muy resistentes con algunos componentes de metal. Y encima se ve precioso. Se puede elegir la inclinación en bastantes posiciones y los colores dejando un solo color todos o ninguno dependiendo de la ocasión al gusto de cada uno y eligiendo también el ritmo del parpadeo y la velocidad del ventilador.La recomiendo para largas sesiones jugando en la cama sin quemarte las piernas o simplemente como elemento decorativo. Para la inclinación dispone de un tope que me deja libre precisamente el puerto jack para auriculares.Tras 4 horas de uso intensivo estoy mas que satisfecho con la compra. No lo veo caro para lo que ofrece y me estoy planteando comprar otro para dejarlo puesto en la ps4
3,Gerät funktioniert kühlt und ist relativ leise hat leider bei meinem Laptop (razer 15 Advanced) keinen kühlwert Laptop ist immer noch gleich warm wie vorher
5,An sich sehr gut!Die Farben sind schön und einstellbar.Wenn man es auf Max hat und es ein bisschen doof steht dann hört man deutlich den Lüfter quitschen bzw rattern. Ist jetzt nicht zu störend aber fällt in einem ruhigen Raum auf.Habe es Aufgemacht und die Magnetspule ein bisschen modifiziert. Daher läuft er extrem ruhig.Auch die Lüfterblätter habe ich mit kleinen lamellen bestückt (Luftbrechen und umwucht rausgenommen. Jetzt läuft er Perfekt.Das habe ich nur als Bastelhobby getan und es ist kein Muss. Erfüllt auf jedenfall seinen Zweck!(Bilder zeigen noch den Originalzustand)Gut weiter zu empfehlen!
5,A pesar de haber devuelto este producto no era lo que buscaba en en cuanto a tamaño no puedo decir nada malo sobre ella. Muy silenciosa cumple perfectamente con su función y si tienes un portátil grande deberías tener en cuenta esta base.En mi caso mi portátil es pequeño de 133 y me parecía demasiado grande y aparatosa pero aún así recomendaría su compra para portátiles de más de 15 pulgadas. Además el sistema de inclinación q incluye permite poner el portátil en diferentes posiciones lo cual puede ser un punto a favor si lo vas a dejar  en un sitio fijo.
5,Purchased for a MacBook Air that was suffering from heat throttling on the processor not ha lad a single issue since. Relatively quiet and easy to setup and use. Even has flashy lights if thats your thing.
5,Veramente ottimo prodotto io ho un nitro 5  gforce 1050ti  i5 scaldava troppo in game  ma con la ventola sento proprio a livello di superficie del PC la diversa temperatura  raffredda davvero  un pochino costosa ma se non volete bruciare un notebook  sono spesi bene .
4,El producto cumple muy bien con las expectativas propuestas la verdad que es bastante completo en general ofrece un buen nivel de ventilación el punto de luz rgb es bastante llamativo y tiene distintos niveles en grados de elevación la única crítica constructiva que le pongo esque los apoyos digamos las gomas que hacen de soporte para que no resbale debido al movimiento son mejorables si tuviera más agarre le daría 5 estrellas sin duda por lo demás una buena compra y la recomiendo.
5,Excellent cools perfectly and well built. Thanks Klim!!
5,Kühlt ca 10Grad mehr runter als ohne ! Ich finds super
2,Non ho avuto la possibilità di verificare se realmente abbassa le temperature. Appena utilizzato ho notato che è molto scomodo per la mano se volete utilizzare la combinazione di Gioco  W A S D. Troppo alto anche nella posizione più bassa consentita o addirittura senza regolare alcuna altezza. Scomodo davvero
5,Acheter pour mon petit fils il a installé il est content niveau refroidissement et bruit rien à redire très bon achat
5,The media could not be loaded.                                                                               Ich benutze dieses Prachtstück beim Auflegen um das Macbook vernünftig zu kühlen.Stabiles Design stabiler halt sieht cool aus der Lüfter kaum hörbar wenn ein Notebook drauf ist. Farbmodi machen Laune und sehen cool aus :) siehe Video.Höhenverstellbar die Raster rasten gut ein da wackelt nichts. Gutes Eigengewicht fliegt einem also nicht gleich um die Ohren. Mir gefällt die Qualität. Auch wenn der Preis zu Anfang abschreckend war bin ich nun überzeugt dass ich nichts besseres hätte bekommen können. In dem Video seht ihr ein 17 Zoll Macbook um die Grössenverhältnisse mal einzusortieren.Von mir ein Daumen hoch bin gespannt auf weitere Produkte dieser Firma!
5,when led lights are on fan slows down very slightly. over all the cooler does reduce my laptop temperature
5,The sturdy built the size of the fan and the ability to do what it needs to achieve.  The light rgb combination is great too.
5,Super leise sehr stabil und Wärme gehört der Vergangenheit an. Kann ich nur weiterempfehlen!
2,The media could not be loaded.                                                                                           Das kühl Pad macht an sich einen guten Eindruck aber leider gehen die RGB Beleuchtung nicht daher wird es zurück geschickt echt schade
4,Die LED Beleuchtung lässt sich mit verschiedenen Varianten auf Knopfdruck an der hinteren Seite einstellen.Der Kühlkörper braucht einen USB für die Stromzufuhr klar warum aber kein anderen USB-Port dafür angebracht ist das Frage ich mich schon denn dadurch habe ich nur einen USB-Port für meinen Lap-top Anschluss "verloren".Kühlkörper hat verschiedene Höhen einstellbar. Die kleinste Höhe stellt das Notebook aber dennoch viel zu quer auf was nicht unbedingt der förderlich für die Handgelenke ist und sich auch dementsprechend anfühlt.
5,My laptop went down 10 to 15 on max fan speed. Fits AWESOME on a 17.3 Asus Rog Strix 3. Noise level it's okay. Can be louder to make the fan go faster. Material looks good but endings a little tiny bit cheap... But it's overall more than okay for the price paid. RGB doesn't add any special value at all... Consumes energy that can go to fan speed or even 2 more small fans... Overall happy.9/10
5,Das Gerät ist schnell angekommen und das Kühlen funktioniert ohne Probleme.Mein HP Omen 15 Laptop fängt sehr schnell an sehr heiß zu werden und dank dem Kühler laufen auch leistungsstarke Programme/Spiele nicht auf ~95° C sondern nur bis zu 70-80° C.Leider gab es bei meinem Gerät einen kleinen Fehler bei der Beleuchtung. Als ich diesen beim KLIM-Support gemeldet habe wurde mir äußerst schnell geholfen und innerhalb von 1-2 Tagen ein Gutscheincode für ein neues Gratis-Gerät zugeschickt.Insgesamt bin ich sehr zufrieden und kann das Produkt definitiv weiter empfehlen!
1,Horrible aunque ya se que estas bases no hacen nada para enfriar (solo levantan tu portatil y enfrian la tapa de abajo nomas) esta base es particularmente mala solo es apoyar la muñeca y se mueve escribes y la pantalla tiembla porque la base se anda moviendo.Si quereis algo que refrigere pillad una klim mistral o un IETS gt300 o gt500 (blowers con sellado de aire lo cual si ayuda a las temperaturas)Estas cosas solo sirven para levantar el portatil y que la parte de abajo no se recaliente pero no te va a mejorar la ventilacion interna.
5,The media could not be loaded.
5,Mon pc portable arrêter pas de s éteindre a cause de la surchauffe grâce a ce produit il ne le fait plus dutout et le ventilateur ne fait pas de bruit . Franchement je suis très content de cette achat de qualité allez y les yeux fermés
1,Ich kann für diesen Lüfter keine Kaufempfehlung aussprechen das Teil ist riesig! somit unförmig die LED's können noch nicht Mal alle Farben wiedergeben die angegeben sind (TÜRKIS GEHT NICHT 😕) der Lüfter ist extrem laut das ganze Ding klappert und rasselt als würde es bald den Geist aufgeben und kühlen tut es auch nicht ich habe das Gefühl das es die Luft nach unten hin absaugt aber nicht das es lüftet ( also Luft ausstößt).Somit 1 Stern mehr nicht.
5,Perfect timing in deliveryThe fan is really reliable and helps the laptops barely use their own cooling system
4,The LED lights are very nice the adjustable height is also very useful for different situations.The cooling however is a little on the weak side. Since this only has 1 big fan compared to the normal 4 fan version I find the fan not as efficient.However does its job well and my laptop is cooling well.The Lights add so much character to it!
5,Als Gaming Laptop Kühlung optimalKühlt gut und ist leise sowie es beschrieben ist
3,Ich habe einen MSi 173“ Laptop auf dem Kühler stehen. Für grafische Bearbeitungen und Konstruktionen habe ich mir dann zusätzlich dieses Coolingpad gekauft da je nach Anwendung der Laptop sehr warm wird.Als ich das Gerät angeschlossen habe merkte ich das sich der Ventilator in die falsche Richtung drehte (Luftstrom ging nach unten nicht nach oben) einfach die Kabel getauscht und fertig war die Kiste. Seit dem läuft sie ohne Probleme ist relativ leise und ist ein guter Zusatz für den Laptop.Standfuß ist easy verstellbar und stabil (es wackelt nichts). Beleuchtung kann man zum Glück ausschalten da sie schon nach relativ kurzer Zeit einfach stört mich zumindest.Ein Stern ist abzuziehen durch die falsche Verkabelung.Sonst ist die Verarbeitung Top👌🏻
5,Sehr leise! Und passt für mein Laptop 17 Zoll.Gern wieder!
3,Franchement pas trop déçu du produit (Klim rgb) sur niveau  efficacité ça va au lieu de 75 degré sur overwatch je tourne à 60 ce qui est pas négligeable les 2 seuls soucis c’est que pour moi le ventilateur Pourrais tourner un peu plus vite pour le rendre plus efficace  Et le deuxième problème c’est niveau support lorsque le support est incliné au maximum la petite languette a quelque difficulté A maintenir le pcMise à jour: ça a finalement fini en retour le ventilateur perdait en efficacité a cause des fortes chaleurs
5,The Amazon review asked me to put a # out of 5 star rating on warmth to which I gave it a 1. I hope this does not give it a negative rating. Maybe Amazon thinks it’s a coat or something. It keeps my laptop very cool while looking very sleek. I highly recommend this product. Good value and functionality perfect for gaming notebooks.
5,This would be great for any laptop/gaming set up.. The fan works really well and its so silent!! The led colour effects are really cool and 7 different modes to choose from.. I currently have this for my ps4 to sit on in my gaming set up with other lights and i have to say it looks great!!
5,Use just 3 days work good
4,光るところに惹かれて買いました！！光り方のパターンも色々変えられて綺麗です。風量最大でも全然気にならないくらい風の音は静かです(・∀・)傾き加減も変えられるし、USBを挿せばすぐ使えるので。機械音痴な私でも設定なく使えて良かったです！！
1,I wanted to get a laptop stand for my razer advanced edition 2021 and decided to choose this laptop stand. Boy was that a terrible decision. Delivery was late (I have amazon prime btw) by 2 days.When I got it all was fine. Basic box basic packaging. I used it for a day or 2 and just found it was so flimsy. The stand would just flex and move down if you were to put pressure on it. The lights are cool but just not fluid at all. They just looked awkwardly slow and had rough transitions as the lights lit up around the stand.The buttons on the back felt like they were going to fall out when I pressed them and the single cooling fan done literally nothing. If anything I think this stand made my laptop run the same if anything operate at hotter temps.I do not recommend this stand what so ever if you actually want good for your laptop. I am probably just going to get the razer chroma stand v2 off the razer website for an extra 40 or so euro.
1,Kühlung ungenügend.Billiges Material.Nicht ergonomisch.Zu teuer.Wurde zurück geschickt.
5,Acheté pour refroidir un DELL Precision 7730 I9 - NVidia Quadro Pro P3200 machine qui vous tient chaud en hiver et qui a tendance à être très bruyante quand ses réacteurs se mettent en route pour la refroidir.Le bruit est assourdissant raison pour laquelle j'ai opté pour ce support refroidissant.Ce support offre le service désiré les réacteurs ne se mettent plus jamais en route (plus aucun risque de décollage du PC ^^ ).A conseiller donc.
5,Ich bin begeistert.
5,Le produit qui m'a été livré était défectueux (problème de bruit du ventilateur). j'ai était tout de suite était pris en charge par le service client de Klim et ai eu un suivi du service à chaque étape que ce soit lors de l'envoie du produit de remplacement de la réception et assurance satisfaction du produit de remplacement.Encore Merci !
4,Mais la double prise USB est un handicap si l'on ne dispose pas d'un HUB USB.
4,Tengo il mio Laptop in posizione fissa vedi foto; inoltre utilizzo una tastiera e un mouse wireless e monitor e casse con sub. Ho smontato parte della base del Laptop perché si raffreddasse meglio ma la ventola girava spesso al massimo generando un fastidioso fruscio. La  Base di Raffreddamento è piuttosto silenziosa ed è positivo che si possa regolare. La luce RGB con tutte le sue varianti è carina. Speriamo che duri!!!
5,Excellent produit! Mon ordinateur n'est pas complètement froid mais l'article fait très bien son travail :)
5,Alles
2,The only good thing about this cooler is that its fairly sturdy and the LED lights but thats all. The fan is flimsy and there isn't much difference between the lowest and fastest speeds.
5,easy to fit and up and running in mins
4,Sehr leise und kühlt gut! Sie hätten jedoch die Drehzahl des Lüfters höher stellen können da es ohnehin ziemlich leise ist und man für gewöhnlich Noise Cancelling Kopfhörer verwendet hört man absolut gar nichts auch bei Belastung des Rechners.
3,Zunächst das positive: Das Gerät ist stylisch ergonomisch anpassbar die Lautstärke des Lüfters akzeptabel selbst bei maxmimaler Drehzahl und die RGB Effekte machen etwas her.Das Gerät hat bei meinem 16" macbook Pro jedoch 0 Effekt auf die CPU und GPU Temperatur; mein Programm zur Anzeige der internen Lüfterdrehzahl und CPU/GPU Temperatur (XRG) zeigt keinerlei Veränderung. Zusätzlich: Die Unterseite des Macbooks fühlt sich subjektiv und ohne Messung genauso heiss an wie ohne die Belüftung.Schade aber das Gerät muss leider zurück.
4,Si buscas una base con ventilador bonita pocas más funcionales que esta vasa encontrar. Se adapta a todo tipo de portátil (hasta 17 pulgadas) tiene varias configuraciones de luz (que no puedes apagar siempre están encendidas) y es muy fácil y simple de usar. Rebaja bastante la temperatura en CPUs que sufren y apenas hace ruido.
3,The stand is robust has a number of height settings and feels premium. If you like RGB lights you will certainly enjoy. The cooling ability of this particular model however is pathetic. Its an expensive stand. I sent it back and got the KLIM cyclone model which is a much better product for cooling but not quite as well built (not too far off).
5,Ok....
5,finally got a fan that cools my laptop down. tried all kinds of things to cool my acer predator as it was getting really hot. can now play COD all day long with everything running at full speed with no over heating issues at all If you have the same problems then this fan is well worth the extra money.
4,Il pacco è arrivato presentato con la scatola del prodotto nemmeno imbustato ma credo sia una pecca di amazon questa che non ho gradito. Il prodotto è di ottima fattura leggero silenzioso e design accattivante. Da rivedere la rigidità della base (rete metallica) con un po di pressione in più entra in conflitto con la ventola.
3,Works nicely as a stand. I usually have the fan switched off as it makes a low rumbling kind of noise when turned on. Other reviews mentioned it as "near silent" so I guess I may have a bad unit or the fan noise just bothers me more than most people.
1,PER L'ENNESIMA VOLTA LA KLIM MI DELUDE!ECCITATO DALL'IDEA DI AVERE UNA VENTOLA NUOVA PER IL MIO PORTATILE DA GAMING MI RENDO CONTO INVECE DI AVERE SOLO 2 LED FUNZIONANTI LA VENTOLA NON GIRA LE MIE PORTE USB FUNZIONANO PERFETTAMENTE.ORA LE COSE SONO DUE O IL PACCO HA RICEVUTO DEI DANNI (0 IMBALLO ESTERNO MI è STATA RECAPITATA SOLO LA SCATOLA CONTENENTE IL PRODOTTO) OPPURE LA KLIM HA GONFIATO I PREZZI PER DARE UNA QUALITà SCADENTERESO AVVIATO ED è LA SECONDA VENTOLA CHE RIMANDO INDIETRO E VOGLIO EVITARE DI MANDARE INDIETRO LA TERZA QUINDI CAMBIO MARCA ADDIO
4,In poche parole:Esteticamente stupendo il  mio portatile 173" ci va a pennello forse una sola  ventola mi sembra deboluccia per raffreddare tutto il computer quando è veramente caldo. Nel complesso bello da vedere e sopratutto MOLTO STABILE. Materiali con una qualità abbastanza buona  soddisfatto dell'acquisto Ripeto il punto di forza è la stabilità  e l'effetto led la ventola fa il suo lavoro non vi aspettate un vortice perché cmq è molto silenzioso!
4,Ha cumplido con mis deseos. No hace ningún ruido. Cuando envié un correo preguntando tres o cuatro cosas respecto a su conexión con una fuente de alimentación diferente al ordenador me contestaron inmediatamente y de forma positiva.Posiblemente para mi gusto y necesidades no me hacía falta las luces pero es fácil las conectaré cuando lo crea necesario. Comprobado que el portátil no se calienta demasiado.
5,PS4初期型に使用しています。気に入ったこと・出力最大でいつも使用しているのですが接地面が冷える冷える!冷蔵庫から出したサラダくらい冷えています!何に使っても効果は抜群だと思います！気に入らなかったこと・特には無いのですが音は少ししますね。普段ゲームは音を出してやるので図書館でゲームする人にはうるさいと感じるかもしれません。ヘッドホンやイヤホン等つければ全く聞こえませんしテレビから音を出してやる人も集中しない時にならないでしょう。
5,Absolutely brilliant Product. Such a beautiful elegant design. The fan is so quiet you cannot hear it. The different Colour lights are very good. If you don't want the lights on you can  turn that feature off and keep the fan on.Such a slick design. I will definitely be getting more
5,Keeps my large gaming laptop nicely chilled. Yes it may make a bit of noise but I always have my headset on.
5,Okay so to confess i actually returned this item because it wasn't exactly what I needed. HOWEVER I actually loved it. It us best for desk gaming and not really lap gaming which was why I returned it. Shame really cus the colours were great and so was the fan very cool underneath.
1,Mi dispiace ma questo coso non fa l'unica cosa per cui l'ho comprato: RAFFREDDARE è peggio di tutti quelli che ho provato. Funzionano meglio i cosi cinesi da 20€
5,Product is definitely worth a buy ! Cools laptop well on performance mode! Not noisy and nice ambient lighting !
