rating,review
5,This thing is fantastic.  I recently purchased an MSI Rainbow6 Raider series laptop and noticed that after a little while of gaming the internal fans would spin up LOUD.  The MSI Center Hardware Monitor would clock the fan speeds ~6000rpm with CPU/GPU temps both around 80*C.This stand dropped my GPU temps by ~20*C.  No noticeable change in the CPU while gaming but the laptop doesn't feel warm to the touch anymore.PROS:* QUIET - i can only hear it when I'm really listening for it.* Ergonomic - can be used on desktop or on lap and really helps elevate the monitor height to comfortable levels.  Also not a pain to use on lap both sitting 'normally' or cross-legged.  I like that the height settings are done with a single bar underneath and multiple notches in the base to hold it instead of two flimsy legs.* Lights - you can turn them off!!!  You can also change them to different colours and patterns which I don't care about.  I'm just happy I can turn off the lights.* COOL operator - even when gaming the air shooting out of the vents on the sides and rear of my laptop is body temp at warmest.  When not gaming it's not icy but it does make my lap a bit chilly.  Wild.CONS:* It's plastic.  ABS plastic but still plastic.  my least-fave material but something i was willing to live with for the sake of the other features.  The stand bar is metal but everything else is ABS.  That does keep the weight down though.* No on/off toggle switch.  If it's plugged into your laptop it's running.  You can turn down the fan speed (dunno why it's quiet on full spin) but you can't turn if off without unplugging things.* No passthru USB ports.  For the price of this unit that surprised me.  Not a deal-breaker for me but may be bad for others.* Size - can fit up to a 17.3" monitor which is great.  Will NOT fit inside a bag intended for a 15.6" laptop though.
5,My laptop dropped 30 degrees in a matter of minutes! Color scheme is fancy though I have no use for it. Only drawback - It takes 2 USB connections to run the fan and the lights. Very pleased with it.
5,Great for gaming and has many options highly recommend if ur reading comments!
5,Using this on my DELL XPS 15. I've been hearing that some people dont find this effective in cooling their laptop and I want to clear up some things. I live in Seattle and recently we hit 120 degrees and this thing worked great. Just a reminder that plugging this in your laptop will actually heat it up so try to plug it to an outlet or as you can see in my picture I have it plugged into my Anker 26800. If you want to cool your laptop just try not to have so much USB plugged into it - well thats one tip.There aren't a lot of cooling pads with a fan this huge ( 200mm) and I'd rather have that than several small ones.The RGB surround is very unique as well which initially was my reason in picking it.It comes with 2 usb plugs to power it because the manufacturer said older laptops cant power it with just 1 but if your laptop is fairly new it should be fine. But like I said try to power this from an outlet or a portable charger. If you dont like the three headed cable they gave you you can buy a normal two headed 12v dc to usb cable for about $7.I'm about to buy a 2nd one of this for my new XPS 17 and I don't regret it. However if you dont like this one two other models I would have considered are the KLIM Halo (125mm fans) and KLIM Nova.If you work from home and stare at your screen all day the extra lift from Nova and Ultimate have the highest lift. Some of these cooling pads have short 2 inch legs that don't really do anything - and they're flimsy. Look at the legs of KLIM Halo for example.All in all this is a good cooling pad. It's slim enough for travel once its folded (unlike some thicc cooling pads like KLIM Airflow) the RGB surround is an awesome and unique feature. The fan is huge at 200mm. And its good for working too since the legs stand up a good 8 inches so you're not always straining your neck looking down. But you don't have to put it this high. At the lowest laid flat its 2 inches. 3 inches on the lowest lift - which is my default setting.If there's anything I want improved on this I say 1) a normal dc to usb cable 2) a bigger AND faster fan. But really folks I haven't seen a cooling pad with a bigger fan so goodluck.And for those wishing this had extra USB ports - it's good that it doesn't. Because when you plug anything to that port the power of the fan can decrease and in addition heat up the main power source. Both bad conditions if you're thinking of plugging this directly to your laptop.Anyway I don't review products much but I protect the things that enable me to work and make a living. This thing saved my life in 120 degree temperature for several unexpected days. It really stepped up to the challenge and I hope this review helps you out.
4,This is the second Klim laptop pad I have owned. I had my first one for four years. That one had a noisy fan since it came out of the box that could be almost muted depending on the angle I set my laptop at. This pad however is utterly silent. And I don't have to turn the dial up all the way to get adequate airflow. Like one of the other reviewers I also play Final Fantasy 14 on my laptop an HP Envy x360 which is not designated for gaming but runs it just fine. This new pad has a better design overall and keeps my laptop nice and cool while I'm running any combination of FFXIV Chrome Discord and iTunes. The only thing I don't like is that the included USB cord is too long and gets tangled up with my charging cord or stuck under the stand if I lift and move it. But I'll keep buying Klim cooling pads as long as I game on a laptop.
5,nice one
5,I bought this because my laptop gets super hot when running ESO at the graphics settings I prefer. It works fantastic and it's comfortable to use on my lap as well. Love it!
4,The cables for it are very short and easy to break. I can do without the fan it helps my laptop breath by putting my laptop in an elevated position.
5,So there's two reasons why you're buying this: it's pretty and it's functional.And my god is it pretty.  You know how they often doctor up photos to make them brighter than they actually are?  This doesn't it's beautiful.  Whether daytime or night the colors are bold vibrant and make any laptop far more amazing.  I have an HP Omen 15 Studio and this has a lot of space to spare.  What's nice about a 15" laptop is that the entire computer is flushed with the ventilation system but you could easily get a 17" on here and both items will perfectly align in size guaranteed nothing will hang off.I like the stand system.  If I'm playing a video game I don't want a computer overheating and the amount of space below the laptop is extremely useful.  I have a rear vent on my laptop and the hot air just rises straight up and out.  I would be playing both Final Fantasy 14 and 15 on 4k settings and being so hot that it burned my fingers now it doesn't.Which brings me to substance.  My computer went from burning your skin hot to warm and that's a massive difference when it comes to electronics.  I would take a stroll around the open world and my computer's temperature started getting very concerning.  Now I'll occasionally feel the laptop and it won't be anywhere near that.I do concur that it's a little annoying that all the buttons are in the back.  Realistically you're not going to turn the entire machine around you're going to reach your fingers back until it feels like it could be a button or dial.  Fortunately only one dial for fan speed so you know which one you're touching.  There's also a click in the dial when the fan is off so you know which way you're turning it.Also it really is whisper quiet.  I can't tell when the fan is on unless I double-check and click the switch.I did worry about it being one single fan albeit a large one but I'm impressed how cool my laptop has become and I can't argue with the results.  If it was a pretty RGB light with no real strenght this review would be all 1s.Hopes for 2021 Model:  put the buttons on the side maybe try for USB-C because I don't use the 2nd USB port as auxilary power (1 USB 3.0 is perfectly fine to power the entire deal so I do my best to tuck away that ugly 2nd cord hanging there) and throw on two USB-C ports (in and out) right on the machine as a hub.  USB-C really is the future and now that you've got a solid old-school USB there's no reason why you can't sell a USB-C version.
5,It's a good laptop fan for around 2 years. Afterwards it doesn't keep my laptop cool and it disconnects randomly. I recommend if you don't use it for gaming. Anything intense like gaming editing and streaming will make it basically useless. It doesn't reach to the important parts of the laptop either.Get this if you're not using it for anything crazy. It will last you at least two years. Unfortunately it just isn't for my lifestyle. I'm looking to buy a new one now.
4,The KLIM Ultimate provided moderate cooling improvements to my MSI gaming laptop.I think your results will depend heavily on the chassis design of your laptop specifically how much of the bottom of the laptop has venting.For instance my laptop not only has vent cut-outs for each fan but also over most of the heat pipes. So the system benefits more from the KLIM Ultimate because the air it pushes flows directly on the heat pipes further helping to remove heat from the system.In my testing I saw at most a 3-4C improvement while playing my games.Also the fan operates nearly silently and cannot be heard at all at max speed once the laptop is placed on top of it. My internal laptop fans are louder than the KLIM Ultimate.I also wanted to quickly comment on the buttons and rgb lighting. There are 2 buttons on the back of the device that control color of the lighting and one that controls the light pattern (rainbow solid flashing off). And everything works just fine!My only gripe with the lighting is I wish they had a button or dial to adjust the brightness. These things are BRIGHT in a dark room so a lot of the time I opt to turn them off at night to prevent eye strain. Certainly not a deal breaker by any means though!Ultimately I think the price of this device is high for what you get. But the device so far has worked flawlessly and it seems like other customers like myself are happy with it too. I opted to spend money on this better-reviewed device over cheaper alternatives and that is a choice you will have to weigh too.
4,This fan stand does what I need it to do and in style! You can barely hear the fan running (I’m using it with a GU501 so it’s exponentially more quiet than my obnoxiously loud laptop internal fans) and the RGB features is the icing on the cake!An unnecessary and overly opinionated suggestion: the only thing this fan needs is an on/off switch. Yes I could just plug it into my laptop I know. But if you’re like me and already have a cluster of cables on your desk with no free USB ports (just use a usb hub dude I know but no my desk is already a cable nightmare…I can’t be the only one…) you have to draw its power elsewhere to help control the chaos of cables. Aside from my personal life choices with arguably too many peripherals connected and Asus’s decision to not include an ethernet port (sigh…) forcing me to use a usb-to-ethernet adapter if I want a hardwired connection….this fan is still worth buying.
4,A few drawbacks but overall I'm happy with it. I have two complaints which are height adjustments and missing RGB colors.The lowest height is too much of an incline for typing comfortably. When putting the pad in a flat position it's rather uncomfortable to type compared to having simply my laptop on the desk. I wish for more adjustment flexibility rather than simply having the 4 preset levels.In regards to the RGB modes violet yellow and aqua are missing in the solid or fixed option. It's in the other modes like fading and flashing. Why not include it along with the other colors?I lied there's another issue and that the bounce effect this has when typing on it. The screen on a '21 G15 Zephyrus will move around like you're sitting in a 4.5 magnitude earthquake.
5,I don’t often write reviews only when a product is special and is deserving of the time. This is one of those times. This fan made me feel a thousand times better about using my new gaming laptop. The built in fans were not cutting it and the bottom of the laptop was extremely hot to the touch. The PC cost over $3000 with the ram and SSD upgrades I purchased for it and the idea of at best possibly ruining my battery eventually to at worst frying my mother board or CPU was terrifying. So I was on the hunt for a laptop cooling fan. I researched a few different options but after looking carefully and reading several reviews I decided to give this a shot. The grate is a nice feeling metal and the cooling pad itself is light but extremely sturdy. It doesn’t feel cheap despite the plastic build for the rest of the parts. The RGB is beautiful and it is big enough for my big 17” QHD laptop. I tested my computer using all ultra settings (with my fancy RTX3070) and the computers bottom was COOL to the touch. It was so hot before it hurt my hand on the hottest parts of the lap top. The fan is much more silent than I imagined even on the highest setting. The adjustable height bottom is perfect for getting the right ergonomics as I sit on the floor when I’m gaming due to the low table in the living room so my hands don’t hurt at all while playing. This machine was worth every dollar and not only that but the creators of the cooling pad even left a hilarious note about how it’s packaged before it arrives to you. No spoilers you will have to by one yourself but let’s just say it gave me a good laugh and made the product feel premium like it is. 100% satisfied. I heard their customer service is amazing too but I wouldn’t know because it worked perfectly directly out the box.
5,I was having the start of heat issues with my laptop. I researched several laptop fans and this one was near the top of the list for the price I was willing to pay. The fan is super quiet (and I have even checked to make sure it's working). I don't care for the crazy lights and luckily there is a mode of no lights..Not sure about traveling with it but will see when the time arrives.
5,I have my MSI GP66 Leopard 11UH on this cooler and it definitely brings down the temperature!After contacting KLIM Customer Support I found out that the 2 USBs on this cooler are for the purpose of incase just one USB port not providing enough power to the cooler so the 2nd one could be plugged in to provide enough power! I've only needed to use one USB though.Easy to clean with a hand vacuum or can of compressed air.The colors are pretty neat too!
3,Ok well. I bought my first gaming laptop and I read things that discussed GPU temperatures. I found this laptop cooling stand on Amazon and decided to purchase it. Well first the stand is very nice. It’s adjustable and also very sturdy. Your laptop is safe on this stand and it does make things easier. Also the RGB lighting looks nice and it’s fun to watch while gaming. So in that respect I would give this stand 5 stars. However unless I’m doing something wrong it has ZERO effect on the cooling of the GPU or CPU. I have a Legion 7 laptop and the temps are the same with or without the stand. The fan on this stand is more of a gimmick I guess not sure. I’m also new to gaming so if I’m doing something wrong I’ll change my review. I’m running at about 68 degrees centigrade WITH OR WITHOUT this stand. I didn’t return it because I actually like the stand. Also it appears that 68 degrees centigrade isn’t bad from what I’ve read so no worries I guess. I gave this stand 3 stars which might be a bit too generous since the cooling feature doesn’t do anything. Anyway that’s it. Great item for a stand. Poor for cooling.
4,This is massive. Far too big for a 15.6” laptop. Only get this if you are a non mobile user with a full size laptop. It cools very well. It takes two USB ports and the rgb is alright. Not great not terrible… 3.6 on that. The klim pro is a better alternative if you need a smaller more efficient cpu cooler.
4,I did a lot of research on laptop cooling stands and finally settled on the KLIM Ultimate. My ultimate reason for this decision was having a single large fan and the ability to adjust the angle. I suspected that some of the competing stands with multiple fans had to be louder. Since I use my MacBook Pro as part of my Zoom conferencing set up with highly sensitive condenser microphones it was very important that the cooler stand was quiet. As any recording musician can tell you microphones hear EVERY sound in the house! The KLIM Ultimate is very quiet: barely noticeable during Zoom meetings. The fan does keep the surface of the laptop chilly. However I also cleaned out the dust inside my Mac and replaced the thermal paste so it's difficult to know how much the improved performance (complete lack of thermal throttling MUCH faster processing times for CPU intensive things like iMovie video exports etc.) is due to the KLIM Ultimate and how much is due to fixing my Mac. I don't use the lights at all but it's fun to know they're there. The size is perfect for a 15-inch MacBook Pro and I REALLY like the adjustable tilt not only for desk use but also for the lap or watching movies in bed. Only complaint: I'm not sure what the hell I'm supposed to do with the dual USB power cable; where is that extra male USB supposed to plug in? I would understand if it was a female USB so you could plug another device into it. This just gets in the way. But it is nice that the power cable is detachable from the cooler stand unlike some stands that have it dangling on it all the time. I also like that the stand has rubber feet so it sits securely on a desk. So far happy with the KLIM Ultimate.
4,Pretty quiet I dont hear it over my OMEN fan and the lights are a nice touch.
4,i don't care about the lighting so unplugged it internally.  i'm getting a 'fan malfunction' error on laptop starting though it only occasionally runs hot on its own. so when my laptop is running hot i get this cooler out and plug it in.  so far no special issues noted on pulling down the computer battery as i plug this cooler into a computer usb port.  the fan so far is entirely dependable and definitely makes a difference and it is quiet.  issue:  I REALLY wish there was a non-clunky way to clip the cooler to the laptop to hold it in place; i use the laptop usually not sitting on a hard level surface.  that isn't a particular fault of this product but all such cooler pads i have looked at.  I wish there was an industrial-grade or milspec cooler pad.oh well i like this product ok and it does the job.ps  the supplied power cord with this unit has a small coaxial plug into the unit-- WHY not use a small standard usb  plug like so much else?  at the other end of the cord are two usb A plugs not one.  found in a review somewhere that this is so one can power the cooler from two usb sockets simultaneously if one usb cannot deliver the needed power. (each usb would  have to be separately rated for current capacity)  I measured the current draw at 0.24-0.26 amps (recall I unhooked the lights)  so this shouldn't be a problem.
4,I've a 17-inch laptop not "ruggedized" but with some heft certainly more than a smaller one or tablet. I'm no gamer and am told that I touch-type like Vladimir Horowitz. Indeed set at the lowest angle on a firm wooden desk surface this cooling pad bounces. To be fair some may prefer that condition but my first such product was an NZXT Cryo LX that I'd still use if its rubber components hadn't mystifyingly deteriorated.All else appears functional it's certainly quiet and the rim colors are pretty if not distracting. Time will tell of its durability and effectiveness. I have the accompanying USB cable plugged into a desktop outlet instead of the laptop proper. I'll also explore and report on the potential for using a suitable US5VDC-AC adapter and cord plug as I'd done with the Klim Cool + metal laptop cooler fan.
4,My one issue is that it doesn't have a fan speed adjustment. No biggie. Other than that it works great.
4,As a laptop cooling stand the Pad is quite effective. The built-in fan moves a fair amount of air and the large mesh screen inset provides your laptop with plenty of area to feed the intakes of its internal fans. The lighting is quite bright and provides a dramatic backdrop. The only real negative is the cord that comes with the unit. It is a USB to power-pin cord and has two inline USB connections. The user manual does not do anything to explain that the cord has two USB connections because early PCs had low-power USB ports and therefore need both USBs plugged in to provide enough power to run the lights and fan. Additionally the cord is very very short (about two feet) which means you are limited as to where the pad can be plugged in; if you already have a wired mouse gaming keypad and USB wired headset connected you probably don't have an available port to connect the pad and have to hope the cord will reach an auxiliary USB port on one of your peripherals. The one thing I would love to see changed is either including a (much) longer cord or changing the power port on the pad to use one of the USB plug form factors so we can buy our own cable to suit our needs. A nice alternate would be an actual wall-power adapter since the pad cannot be controlled over USB anyway.
4,Product was great . Only problem I have is  I wish they would be more detailed in there product. I’m running a omen i7 17.3 screen and coming in at a hefty weight of 11.3 pounds ..... that being said you can get the stand up to two notches and that’s it. Any higher and that bad boy will fall off . Not really a deal breaker but should be mentioned in the description . I’m very satisfied with this product as it doubles as a fan and a stand!  Really does help cool my hefty gaming machine . So if you have a big lap top like me just know it will support the weight but will not rise all the way up due to the weight and the stand not being able to hold the lap top. Other then that it’s an amazing product and highly recommended! Doesn’t feel cheap and the lights are nice to!  But it would be nice in the future to have a big boy version so we could tilt our laptops  more to!!! We wanna look cool to and we’ll it would help with posture etc.  please make it happen!
3,Thought the big fan would of really pushed some air out.  Wish I had read reviews first.  Its nice but definately could use a different fan.  I bought for gaming and noise I really don't care how loud it gets if it cooling it down.  Just seems like the fan is underpowered or something or blade design on it isn't very good.  If u want cooling I'd suggest one with more fans.
5,This cooling pad works very well. My MacBook Pro was getting hot and that is a problem. After placing my laptop on the cooling pad and using my laptop for over an hour the bottom of the laptop was almost but not quite room temperature.  This is a tremendous improvement that will prolong the life of my (expensive) laptop.  The fan is quiet and moves as much or more air than more expensive devices. The ability to change the angle is convenient. The little tab that keeps the laptop from sliding off of it is nice. Personally I don't have any use for the LED variable color lights around the edges but they are there and that is okay. I was going to get another cheap cooling pad but wow I am glad I bought this one. You can spend a $200-$400+ for cooling pads but why? This one works and it works well.
3,Overpriced and underpowered for what it is. At max speed air flow is too low.
5,I'll admit I was skeptical about buying this cooler. At first I thought it was just pretty lights and overpriced and that the multi fan ones that go faster and move more air would do a better job at cooling my new rig. I was bored on a Sunday browsing amazon and I had a birthday gift card burning a hole in my pocket so I figured what the heck; I'll give it a try. I bought two other coolers as well to compare. The vacuum one and one of the multi-fan ones that moves 15 more btu's or whatever than this one claimed to. This one beat them all and it looks stunning. The LED is so bright it even outshines my GE66 Raider which is if you've seen it up close: super bright and flashy. I posted temps from both my cpu and gpu and I'm honestly amazed it got that cool. The other models I would put my hand up to just to see if they were on and blowing air and it was hard to tell. With this one I was holding it for a minute and had to put it down because my hand was getting numb from how cold it was. Definitely would recommend esp  if you've got a gaming rig you're trying to keep alive a little longer
