rating,review
5,very silent cools my face sometimes as well good angles lots of LED display options
5,Works great on my Predator Triton 500. Perfect size and the light features are awesome.
5,My son loves this for his laptop.
4,The fan is very weak as in don't do its main job as a cooler fan is very low speed
5,i got this for my husband for an anniversary gift and he loves it! it’s durable and light weight. much quieter than the laptop fan itself. he really likes that it matches his light set up for his MSI gaming laptop too!
5,The media could not be loaded.                                                                                 Bought one similar for my bother a few months ago and he loved it. Since I got a new laptop due to my old one over heating. This is great I love the lights fan is minimal noise and is good for a 16” laptop. I’ve tried gaming yesterday and it’s great my laptop hasn’t overheated. Super comfortable to work with and easy to work it. Would recommend it!!I’ve had this a few months now and although I’m not a big gamer I am a secretary and sometimes I have to bring my work home. I’m usually on my laptop over five hours and the fan keeps my laptop cool. Still no noise from it and the lights work great. Speed of the fan is low to high and no noise. All the people that have seen my work space always ask me where I bought it and if it’s good for gaming. Honestly my brother was at my house for a few months and didn’t have his so he used mine and he loved it. Like I said before I had previously gotten him one and he still uses it every day. Its almost a year that I got that one my bother has and continues to work great. This one is working as it did the first day I took it out the box. And I do have it in a spot where I do nails everyday so dust does get on it but it’s a fighter and works with no problems.
4,This cooling pad is certainly one of the best looking ones you can get. It has these various different height levels that you can adjust to your liking which is great. However the cooling pad doesn't really cool my gaming laptop so if you have a powerful laptop that produces much heat then don't expect this cooling pad to cool your laptop when gaming or doing tasks that produce much heat. The cooling pad is alright though for when I am not gaming it drop my temps about 2 ° C  which isn't that great considering the price of this cooler. Although customer support helped me out and understood that It wasn't cooling my laptop and gave me a partial refund which was enough to buy another cooler for when I am gaming. However this cooling pad is great if you are looking for something that is slim quiet and good looking.
1,This is considered the "best cooling fan" on the market. Yeah right barely produces any air and my X17 R1 keeps the same temp with or without using this dysfunctional cooling fan. Stay away from thus product unless you want to give your money away. The only good thing about it is its ability to to adjust the level your laptop sits and its cool looking rgb lights and it isn't loud. The cooling aspect SUCKS.
5,This thing works great and is pretty. Works as intended and adds cool rgb lighting to your desk. Also makes the key board easier to use due to it being slanted and different angles that you can set to your comfort level. I would recommend
5,Great product very quiet kept my legion 5 pro laptop cool on heavy load & nice RGB lighting
5,I use this product for gaming and to keep my laptop cool and running.
5,The media could not be loaded.                                                                                 Product works good the only proble was package was opened on arrival an the Amazon delivery man knocked ran from me. 👩🏼‍🔧
5,Love it’s excellent. Yes a bit noisier but it’s not an annoying noisy it’s just more subtle. Phone works excellent it makes a huge difference with your computer temperature I like that it seals the laptop below. The inclinations are awesome and very comfortable this is a high-quality product
5,Great product
5,Really cool I love this product. The fan is quiet you can adjusted from low to high speed.  The led light is awesome you will love it.  There are a few changes in colored light you choose what you like then there is. You can either turn off fan while use the light on or turn the light off and leave the the fan is on.The bottom of the stand has four levels it's cool.
1,Looks cool but the power of the fan won't move a single sheet of paper. It's disappointing considering the reviews
5,Good
5,The media could not be loaded.                                                                                             I like how it looks at night!!!
4,The product itself is great; low noise level serves it's purpose of cooling and I love the little lip on the edge to hold the laptop in place but the cable it comes with is ridiculously short. It's literally like 1 foot long. I don't know anyone who sits within a foot's distance of the outlet but I had to buy separate one in order to actually get any use out of the product.  Would recommend only if you buy another DC-USB cable for it.
5,Color adjustment fan speed adjustment height adjustment. Solid design and products used. However the only dislike is the lack of usb of any kind or type c thunderbolt SDor micro SD PORTS available for the extensive over 80 dollar price tag. The extras that came in the box for the product info and such were classy like a formal invite to something.
5,Work great
5,Love it!!
5,This KLIM Ultimate laptop cooler is very cool!  I love the good-mood inticing lights and my laptop is actually staying cool and I hear NOTHING from the fan; a wise investment....  (I also bought KLIM's chroma wireless keyboard and with those backlit sci-fi beautiful colors it's like I'm all set up now to blast off in space...excellent quality from KLIM!  (and honestly no I don't work for KLIM but I have a big mouth for reviews and I like to give reviews as honestly as I can bad or good)).CA MacKinnonMontreal Quebec Canada
5,I wasn’t sure if I would like this cooling pad the others I’ve tried haven’t done much and have been very loud. You can hardly hear the fan on this! The angle is great and my posture is much better while gaming. The lights are pretty too- but overall I’m happiest with the functionality. It’s also the only cooler I’ve had that has made such a big difference in the temperature of my laptop after a few hours of gaming. Highly recommend!
5,Mon PC chauffe ses derniers temps et le KLIM Ultimate  rempli parfaitement sa mission.Design sympa  très peu brillant et Klim est une marque de qualité je ne suis pas déçus.seul petit truc c'est qu'on reçoit un câble d'alimentation avec de connecteur USB mâle et nul par t j'ai eu l'explication.Est ce qu'il faut impérativement utiliser 2 port USB pour connecter le KLIM Ultimate si quelqu'un à la réponse merci.
4,Rafraichisseur efficace et silencieux. Je ne suis pas trop fan des LEDs mais c'est un + pour ceux qui aiment ça.Attention néanmoins à l'utilisation en mode incliné : c'est pratique et réglable mais sur la plupart des modèles de PCs l'écran vibrera lorsque vous tapez sur le clavier. Perso ça me gêne j'ai stabilisé mon écran avec un pied posé sur le bureau en complément.
4,It’s fits relatively small for my Alienware M17 R2... the fans is working but it’s not that strong to actually cool the laptop when your using the system extremely hard... it’s only useful if you have smaller laptop and the only cool thing about it it’s RGB... they should release a larger cooling pad that can accommodate bigger laptops such mine
5,As you can see from my pictures; Aesthetically it's absulutely amazing and mesmorising to watch and enjoy. In terms of build and design they haven't missed a thing. My laptop is oversized as it's a gaming / development laptop so alot larger than most and fits beautifully.The clip at the front that ensures your laptop doesn't fall off is brilliant. I wouldn't have even thought of that! Bravo.The service is second to none as it arrived in no time. The packaging is amazing as it's well packed looks professionally presented and the little note inside... Well I'll leave that for you to to read as it really did make me both smile and laugh.My only criticism and it's nothing serious at all is that personally I would have done a "PWM fade" between the LED changes in the multi colour mode so they face into each other rather than "move along" but like I said unimportant... I'm just uber picky.The temp on my laptop whic usually burns at 65+ degrees is down to 48! I KID YOU NOT... I went through buying and using liquid metal cleaning fans everything... This thing is a Godsend...That said.. I'm going onto their amazon now to see what else they have because quality like this is just engineering at its best.Just because you've earned your space in the hall of awesome I've added your stickers to this laptop my PC (MSI) and saving the others for my next....
5,Solid cooling fan/platform. The lighting function is a bit distracting so I don’t use it but it looks cool when on! My laptop is running considerably cooler. If this pad doesn’t fix your heat issues don’t blame the pad clean out your dusty ass laptop and re-paste your processors!Also silent on the highest fan speed if anybody was wondering.I would suggest using a separate keyboard when using this thing more ergonomic as it raises your laptop up a bit
5,Absolutely perfect! Fits my 17" Asus Strix without it overhanging and the fold up lip keeps it in place. The large fan draws a lot of air and is relatively quiet considering the size. I definitely recommend it it's a great bang for the buck!
1,Don't waste your money on this heap of plastic ****. It barely cools down anything the fan is not powerful enough to do anything. If you like RGB tacky lighting then you will love this but if you want something that will help your investment cool look elsewhere. This is a knockoff of a more expensive brand but it can't even imitate a proper cooling pad properly. Keep your money and but a different brand.
5,Excellent Cooler for any PC laptop as it keep my Monster quite cool my laptop is a 9th gen I7 an 64 Gigs of Memory Gamers i guess which i don't game but becomes a Furnace  until i got this one from KLIM  Love the light show but can rarely use as  when it is on my Dog Howls an whines and wants to chase it for some reason when  alone is Great light show the harder you work your machine the better it looks also VERY QUIET operation and keeps the furnace into a Freezer mode Couldn't ask for anything better you will not go Wrong buying it!
5,Great laptop cooler. Good and decent quality. The LED light is a fun feature I turn off its light most of the time as I see no use of it. This cooler is Very very quiet it is turned to highest speed and my studio condenser microphone does not pick up any of its noise from about 1.5 metre away. My ears is about 90cm away and I cannot hear it's noise. I ended up have put my hand under my laptop to feel the breezes to confirm it's actually running.Well done Klim
3,In terms of gaming or even just streaming it made no difference looking at that temperature stats. It's fine for a regular cooling pad though but definitely not good enough for gaming or streaming.
5,Almost fit my Dell Inspirion gaming laptop. Just have to align it further forward in line with the front horizontal edge without using the cooling pad stopper latch. Easy to switch between light modes. After a week of usage I just kept it in fixed mode instead of cycle. Although it has only one big fan it is sufficient to keep my laptop cool while gaming. You do not need to plug in both usb connectors if both lights and fan are working. Should have specify that in the description. Yeah I wasted money on usb hub because I thought both usb connectors need to be plugged in. And no those two connectors don't powerup lights and fan individually. Any one will work.
5,Muy buen producto. Excelente. Entraba el ventilador de mi lap y antes se tardaba una eternidad en enfriar el equipo y se alentaba  ahora dura poco el ventilador de la lap y si broncas lo único digamos medio malo fue que en amazon no había detalles del envío y en donde estaba pero llegó mucho antes del tiempo programado y en excelentes condiciones. Altamente recomendado valió la pena la espera.
5,Après un mois d'utilisation je suis toujours aussi satisfait.D'ailleurs j'ai moins mal au cou maintenant que l'écran est plus élevé.Par contre petit côté négatif à noter.  Si vous utilisez la caméra et que vous tappez en même temps ça fait bouger la caméra.  Donc si comme moi vous passez vos journée en conférence Zoom ça pourrait vous agacer mais sans plus.
5,Llego en muy buen tiempo haciendo el pago de envió urgente.. el producto venia en super bien empacado en su caja y instrucciones y algunos stickers en lo estético no hace nada de ruido y quedo perfecto el tamaño para mi laptop15.6" el rgb esta muy chulo con varios modos y colores... funcionalmente mientras juego si mantiene la temp del CPU unos 7 a 8 grados menos de lo que usualmente estaba de 99 - 98 grados C a 91 - 89 grados C
5,I bought this for my gaming laptop which turns into a furnace when I'm actively gaming. It's been able to keep my laptop cool and is very aesthetically pleasing. The brightness and colours are perfect. My partner was so impressed that I ended up having to buy a second one and we're both very happy with this product.
5,El ventilador de computadora o más bien enfriador portatil de laptop es una maravilla. si enfria no hace ruido las luces se ven muy chidas. No se arrepentirán porque parece mucho dinero por un ventilador pero estás comprando calidad la calidad cuesta.
5,This is my second laptop cooler. My first was a cheap finicky thing where one of the two fans broke the day I received it. This is so much better it’s bigger and easier to put together and take down the fan is huge and does so much work to cool the laptop and makes minimal sound which is great. The price was great for such a sturdy product that works really well. Also I love the flashing rainbow colours. Would recommend
5,The only issue I have is that it uses one (and maybe two) USB port on the laptop to power the KLIM.  Fortunately I have an old USB charger that I could use instead and that give enough power.
4,I use my laptop for virtualization with several machines working simultaneously so it tends to get hot. While using this fan meant a significant reduction of heat I was expecting this to be a little bit more powerful. The noise is easy to ignore the build quality is just right and the lights are really nice.
5,Works great!  I think this is the best one that I have purchased thus far.  The colorful LEDs are pretty spectacular as well.
5,Very impressive cooling pad. Customer service is very good due to the fact that I had an LED defect in the first shipment and I was able to get a immediate replacement for free.I recommend this .
4,For the amount of fan noise you would think it was super powerful airflow but not really. Well constructed.  Lights are super bright.
5,this fan is very quiet and lightweight! much better than those brandless knock offs! the light is customizable for static colors like white or disable it completely for low profile desk setups. highly recommended!!
5,It is 100 perfect for laptops that are hot a lot this cooling pad is like a table for your laptop you cant hear it but you can feel the cool air coming from it i wouldn't buy any other cooling pad
5,For those who are considering KLIM™ Airflow or other multi-fan cooling pad.KLIM™ Ultimate is actually silent at low speed. KLIM™ Airflow isn't. It was driving me nuts.
5,It's nice and I love the colours
1,the look and feel of the product is good but sadly my Laptop keeps heating up even with the fan on full speed.Yes I have checked and no its not my laptop. It is because of the stand :(
5,Nice quality
5,Super bien por el precio la recomiendo
4,Nous utilisons ce produit pour diminuer la chaleur d’un laptop de gamer et ça fonction très bien et en plus c’est cool avec les lumières intégrées
5,great for a gaming laptop
5,I bought because of the many positive reviews and thankfully those reviews are real. Lights look bright and fan is not noisy. Love it!
5,El material se ve de buena calidad feliz con la compra
5,I needed to cool my laptop down. It was heating to 61 degrees C. The cooling pad done it's job perfectly.
5,Good product as expected. Delivery also is very fast. Thank you.
5,It works well
5,Great stuff. Not noisy and working properly.
5,Works amazing for me was able to lower 10c for my cpu temperature
5,Quality and standards are awesome
5,Bought this for a second time. Amazing product.
5,Excelente
5,Very bright and does the job
5,Happy with my purchase
5,Nice product
5,great fan really helps cool down my gaming laptop. comfortable to use.
3,It’s basically just a fan. What could go wrong… for that reason I think a cheaper option would be better. The fan is pretty silent the rgb leaves some things to be desired but whatever I suppose. Conclusion… buy a cheaper option
5,Der Laptop Kühler erfüllt wirklich alle Erwartungen.Er kühlt hervorragend auch meinen iPad Pro der bei einem Zeichnen Programm sehr stark erhitzt.Er ist angenehm leise  leicht und trotzdem stabil.Schade ist nur daß er dafür konzipiert ist waagrecht verwendet zu werden also für ein Laptop.Die Stützen an der Unterseite erlauben nur ein waagrechtes hinstellen.Toll wäre wenn er auch Stützen an der Unterseite hätte mit denen man den Kühler senkrechtstellen könnte um mit einem iPad senkrecht arbeiten zu können.Trotzdem 5 Sterne und sehr empfehlenswert!Nett und witzig ist auch der kleine Brief an alle Käufer und Käuferinnen :).
1,UPDATE: I will leave my unedited review below.  But I wanted to come back and say the company contacted me. I returned this item and bought from a different company. KLIM apologised and offered me a discount code for a future purchase. This did a lot to restore good will. I won’t be afraid to try them again in the future.———ORIGINALNice lights….too bad the fan stopped working less than five minutes in. Not buy from this manufacturer again dang!
5,Cools the gaming laptop brilliantly.Looks amazing with its colour changing leds.
5,J'ai acheté ce produit car je trouvais que mon Mac Book était souvent en surchauffe ces dernières semaines. J'étais un peu perplexe mais au-delà du côté ludique des couleurs qui entourent le refroidisseur c'est très agréable de ne plus entendre mon ordinateur en surchauffe et c'est forcément très rassurant aussi ! Un très bel achat que je recommande.
4,The Klim Cyclone has a sturdy design with no loose parts. This makes it ideal for me to have some parts of the stand over the edge of my small home office desk.The controls are at the back and consists of a colour mode (switch between different colours) light mode (switch between different modes or off) and a fan speed control wheel. The power cable has 2 USB ports only 1 is required. There is unfortunately no additional USB port on the cooler to replace the USB port that it takes.My ambient noise level (with my laptop on) is about 24 dB while with the laptop cooler it reaches about 28-30 dB (measured using a free decibel app). It is definitely audible and due to it have a rotating part (the fan) there is a cyclic pattern to the noise. It is definitely quieter than my laptop fans (when they speed up during gaming etc.). I would recommend not to run the fan constantly at max perhaps at 80% as fans in general do not function well when operated constantly at maximum.The fan does a good job of keeping my laptop cool the height adjustments also assist with that by allowing better airflow. It is important to note that your laptop should have air intakes and preferably intake fans at the bottom of the laptop for laptop coolers to make a difference. Also take note where those intakes are located to purchase the correct layout. My intakes are located from the middle of the laptop and continue to the rear of the laptop.The sturdiness (relative) quietness and decent temperature control makes it ideal for my use case. It is difficult to compare different laptop coolers as most of the manufacturers do no state their noise level or air flow rate. Those metrics will be ideal to compare and make an informative decision.I can only refer you to the Klim website for more information regarding the dimensions or noise levels of their products. Alternatively one could contact the customer support as they are very friendly and supportive.I would definitely recommend trying this (or a similar Klim) product.
5,Love the product!! Although it has plastic build but the quality is good! No noise whatsoever from the fan and you can switch off the rgb lights!!! It’s keeping my ASU’s rog strix laptop quite cool when Iam not using my ac which is great!!! Highly recommended!! I bought it in a sale for around 3.8k so it’s a great buy for me.
5,Bin sehr zufrieden. Ist sehr leise Die Lichterleiste ist schön bunt ;)Kühlleistung ist ok. Lebt halt von der konstanten Leistung.Verstellbare Drehzahlmodi wären toll.Ist ok für das Geld. Obere Schmerzgrenze
5,Bene
5,Mi ha salvato da un estate calda luci perfette eliche giuste. Consigliato.
5,Macht was der kann
5,My laptop is 17 inch - it has AMD Ryzen 9 3900 12 Core CPU / NVIDIA GeForce RTX 2070. It's used mostly for web development graphics (adobe CC) and a bit of warcraft but lately I've wanted to do some video editing on Premierepro and found it was getting too hot and shutting down.I tried cleaning it all out for dust but there wasn't much inside and still afterwards there was a lot of heat especially on the right hand side where I suspected the internal fan either wasn't working or not doing an awful lot.I had an N11 Tecknet cooling pad but it just didn't seem to be blowing out much cool air. So I bought this having watched Tech Tyrial's very helpful review on Youtube. From the comments it looks like he used the Mistral initially (I didn't fancy that because of the noise) but had some probs and moved on to the Klim Ultimate.It's a sturdy cooling pan and has a nice height adjustable feature. The lights are of course a nice bonus. It also arrives very nicely packaged. It plugs into the laptop via USB. It's nice and quiet even on the highest setting.I've had it just a day but I've noticed an immediate improvement. I've been able to run Premiere Pro and happily edit for hours with no shut down. I'm positioning the cooling pad a bit to one side so the big fan is blasting right under the warmest side.I'm using coretemp - temps seem cooler - I'd say about 10 degrees lower roughly - usually it climbs into the high nineties and then shuts out.So so far a great purchase I'm very happy. Obviously I can't comment on durability as I've only just started using it.
3,Ne convient pas esthétiquement au 173" (voir photo avec 173 pouces MSI) ni même aux 17" contrairement à ce qui est suggéré dans l'annonce du constructeur.Esthétiquement conçu pour des PC de 34cm de largeur réelle au max parce que ça correspond à la dimension de la grille.Le ventilateur est réglable en continu avec un dispositif de type potentiomètre mais avec une valeur de rotation minimale plutôt élevée ce que m'a caché le SAV KLIM.On peut éteindre les leds.Sinon ne consomme pas beaucoup 030A en ventilation max et 019 en mini mais sans les leds.Avec les leds et avec la ventilation au max on est à environ à 056A.Niveau bruit on est dans la norme des supports pas trop bruyants mais rien d'exceptionnel.Niveau ventilation c'est un peu light pour les PC qui chauffent beaucoup.Pas mieux fabriqué que les autres marques de supports qui en proposent plus sur les systèmes de commandes qui dans la cas d'espèce sont situées derrière.En conclusions: Bien trop cher pour ce qu'il offre mais serait preneur à ce prix s'il avait 8 cm  de plus (1 vrai support 173") en largeur avec du coup 2 ventilateurs ou un ventilateur de 200 comme le Thermaltake.
5,CONFORME A LA DESCRIPTION ET SILENCIEUX
5,permet le positionnement du portable avec ambiance lumineuse
4,The media could not be loaded.                                                                               Ich habe das Gerät vor drei Tagen bestellt und dauerhaft über 8 Stunden und länger im Betrieb gehabt. Es ist festzustellen dass eigentlich so gut wie kein Geräusch zu hören ist. Der große Ventilator oder Lüfter dreht sich ohne jegliche Abgabe von Schleifen Surren oder irgendeinem Rauschen.Was mir nicht so gut gefällt ist dass es zwei USB Anschlüsse sind die angebracht sind. Aber auch nur bei Verwendung von einem einzigen USB Anschluss funktioniert das Gerät einwandfrei. Auch das Licht funktioniert bei mir wenn man nur ein USB Stecker einsteckt.Friedlich entspannt arbeitet der Kühler im Hintergrund während die Hände ergonomisch auflegen können und man ganz normal sein Gerät nutzen kann. Auch die Temperatur ist auf eine angenehme Arbeitstemperatur herunter gekühlt. Selbst bei anstrengenden und komplexen Rechenleistungen wie zum Beispiel Spiele mit hohen Grafik Anforderungen Oder Multimedia Streaming Sind alle schmerzfreier für den Klapprechner auszuführen.Man hat jetzt einfach nicht mehr das Gefühl dass die Festplatte nur so dahin schmilzt. Die Lichter kann man sogar ganz ausmachen was sehr gut ist wenn man einfach nur schlafen gehen möchte.
