rating,review
5,Great product
5,Excellent
5,actually works
5,Given s a gift. My boyfriend loves it
5,This is a great product. Works well and phone feels secure. Have now used the vent product as the weight of the phone and holder will mess up my cars vents.
5,This is not like the cheaper versions you typically see. I liked the one I bought so much I just purchased two more!!!
2,The mounting pad doesn't stick at all on the dashboard like the instructions stated even after over night application. Otherwise the phone mount holds my phone and has great reach for easy access.  Might return for another that will stick better to my dashboard.The vent clip is too close to the vent and makes my phone hot.
5,Easily viewed and positioned
5,Excelente
5,Great product! Love the extension and the padding for the holder.
4,Ok
5,The holder holds well to my visor. The air vent is to unsteady to hold my phone. I Love it!!
5,Fácil de instalar
1,Because of the design the weight of my phone points the screen down out of vision while I drive. I've tried tightening the joint in question but since it is a ball bearing joint it's designed to be flexible and in this case floppy. I regret not trying it out in time to return. Buyer be warned.
5,Great buy. Very strong and sturdy.
5,The best phone holder..you won't regret it
5,Prompt delivery we are pleased with this product
5,Very good product
5,I liked the product because it was simple to install. And it was also reasonably priced.
5,solid features. versatile orientation - stable and secure -
5,After writing that one of the arms wouldn’t move when I received mine the seller contacted me and refunded my money and also sent me a new one immediately!!  Very impressed!  New one works beautifully!
5,I've had this installed on my dash for a month. I did't even clean the flat plastic surface and it has remained in tact.
5,it's solid unlike others I've tried.  I use the air vent attachment and it tightens down for a great fit.
5,I have the iPhone 11 and it fit perfectly
5,I like the ease of taking it in and off the vents because I drive a different truck every day for work and need to bring my phone with me.
5,Works perfectly in my Explorer holds my phone securely.
4,Really good !
5,Very sturdy! Cool how button releases your phone
5,I love it. It is well-designed and works as advertised.
5,Looks good and functions as described. Used both with the vent clip and mounted on the dash both ways offer enough adjustments to position the phone where needed. The grip is very secure.
2,It worked perfectly for about 24 hours and then the adhesive holding the dash plate in place gave and the whole thing came down mid-drive. It won’t restick I tried removing it from the base and the adhesive on the mount itself won’t stick either. I’d previously had an iOttie car mount and chose this one as a replacement based on the reviews. Big mistake I should have just gotten another iOttie mount and stuck with the brand that had already proven itself.
4,Not bad
5,Muy buena compra. Lo recomiendo.
1,Does not stick to the dash in my daughters Kia sol
5,It is very good quality and very adjustable!
5,Ok
5,Stays mounted very well useful a life saver really
5,it works like its suppose to
5,Easy to install and very sturdy!
5,Very nice product
5,Awesome product! As described sticks well to dashboard with 3m helper!! Must buy!!
5,Works as was indicated and works well!Very happy with product
3,Has to be tightened every other day.Even when it’s tightened the mount is always very loose.
1,Didn't arrive with the vent mount.  Completely useless for what I needed it for.
5,Itás working perfectly untill  now !!
5,Love it. Has the most suction and holding power of any holder I have ever had. Holds my note 10 plus easily and securely.
5,Great item
1,Everything
5,I love this product. I recommend this 100%. It holds the phone steady.  No more falling with bumps from the roads.
5,Works great for my car. I use the vent clip since I don't want the adhesive on my dashboard. Well worth the money.
2,I cannot get it to stick to my dash or suction! The attachment for putting it on the vent is awful! I will be driving and it falls off the vent with my phone! I have tried a million different ways and CANNOT get this thing to work! Up to you if you want to waste your money!
5,I have bought 4 of these this is the best the suction thing works it moves to the perfect position I will be buying one for each of my cars - jeff
5,Very nice for the money! Just as described.
5,This is a quality product. Better than any other mount I’ve tried.
4,Strong. Overall I'd recommend it I just wish the adhesive was better.
2,This thing is a waste of money. The suction cup has no actual suction and if it does it’s not noticeable. The adhesive on the cup is crap as well. I placed it on my dash and window (without my phone in it) and the weight of the shaft was so much that the suction cup came off without me touching it. Please buy something else don’t waste your money.
5,Sturdy and reliable; useful for using Google Maps.
5,Very good phone mount. I really like it.
5,Impressive product - easy to install and use - well made.
5,Best phone mount I have ever had. Its sturdy and very adjustable...
5,Amazing. Works great for my iPhone 11 Pro Max!!
2,The part that can clamp to the vent works really well however the suction cup would fall over and over from the very beginning of me buying it and I kept putting warm to hot water for it to get sticky again per the instructions and it failed over and over. I only kept this item because of the clamp that can be attached to the vent.
5,The girlfriend loves this! She does Lyft and doesn't have a problem like the other ones she's had. It was suppose to be mine
5,Use it in my car to hold cell phone. It's perfect!
5,Buen soporte
5,Will buy again
5,Works perfect!
5,The mount Holds my note10+ in it's case firmly and securely even on rough terrain.
2,Quality and Design of the Cradle itself is very good. However the vent clamps failed after 8 months of use. The foam pads compressed and lost any grab they had.
4,So far so good
5,excellent
5,Love it. Hold great.  Can barely get to the finger scanner on my S9+ but I can so works grear.
5,Happy with product glad that I didn’t have to attach anything to my phone in order for it to hold.
5,Arrived when expected and is an excellent product
5,I bought this product as a gift.  They loved it.  It sticks well and is easy to use
5,Great product now I have 1 for each car!! Highly recommend
5,Good product
5,Buy it...I will buy another one for my wife's car.
5,Had done quite a bit of research to find the right phone holder. Bought this and installed yesterday and we are already in love we bought another for our other car.
5,Haven’t used the suction to the dash or windshield yet. I have used the vent clip & it is amazing. Everything  have been looking for! Great product! Highly recommend & would definitely purchase again!
3,The suction cup is not strong enough. My phone keeps falling off with the stand. Not even lasted a day.
5,Ive been through a lot of phone holders for the car... this is the best! Im buying another for my husbands car too
5,Worth the price and works as it lists in the description.
5,Great addition for my IPhone 11 Max Pro.  First time using a mount I’ve been missing out!  Thanks
4,Great love it!
5,Great product
5,Great product and easy to use!! And it arrived very quickly!! A perfect valentines gift for my hubby!!
5,It doesn’t get tighter enough.
5,The media could not be loaded.                                                                                 It’s good.
5,Love it works perfectly.
5,Very nice and tight grip. Love this!
3,Absolutely perfect for my car🤗🤗
3,Great.
5,I absolutely love this phone mount.  Super easy to put on super versatile.  Can be twisted and adjusted in so many different ways.  Very happy with this product.
5,It is a wonderful cell phone mount! Sturdy and very adjustable for Convenience!
5,So far I've only used the clip on the vent. I have a 2013 Honda CRV. Works great. Ill try the adhesive option this week and update my review :)
5,Got this for my mom. It works well
5,After 3 different types of mounts this is the one i should have gotten first. Easy to use and place
5,This is the best phone holder I have been used. Because you can adjust your phone in 3 ways. And it is very safe
5,Bought for a gift
5,Great product exactly as described
2,The suction on this thing is awesome!!! I live where the potholes outnumber the people and it's STILL stuck to my dash!!! Ordered another for the passenger side.UPDATE**** HOLDER WON'T KEEP SUCTION AFTER REPEAT CLEANING WON'T HOLD PHONE WITHOUT FALLING OFF DASH
5,Best mount I have ever used. Stays in place easy to put the phone in and take it out. Love it!
3,this was a gift
5,This is the third one I’ve bought. They are perfect and fit in more then one spot in vehicles. The suction is great!!
5,The best mount i ever baught ...Definitely recomend this product... may be price seems a little high but you won't regret buying it..
5,It met my expectations. But no more.
5,I went through a number of phone holders before I found one this one that works.Very well made.
5,Hook
5,Lily was great as customer service and product as well
5,Works good no complaints
5,Came as promised. Would do business with again
5,Use this for my phone.
5,Have had several phone holders over the years and this one is by far the best. Two mounting choices and both work great. Recommended to family and friends.
5,Great Product
5,Great product.
5,Great product! Good quality :)
5,Works great and as advertised.  Easy to install.
5,Super easy to install. Works great!
5,Works great on my dash but do not use the clip on your a/c (falls off).
5,Good
2,Lasted less than a month.
5,Great product  n quality.Awesome customer service 💯Quick delivery.
5,This is a very high-quality mount for your iPhone it really sticks the heat Does not affect its durability and effect to stick to your – it’s
5,As the reviews show this is a quality well designed item and works with my Note 10 plus.
5,Its sturdy not too big itll block my view and comfortable to take the phone in and out. A great purchase.
5,Works fine. Great adjustment ways
5,Solid product .
5,So far so good. Finally a decent mount for my 370z which had no place for a phone.
5,Used for several months now mounted on my windshield with a 11 pro max phone.  Great product
5,Great value
5,Works much better than my other.  Use in my Jeep Gladiator!
5,Awesome product!!
5,Like it but only draw back swing around a lot
5,Had issues with the device we received but they have phenomenal customer service and dealt with the issue asap! Thank you!
5,I’m Very happy
5,Stuck to my car dashboard really well.
5,Works perfectly!
5,I’ve gotten ones that doesn’t work so many times and it’s frustrating.... trust me this one is amazing!!
5,Well I had some minor problems... but it was taken care of immediately!  Thank you so much
5,Absolutely great iPhone holder. Very secure.
5,Great product— good company to do business with... would recommend..
5,So far so good. No issues.
5,It is delivered as described. And it has a round tap that can help you attach to curved surface on dashboard.
5,Very sturdy. Nice quality. Can be used in just about any position.
5,I liked this enough i bought another one for another vehicle. it is simple it works well and is at a good price point at the time i bought it.
5,Cost is good great features.
5,Easy set up. Easy to move into countless positions.
5,Cool
5,Works great. Finally found one that’s perfect.
5,I secured it to my dash a few months ago and it has held solid ever since.
1,I had a cheap car mount for my phone I got for like 5 dollars from Marshall’s and figured I would upgrade and get a nicer one since I liked having it so much. Well this was a waste of money. Followed all the directions and the 3m didn’t stick AT ALL and thought maybe it would work with just the suction.. about 5 minutes down the road and it came flying off. Totally unsafe and a WASTE of money. Go get yourself one from Marshall’s and don’t waste your time. Will be returning.
5,Does what my wife needed it to do when she had me order it. Good quality.
5,Super reliable very stable and secure.
2,I bought for my new car but was so excited to try it! I put it in my old car big mistake! Now the adhesive wont stick in my new car. Very disappointing! Stuck good at first unable to reuse after that.
5,Suction power is good. It is little squeaky while moving. It is a good mount.
2,We bought 2 of these when we were moving. One got messed up when we went to switch it from moving truck to car and we had to throw it away.  The other one broke after 2 months using it!Would not reccommend
2,Followed the instructions. Did not stick long. Truly disappointed. Wasted $25.I do not recommend.
5,Love it works perfect!!
5,Love that the suction cup sticks directly on a textured dashboard - per suggestion remove and reattach periodically.
5,its great
5,This is the first one I found that truly holds it place and phone wonderful deal.
5,Product is well made and very adjustable can be mounted on dash windshield or vent
5,Awesome Product!!!
5,Good product
5,This is a SERIOUSLY good car mount
5,I like that it has the button to release the phone secure mounting
5,fits my cell phone great
5,Thanks a bunch!! Quick and speedy shipping and everything looks great! I know my friend will like it! :)
2,It was easy to install. It was used every day for about 1 hour holding an iPhone 12 mini. Suction and adhesion stopped after 8 months. Left a bunch of glue on my windshield. It was a mess to clean off.
5,this holder is amazing. I think the texture of this holder is very good after I take it and it also feels very convenient after a period of time.
5,This is very well built will by another
5,Very easy assembly I like it
5,Great product! Met all my expectations
5,I love it!! Its strong and it hold my phone. Its what i have been looking for. I recoomend this item.
5,Vey well made. Sticks to the window very strong and does not fall off.
5,I like that I can have it mounted on the ac vent. It hold my iPhone 11 Pro just fine.
5,Holds tight solid grasp of my S9+. Very happy with it!
5,Loved it for my sister that I went and bought 3 more
5,Great product simple to install
1,100% the phone holder looks really nice. But the suction legit sucks. I am disappointed in the fact that the suction did not work at all. I bought it for that main reason to use it on my dashboard. I used the little disk provided for the dashboard and It didn’t stick on the dashboard either. I am disappointed that it doesn’t stick to my dashboard and I feel like it was a complete waste of money. I read the reviews and everything. I thought I was well informed. But nope it turned out to be a waste. The air vent holder works fine it’s a bit of a hassle to put on but it’s alright. If you want to use this product for your dashboard **DO NOT WASTE YOUR MONEY!!!
5,easy installation  Firm and reliable ～I think this is the biggest requirement for the phone holder.This product works best at least in all my cell phone holders.
5,Completely worth the money. Works great. Love the dual mounting. Completely satisfied.
5,Very versatile fits my Galaxy 10+ perfectly.  Have recommended it to two friends and they love it as well.
5,Its really stable and will hold my Note10 perfectly.
5,Quality construction
5,I use mine with the vent mount. It stays secure and adjust to fit any phone. It even has a slot cutout for your charger cord.
5,First time ever buying a phone mount and this one by far exceeded my expectations. A must buy!
5,Suction
5,Very nice
5,Just as described
5,Good quality and holds the phone in place.
5,Succion power.
5,Easy to install and really strong.
5,Amazed on how well it holds up.  I will recommend this product to friends and family.
5,Great buy and is much needed
5,Awesome .and a good price
5,Great product
5,PERFECT FOR CAR — GREAT GRIP. — ROTATES —
5,Very happy with VICSEED universal car phone mount. Very sturdy attractive and versatile. Highly recommend it!
5,It worked great for my Lexus NX200t which has very limited areas for phone mounting. The vent clip worked perfectly and didn’t hide anything from view.
1,I had this mounted to my dashboard for several months. It was very easy to install and I had no issues with it. Then I had to move it slightly to the right. It never stuck again.I ended up using duct tape to try and secure it because it kept falling off the dashboard with my phone while I was driving. The adhesion of the suction cup seems to be a one-and-done type of thing so if you purchase this item be aware that you can't mount it more than once
5,work very well
5,Good
5,Product is good no problems
5,It is perfect for my jeep.  I use it for my samsung phone
5,Great range for dashes that are higher and far away and no room on the face of the dash. Love it!
5,Great price
5,Well made product
5,Great product that holds your phone stable
5,Awesome product! Love my phone holder :)
5,Great everyday use
5,Works well. Makes driving less destractful
5,As advertised. Sturdy can’t beat it for price. Better to put on windshield or dash. Heavier phone on a/c went might be too heavy
5,Really liked the adjustable options on the product. Use in personal vehicle.
5,Works perfect and hold my iPhone pro max with Otto case without a problem . Good customer service .
1,broke my vent clip after having it on for only around a week for light use with my iphone 8. Beware of this product. YOU GET WHAT YOU PAY FOR with this device. Suction is middle of the line and so is the adhesion.
5,very durable product
5,I think I finally found the one Inwant after ever
5,I bought this for my wife and she loves it.Works just like it says.
5,Works great.
5,I don't use suction/adhesion. I use the air vent attachment. It works great! Love it!
1,It broke INSTANTLY. It’s was still usable but one of the arms stopped moving immediately after trying to put my phone in it. With a wonky arm the SUPER shallow grips weren’t able to grab my phone at all. This is NOT meant for phones with thick/ sturdy cases AT ALL. My phone has a lifeproof case which proved to be about the max limit for what the car mount could take. When I added a small adhesive wallet to the back of my phone the mount stopped working completely. The arms broke further from me trying to force them closed over my phone. Any time I sped up slowed down or hit a turn my phone would fly off the car mount.
5,Easy to use.
5,Great item!
5,Great
5,Great cell phone mount and now buying another for my son.
5,Fit well on our vertical vents.  Sturdy and will fit pretty much any phone.
5,I finally found one i love. a little bulky but very sturdy and well built for the price
5,Great products it absolutely worth purchasing. Fit my car perfectly. Seller shipped the product fast great communication.
3,Directions are not clear and I had to buy additional parts to make this work.I felt like I was doing surgery!
5,This was very easy to install.
5,Works great.  No problems at all.  It’s secure and easily released.  Would purchase again.
5,If and when this whenever breaks or wears out I will buy another one.
5,Love it easy to install and use.
5,Works for me.  I add the vent clip. Nice to have options.
5,This suctions to my car very well without even needing the sticky pad. I love this.
5,Excelente producto  tamaño perfecto.
5,Me encanto quedo perfecto en mi vehículo.
5,Well made and secure. I love it!
1,It’s to fragile
5,I like this item but it works better with horizontal vents....my thought only.
5,This is the best car phone mount I’ve bought. Stays on the dash and has several swivel options.
5,Easy to assemble  works great for dash
5,Está perfecto y para mi es muy útil
5,Second one purchased. Great quality.
5,Very easy to install
5,Works well
5,This phone holder is perfect. Easy to install and very easy to use.
2,I bought this for my boyfriend and we liked it so much that I got my own. We both loved them until they both broke in the same spot only two weeks after installing them. We unfortunately can only use the vent clip but since they break so easily I will not be getting a new one.
5,Easy to operate and install.
5,Easy installation and secure suction👍🏻
5,So adjustable!  Fits any angle or distance.
5,Loved it
5,Very well designed and holds the phone in place
5,Excellent
5,It seem very strong.
2,I love the design and look of the product however it does not stay on my dashboard.  It is therefore useless.  When I am driving and I have my GPS on I want to see it but it falls off and lands on the floor.
5,Works great one of the best I've purchased.
5,🥰
5,It’s great and easy to use. Love that it has different options
5,Arrived in perfect shape and in time! Use it everyday. Will recommend
5,Trabajar
5,Amazing for the price. Don’t get a really expensive one this one is great
2,I installed on the air vent. No matter how much I tightened the knob it still would come off. Will reinstall using either double stick tape or a coupla dabs of silicone adhesive.
5,El agarre que tiene evita que el teléfono se caiga
2,Unfortunately after one day it stopped sticking to the included dashboard pad. I don't think it can handle the summer heat that the interior of the car  reaches.
5,Don't let negative reviews turn you away this thing is worth the money
5,Love the product use it everyday simple and easy fit to the dashboard.
5,Worked like a charm on my truck window. Easy to install. Strong and durable.
2,This worked great for about a month. Now my phone will not stay in it. Falls out constantly....
3,no matter what I try I cannot mount it to Honda CRV ...tried all kinds of Adhesives
3,I wish it was more wide for people who have credit card holders at the back of their cellphones.
5,Works great. Bought a 2nd for my son. Quality product versatile and definately makes for a safer drive.
1,Wouldn't hold my phone it kept dropping it.  Too late to return it now.
2,Not really a whole lot to say other than I am disappointed by this. I have a phone mount that goes in a cup holder and was hoping to free up the cup holder after buying this one. However it just would not stick to the windshield. I made sure to clean it properly and let it dry before attaching it. However it just kept falling off hours later.
5,Got it on time. Very nice phone holder
5,It's ok
5,Works for me perfectly
5,Happy with the quality so far.
5,What a Great Seller A+ Wonderful Thank You.
5,Simple durable mounts like a stud! Love this phone mount I highly recommend purchasing this!
2,The suction cup does not hold phone in place - I would say it isn’t designed for larger cell phones when you have it extended half or more.
1,Didn’t hold suction to dash and not practical to support the weight of a phone.  Better suited for a desk then a car
1,This does not stay on the dashboard. Falls I don’t like going the hassle of returning things really want to return this because it doesn’t work since it doesn’t stay. It’s fine as long as your phone is not in it which defeatthe purpose.
5,Good solid product
5,I love mine
5,no longer sticks
5,Was very easy to put on dash of car. Love this product.
5,This is a good cell phone holder or use it in the air vent it holds it’s flexible it works
2,Easy to put into place. Does not hold after a day or two no matter how much it is tightened.
5,Love it
5,They’re great and durable
2,Living in Florida temp in car prevents it from sticking to glass or dashboard. My car is 2009 focus and slanted dash makes it difficult also.
1,Product did not stick well to dashboard.  Plastic components poorly made break apart within a week
5,I have had this for several weeks now. The suction has not worn off and it is easy to adjust.
1,Vino incompleto esto no sirve no lo recomiendo 👎
5,Very good quality  several different way to use. Perfect for my car. Recommend.
5,Holds phone at all times...love this
5,Very sturdy and works great in my Ford Edge.
5,Very easy to set up. Suction so far holds in very cold weather.
5,Prop handled well. 5 stars
2,The product does well to extend out BUT the swivel in the end is limited to just about 45 degrees. That limits the versatility of the extension that I was depending on to fit in a crampy dashboard. Returned since it didn't work for me....
5,Excellent piece. Exactly what I wanted/needed. Very satisfied.
3,Nice phone mount with strong hold... just has small phone area so my phone didn't fit in it (iphone xr).. thinking about returning
5,Good suction on dashboard/windshield. Easy to place remove phone.
5,MORE than Fair price for a great little devise.
5,No complaints what so ever. Easy to adjust if needed
5,very good product excellent suction will buy again i have on a iphone 8 plus
5,This product was well worth it!!!
5,Easy to install and durable
5,Works great
5,The most durable and sturdy cell mount I’ve ever used
5,Excellent product
5,Mounted on my skid steer loader front window and doesn't move!
3,This is the second product like this that I purchased and they don’t stay on the car
5,I’d highly recommend.
5,Recomiendo este producto
5,Love this. Worth every penny
5,I clip this item onto the air vent (rather than use suction/adhesion) and it works well
5,Very steady and easy to use.
5,Works great! Very sturdy and able to be moved in different positions.
5,Had issues with first one but company was very rezpinsive and sent me another.
5,Ordered 2.  They work great!
2,Lasted about a month and fell of the dash. Adhesive is terrible and would not stay mounted. Tried to contact manufacturer but website does not work. Do not buy!
2,Suction doesn't stay. Won't hold phone over bumps bc I have it in a (very thin) case so if you have any case at all on your phone this probably won't hold.
