rating,review
5,I've had this product for almost a year and a half and it still works well I have it glued to my windshield and its been there ever since. I live in Texas and we constantly have 100F heat waves and my car stays in the sun constantly I'm so surprised it's been holding on extremely well! it's a great product the little space on the phone holder allows me to charge my phone while I drive. Over all its a great product!
4,Sadly does not hold phones that have pop sockets.  The brackets on the sides are too short.  It’s a design flaw.  All you have to do to make the device compatible with any attachments to the phone is to have the side brackets longer.  So it can hold thicker devices.  Other than it not holding my phone 🤣 it works great with my husbands phone that does not have a pop socket.  The device itself is quality plastic and stays secure to the car.  Has good grip on the phone.
5,First off let me say that I really like this phone holder.  I mounted mine on the windshield & use it every time I drive.  It is very handy and you are able to look ahead and see both your phone & the road and other cars.  It was simple to install and easy to use.  I love mine.As for the Customer Service I was really impressed and greatly appreciative.  You see we live in Central Texas and it is super hot this summer.  As per my picture the 100 degree temps finally took a toll on my suction cup and I watched it melt away day by day and it finally separated and fell down.  I was so sad but I told myself to reach out anyway and explain my situation.  So I wrote to them and told them exactly what had happened and asked them if they sold a replacement suction cup replacement.  They checked on it and approved it and sent me not only just the suction cup but the whole end and all we have to do is replace the end piece clean the windshield really good again and re-apply.  I am debating on waiting until this horrible heat wave is over and the cooler temps are here.Thank you Lily for all of your kind help!
5,I bought this car mount from Vicseed in April 2021. After nearly a year and a half of good use the tightening screw broke.I messaged the Vicseed customer service team on Instagram expecting them to tell me that they can't do anything because it is outside of the 1 year warranty period. To my disbelief they promptly sent me not one and but two replacement screws completely free of charge. The replacement parts arrived at my doorstep within 4 days of sending a message to them which is just phenomenal. Shout out to Zhung Lili from the customer service team.Big brand companies with much higher profit margins than Vicseed should learn a thing or two from them about what good customer service really means.My recommendation: Buy this product without worry you won't regret it.
4,This could have gone 180 degrees the other way but I found the replacement part.  The mount works well enough the locking handle/retaining nut wore out quicker than I thought it would or should.  Without the locking handle the mount is worthless.There is a place here on Amazon that sells the part so I got a couple.  Seriously Vicseed include an extra one or two.
5,First and foremost this is a great product and works well with all our vehicles.  Secondly the company’s customer service is outstanding - I thought I was missing a part (which as it turns out wasn’t missing) and they delivered a new part the next day!
5,Have had this for about a month now and I have to say this is one of the best phone mounts out there suction cups don’t melt holds phone with minimal shaking and very sturdy. HIGHLY RECOMMEND this product.
5,If you have a 2013-2018 RAV4 you know how hard it is to find a phone mount. You can’t just pick one up at the store like everyone else because of the dash and the orientation of the vents.I have purchased another phone mount on Amazon that cost more than this and was only willing to hold a phone as large as an iPhone 8. Once I upgraded to a 12 it just kept falling out.This phone mount is superior to the previous headache I had. This was simple to install and is easy to use and very flexible with whatever size phone you may have.I definitely recommend this phone mount especially for Toyota RAV4 owners.
5,Love this phone mount. I have purchased 3 of them for two of my cars and a work truck. Solid phone holders. It even sticks to the textured dash without falling off.
5,What stands out to me about this product was the customer service from the seller. Very responsive and attentive. I bought 2 of these and returned one. They were more than willingly to make things right. The best part of it all was I wasn't returning it do to any issue with the product. But because they were willingly to make it right with no questions asked? This stands outs as customer service 101.  Make the experience with the customer memorable. I will buy from them just on that bases alone. Oh Btw the product worked wonderfully. The adhesive suction power and mounting system all worked well. I was concerned about it being out in the AZ heat but nope. The suction continues to hold and the adhesive has not come off. Well done!
5,Outstanding customer satisfaction and service.Many variables for mounting due to products flexibility and superior suction even on slightly textured surfaces as opposed to other similar products of this type I have tried very happy with this product.
5,I have bought this for both of my cars and they are still holding great.
5,He decided to use the bracket that attaches to the air vent and has been very happy with it. I'm pleased that he's not sitting his phone in the center console where it use to bang around or trying to hold it while he uses the GPS. It's been a good purchase that has given us both a piece of mind!
4,It was a great help traveling
5,Easy to install and does the job. I've had this mounted for some time now and the adhesion is still holding up. Very easy to maneuver and I'd definitely recommend.
5,My wife drove my car and is now replacing her old mount with this one!  Great product with lots of available mounting options.
5,Been using this product for more than a year and I could say that this is a great product been using it most of the time.I would recommend to follow the advise of the seller to remove the product if the temperature is high(so not to loss the grip of the suction cup) and if not using it or if traveling just use the vent phone holder instead to prolong the lifespan of the suction cup.based on experience I made this mistake and reach out the product seller/customer service.The best part is the seller/ customer service is so kind and easy to reach out and solve my issues with my vicseed dash phone holder. Highly recommended!!!
5,Holds to surface great holds device in place
5,Me encanta es el mejor que a podido comprar después de gastar mucho en varios que no me sirvieron por fin encontré uno que si vale la pena😊
5,The mounting system can either be used with the included flat disc to mount the suction cup or you can mount with just the suction cup as the cup has a thick lining glue that is more than enough to hold the holder as well as any cellphone you mount.Our cellphone holder was mounted upside down on the windshield an even holds up in direct summer sunlight.
5,I needed a part replaced. I texed Vicseed and was responded to immediately and the part was sent to me 2 days later free of charge. Lily Cheung Rocks!
5,Wife and I have large phones.  I have a Pixel 6 Pro and she has an S22 Ultra.  This mounted stable and holds both phones with ease.  It has a lot of different mounting option and articulation so there was no problem setting it up to work with either phone.Only complaint is the sun visor doesn't fit with this installed but that would is not fault of the mount and would happen with any mount attached to the window.
5,Para mantener mi teléfono listo para cuando uso la navegación GPS.
5,El producto para mi es ideal. No tuve ningun problema adaptandolo a mi auto. Nunca se cayo y es ajustable.  Sin dudas un excelente producto!
4,I bought this to install in my sedan so that I may stream music (and skip songs safely) without having to look down for the buttons on my phone. The holder works great! It supports any phone from the bottom and the width is adjustable to secure your device. The only flaw is that the volume button on my phone is partially covered by the side grips however I have simply lifted my phone a bit higher in the cradle and all works well.After transferring the holder to a differ6 dedan I ran into difficulty with the adhesive suction cup becoming too damaged to function. I emailed the company and they worked quickly to help me replace/reuse parts I would need.I highly recommend this product and company.
5,After about a year of successful use the back screw sheared off from the holder. I wrote to customer service and they sent me a whole new unit within a few days free of charge!! Great customer service.
4,Good items
4,This is a well-made product that has great stability when installed according to the package directions. I installed it on my dashboard in my Subaru Ascent and it’s extremely stable and holds my phone with no problem. I needed a phone mount with a longer arm due to having an SUV that by nature has a deeper dashboard. My only real complaint regarding this product is that it would be nice if there was a way once installed to change the angle of rotation by tightening and loosening something. The way that the product exists currently once it is in place whatever angle it extends out to is where it stays forever. You can shorten or lengthen the extension arm as well as change the height of the holder up or down but you cannot change which direction it comes off the anchored adhesive circle. Overall great product though and I actually just bought a second one for my best friend.
5,Had a retired GS8+ and needed a phone to display digital data from my new outboard motor. But the console was already packed and there was just a small area to land a suction-cup mount at the back but then needed a long reach forward. Bought this particular mount because it has lots of adjustable reach and looked fairly rugged.I've had the mount installed for nearly a month now and been blasting around up to WOT (~49mph) and the mount has never moved a bit. Two thumbs up!
5,I purchased this product for a road trip in my RV. I plan to purchase two more for my personal vehicles. Suction is powerful and held my phone in place during the trip. Wide enough to hold my iPhone 13 max with a phone case.  Pleased with my purchase. Highly recommended!
5,I love this! It keeps my phone in place and really durable. I got another for my daughter.
5,I am very pleased with the car phone mount. I have tried multiple car phone mounts and this seems to be the best one yet. I have only used the air vent mount so far but it is very strong and study and working well. I also love the squeeze grip and release button. Very handy.
4,It did take a couple of mounts before I found this one. I do carry a larger phone with a pretty durable case around it and one of the issues I have had with other mounts I tried was they just couldn't hold the phone well or would detach completely from wherever I had it mounted in the car with even slight bumps in the road. I will say that the suction works best on the windshield which is perfect for me since I like my phone mounted in the left corner of windshield behind the steering wheel. Although it does stick pretty well to other surfaces in the vehicle.I have only had the mount itself detach once when the inside temperature of the car was well above 100 degrees on an unusually hot day. I have never had an issue since.My one issue and this is very nuanced is that because I have a case on my phone when I go to plug in a USB cable and then place the phone in the mount it does not fit perfectly with the case/USB combo. This may be in large part due the fact that my phone case does have a dust protector over the USB charging port that hangs from the bottom of the case when a USB cable is plugged in. However if they would just make a small adjustment bottom of the mount (since many decent phone cases do have charging port covers) that would accommodate phone cases with or without charging port covers it would make for an almost perfect phone mount.
4,I mounted this on the passenger window of my 1969 M35A2 Deuce and a Half.  Works perfect.  I can not think of a better vehicle to test this mount in.  If you have ever had the privilege of riding in a deuce you know just how bumpy the ride is!  There is a very sticky adhesive on the back of the suction cup.  Go SLOWLY removing it from your window as it is VERY sticky stuff BUT it is removable.  If removed I would suggest doing so when the vehicle windshield is not hot as it may cause the adhesive to remove itself from the looks of other's reviews.  The arm is extendable and overall it provides plenty of adjustment.  I have a Samsung S21 in mine.  Works great!
5,I absolutely love this product. I did not use the suction holder but instead screwed the holder into my air conditioner vent. I was convinced it would not stay but it did. I’m an Uber driver and it has stayed put over  speed bumps curves u turns etc. holds my iPhone 12 with a phone cover over it. Highly recommend
5,Don’t waste your time. I have one and that thing is secure. It sticks to my window even in the heat waves. It adjust to size weight  and you can rotate to whatever angle you need. I ordered one for my aunt who has a sad clip in her vent the clip version of this is just as solid! She loves it!
5,I purchased this and mine ended up breaking. I contacted customer service and they sent out a new one.  I have been using this for about 6 months and love it. It's so convenient to have your phone available.
5,I highly recommended to buy this product!
4,Arms aren’t big enough to hold a mophie charger.
5,I like everything
4,I like the system and it held my phone very good but the screw knob to tighten the swivel cracked because they use plastic.Edited on 12-10-2010So I reached out to the company and shared my issues with them. They immediately sent out the parts to make the repair. I followed up with another email stating that I had another issue with the suction cup once again they immediately sent out parts to repair. First problem was a broken knob. This issue can be from the user over tightening the knob. The second issue was the suction cup. It had NO problems sticking to my window for a full 6 months the issue was removing it!  It was so strong I had to use 2 hands to pry it off. To be honest my truck is in the sun a lot and I have never removed the product from my windshield. What seems to have happened was that months of Texas heat possibly made the rubber break down a little and made it stick even more. There is NO damage to window and the product as it sits with the new suction cups still works just very sticky.This is a robust product that I have put through some rough conditions. So I give the product 4 stars but the support and response a big 5 stars.
5,All of my previous experiences with car mounts involved things falling off.  I've had various Garmins with Garmin mounts and they always fell off (whether from the windshield or a disc).  It got to the point that I would leave my GPS plugged in constantly while using it so that if it fell in floorboard while I was driving I could pull it up with one hand using the power cord.  It did that a lot.  Inevitably while I was driving in very heavy crazy traffic with an exit coming up in under a mile.  So that's what I have to compare this mount to.This mount came with a disc to put on my dashboard but I didn't want to pry off the old Garmin disc.  I was afraid that would damage my dashboard since the thing has been there for 12 years or so.  I considered stacking the discs but thought I should try the new mount on the old disc first.  The mount just barely fits on my old Garmin disc.  The disc that it came with is slightly bigger.  But it did fit. Just have to be really careful to get it lined up since the fit is so close.  And it does NOT fall off.  Honestly I can't even pry it off.  I have to get my husband to pull it off when I want to remove it and it takes him a minute or two to get it off.I've had this for two months now.  It's had a decent amount of city and country driving and it's been on one roadtrip so far.  Lots of bumpy roads and such.  And it never once fell.  That's all I really wanted.  Was something to not fall.It fits my iPhone SE well.  Because of the case I have it is difficult to insert the plug into phone in while it is in the mount so I just plug it in before I stick it in the mount.  I like how adjustable it is.  I was able to position it to where it was comfortable for me very easily.  The air vents in my car would not take air vent clips and those were too low for me to see easily.  This one is perfect.The one thing I can't speak to is how meltable it may be.  It spent most of the hot days at the end of summer in the garage.  Not a lot of chances for it to melt the gel.For what I wanted though this is great.  It just barely fits on the pre-existing Garmin disc and it doesn't fall.  It's never dropped my phone.  It was a good purchase.
5,REALLY easy to put together! I used the air conditioning holder piece to hold my phone and it’s really strong. I like that it has two ways of use
5,The nut that hold the holder to the base broke.  I contacted Vicseed customer service and within 2 days they sent me 2 upgraded nuts.  Thank you very much!  Highly recommended!
4,Occasionally the suction cup would fall in hot temps but works well
4,Adhesive to my dashboard mount wore out and eventually lost stick. Maybe due to heat. The vent clip chipped off after a while as well. I am now left the suction option. Unfortunately the adhesive between suction and dashboard mount is so strong I can’t  separate without risking further break. Can I have another adhesion slip for the dashboard mount?The product is great and I love it which is why I want to continue using it.
4,After my original review the seller reached out to me to make it right. Suggested a different one and sent to me at no charge.  USPS lost the 1st one so they resent. I am extremely happy with the one they sent me. Its smaller and works great for the RAV4. I greatly appreciate the seller reaching out to me and suggesting the phone holder they did. Great customer service we stayed in constant contact thru out the processHighly recommendBig and bulky; didnt work for Toyota RAV4
5,Nice grip
4,This phone holder works very well. Do not understand why the suction cup has adhesive on it
5,VICSEED Universal Cell Phone Holder for Car Phone Mount Car Phone Holder Dashboard Windshield Air Vent Long Arm Strong Suction Cell Phone Car Mount Fit with iPhone SE 12 Pro Galaxy S21 All Phones Over the years I have tried numerous phone car mount holders numerous!  About 2 years ago I searched through Amazon and rolled the dice on this particular mount made by VICSEED it was well worth the gamble.  The mount came in well packaged and simple instructions.  This mount can be used on the dash window and vent.  I particularly prefer the vent mount holder with any phone mount holder I have purchased.  The major difference that I seen and noticed is the quality it is hands down better quality than any of the phone mounts I have purchased over years.  So satisfied that I quickly ordered another one for my other vehicle.  Attached are pictures of the VICSEED Universal Mount (first 4) compared to one of the mounts I have purchased in the past (last photo).  The VICSEED Universal Mount securely holds my phone in place no matter if I hit a bump or any form of driving.  The other mount in park doesn’t stay in place and will completely fall off the vent leaving my phone in the floor.  I personally have a large phone in which (Note 20 Ultra)  in the picture is my son’s Phone note 9 and the VICSEED holds up amazingly it also has a quick release for when you want to release your phone.  Lastly what I noticed is a major difference is the quality of the clamp. Great customer service….one day I accidentally broke the vent clamp I didn’t think about contacting the company at first because it was my fault I just ordered another one.  After receiving my new VICSEED mount (same one) I emailed VICSEED simply to see if I could purchase a new vent clip they responded fairly quick and shipped me a new one (no charge). Awesome product with great customer service!
5,I bought a cell phone holder from Verizon 6 months ago. I was impressed...for a day or two. Fast forward to turning a knob to tighten the sides around the phone and this being such a pain and u could never get it quite right. It even fell out one day while I was driving which was really dangerous. The sides also had foam inserts in them to cushion your phone as it held it. They were both falling out. I actually brought the phone holder inside and was super gluing it and securing it with clamps to dry when it struck me how ridiculous the situation was and how this product was so much more trouble than it was worth.I am getting ready for a road trip and needed something to hold my phone safely so I can use it for phone calls navigation music (and be switching back and forth between all these functions. To be honest for once I didn’t really read a lot about the product or look at the reviews which is wild considering the nightmare my last holder proved to be. I picked this one cuz it was an Amazon Choice and it had almost perfect stars. OMG!!! The button on the side is AMAZING! I just rest my phone on the “shelf” for the bottom and squeeze the sides together and it just stays put. NO KNOB TO TURN!!! But WAIT...it gets BETTER...to release your phone you just push the MAGIC BUTTON!!! WHAAAT??? Who is the genius who came up with that? This seems really well made and I don’t anticipate any unusual wear and tear like I ran into with the piece of crap I had before. There is no foam in here to fall out and I am not worried in the least that my phone will slip out when I’m driving and be sliding around under my feet. I liked it so much straight out of the box that I adhered it to my dash. I have never done that before with anything and didn’t know what to expect. I don’t worry about that coming off either...it’s solid. You know how every once in a while an everyday purchase makes your life infinitely better? This was that purchase for me.
4,e comes with 2 different ways to attach it to the car.  One is using a clip to grab onto one of the vent slats and the other is with a peel-off sticker to adhere to the dash.  I use the clip into the vent since the sticker method isn't recommended to leave in the sun.I like the way it holds the phone and has a button to easily release it but found putting the clip with the ball difficult to fit into the ring section of the arm.  It took several tries with some force but I finally got the ball to snap into place.It holds better than a magnet method.  I am ordering a 2nd one for another family member.
5,Happily replaced my units two years after the fact due to the suction cup failing in the hot Texas heat
5,I like this mount. I use it on my vent. If you have bigger hands you might have a slight issue adjusting this. I would adjust the prongs until it just will slip over the vent because then you will only have to make a few adjustments. (If that makes sense.)Like any other thing that has a suction cup you will need a smooth surface. (Logical would state this.) If you don't think a suction cup from the dollar store will stick to your dashboard more then likely this won't. If you have a plastic console in the middle of the console that feels like plastic this will more then likely work. The fancy coating will not with this suction.Also. Like any other suction cup... it's thin. It will melt in the heat. Plain and simple. Especially in the summer. There really isn't a way around it.I bought three of these. One was for my boyfriend and the other my ex liked and I just gave it to him. (We are amicable.) And my bf is one of those for some reason or the other thinks higher priced things work the best. He had like a 60 buck thing or something and it sucked. He loves this one.
5,Works as intended. Sticks to dash holds phone snugly releases phone quickly and easily.
5,I had bought one back in August of last year and recently I took it off of my dash to put on my wife's dash of her vehicle. She loved it so much I let her keep mine and bought another for me. Absolutely love this product!
4,Well-made holds the phone securely in place and the adhesion to the windshield is extremely strong.  Almost too strong.  I'm not sure if it is the intended design but it cannot be moved (e.g. I wanted to use the holder in another car and couldn't remove it from the windshield).  The only other item I did not like is that the release button (for removing the phone from the holder) is on the left side instead of the right side.  Minor detail but that design makes it a bit awkward for one handed removal (for me anyway).
5,I love this
4,Great mounting system and adhesion while it lasted. Rubber melted off
5,VICSEED Universal Cell Phone Holder was delivered on time. It was easy to install. Phone fits great in it. Sits perfectly on my dashboard.
4,Holds phone in work truck drive a triaxle dump truck so it takes a beating
5,I like it all
3,It suctions good but I have to keep tightening the screws down because phone tugs down on it when I hit some bumps in the road.
