rating,review
3,perfect size and ability to adjust the position. But the screw part comes loose often and I have to keep remounting it. I tightened the piece on the back and it still did the same thing.
5,I love this phone holder! It was super easy to install. The suction cup is very strong and adheres to almost any surface.
4,Good quality
4,Easy to install
4,It seems to stick on the dashboard pretty well.
5,Works as advertised
5,I got this for my daughter. I was surprised how well it was made it seems to be heavy duty like overbuilt. It's solid and was simple to install. She loves it.
5,Popped this on the window with the suction cup. Has adjusters for tightening up every connection. Been over bumps roads and it stays put. Great design and works.
5,Love it!  It’s perfect for my jeep!  I go down a lot of dirt roads it holds up great!!!
4,Looks good. Works better than my other one and sturdy.
5,Stays on windshield. Holds Samsung Note 20 Ultra 5g securely. Great for someone that doesn't have built-in navigation screen on vehicle.
5,Easy to install stays stuck to the windshield opens easily to remove my iphone and holds it in place while driving. Very happy will get one for my wife next.
5,Love that it has many adjustments! Suction cup works but not great on my dash. They do send an adhesive patch if needed.
5,I have been looking for a car phone holder for decades it seems and there is always some reason they don't work...until now. This works great on just about any car dashboard and is built well. It can be tweaked to fit just about any type of space. I am using it on a Kia Soul and it is the first one that has worked for me.
5,I love that the phone holder is so versatile. I attached it to my windshield and it’s still adjustable with the turn of a knob.
5,I will give an update on this one this is the third one I have bought but different name this one seems to hold the phone a lot better then the others I have the xsMax in an Otterbox commuter case so far good 👍🏼I’ll come back after two weeks and give an update
5,looks great really cheap feels expensive. added some spit to the suction cup and hasent knocked off once. didnt need to use the adhesive plate. looks awesome in the e36 holds my phone perfectly
5,I didn't expect this to stick well to the curved dash of my Nissan Titan but I wanted to try one anyway.I was wrong. This thing has worked way better than I thought it would. No loss of suction in more than a month  rock solid where I adjust it to but easy to adjust.I don't use the vent option so can't comment on that.Very good value for the price highly recommend.
5,It easily comes off but it worked another way so I guess it’s okay
1,I put one in a the windshield of a new car. I live in CA and it's not that hot (used to live in AZ and NV). A few week later I scheduled to have the windshield replace. When  I went to remove the holder the suctions cup had turned soft and very tacky. It's a total waste now. Good for 1 time install?
5,This was absolutely perfect for my vehicle. The suction cup was made of a soft rubber that even stuck to my textured dash. I was amazed. Install took literally a minute. Great product.
5,Ok so this is a very sturdy holder and keeps me connected safely.  I first bought this and it quickly broke and I was like whatever... i was emailed by the manufacturer a few weeks later asking how it was doing and I told them it broke. They mailed me a brand new holder for free and it's been perfect  ever since. I even bought this for other people because it's so great.
4,Works perfectly in my car!  I especially like the arm extension to make it customized for each individual.Our state just went hand free so this works great!
5,Customer service was very kind to send me a different version of this device wich makes a lot better and perform  very well I am so happy with product and recommend to buy one.
5,Fantastic value.  It has exceeded my expectations and will remain in my car.  It stays put and is easy to manipulate.  You won't regret making this purchase... I guarantee it
4,Waste of money.1/17/2020 Update: seller reached out to me to send em another mount to try. Excellent customer service someone who actually cares for those who buy their products. Raised to 4 stars until I try out the new mount.
3,The clip works fine but the little adhesive circle did not work at all. I even pressed on it for a minute and didn’t put the suction on for 24hrs🤷🏽‍♀️ I really wanted to mount this to my dashboard.
5,The cellphone holder positions the cellphone well within easy reach and holds it securely.
3,This was easy to install we used the vent clip because the suction wasn't that good but after not even 6 month the clip just snapped one day. Now its useless.
5,I had to return 2 of other cell phone holders before finding this product. It holds my iPhone 12 without any problems.
5,Used in my car. Great product. All others I have purchased did not hold my phone or the suction cap was terrible. The Vicseed phone holder was great. Everything I was hoping it would do.
5,Very easy to install although some of the joints require repeated tightening to be secure. With the first product I received I could not access the charging port on my iPhone X but the providers kindly sent me a new version which works very well with my iPhone X. I was very impressed with the provider who offered excellent service to send me a completely new unit free of charge and without me asking for it. I feel that I can now recommend this product enthusiastically.
5,Best phone stand I have ever used. It does not fall off and takes an act of god to remove which I am grateful for. It fits my iPhone XR really well and swivels and rotates to any angle very easily. I also love that this is a set so if for any reason I want to use the smaller vent clip I can.
4,I had an issue with one of two mounts that I received and Vicseed has gone way above and beyond to correct the problem and even sent me a new unit with recommendations for a more secure mount at no cost.  Excellent customer service I couldn’t recommend them more
5,This is a great product ! It helps you focus on driving safely to your destination while the product holds your phone securely. You have an option of mounting on the dashboard or securing into air vent. The seller is very responsive whenever you have a question. The initial product did not fit my car the seller was quick to email me. She also sent out a new part at no cost.
5,the car mount works great and I didn't realize that it would come with the second one that connects to the air conditioning.it holds my phone firmly and safe so that it can't fall out from the bottom like other phone holders I had in the past.
5,The real test will be 6 months from now.  I purchased March 29. My last one lasted almost a year and lost its adhesive. This one is easy to use and install.
5,Update:  I was sent out a different model by customer service and it works amazing!I really wish this would have worked.  It just did not stick in my car!  The vent one is a little better but it still has warped my air flow.
5,I love this item practical for easy access navigation display and handsfree for safety..
5,This has been one of the best things I have ever purchased.  It holds all different types of phones.  It has been put on my dash and hasn't budged at all.  Love it! great product!
4,I have mine mounted on the dashboard with the suction cup and pad combo and it’s been working well!  I like that it’s thick enough to hold my phone with both its case and pop socket.
5,Super easy to mount. The suction held it tight and the extender puts it at the perfect distance!  I appreciated the ability to try the different ways to mount (in ac vent or suction) although the ac vent connector didn’t work in the style of vent I have.
3,I never got this installed. I tested my Samsung S9 phone on it first and the back of the holder was too tall to activate the fingerprint function so I couldn't open my phone. I returned it and was given a prompt refund. If you have a taller phone it's the perfect car holder!
5,This is the second car phone holder I purchased and I will purchase this one again. It was easy to assemble and install. I like how secure the holder is to the dash and my iPhone Xs fits in its holder without any signs of it falling off. Highly recommend.
5,I got the product right away. I was very impressed at how strong the suction is. It has held my larger phone no problem and has come lose once.
5,Full time FedEx employee in MI. We have some of the worst roads in the country and the phone holds securely to the windshield of my StepVan. I've tried 6 other kinds of mounts and all have failed within a week. Thank you Vicseed for the best phone mount I have used.
5,Fit an iPhone X with an Otterbox protective case quite well.  Vertical or horizontal positions not easily interchangeable; i.e. must use one or the other.
4,Lots of variations. Will mount and hold easily. Good construction too.
5,This car holder works great. Why? Because it's easy to setup and the release latch works fine. I use it for the vent on my AC. The clamp is strong and it holds the phone well. It looks high tech too!
5,Ordered one for my wife after I got one the one that goes into the car heaters aren’t that great but the mount with suction cups is great. After I ordered mine I realized I lost the screw that came to the mount so I went online and messaged them on Facebook and customer service was awesome sent me a replacement mount in two days
5,This product is great!  Our last two phone mounts either kept falling off or letting our phones flip out.  The suction on this is excellent and it stays put!  The phone holder is ajustable and holds a verity of different size phones.  It comes with two other mounting systems!  Great buy!
5,Perfect in my motor home.  Was worried it wouldn’t stick to my textured dash but it does.  Love it.
4,Seems sturdy enough. I like the fact that it extends. Cradle itself seems a little on the cheap side but the warranty seems good.
5,Super easy to put together...I would buy another one just because it’s that good!! It sticks to the glass or dash board!! I have the iPhone 12 with a case fyi
5,Impressive holder and includes three ways to secure your device.  And each work amazingly well.  I've never had a holder work as easy and secure.
2,The horizontal and vertical rotation is pretty hard over the ball bearing and feel like you are going to break the vent clip or the vent itself by exerting more force!
5,I was a little disappointed in the plate that attaches to the dash to create a flat surface. That did not stick as well as I thought it would but so far I love it and it’s working great. I’ve had it for about a month.
5,I had some issues with the suction initially but I reached out to the seller and they gave me some suggestions. Basically there was some debris on the suction so it wasn’t working well. I rinsed it let it dry and no issues since! I’ll try to remember to follow up on how it handles the Colorado sun in the summer but so far I’m very satisfied.
5,Legit
4,I like the product and in fact i will order another
5,Holds on really well to my cars dashboard. Even off-road hitting large holes. Does vibrate a bit when on the highway but that’s probably the fault of my bad suspension not the mount.
2,I followed the directions perfectly and stuck the adhesion part to my dashboard. I pressed hard for over a minute to allow it to adhere to my dashboard as per the directions. I left it there for OVER a day (over 24 hrs) and when I went to go attach the part that holds the phone and then place my phone in it the entire mount just came undone from my car dashboard. It does not stick whatsoever. I currently use the part that attaches to the air vent however I don't like that if I need the heat on it blows hot air into my phone and I can't close the vent to it because the product while attached obviously hinder that action.
4,I've had it for less than a week. However I do like how it works in my car.
5,I like this alot I have it on windshield I keep removing it after my shift im a truck driver and when i readd i just add a little windex it re sticks just put a wax paper or something for the suction cup not to dry and your good to go
5,I was leery about this when ordering but so far this has been (with one exception) a great phone mount. The single exception is that the adhesive is a BIT strong. When trying to place it on the dash I had to use a knife to get under the suction mount because the adhesive wouldn't let go. That's not necessarily a bad thing but be aware of this if you purchase this item.
1,The adjustment screw that keeps it tight from moving cracked and it will no longer stay in place and is useless.  Material needs to be changed.  I don’t recommend this product.  There are more quality mounts available.
5,Product works great. I got the dashboard suction cup but for some reason it wouldnt stick to my dashboard. They sent a new one for cup holder which works perfect now. Very happy with this product and seller!
4,Easy to install.  Multiple easy to set positions.  Very secure.
5,So far so good. It's mounted in a concrete mixer and they ride lousy but so far it's hanging on.
5,The suction not working anymore..after 8 months
4,Easy setup. Won’t fit it you have a popsocket but if you have a otterbox it will fit.
5,I put this right on my dash and it works fine. I really do love it.
5,This car phone mount is excellent it adheres to my windshield very well and fits my Samsung Galaxy S10 plus easilyVery easy and convenient to use this mount. I highly recommend this mount.
2,The suction and adhesion only lasted about 3 weeks. I followed the instructions. Now I have to find something that will actually work.
5,Sturdy easy to mount and operate.
5,My car mount is a great device to have in my car. My car mounts suction power was not great so it was making the mount fall off. I emailed customer service and they immediately just replaced it for me. Great service great help.
5,I wasn’t satisfied with the adhesion of the product so the seller reached out to me. She sent me a new one free of charge and it definitely works better than the first one. It definitely won’t be falling off my dashboard anytime soon.
5,I believe that this product is great for the price however the value comes while dealing with this company I mean they go above and beyond when it comes to customer service. Good product Amazing company backing it up.
5,As described in the picture everything was in the box. Easy to install and I love it. The suction power to the window holds well.
5,This car phone Mount is the best one I have ever had. It’s sturdy and the suction power is the best I’ve seen. Every other car phone Mount broke within the first couple of days but not this one! I highly recommend!
5,Brought it for my daughter who is just starting to drive. I love the convenience of it and it makes me feel safer knowing she’s not looking down for the phone. It also helps for phone navigation
5,Very sturdy! Highly recommend this phone mount!!! Its been almost 100 degrees in my car and it has stayed on perfectly.
4,Nice and sturdy. Holds phone nice and tight
4,Using without 3M
4,Wish it was easier to dock or release the phone with one hand.But other than that it adheres to my windshield great and keeps my phone secure even on bumpy roads.
3,Have had this product for 4 months. Got it in February where the weather was still in the mid 40s. This product did not hold my phone weight (iphone xr with case). Made a turn once in the highway and it fell off. When it’s too hot and I mount my phone it falls off mid-ride. I’ve wiped and dried down the area that I stick the suction cup in and it still collapses. Buying a different product now
4,Worth it for the price/ not janky
5,I have a 2019 accord LX which doesn't have carplay available so I have to setup up a phone holder for my iphone 6s plus. As there is no more space in the middle center console that I have to move the cell phone holder to the left of steering sheel as shown in the pic below. I used suction cup instead of air vent clip and mount it to the lower left corner of the windshield and it can stay there quite firmly. I would highly recommend it to anyone.
5,The best mount I've ever had.
5,Solid very happy with it would definitely buy again but don’t expect I’ll have to.
5,This thing really stays stuck and makes it a bit hard to remove if you want to move it around I am loving it so much that I bought 2!
5,Works great easy to poo phone in and out. Positions any way I need. Thinking about getting one for second car.
5,So glad for it.  Secured right underneath my rear view mirror so it doesn’t block my view.  It swivels so you can view your phone in both landscape or portrait views which is helpful and your passenger can have a look as well.  I love it!
4,It's very sturdy but when I do videos the video wobbles and it shakes a lot.  I still have to hold my phone to do a video when I'm driving.
5,My dash has mainly curves so I had to use the air vent clip. I like that I can tighten the clip to the vent fin. Works great. Only downfall so far is that my phone is a 6.7 so getting to push button to release the arms is tricky.
5,This phone mount is versatile and affordable. Driving for an app this product keeps everything secure and in its place.
5,This is THE BEST phone holder I have ever bought. Like it so much I bought one for each of my other two cars. The suction power holds strong to the windshield giving me better control when touching it.
4,I used the adhesion and then the suction and it still falls.  Who knows?
5,My suction was coming off I contacted customer service  and they replied fast and helped me get a new suction ordered.  They even covered the shipping cost. Very pleased.
5,Nothing to dislike. It’s easy to use. I mostly use it attached to my air vent and it stays in place. I have an iPhone XS. Love it👍👍
5,I liked this product the minute I got it out of the box. It was sturdy and my phone sat in it good because of the adjustable lock. My phone stayed in place not like the last one I bought. My phone kept falling off dash with the old thing I had. I have my phone on bluetooth and all I have to do to use it is tap the phone I am confident with this new product. I know my phone is secure.
5,works well for my average sized phone with typical case but my husband's plus sized phone with case has to be turned sideways to be supported well.
5,To be honest this is best-built cell phone holder I have ever purchased. I use OnePlus 7 pro a heavy one but this holder holds it still. I used to buy a lot of cheap ones but change once in a while but the cost added up quickly. This holder is not cheap but will last much longer and end up saving more money for me. Highly recommended.
5,I used this holder on my vent. I have a reg. size cellphone a motorola g6 and it is perfect. Holds solid and not in my windshield view. I love it.
5,Was looking for a car mount which would give me the flexibility of both dashboard and air vent mounts.  Especially an  air vent with an easy screw knob to adjust the opening of the clip to fit the air vent and this was perfect. Very pleased with the quality and easy assembly directions.  Did not use the dashboard mount because my car is too small but would definitely save it and use it later on.
5,Love everything about this. Works wonderfully
3,Great concept but.... Wouldn't stay connected to my vent. Flip flopped all over the place.
4,Product was broken when I took out the box I need a replacement
5,Easy to install and a great little holder to hold my phone in place.
5,Should have installed it sooner. My hubby stole it and startled using it and loved it! So I had to order another one for me!is to move around if you need to!
5,We got this for long road trips but now we use it for short ones too! The suction works really well. We have tried it in a few different cars and so far its worked great in all of them!
5,Works great. Holds phone very tightly. Was tied of having to hunt for my phone on the floor after every turn i made. Great item
5,I've used this for a few months now and it works great. I had another brand similar to this and after several months of use in the Florida heat (even though my car is parked in the garage at home and at work) it didn't hold up well and had to replace it with this one. I'm hoping this one works better than the other brand I tried!
5,Update: Seller had exceptional customer service and sent replacement parts in a timely fashion. Because of this I bought another one for my girlfriend!The product works great at first but after 2 months of it being in my truck the telescoping extension fastener has broken off. The seller fixed this issue without a hassle!
5,I bought these phone holder for my car it’s super useful and nicely made you can either put it in your dashboard or on your front window it come with a nice Warranty you just gotta simply register it customer service are super sweet and helpful! Buy it ! You won’t  be regret !
5,The suction cup sticks great to the dash of a 2003 Toyota Tacoma. The adjustable holder puts the phone in the perfect spot for the driver without interference with the AC vents.
5,I like this phone holder because you have an option to mount or attach to the vent.  Living in Alabama I am using the vent mount because the adhesive is more difficult because of Alabama heat.  Looking forward to using the dash mount.
5,Used VICSEED universal  cell phone holder mount for my car. I love it was great product to where I am to get another one for my husband.
5,These were purchased to comply with hands free law in Indiana effective 7/15/20. Easy to install in 6 vehicles suction to glass worked very well tried to remove and had to go get a thin blade putty knife to remove from windshield. Great Product Well Buy Again if Need Anymore.
5,Suctions better than any other suction device I’ve previously used in 20+ years. Used in a few drastically different vehicles and the adjustability is very nice.
5,Highly recommend this car mount!!! It was so easy to install and use!!! I love it!
5,Best one yet quality above average and suction is Superb!!
5,I have it mounted on my dash and it has held very well. It was easy to install. It is very stable and holds my phone perfectly.
5,Works great! I have a thick cover on my phone and it holds it perfectly
5,This holds my iPhone 11 Pro Max with a THICK Otterbox Defender case. It is ~0.59" thick. Holds tight and stable. Does not wobble or make noise.
5,Very strong and sturdy enough adhesive suction 👍🏼👍🏼💯😍
5,It was easy to install and holds my phone great I love that it can fit my phone with an OtterBox case on it
5,Haven’t tried the window mount yet because I just got stuck on the vent clip. Love it. Super strong the release button makes it super easy to take your phone off and put it back on. I have an iPhone X max and the vent clip alone holds my phone super sturdy and I have a life proof case on it. So worth the money. And I drive a lot and been thru many many phone mounts. Best yet.
5,The area for the phone has an opening for the charging cable. There is foam padding on the sides that squeeze together to hold the phone securely. The button to release opens the side arms smoothly and stops when you release. There are no sudden popping or clicking actions and it feels like it was designed and engineered with some care. Totally unexpected at this price point.
5,I had issues with the adhesive that anchors the mount to the car. It was almost 6 months since I purchased and was not sure whether customer service will respond. Much to my surprise they responded immediately and shipped a replacement part. Was very pleasantly surprised. Great company and customer service.
5,Really like this. The telescopic affect makes your phone so accessible. Had a bit of trouble getting it on solid but once it was suctioned on it has not come off. We will see in the future. They also supply another pad in the box that can help with adhesion but I have not had to use it yet. Would recommend.
4,Does not stay on windshield in the summer heat
4,Good product I just had difficulties getting my phone fit. Also a great seller!!
5,This product has been sad table while holding my phone in place. I didn't like blocking my air vents with my other phone holder and this is great because it can be place where is best for you in the car.
5,I got this for my fiancé for his Jeep it’s great! He has an iPhone 8+ and I have the iPhone 11 and both for great. He has it clipped into the vent currently rather than the dash but for the price this is great because you have many mounting options and it holds great!
5,This is a great product. The suction cup was a little hard to use and it did not work very well however this could've been because I didnt use it correctly since the instructions were hard to understand. However this is of no consequence because it also came with a clip to the air vent which I use which works magnificently.
3,Suction and adhesion both terrible.  Car out in sun for a few hours and adhesion wore off.Tried suction but slight curve to dash made it impossible. Ended up using clip mounts.  That works better.
5,Excellent!! Have only had this a few days and love it! I had a different brand and this one is much better! Fits my Galaxy 20+ perfectly!! Definitely recommend!
4,It works great however it doesn’t stick to a curved dashboard very well. I mean it’ll stick just enough to stay put but it’s awkward.
5,It has the best phone holder I've ever had . Suction power is great adhesion is awesome and it's very easy to install
5,Bought this for my daughter and it works perfectly in her air vents to hold her phone up so she can see the screen!
