rating,review
1,This shredder stopped working on the first day we got it. It says it can do up to 12 papers. I didn’t try that but as I was shredding I noticed it struggled with letters that were folded (4 sheets). Eventually it just stopped working. You could hear the spinning sounds but paper had gotten stuck on the feeding side and those could not be removed. First day! Don’t bother with this one.
1,The motor broke with 10 sheets. Into the landfill it goes. More cheap junk going to the dump in less than a year.I opened it up and found that they use plastic gears which simply snapped under the pressure of six sheets. Photo attached.I will be reaching out to this company for a refund and will update my review on how that goes. DO NOT BUY.*UPDATE: I have reached out to the company and been ignored. They have deleted my 1 star review on their website twice. They are curating the reviews on their website.**UPDATE: I posted a question (not a review) on their website and they actually replied (photo attached). I asked "why do you keep deleting my 1-star review?" and they actually replied with "12 page shredder will not shred 12 pages or even 8. It works well on 2 or 3."So you did see my review.... and it's called a 12-page shredder. And their descriptions say 12 pages... wow. Welcome to the new normal!
1,Poor quality and quit working in a month.  Did all the troubleshooting and still did not work.  No satisfaction when I called the company; said out of warranty.  I will not buy from this company again!!!
1,Warranty is only 30 days. It's a piece of junk; jams easily and not easy to clear. Mine broke after 5 weeks.
5,All good
5,This Shredder is Very Fast and Effective...Allows Me to Spend Less Time Getting Paper Resolved and Thrown Away...a Excellent Product and Cost Effective Too .
4,This machine works well. Very top heavy. Not a light unit.
4,Have learned to push down shreds occasionally so blades dont get clogged.
5,This is a great paper shredder!  Very easy to use.  The “window” in the front is very helpful in showing how full it is.  I would recommend this product to anyone looking for a good paper shredder!
4,It's been good for what I need without spending that much. Quality is good but remains to be seen in the coming days.
5,I've been needing to get a shredder for years & finally got around to it. As soon as I opened it I put it to the test. So far I've shredded credit cards old CDs & 6 stapled pages all without issue. I still need to go through a huge stack of papers needing shredding but so far it works great!
5,I had a problem not with the shredder but found my house was too humid. I bought a small dehumidifier and no problems since. The company contacted me and were very helpful even tho it was not their machine that was the problem.
5,It was smaller than I thought! However it does work wonderfully!  I have only used it a couple of times but so far so good!  It is quiet and shreds nicely!  It helps clean up the clutter of paperwork!
4,Looks mice but to be honest I haven’t use it
5,Upgraded my antiquated shredder to this one and wish I made the switch sooner. This shredder is really quiet compared to my last one and is more powerful. Does a great job shredding and compacting so you can shred a lot of pages before having to empty the bin. Awesome safety features as well.
5,This shredder was bought as a replacement for a bonsaii shredder I have owned several years. It is a smaller model than the one I owned previously; however I like it because it has basically the same features and is much quieter.
5,Handles junk mail easily. Like any shredder it overheats if you use it for too long but once I had gotten through my backlog it hasn’t been a problem since. Large enough capacity that I don’t have to empty it often with normal use.
5,Working well so far. I’ve only shred 2-3 sheets of paper at a time. Shreds quickly. Not sure if it will get hot quickly as I’ve not used it to shred a bulk of paper as yet.
1,Filled the bin 4 times.  Worked great.  Next batch it started to jam up while only feeding 4-5 sheets at a time.  Died soon after
3,This shredder is okay for home use but I am a little disappointed. If you run 5 sheets through it it sounds like the motor is straining. I went to shred a cd and it jammed. Now I use it mostly to shred paper. Adequate for paper but it could be better
4,I would prefer that basket be taller
2,Jams to easily  very messy  when you need to empty very dissatisfied.
5,so far it's been a great replacement for a shredder that I have had for many years
4,Small but efficient. A bit noisy. It's nice to have the small view space so I know when to empty it.
1,Works nowhere near as advertised. Can't shred more than 2 or 3 sheets at a time. Paper jams common. We gave up and donated it to our housekeeper.
5,I had a non-operating problem with one component on the paper shredder.  Bonsaii promptly sent me a replacement.  Excellent customer service.  The shredder performs very well.
5,I love this shredder! Sure can’t put these pieces together. Great for credit cards too. We replaced old machine. Nice sized. Heavy duty.
5,This is a mighty mini!!! I was nervous because it was smaller than my last shredder.  It is smaller but it works great! Best feature... I can actually put a plastic bag to collect the shred.. no more loose pieces at the bottom of the bin.Love it!!
4,Had to shred all of my late husband’s files.
3,I would be cautious when buying from this company. My first purchase died within 3 weeks. Only used it 5 times with 8-9 pages at a time. It took me two months to receive a replacement
5,For small to medium shredding projects this is a great item. Have used it to shred paper and credit cards with no issues and no jamming
2,This shredder stop working after 3 months. Nothing is jammed in it. I turn it on amd it starts smoke. Please buy something else this one is a poc
3,I am not happy with this product!!  It does not work as advertised.  I kept getting paper jams after only using 4 or 5 papers at a timeVery disappointed in product❗️Elaine Shatz
5,This is a good product for what I use it for at home.  It is durable and works great.  It can only hand 6-7 sheets of paper at a time.
5,Great product does the job put two bins of paper through it so far no issues. Only downside is wish the collecting bin was larger.
4,The cutter is a bit awkward to handle.
5,Bonsaii Paper Shredder 12 Sheet Cross Cut-works very well. Had it for less than a month and is doing well. Light to medium home use to shred unwanted bills and documents.  Surprisingly feels like a good quality shredder. Recommend.
5,This is one of the least expensive shredders but it is very solidly made can handle 12 sheets (although I do not use more than about 8 sheets at a time). I highly recommend this shredder.
5,Great
5,I enjoyed it works exactly how it says I enjoy shredding my stuff...it is more on the heavier side but it fits anywhere
5,Is exactly what you ordered. Easy to use.
4,i would like a bigger basket to catch shredding
4,Just started using it. It appears to work fine.?
5,I replaced another one that I had that had stopped working correctly which was a different brand.  This one seems to be working just fine.. good for the value I would recommend it..
4,This is just what I needed.  All I need to do the job.
5,Great little shredder you can stick anywhere out of the way. I love it! It's perfect for my needs.
4,Reasonable and adequate.
5,I like it because it’s quite and smooth when it cut.  What I don’t like is if I use it a lot at one time it will jam
5,Loves to devour all of the credit card offers and unwanted bills! What a great “gotta have” for any household!
1,Lightly used for under three months. Totally failed.  The price is right but product is not suitable for use it is advertised for.  What good is AMAZON prime if I cannot return and product totally fails.
1,Not very sturdy to do more than 5 sheets even though it said 12.Just stopped workingSo returning.
1,This is the worst shredder it jams all the time under five minutes of use! It also isn’t true that you can shred more than 1 page at a time! Bonsaii Cuatomer service is terrible they give you excuses and said shredders will jam! I said they can’t jam all the time that isn’t normal! DON’T WASTE YOUR MONEY!
5,So far great.  Not too much noisein my opinion.  I recommend it.
5,I love it.  Its fast and durable.  I already done shredded up half a file cabinet I had.
5,Very quiet and powerful.
4,As described
2,disgusted
3,It's powerful but I don't like the fact that you can only use it with the garbage can it came with.. it has this like magnetic mechanism to connect the shredder with the can for it to work ... Might return it
3,I only used 6 sheets at a time. It worked well initially but started to stop working (jams). You also need to empty the bin when it’s half full or else the shredded sheets will be pulled back to the blades thereby jamming it.
3,Advertised as cross cut the one sent to me is not. It gets the job done. I don't want the hassle of returning so I will keep it.
3,Didn’t last me long got jammed and I get a lot of spam mail so waste of money
1,I used this shredder for less than an hour and it quit.  Very disappointing!
5,very good Brand this may be the best I ever purchase. Thanks.
1,I know it is not the most expensive one out there but you would like it would last more then 2 days.
5,It is small but mighty!! Just be sure to follow the instructions for use especially lubricating the blades. If you do it will keep humming along like my shredder.
1,When I first received this shredder I liked it.  It was quiet and shredded quite nicely.  But after roughly 12 days I heard a loud pop then it sounded like it had rocks in it and would not shred anything more than a page. Sounds like some internal gears failed.  Sucks...
5,Its everything I expected and more glad that I purchased it
1,Broke down on the first use
5,I like the way it shreds the paper The shredder mechanism seems to very ample..
5,I finally found a shredder that finally works well. Papers don’t get stuck. I did a lot of shredding and it didn’t break. I even shredded a credit card without problem. I highly recommend this product.
5,Very pleased with this paper shredder. It’s powerful and no issues with jamming!
4,Great
5,Shredded the paper good and could use more sheets in it than my old one.
5,Great shredder. This is the first one I ever purchased but I can tell you it’s very good and I am excited about how well it shredded my important documents
1,Bought this for my wife for Christmas. The thing kept jumping with only 2-3 sheets. Got stuck and them got stuck again and again. Then totally stopped working. My wife says it's the worst shredder she has ever had.Can't get it unstuck so in the trash it goes. If your looking for a good shedder guy anything else but this one.
5,Shreds 12 sheets at time and quiet
5,I really like this shredder and it works great!!!!!!!!
1,This product overheats very quickly and constantly jamming
2,Too small and weak. Junk
5,whole family like it very versatile price good
1,Need exchange.  No longer working.  Please help me with this.  Need Printed mailing label.
2,very hard to empty very overated
3,To top heavy. Keeps falling over.
1,This item is complete CRAP. I used it once and it over heated. And now is not working
5,Makes the small shred strips that I like which works very well for my home office.
1,This is the worst shredder I have ever owned. It worked for 15 minutes tops.  It says it's supposed to shred 12 sheets at a time.  I inserted possibly 4-6 standard sized sheets at the very most and it got stuck once.  I was able to free the paper and the second time it just completely stopped.  Reversing didn't work.  I let it sit for hours unplugged it and nothing.  I called customer service and was on hold for about 18 minutes and then disconnected.  I emailed and no response.  Do yourself a favor and save your money.  It's not user error because my last shredder lasted for about 12 or more years and it cost less.  I just basically shredded my money.
5,Didn't over heat and went through 8 bags if you used properly.
1,I have owned this product less than one month and it is already not working.  I have only ran less than 100 sheets of paper through it and never more than 3 or 4 together at one time with any staples in it or any credit cards/plastics.  I would like a replacement as clearly this is a lemon.
2,Tried to do about 12 papers like said can handle and it got jammed. I switched it to reverse and it didn't do anything. I tried to pull the paper out while in reverse to help it and it is now off the track. Now it doesn't pull the paper down. Didn't even last a month.
5,For a small unit it does the job.
3,It is much smaller it will require you to empty the container often.
5,Strong machine
1,Thos didn't even last 2 months. Don't waste your money! Should be 0 stars high cost low quality.
1,I don't care for this shredder. I've ordered two(2) and they both stopped shredding after several uses. The shredder stopped catching because paper got caught in the shredder's feeder and I could not remove the paper caught in the feeder even with your counsel. I took a pair of tweezers and tried to pluck out the stuck paper and then used a credit card to further loosen the paper and turned on the reverse operation and then tried inserting two(2) pieces of paper in the feeder and it did not catch. I want my money back and need to know what to do to return them.I have one boxed up already..the first shredder and need to know how to return the second. I think I have the return label for the first.
5,I like this shredder is smaller than the older one I had.  Powerful and quiet too!
5,I have no dislikes
3,It’s ok - not as good as I thought it would be - also kinda heavy
1,Basket came cracked it is paper thin I can only imagine how long this would have lasted if I actually got to use it. I can’t say what the shredding is like but without a basket there’s no need to proceed.
5,I bought this for home use. For my needs it is perfect.
2,The shredder worked well out of the box but within 4 months the gears in the middle jammed after routine use on normal paper.  I called customer service who will send a replacement but the shipment will originate from Vietnam and will not arrive for another 3 weeks per their estimation.  I give this item 2 stars for customer service- Zero stars for the actual product.
5,It shreds the paper just right.Love it.
2,You have to take off top to empty the shredded paper. Don’t like that.
5,Work just fine! Much needed to get rid of important papers
5,been needing one of these and this thing is very efficient
2,The will not feed paper anymore in less than 5 month from time of purchase. Awful performance. Of course the return period was 30 days. Since I am working from home this is unacceptable. Documents with PPI and HPI should be shredded. This item was a waste of money
5,Does a great job of shredding mailings.
5,This unit is a perfect tool for the home office
5,Love the shredder. It fulfills its promises.
5,Works well ---can now get rid lots of papers no longer needed
3,The motor is too load.
5,It’s a good shredder for the money
3,smaller than I wanted  have  to clean  a lot
5,Works great. Amazon basic stripped gears by
5,I re  as lot love this I wish it had wheels the base is kinda heavy
1,Have had it less than a month and it's burned out.
5,Absolutely GREAT!  Perfect price-point and everything we we expecting.  Thank you!
5,This shredder does exactly what we wanted
5,works great and does 12 pages at once
5,USO PERSONAL...
5,i love my shreder
5,Good  machine work great
5,Great for the money!
1,Opened box plugged it in and began testing product.  Max capacity is 12 sheets of paper but I didn’t want to push it so only did some receipts regular size sheets of paper and a few pieces of junk mail.  I didn’t operate continuously only in small batches.  Before the bin was even 3/4 full it stopped working.  I thought maybe it overheated so I left it alone for about 20 minutes.  When I tried again it wouldn’t work but the light was on.  Waited another 10-15 minutes and still won’t work.  Back to China it goes👎👎
5,Right size
5,Shreds really quickly
2,Worked ok and was used as directed- one day stopped taking paper- don't buy! Customer service proved finally sent another unit out after quite a bit of prodding.
5,Powerful shredder at a good price
5,security factor
5,Compact works well love it!
1,does not crosscut just shreds inconvenient to use and empty smaller capacity than expected not worth the money
5,Works very good
1,After one session of slowly inserting a few pieces at a time a pin on one of the gears bent and now the device is unusable :/
2,Although we are very careful not to feed too much paper into this shredder it jams frequently.  It is not easy to remedy the jam as we have to take the gears apart to clear the machine to continue using it.
3,Noisy paper jams would not recommend
5,Shredding documents
1,First day it jammed on one side.  Second day it stopped working completelyOld shredder lasted 6 years without any problems not this brand though
5,Liked it
5,This is a really good shredder for the price
5,Works perfectly
5,I don’t like the product; it James up very easily and stops working
1,I got what I paid for. Don’t do it
3,Not happy it turns off after about 20 papers
5,Quite quiet
2,Extremely loud and item jammed constantly even with 5 pieces of paper. I bought it May 31stbit died last than 2 months after! It. It jammed every week in between. I used my mom’s Amazon basics and I was highly impressed. I ordered on immediately! Don’t waste you money on this shredded.
5,Love my shredder its the perfect size and works great.
1,This is the worst shredder I have ever bought. Do NOT spend your money on this.
1,This is like a toy...it comes up to my knees and I'l 5'4" tall.  It doesn't have a removable bin to empty the shreds...you have to take the heavy top off every time to empty it (if it is plugged in that's a problem).  It holds barely 50 pages of shred before needing empty.  Its only $55 dollars but buy one with more capacity and convinience to it. This thing is for cancelled checks....maybe.
1,Broke after two weeks .
1,would not recommend.....jams very quickly...
1,K hace 1 mes y algo y ya no sirve claro que no me agrado
5,Very heavy duty
5,Perfect for a home office
5,Great product
1,Completely jammed up after one month.  auto on feature failed to work.  Extremely poor quality and certainly not worth the money.
5,I liked that itt works perfect. No problems.
5,Acorde al precio
2,The first and second one only lasted for days. Kept jamming and ultimately stopped working.
5,Perfect
5,i LIKE THIS PRODUCT
1,Didn't even get to fill up the tub with shredded paper before it stopped working.
2,I just received this shredder @15 min agoAfter using for approx 7 min it overheated and won’t go back onKeeps going back to red light and shutting down???
2,I was looking for something different
5,Wonderful
1,I bought this to keep in our home office to discard personal info. EVERY time that we used it it jammed or over heated. It would jam with 3 pieces of paper!!. I was able to get un-jammed a few time but I finally contacted customer service and they sent me another shredder in hopes that it would work... NOPE same thing happened!!! The quality of this product is terrible. DO NOT BUY and WASTE your money!
2,I purchased this item and the first day I used it just stop working.  I could not fix it so I returned it for another brand.
1,Died on first use.
2,After only having the shredder for a month it just stopped working. It barely held 4 sheets of paper
2,It says can handle 12 sheets of paper NO it doesn't four sheets jammed it had to take it apart to unjam it.
5,QUICK
2,The blade got stuck after one hour working so I have to wait till and you’re cool down and see if it’s working if not I have  to return to Amazon .
2,For such a small unit much too noisy great for shredding junk mail orJust to recycle paper with  no personal information.
1,I really just feed 2 pages at a time it cannot handle the 12 advertised. I have a small office and might need the shredder once a week when my reports do not print correctly. It jammed up by somehow leaving a lot of paper product above the shredding teeth. Please address this issue.
2,It was much smaller than the picture indicated
1,I ordered this unit and it didn't work right away. I have had a pending warranty for two months now and they can't even tell me when one can ship. Very bad experience
1,When it invariably jams it is a B**** to get it working again.  If a return wasn't such a hassle because of size and weight I would return it.
1,Shredded about 60 sheets of financial records the day I got it.  It broke the first time I used the "reverse" switch.  Sending it back.
2,It gets really hot when shread for a long time.
1,This product was a waste of money.  I only use it 3 times and you cannot shred no more than 2 documents.  This wasn't something I used on a daily basis so I'm not sure why it stop working.  Very dissatisfied with this product
2,Product works well but you are constantly empting it. Needs a bigger area to hold shreds.
1,Horrible. I have an older smaller one of this brand. It was great. I wore it out so had to have the same brand. New one is bigger supposed to handle more sheets. It sounds like it is dieing with one sheet. Gets hot way too quick takes forever to cool down. After contacting them they asked if I wanted my money back. I said yes. Haven't heard from them since.
1,The media could not be loaded.                                                                                 Customer service is very hard to deal with. Still trying to get warranty service.
1,Shredding old documents didn’t last a good month. Called for product support they said they would send a new one. Been waiting over a month now not worth the money
1,I just opened my shredder and it looked used. It had a yellowish dried up glue substance under the lid.  Then it jammed on the first day I used it.  Now it won't work anymore. What a waste of money.
1,Overall good shredder but I really do not like it stop shredding all of the sudden because the bin is full. No warning sign to empty the bin and I wish I would known it before I buy this shredder.
1,It was fine until it stopped working. When you turn it to auto position motor start running with nothing inserted When you try to insert paper it wont go into feeder.
1,It didn't work for long
1,brought it on July 9 2021. Stop running already ! Speed is too slow and too much noise.Paper jam all the time .
1,I’ve used the items 2-3 times for light shredding. Today while using it it became jammed and now won’t operate at all. I never went over the 12 paper maximum. Extremely disappointed
1,The media could not be loaded.                                                                                 I am on my second one of this product i got one the paper got stuck and they replaced it. And now I am having the same issue and I have been going back and for with the seller and still it does not work. I don’t recommend this product at all
1,Purchased this in March. Had it for four months. Used it about 5 times. It is totally jammed up and will not budge.
1,Just got the shredder  it gets jammed when shredding credit cards. I am very dissatisfied
1,Do not buy ! a piece of junk!!! Work only in few days!  Returning and DEMANDING a F%%%%^ refund!  Worst purchase yet from Amazon! NOTE: DID NOT WANT TO GIVE NO STAR; ONLY DID TO BE ABLE TO SUBMIT THIS REVIEW!!
1,The product stopped working after about a week of use. Intermittent use.
2,The paper jammed frequently even with only 6 to 8 pages.
1,this product broke after minimal usage. it jammed and we cleaned it. when cleaning we noticed the teeth on the gears were broken
1,gets jamed up motor got hot started smoking. had it for A while before I used it so probably can/t send it back
1,Just received this unit today and it’s going back. Wife used it the first time and after about 8pcs of paper it jammed. She cleared it and the unit got hot and jammed again. Piece of junk! One star is one to many!!
1,This is a dangerous toy that falls over easily and shreds poorly.
1,This shredder stopped working within a few months. Customer service was worthless!
1,It’s not working already!  Didn’t have it long and it’s not jammed but not working.  Really disappointed with it!
2,Not recommended!
1,Brought in February this year product only work until recently now it will not shred do not buy
1,Only had it for a month before it quit on me
1,Would not turn back on after 1 usem
1,I liked it if it would have continued to work
1,After using this shredder for the second time it is already broken and will no longer shred paper.Not happy at all :(
1,It got jam with paper and I was unable to Unjam it I had to buy another one
1,It is much too small I was led to believe by looking at the picture it was much bigger than it is. Dissappointed.
1,I was able to shred a small amount of paper.  I used less than 12 sheets and it would get hung all the time.
1,Both only ran for a few days then continued to jam. Do not need to spend time unjamming it. Do not tecommend.
1,stopped working company said they would replace an never sent a replacment
1,Used 2 times and the blades jammed
1,I bought it to shred documents.It works well and price is very reasonable
5,
1,It did not hold up. Broke the first month I had it!
1,Started out OK but soon jammed under household use.Very disappointed.
1,It broke after using it for less than a month.
5,The only thing I don't like is that you cannot see when the paper is filling up
