rating,review
5,So far this is the best shredder I've ever owned by a wide margin! Glad I spent a little bit more money on a much higher quality product (I got the 10min one too) this is the best bang for your buck!I've had a few shredders before in the ~$40 range (mostly Staples ones) that broke pretty quickly -- this one really doesn't cost that much more comparatively. They'd only be able to do like 5 sheets (nowhere near 12) and eventually plastic bits would start falling out of the insides and it would stop working. If you put in like 4 sheets and folded one accidentally those would jam immediately. Then the jams would be hard to clear and could damage the shredder. Or you'd run it for like a minute and it would start overheating already and start malfunctioning.So far with this shredder in a few weeks' time period I already shredded more than I have in the past 5 years combined. Probably did like ~10000 sheets of lots of old documents. That's how much of a powerhouse this shredder is compared to all the other ones I've owned previously! So it's been easily worth the money already as it has outlasted the others that would start malfunctioning at ~1000 sheets.It's also never jammed on me! I've never tried 12 sheets on it but it'll do 6 sheets no problem whereas my previous shredders would start falling apart -- literally -- if you tried 6 sheets.And this thing can run for like an hour without overheating! Like I get tired out and I have to take a break well before it overheats. Whereas with previous ones I'd spend like 2 minutes and already had to wait for it to cool down. Now the bottleneck isn't the shredder but me!Also because it's been so durable so far I'm no longer afraid of shredding things here and there worried that the shredder might suddenly break. Sometimes I shred some old documents as a therapeutic meditative activity now -- shred your worries away xDIt also holds more paper than my previous shredders before I have to clean it out. And while it is taller than I expected that surprisingly made it more ergonomic so I didn't have to lean over as much while shredding.As some reviewers have noted when I got it I did check the insides and did see some bits of shredded paper. That seemed sketchy but it does say on the note that comes with it that they "test every shredder" and so that's why you might see some leftover bits. And honestly even if it is used it's outlasted my previous shredders by a 10x margin already so it's good quality stuff either way.So overall well worth the price best bag for my buck I've had with a shredder. Bonsaii also has a 1-year warranty (and the reviews seem to say that they've made good on that too!) which is why I originally bought it with my past shredder purchases going awry. But I guess it's as they say if a company is confident in such a long warranty the product probably isn't going to break quickly! Hoping to have this last for many more years :)
5,I liked it But then it randomly shut down and I had to slap the top of it for it to turn back on. (read til end)The window is useful but where I have it I can't see it clearly (dark).I looked through the troubleshooting and it told me to check if it was full and sure enough it was - _-So yea the window tells you when it's full since this shredder motor sits deep into the container. I thought it still had a little more to go but forgot the motor is pretty big.
5,Bougt a replacement for my old broken shredder. This is doing the job so far still manageable noise and overall functioning the way i expect it to. Nothing fancy.
5,This was a replacement shredder & it proved to be much better. Quiet operation efficient & easy to use.
5,I have run hundreds of files with no problems.  I am very pleased with its performance.
5,The size is perfect for our needs it's also quiet when it runs! Very important for us since we both work 3rd shift... we're not waking up to a crazy loud paper shredder! Whoop! Whoop!
5,I feed this thing unopened junk mail and it just effortlessly chews through stuff.  So far I am extremely impressed with this machine.  My old shredder was a toy in comparison as it could only handle three sheets and I had to remove staples.  I'm loving the new found freedom this gives me.
5,very dependable. no paper jams.
5,Best shredder have ever bought
5,like it
4,For the price this thing is good. It’s jammed and still works after being unceremoniously un-jammed.
5,Great product….heavy duty built.
4,Very sturdy. So far shreds 10 or 12 sheets at a time
4,Product arrived overnight super easy setup. I was actually using the shredder less than ten minutes of opening box.
5,I haven't had it long but this shredder is very sturdy and working well so far even on cardboard.
4,It was a lot smaller than I thought it’d be.
5,Small enough to conceal when not in use.  Works great and credit card feature is most convenient!  Recommend highly for home use!
4,Does a good jobfits is small places..only gave it a 4 because I shared lots .therefore bigger is better
5,It was quiet and does the job. We have not had it put to long term use yet but the noise is a large factor at this firm.
5,It works great!  Very good value.
5,Initially this was a great product with no issues whatsoever. I only used it intermittently and made sure to clear the shreds of paper from the blades to avoid jams. I kept the machine very clean. Once it was unplugged I would use tweezers to remove every bit of paper from the blades to keep it in working order. The other day I plugged it in to use it turned the switch to auto and just like that no power. No power in reverse either. Not sure what happened but it's in the landfill now. Very disappointed.
5,I have had this for about two weeks now and have had no problems with it as of yet. I have shred atleast 500 - 1000 documents already maybe even more then this without any issues.
4,I use this unit to shred private documents for my tax service and personal use.  Shredding is adequate but it does clog the cutters too easily.  Wish I had spent more and purchased a micro cross cut shredder like I had before.
5,Sturdy fast and so far no paper jams
5,Quiet and easy to use.
4,It's fine if you shred as go.  Don't accumulate a big paper stack because it has a thermal protection lock out.
5,Takes at least 14 pages with no issues.  Shreaded a lot of stuff and container still not full.  Do not know bout safty features.  I like this and have no complaints.  Have not shreaded disks or credit cards.  Only used paper and staples.November 17 2921.  Shreader stopped working.  Valled number on shreader to troubleshootTHEY ATE SENDING ME OUT A NEW SHREADER.  I wonder if they would of done this if I had it longerMay 5th 2022Shreader got stuck again.  Called # again on unit to get help.  They told me what to do and shreader is working great again!  Great customer service! You just have to be careful not to put too much in it.  Shreader gets stuck. And reverse did not do a good job. This time I just had to get the stuck paper out of unit!  Takes 14 pages though. I try to keep the page count lower though
5,Cross Cut multiple page capability
5,Easy to use. Cut documents into very small pieces leaving  me with a feeling of security without worries that Nyone would piece the pages back together.
5,This thing chews it up! Love it
3,It definitely seems safe to use. My teen helped me to shred some old bills. However it only lasted about 1-200 papers and it won’t work. It no longer spins and makes a screeching sound. I’ve let it cool down  cleaned it out and nothing helps.
5,For the cost this shredder is effective.
4,Good quality
5,As expected
5,As a shredder
5,Shreds like a charm
3,Paper jams up in the shredding teeth and needs to be cleaned out frequently even when the basket is empty.
4,It’s fine for simple home use - old files containing personal information that you don’t want to send to the dump etc.  But you might want to go with a bigger one if you have a home office.  Bin fills fast and is a little awkward to empty.
4,It is more powerful than I thought it would be. Take your time and it will eat that paper. A little top heavy but not a real problem. Fills quickly.Easy to clear if it becomes jammed by reversing. I was putting in about 10 pages at a time and it worked well.It will shut down for 30 min after about 15 min of use if you continuously feed it but I didnt find that to be too inconvenient for my use.It is good for the price but I dont think it is good for a large office. More for home or very small office use.
5,Great shredder.  Serves our purpose perfectly.  Thanks
4,Ok while it lasted. I know how shredders do jam I have been especially careful with this one. I love the way it shreds credit cards and shredded paper. However if the basket gets full and you’re shredding paper the shredded paper it may back up into the blades which can cause severe jamming.  so that is my issue now. it’s been a year since I’ve had it October 2021 would’ve been one year so just a year and a few months and it’s no longer functioning. I can’t get it replaced under the factory warranty. therefore I am in search  of another shredder not sure if I will buy this brand again but I will say it was worth the money but now the price has increased. When I bought it I paid $54.99
5,Home shredding
3,I should have  gotten larger
3,It says this can handle 12 pages at once. No way. At about 5 it bogs down and strains to mulch them. Overall it got the job done. But needed patience to get through the shredding that was needed. Also one good thing it doesn't jam very much and the reverse mode takes care of the rare occasion it does.
5,It functions as described.  It’s a little too top heavy and wish it had a larger bin.  Otherwise seems to be a workhorse.
3,I assumed I was buying a new product but it is very obviously used and arrived pretty dirty and dusty. I wouldn’t have purchased it at this price if I’d known that.
5,This product  seems solid and offers good value  You just cannot be too careful with the sensitive information you through into the rubbish bin
5,Solid unit for the cost. I’ve not had the unit over heat yet and I had 3 years worth of junk to shred.
5,This paper shredder is great! This shredder is very quiet compared to others that I have had.  I had a lot of shredding to do and found this shredder capable of shredding quickly.  The only con I can think of is that  container is small had to dump several times.
5,So I ordered a Bonsaii paper shredder over 4 years ago but thought that it was only 2 years old (this extra time at home has totally messed up my time references!).  It was jammed and we thought that was the end of it.  Well I checked to see if I needed to write a scathing review about how it doesn't last as long as one should (I was feeling surly that day) only to realize that it was much older than I thought.  Well I figured it was just at the end of its life so I ordered another one.  Well one more try with trying to unjam it and VOILA!  It's back to its former glory.  As a result I haven't even had the opportunity to use the new one!This was an amazing purchase and I would recommend this brand to anyone.
5,Equipo co buena calidad en su motor de trituradora y buena fabricación.
4,Would liked to have the shredded pieces smaller.
1,This shredder has been working faithfully for my without any issues. I typically never shred at the max capacity of 12 pages at a time. I’m usually at about 8 max and never had a jan problem. The motor completely died on me just at the 1 year mark. I also painstakingly cleaned both sides of the shredding blade with tweezers and was hopeful that once I was able to clear it that the blades would turn and do their magic again. What a waste of money. My previous el cheapo shredder lasted me 10 years and only shredded up to 6 pages at a time but it was very faithful. I regret getting rid it of and replacing it with this gawd awful one from Bansaii. What a waste of money
5,Exceeded my expectations!  This smaller shredder really packs a punch!  Some reviews complain of the 5 minute "limit."  If you run 12 pages at a time and don't let it stop it will only run for 5 minutes straight.  However grab some papers shred them pick up some more then shred those and you won't have to worry about the 5 minute "issue."  I shredded enough paper to fill two 30 GALLON garbage bags over the course of 3 hours and it didn't stop once!  Shredded credit cards without missing a beat.  This is a heavy duty shredder.  Buy it you won't regret it!
5,I’m definitely very happy with this shredder it’s not obscenely loud and does a good job I found the top heavy bit after looking at how solid the blades are I can see why. Worth every penny and then some.
3,Okay product paper jam easily
1,Obviously used to shred documents.  The first shredder worked for 6 weeks.  Careful to not overwork the machine. Only Shredded 3 or 5 sheets at a time (maximum shredding capability is 12 sheets - don't do that many). Did not shred longer than 3 - 5 minutes at a time (maximum 5 minute using time).  What a nuisance.  Machine totally malfunctioned 2 weeks after return eligibility date with Amazon.  Contacted the company. Sent pictures of Machine with explanation of the malfunctioning problem.  After going back and  forth with the Custer service rep it was finally determined they would send a new replacement.  On the second day after we received the replacement the machine died.  We replaced our original unit ( a Fellows product) after approximately 10 years with never having 1 problem.  We decided not to  pursue a replacement. The company DOES NOT REFUND MONEY.  They only replace the unit. BUYER BEWARE. NOT A CONSUMER FRIENDLY COMPANY.Writing a review like this goes against my grain.  However  after dealing with the company for several weeks my frustration has got the best of me.  I suspect there are many customers who are use this company's products are wondering what planet I come from!
5,Just as described
4,This shredder works much better than the ones I've had in the past but it has one characteristic that I'm not crazy about which is the 5-minute limit for shredding. It's inconvenient if I have a lot of shredding to do because I have to wait for 40 minutes between 5 minute  bouts of shredding apparently to keep the unit from over-heating. If I had read the provided info more thoroughly I probably would have sprung for a more powerful unit. But as long as you use as instructed it seems to work fine.
4,Well? I purchased this unit in June 2020.  Today is March 2021.  While it's "working" it seems to have slowed down and making a horrible clicking noise.  Always properly used and never abused.  1 year warranty stated.  Will reach out to seller and update.Update July 2021. Seller provided a replacement. Working well and thankful for good customer service.
5,Well worth the upgrade to 12 sheets at a time capacity for my year end home office records shredding; did an excellent job!
5,If you’re looking for a home office shredding to do some simple shredding this is perfect. Able to do a few pages at a time. Shreds well. A little noisy but what shredder isn’t.
5,This is an efficient shredder and far less noisy than previous ones I have owned.
5,Very great product
1,I had a fellows shredder for years until it recently stopped working and decided to give this one a go based off reviews. Worst purchase ever. I have not even used enough to empty the bin the first time before it stopped working. It got a paper jam and I was able to take the paper out but bits of paper are stuck on the blade. Unless the fellows which provided more space to allow me to remove paper bits stuck there this shredder is so narrow it is impossible to clear it. I have to use a knife as the only thing narrow enough to fit in the space and it has scratched up the entire shredder and it still not clear or working. I have reached out to customer support and will await their response but I am extremely disappointed in the shredder. I understand for safety features the space between blades is good if you have kids but makes it impossible to clear any paper jam
5,I bought this in September 2020 and used it occasionally.  Then I had my first jam a few weeks ago and after I cleared the jam the shredder had stopped working.  Reverse still worked but not the shredder.I contacted customer service and described the problem.  They agreed to send a replacement for free.The new shredder arrived within a week and is working well.  I'm being careful to keep it at about 5 or 6 pages at a time to avoid the possibility of another jam.  5 stars for customer service!
2,I liked that it shredded more pages than others I have had.
4,This shredder is great for at-home. It has yet to jam on me as I am quite careful with how many sheets I am putting in. The only con would be that the storage is smaller than I would like and the top shredder part is quite heavy.
2,It says you can shred upto 12 pages at time...7 pages & it gummed in order to un-jam itit would need taken apart down to the blades
4,Paper shredding
4,Like
2,It only allows 2 or 3 sheets at a time.  It's nice and sturdy but I would pass!
4,I love that it shreds the paper super fine but I don't like the fact that it bunches up in the shredder itself. I continually have to pull the loose ones from the shredder. Other than that I am super satisfied with my new shredder. I have only had it a few days so we will see how it does after a few weeks.
1,This is not worth the money I paid for it.  First off it only has an off setting automatic setting and reverse setting.  It has no forward button that keeps running continuously until I want to change settings and 9 out of 10 times if you use the reverse setting it causes it to bind up with paper and no paper will feed through forward.  I have to take a pointed object and push the jammed paper through the shredder roller blades to clear the jammed paper.  I spend more time working on it than using it.  I could not put as many sheets of paper through at the same time as seller said could be shredded at one time.  I would only feed through about half as many sheets.  I would recommend you not "EVER" use the reverse setting if you make the mistake of purchasing this product.
3,Gets hot too fast... Not for commercial use! Good home shredder!
2,We received it 6 days ago. It overheats quickly. It cannot handle 12 sheets of paper.  It has a popping noise that sounds like something is about to break.
5,Bought it to replace an Amazon Basics shredder that gave up the ghost after a brief career in my home office. This one is heavier and feels better made as reflected in the 10% price difference. I don't ask much of these things and it's early yet but so far it's done 8-10 page wads without difficulty. I put waste bags in and it works fine with them.
3,No "on" switch just "reverse" "off" and "Auto" which makes it difficult to clear. Had to clear by hand (after unplugging)
3,Used it for about an hour. Then I put in 5 pages and it jammed. Did the reverse to get them out then jammed again. Now it doesn't take paper because there seems to be a load of shredded paper around the rotors.I haven't had a chance to open it up to clear it (don't know if that will even work) but definitely not happy with the purchase.____________________________19-03-21: I received a replacement without having to ask- just received so will be using it again though more carefully. 5 points for the customer service and will give updates on performance.
1,There is no indicator when it's full so all you can go by is the window. Fair enough. However at 3/4 full it's completely clogged doesn't shred anymore and now that I tried to clear the jam it does't even turn on anymore. At least before it would go backwards haha. Which didn't change anything the paper was still stuck. I had this for 4 months hardly used and I'll can do now is throw it out and buy a new one. I wouldn't recommend.
5,Not liking the heavy weight.....After using it just a few hours it quite working and nothing I could do to rectify the problem.  Must call customer service now
5,I use this mainly to shred cardboard. It works really well. It started to slow down a little after several months use so I purchased lubrication/sharpening sheets and now it is back to shredding the cardboard at the speed it used to. Always had issues getting enough browns for my garden compost until I purchased this.
4,Works good
4,This is a good shredder. It will NOT shred 12 sheets consistently as it is advertised. I usually shred 4 or so at the time and it does good. This is not your volume shredder if you need to dispose of a lot of paperwork on a daily basis. Get a more robust and expensive one.
5,works great for my business if i sent in a bad review it was by mistake wrong product this product is great
5,Could use handles to lift the heavy cutter up from basket
1,The shredder stopped working after just over a month.  Moderate to light use.  I contacted their support they said we need a copy of the receipt and a video demonstrating it doesn't work.  Its been three weeks and I keep sending emails and additional requests for help - nothing.  Garbage support from amazon and whoever this wacky 800 number service is - obviously an outsourced support service company.  Really unhappy - the item should have been fully replaced  under warranty or a full refund should be issued.  I feel like they are intentionally dodging giving me support until the warranty runs out or i get tired and just go away.
5,This is a great shredder. It definitely takes 12 pages and the accidental staple. I'm not really interested in shredding papers. I have to clean out my office after 10 years of collecting papers and it's doing the job with gusto. I hightly recommend if you need some shredding in your life.
3,I had a lot of trouble with the first one I ordered. would jam and the reverse didn't clear the jam. Also I tried a credit card and that jammed also. I would be surprised if 12 sheets would be a good idea. I only do up to 4Amazon kindly sent me a replacement As long as I empty it when the bin is 1/2 full and run the reverse periodically whether it needs it or not so far the replacement has been satisfactory.
1,Bought in November was fooled by the price. Seemed like a reasonable deal but when it jammed up after 6 months I realized you get what you pay for.  I put in a peace of junk Mail from AAA and it ground to a halt.Then I spent hours cleaning the jam going back and forth. Now the cutters don’t turn and nothing feeds into it. I wish I would have listened to all the negative reviews and saved 54.00 I hope some will listen to mine.  I can’t contact anyone with the company if you call they put you on hold for a half hour then disconnect and 6 months is to long to send it back. A warranty is worthless if you can’t talk to anyone in the company.all I have left to the bbb and a trash bin.
4,Paper shredder
2,Works well at first!!!  Wife uses it to shred many medical documents every day.  HOWEVER after a couple weeks of use it jams up quickly and you have to MANUALLY unclog it frequently. I found that the claw parts of the grinder fill and jam up with bits of paper then it starts jamming up. You actually have to use an ice pick to remove these bits of paper jammed in the claw parts.  After cleaning well it will shred about 30 sheets and then start jamming again. (We only shred one sheet at a time in the shredder and it still jams. I think the claws are machined too roughly and causes the paper bits to stick to them. The claws may get dull quickly (not hardened) and that prevents cutting the paper correctly. (Not sure but educated guess)
1,Stopped working after first use. Just makes noise but the shredder blades don't move tried reverse and that didn't help either.Returning for refund.Don't waste your time with this!!!
5,So far so good for household paperwork.
5,I've had a lot of shredders over the years but so far this is truly the best one I've purchased.  It does a fabulous job at cutting up old credit cards as well as lots and lots of old bills that keep pilling up.  This is definitely the most used thing I've purchased this year.
5,It’s the best shredder ever! And basically I shred a lot! I mean lots of important papers and envelopes  and it runs like a champ  as well as it holds up a lot of shredded papers before emptying l.
5,Love it shredded very good
4,One of the best I've bought so far
2,I only used the shredder once a quarter and bought it in Nov last year.  So I used it about four times putting financial documents through it.  I do not own a business or work from home so it was barely used.  Today I used it for a few minutes straight without stopping and then it wouldn't go forward or in reverse. I called the number on the motor and left a message.  I liked that it could shred with a staple in the papers. But I have another really old shredder that doesn't do staples. I bought it years ago at Staples for like $20. It still works.  So I don't give this Bonsai high marks.
5,great value for your money. don't try to put more than 6 sheets of paper at 1 time. it will get stuck & not easy to get out. but if you use less you will be satisfied with the performance. takes up a small space.
4,Value for money. Obviously not as secure as a cross cut but I didn’t want to spend that much. Doesn’t overheat quickly
5,It does everything it says on the product. I love it it’s fast and pretty quiet. I’ve been shredding everything
3,The downside of this shredder is it has no handle or safe way to remove the top when removing the shredded material.  Other shredders usually have something to grip this one does not.  It's precarious to try and put the top back in without worrying about getting your fingers in between.The upside is it's quiet and does the job.
