rating,review
3,Ordered this item to replace an older shredder. It does not seem to cross-cut as described. The paper is coming out as strip cuts.
2,Can is very cheap plastic and the shredder top is extremely heavy. Ist use top slipped off the top of can and can split into. Called at least six times and was told a replacement was on the way. Never arrived!
1,It worked for maybe 3 minutes. My spouse bought it for me and I just tried it it only shredded maybe 5 papers and stopped working. Don’t spend your money on it it’s not worth it
5,Got it to replace a shredder that I put over the top of a garbage can and only shredded 2-3 pages at a time. This thing shreds a lot at a time. It shreds cards also. I am really enjoying it and it seems very sturdy.
1,When I opened it the printer had been used and full of shredded paper stuck in the teeth of the printer. Also there was dog or cat hair all over it.  It was the worst experience in the purchase of anything.  I have never given a bad review but I am compelled to let everyone know of my experience.
1,Did not take long to jammed to the point of no return.  The shredded paper accumulates under the cover and eventually jams up the teeth.  Trying to remove the cover to clean is impossible.Waste of money.  Do not buy.
1,On the 3rd shrewd the paper got stuck with 4 sheets and quit working. I’ve went back and forth to get the jam out CAN’T!!! It will notMove!!! It will go backwards but where the jam is it doesn’t budge!!! So can’t use it and husband through all the box and stuff away before I used it so can’t return it!!!! Makes me so mad!!!! DON’T BUY!!!!
2,I am returning this now. The pictures have you believe this is a standard size planner but when you get it its SMALL. Like it can sit on your desk. Buyer beware! Im not paying this much for a shredder this small. So mad and disappointed.
1,After several uses it died.
5,works well is heavy to me but does the job  only use in home but no problems so far
5,Small footprint great shredder crosscut
5,This is fun ! Awesome peace of equipment I didn’t know I need
5,Quiet works well!
5,Perfect in every way
1,UPDATE...I didn't think things could get worse but they have.  Not only is this a challenge to operate and do what it's supposed to do...it gets even worse as it no longer will shred even a half a page.  Please don't but this product unless you want to do like I did and just throw your money away!!!...Not recommended...I initially bought this shredder because I thought it was a good value. BUT this compact shredder was great when I only had to shred 2 or 3 sheets of paper a day. Once I began cleaning out files and running reams of docs through it for 20 minutes or more (sheet by sheet) it jammed and froze up.  Its gone from a paper shredder to a paper weight.  The shredded paper builds up below the cutting blades causing it to over-heat. Using the reverse function causes the shredder to jam and stop working completely.  After plucking the paper from the blades and waiting for the temperature to cool down it starts again.  Next time I'll buy a shredder that is functional and dependable.
5,Quiet and you don't have to shut it down every 10 mins!
5,Great purchase! My old shredder left the papers/cards in strips...this one cross cuts the items. It's not silent but it's not nearly as loud as my old one and it doesn't take up much space. I highly recommend this product.
5,It's smaller than I thought it would be but it does the job.
5,This shredder works as it should Price was good.
1,used the day i got it and ran about a dozen sheets in it and allready jamed up. i would not by this again.
5,Great quality and capable shredding ability. Very surprised at the strength...
5,works great and lightweight
5,Got it for my mom who’s old shredder from like the 2000’s broke! Awesome shredder! Did the job smoothly! No interruptions. Did credit cards like a piece of cake. It’s small and easy to hide and keep your room looking clean. Very well built shredder definitely recommend to anyone
5,This shredder works great. I have used it to shred personal information and it works good.
5,Does a lot of paper and runs very quietly.
5,It’s wonderful is exactly what I was looking for. Nicely built capable and sturdy.
5,at this time i can only expect for the best.
1,It gave up on me after the 3 shred
5,Very satisfied with our general lightweight shredding of paper. We haven't tried anything heavier such as cardboard etc.
5,manages multiple pages very easily
5,I like that it never got jammed where i couldn't get it fixed. i had another brand but it was as great as this.
5,Very easy to use
5,Just what I needed and is easy to use.
5,Shredding documents
5,Nice shredder.  Because I have arthritis and am older the top was too heavy for me to lift to empty.  So I gave this one to my son for his business and bought another from the same company that has a drawer in front that is easy to open and empty.
1,I ordered this paper shredder to assist with cleaning my home office. While cleaning I prepared a large pile and waited for the paper shredder to arrive. I unboxed it and it looked as if it had been used. See photo. I thought maybe they simply tested it. I plugged it in and tried shredding one sheet of paper. Nothing. It was broken. Why would a company send out a broke item. Not good spent your money somewhere else.
1,Used it one time snd it quit working.Update:  The seller sent me a new shredderat no additional cost. The shredder works. The container it sits on waste basket arrived cracked.  Luckily I still had the other on so between the 2 I have a complete Shredder.  The seller did try to make it right. So I would rather do business with someone who admts mistakes and will do their best to correct them. It didn't cost me anything over the original cost so I'm happy.
5,This is a sturdy efficient product. Compact in size but powerful. Good value
5,Wished it was wheels I like that it is light
5,Works great so far!
5,Good product its work 👍👍👍
5,Its very efficient and e3asy to us.
5,Very impressed with this shredder!  I didn’t know how noisy my old one was until I got this one! Quite powerful too!
5,Sharp. Compact. Holds twice as much as last shredder.
4,My father is a retired lawyer and needs to safely dispose of paperwork leftover from his practice. I purchased this shredder for him based on the reviews. It does need breaks but that’s great because so does my 72 year old dad! He can shred while listening to NPR or watching TV and emailed to say he really likes it.
5,So far so good.  Seems like a good value.
5,Best value for the money.  So much easier to use than my previous one.
5,Good shredder!
5,Easy to use
5,The media could not be loaded.                                                                                 Great value. Not too loud. Noise level is is quieter than other shredders. At first I shredded one piece of paper then I shredded the equivalent of 11 pieces of paper sheets and envelopes. Both went through with ease and definitely did the cross cut as you can see. Hope it will last!
5,Good size. Work very well!
5,I love the way it shredder the credit card and disc.
5,Excellent!!!
5,shreds up to 12 pages with or without staples and paperclips. Is Quiet. Effecient.  12 sheets Cross Cut Paper Shredder C170-C shipped next day delivered with care via Amazon. Placed in the special box on porch with care.  Instructions state run 5 min-max time rest 40 gives machine time to rest/clear and continue. Wont overheat this way.  Main switch has 3 settings - Auto REV OFF. The Power button is blue. Starts shredding automatically when paper is inserted into feed opening. Warranty is for 12 months from date of purchase. This product replaced similar shredder but it only did 5 sheets-wasnt as AWESOME as this one.  Highly recommend this product (home or office use)
5,As advertised! Very very happy!
4,It works well and does it's jobs and even shreds credit cards and DVDs. I just dislike that it can overheat just be careful not to stress the machine so much.
