rating,review
4,The steel on the inside of the 360 ball head on one of the lights was delivered broken. I used black electrical tape to keep it on. Otherwise the lights serve the purpose. They're easy to assemble and they're bright.
4,These little lights really get the job done. I used one as a key to couple with my ring light as a fill and the other unit as a back light. Made my small space look great. I’m not sure these would be sturdy enough for a lot of travel but they work really well for my basement setup
4,Good for the price.  Smaller than I expected and I wish they would extend a bit higher.  A wall plug would have been nice instead of having to use USB adapter.
5,The package arrived with one ball head. It doesn’t screws on neither of the tripods. Too bad I like the light but it’s crucial for this to be able to tilt it.  I will be requesting a ball head or return the whole thing.
5,These lights work great. They come with an array of colors which are easy to change. Power cord is short which works fine in my studio but want to make note of it for others who may be concerned with length.
4,These work well for the costs.  The dimmer switch is useful.  No problems with how they perform.Only thing I would change would be the height that they can go too.  A little short in my opinion.
3,The lights are lightweight dim-able with easy to use color filters. The stands they come with are cheap and they will fall apart leaving a trail of hardware like nuts and bolts wherever you go making them useless. Use a different higher quality stand for the lights and you are good to go. The lights are worth the price even without the stands to be honest.
4,Las luces son sencillas sin embargo creo que están bastante bien por el precio
4,I bought these to use for product photography and they've worked well so far. I did notice after I got them that each light seems to have a slightly different color temperature (one warmer one cooler) not sure if they are suppose to be like that but it is what it is and hasn't bothered me. A few months after buying them one of the lights has started turning itself on seemingly randomly at night. Maybe I just have a ghost?Overall would buy again and they're a good value for the money if you're not too picky about quality and just need some additional lighting. I do wish the cords were a little longer though.
4,Great price.
5,Great for YouTube broadcasting. Priced right
5,This really helped me with the lightening it is easy to assemble so you don’t have to worry about it.
4,I use these to accompany my ring light. They work but aren't too bright on their own. Switching out the slides is clutch. The remote that dims the light is a b word to use but it works
3,They work great! However if you get annoyed by high pitch noises I would not adjust the light at all. As soon as you dim them they start ringing.
5,They work AMAZINGLY for what you pay for. I will say the color screens do get a little warm when used for more than 5 minutes but for the multiple shoots I have used them in nothing has melted.. yet? Lol.Definitely a great purchase if you looking to improve your setup or improve the lighting in video/photo shoots!
5,This is a great product for not a lot of money. I use it to light my green screen.
3,These lights are nothing special and a bit pricey for the quality. Maybe this is more on me because I expected a little more and would probably spend more money next time to get a more featured and controllable light. I was admittedly being cheap here and I regret it but the lights OK.
3,By far the cheapest crap I've ever bought on amazon... I mean this thing doesn't even qualify as cheap. It's not bright cable is short so repositioning is a challenge if you don't have 20 extension cords. Overall not going to buy again or need for very long. Oh and these things get hot when you leave them on for too long
3,They work great but be gentle with them. The base that threads onto the stand is very thin and flimsy. One of them broke while simply setting up for a video it was barley bumped. I sanded the paint and put some JB Weld on it and moving on with life. But they are really bright.
4,These are easy to use but they really don’t project enough light to be useful even in a small room. Spend a little extra and get brighter/larger lights.
3,Light is good pictures rock but swivel broke first time I put it on
3,Inexpensive and it shows not that bright. Maybe for a helper light.
5,For the price I was not expecting it to be THIS good. It came with 2 tripods the lights themselves and 5 color lenses (including white) (10 total lenses 5 for each light). On their wire there’s a little control panel thing that lets you adjust the brightness. I actually highly recommend. If you’re looking for good lights at an insanely reasonable price this is the product for you.
4,El producto es de buena calidad recibe su energia por USB y aunque cumple su funcion en cuanto a iluminacion no es tan de lo mejor porque tiende generar sombras fuertes por lo tanto lo recomiendo para videos en casa y cosas sencillas porque para un resultado mas profesional dejan mucho que desear pero aun asi son muy buenos.
4,These are decent  simple led lights
5,The media could not be loaded.                                                                                 Great for product photos super lightweight easy to use. Not the sturdiest at max height but I like them. There's a swivel head attachment so you can aim the lights.
5,These are actually fantastic for what they are. The fact you even get 2 tall tripods with universal-threaded connections for less than 40 bucks is a steal since you can use them for anything else but the lights themselves are also very bright. They are not huge so you will want to use the provided or other diffusers but with clever placement the right diffusion and leaning on some software enhancements in post you can likely make these work as well as a much more expensive 'light tent' assembly.
5,The media could not be loaded.                                                                                 the best decision over the best option UBeesize LED Lightthe package is simple and safe thanks to UBeesize for your beautiful and helfull product and thanks amazon for few hours delivery.Adjustable Tripod are metal everything else is resistant plastic and very stable.the size is same as I saw in amazon and the expected one (I don't understand why some people are complaining) the product has bright light and can be adjustedTripods are very long and you can connect different devices such as webcams phone and others the cables are long as well (I will like even longer as possible but they are fine)The lights can be turned in any direction and either way up and down as well 30 90 is amazing.I use the lights in a car and it seems all natural you can also change the colors as you can see in the photos also you will appreciate the difference from the very darkest to the highest light possible in these lights. (only 1 first and both after)I Would recommend this to anyone for taking pictures putting on makeup streaming or creating content.If anyone has complaints I remind you please look at the price first I think it is something important to keep in mind we all want the best but sometimes demanding too much is not cool.blessings to you all and have a good day
4,It's very different from other light kits that I use. This is more portable and can be attached to a laptop or anything with a USB port. It needs barn doors and a change in temperature not just intensity... overall it's good.
5,The media could not be loaded.                                                                                 Pros: don’t be afraid by its size this little thing is POWERFUL you could actually use only one if you want to and it will do the job. I make videos for instagram and TikTok (@polianaciliento) and I was struggling with the darkness of my kitchen lights my videos were coming out with poor quality because of it but this little guy it’s really powerful. I would say that this lighting is 10x better than a ring light which I also have used before.Cons: it doesn’t come with the outlet what is a bummer but it says in the description that it doesn’t and it’s not expensive so not too bad.
3,I bought this set of lamps to light my home movies. All is well EXCEPT they didn't think to include USB to wall outlet adaptors so now I have to order two adaptors to use these things. True I can plug the power cords into my PC USB ports but that isn't really a solution I'm happy with.
4,Over all not horrible decent brightness. My major complaint the power cords are usb and did not come with power blocks. On top of that the cords are very short. They are decent quality for the price. Slightly annoyed I have to buy two usb power blocks its kinda cool because you can use power banks to power them but it should be better advertised they will not work as is out of the box.
5,Get these lights for your studio if you want to be a content creator. It took me about 10 minutes to set up and they come with interchangeable color tabs.Say YES to these lights 👍🏾
4,I’ve used high end professional lights before so I know where the bar is set. These were surprisingly useful in a portrait session and provided nice dynamic colored light when paired with natural light. For the price I expected much less brightness but these babies can do the job.
5,I wasn't sure waht the quality would be.  This set is pretty nice.  Pretty bright easy to move.  I'd recommend.
5,le dio a mi oficina un aspecto muchisimo mejor  ademas para los videos queda perfecto como luces de fondo.
4,One of the lights will not turn off when press the off button on the connected remote. It only turns off when unplugged. Other than than everything else works well.
4,Just the right size for what I need them for.  I use them for my product review videos for YouTube. The lights are light weight and are very easy to travel with.  The included filters are a nice plus.
5,Better to press the button than having the power on your phone. For the price! Great!
5,Very nice product and enjoyable.
5,The product is just as described. Value for your money. It's bright and you can adjust the brightness level. I'm quite happy with the product.
5,I use these to add some added light to my desktop when I do Youtube recordings of projects.  they are USB powdered so I don't have to worry about lots of wall worts I just use a tower of power for all of my lighting needs.  which also means that I can take them with me on the road as I can run both lights on a portable battery pack.  the diffusers are good for mood lighting or to soften the light the tripods that come with them are by them selfs worth the money I paid for the whole setup.
2,It’s a good product for the value but first things first the base of the tripod is nowhere near as big as pictured which makes the tripod easy to tip over. On top of that I was missing 1 light and a mount with my original order. I told them about it and after complaining they sent me an entirely new kit.. sounds great right? Wrong the new kit has one light that is completely busted so now I have 4 tripods 3 lights and only two of them work… At this point I kinda just want my money back if you just need to do a quick photoshoot then these may work for you but I’d just rather not bother
3,I haven’t even tried my lights yet but I didn’t know you need a wall usb charger for them.
4,Lights are a bit small but not nad overall
4,Smaller than I thought but in all seriousness it works really well! It’s super bright. I like it
5,Great product. Easy to set up store and use.
4,The adjustable brightness is great. My suggestions are to move the on/off/adjustment switch higher on the cable - I have to bend over to reach it. And to have a pass-thru "always on" position so I can control it with a smart plug.
4,The AC in this case USB is a little short easy to overcome. The light is great.
4,Used these to take my baby’s Christmas photos bc hiring a photographer was so expensive! Our photos came out great. I didn’t think they’d work so well bc of the price but I must say they exceeded my expectations!
5,The lights are good enough for my needs.
3,The lights are ok in brightness. But they fall over with the slightest bump and the light covers broke off from the falls. Also… the cables are too short when the poles are extended to the max. USB is not good for this.
3,I didn't want to review too early. I wanted to use for a while and see if things get better. Buy I stopped using for now. The light is like a flashlight not soft light. They came with USBs and nothing to plug into electric socket so I have little options on where to plug in. If you're serious about taking pictures and video this light is not for you.
3,The product in and of itself is not that bad of a deal but understand the drawbacks. First off I didn't realize it's powered only by USB and secondly it's not really that strong of a light. It only works if it's right up on the subject. Any further away than a foot and a half from the subject this light is useless at least for my purposes. This was an impulse buy on my part. I had a better quality light with stronger output dimmer and battery option that I had my sights on but saw I could get two for the price of one those with these light. Read the fine print. You get what you pay for.
4,Setting up for small stream. Can’t afford the “pro” lights so I gave these a shot. To my amazement they work fantastically. I was able to use the face light at high and the second as a fill from a different angle and lower power.The ball adjustment for the light head is a metal ball in a plastic socket. The plastic is threaded and that’s how you lock it in place. The metal screw can easily strip the plastic threads if you twist the locking screw too hard.Overall for the money they do exactly what I need until I can afford nicer lights or I may never need to upgrade.
5,I love the different settings for the lights from lite to bright.  Helps me much better to do what I'm doing because of the lights.  Definitely recommend this.
5,The media could not be loaded.                                                                                 I was so happy when I came across these. I had a last minute 360 event and needed some lighting. I ordered these and they were so easy to put together. They also got the job done. Very bright and love the different light settings that you can choose from. I ordered four. I love that you can switch out the color plates. I use these lights for all my photo booth events now. Easy to transport and assemble. They don’t take up a lot of space. Make sure you have either a USB box or outlet to use them. If you would like to see other events check out our Instagram @mtomeventsco
5,The media could not be loaded.                                                                                 I had a big light box and the bulb broke so I went looking for one and found these. This brand never disappoints me. They get brighter than I thought they would. I think they could definitely even light up the room in the dark on their own. I like that they’re small actually. Easy to store when I move back and forth from school. I like that it’s not one big light too. It’ll have light from both sides instead of straight on. Haven’t done a shoot with them but I think they’ll be perfectly fine. It’s a little brighter white than I’d consider daylight but hey I’ll take it. Can color correct later or play with the screens. I’d say both of them together is easily like at least if not more equivalent watts than the big 85w bulb I had.
5,These lights are a bit small and unfortunately not as bright as I would’ve liked
3,For the cost these are great for filming in small spaces. They also come with color filters and stands. Assembly was really simple.My one disappointment was the fact the power chords end in USB rather than q standard outlet plug. Thankfully I already had a dual USB to wall adapter but c'mon now that's just one more stupid thing to haul around.For the cost it's pretty good.
4,They are good for the worth.
4,They are going to light up anything too far but are good spot lights for small scenes the color filters actually work well
5,Easy to maneuver when taking pics for online selling. Adjustable. Happy with purchase
4,The lights work well but be careful they don’t fall over. One of mine fell over and the plug ripped out of it. Other than that issue they are very useful.
4,I was surprised at the brightness coming from these things for what they cost. They are easy to set up and the adjustable brightness is great too (they adjust independently). The only real concerns I have are the durability and the lack of an AC power adapter. These are super lightweight so easy to transport but don't bang them around I don't think they would survive. Each light has its own power cord that ends in a USB I was surprised to see that it did not come with a USB power block or something to convert to an outlet. Overall solid product!
3,I use this for streaming and the light quality is okay. Not the best but it gets you by .
2,I try my best not to create garbage and I have access to taps and tools so imma try to get this one going but come on now
4,Pros:1) Easy to set up2) Multiple angles of light to cancel out shadowsCons:1) Needs a better diffuser; light is almost as harsh as an open bulb2) Yellow is verrry yellow; I’d hoped it would be more of a “warm white”
3,I'm pretty confident I could get the same effect with a couple of table lamps. The filers could diffuse the light better shadows behind the subject are still harsh. But these lights are better than having nothing.
3,Save your money. CHEAP!!!
3,Just not what I expected.
5,Soy un streamer nuevo y pequeño y tiene la calidad y precio que uno necesita para empezar en este mundillo y luchar por nuestros sueños ofreciendo una buena calidad de imagen apoyandonos en una buena camara que este al alcance de nuestro bolsillo!!!Hazlo sigue tus sueños!
3,Is expensive and it does not work a lot.
3,The media could not be loaded.                                                                                 The pictures make it look bigger.
4,Not bright enough
5,The media could not be loaded.                                                                                 I am very pleased with this product. It is very easy to set up and operate. I love that you can adjust the tripod to whatever height you need. It is also great that you have four different color filters to use; White Blue Red and Orange. It is very easy to switch which filter you want. Simply slide the filter out and slide the new one in. Each tripod stand comes with an easy to use remote that allows you to adjust the brightness of the light as shown in my video. I am very excited to use this product for future projects. I definitely recommend this product to anyone looking for a light set up for filming or pictures.
2,Bought to do live steaming and shootings but for me it’s not enough had to buy another one.This is one is more for short distances shootings like make up…
5,Exactly what I expected.  Would like a longer cord.  USB wall plug as an add on bundle would improve the product.
5,✔️Shipped on time✔️Works Great✔️Flexible adjustment height and practicality✔️Works great on my live video broadcast!
5,Los trípodes son de muy buena calidad son muy ajustables y versátiles para muchos usos. La luz es muy intensa la posibilidad de cambiar el color es excelente son muy sencillas de utilizar y el precio es buenísimo. Muy recomendadas para empezar.
2,Really was hoping they would be better quality but not good at all  lens covers fall of easy they tip over at the slightest bump or wind
5,This product is definitely worth it. Super easy assembly. The stands when I ordered I had thought would be small which wouldn't be an issue fir what I was using it for. However the stands extend to about 5 feet or so. So not only can I use them in my video production I can also use them with my portrait photography as well. The dimming and brightness controls are on point. The color filters are a hard plastic which is a fantastic feature as they will not easily tear or break. Way to go with this product really loving them and can't wait to begin shooting.
5,was on a budget and wanted a way to get good lighting for cheap. had low expectations for these considering how cheap they are but they work phenomenally. I use these for streaming/videos and they light me up well. the red is harsh though other than that it is amazing and easy to use. amazing for its price. 10/10 would recommend
5,The media could not be loaded.                                                                                             I love this light for all my crafting. It's bright easily moves from project to project. So glad I bought it!
2,These are cool for indoor shots with a LOT of light. They are not bright enough to cut out shadow.
5,I purchased to take better pics of clothing I sell online and they work great but I had to buy an extra set for complete lighting.
5,If you need good lighting for a small space the. Look no further. A nice affordable product that works out of the box.
4,The lights are pretty good good brightness very adjustable the only downside for me is the plastic where you adjust it is a little weak just be careful when adjusting
5,I really like the lights for the price. The lights are a little small only a little bigger than my phone but they both can get very bright which makes up for the size. I love how many colors it comes with and how you can adjust the brightness. The only thing I’m not a fan of is they don’t come with cords that plug directly into the wall they are just usb cords and you have to have your own wall piece because they don’t come with one. Other than that I really like them and can’t wait to use them.
3,The cord is just a little too short
5,This product is really easy to use just adjust the knobs on the side to set up or put away. The tripod that comes with the lights can also be used with a camera making it great for filming content. I would definitely recommend these
5,I have been extremely impressed with these light. Easy assembly great instructions and simple to use.  Because of the way that the lights are made they can be used for many things.Great for photography and video lighting and enhancement.  They include color filters and the brightness is adjustable.They are also perfect to add light to otherwise dark areas as well as for reading.The price for this product is low but the quality of the lights and tri pods is very high.I am going to order more for gifts.  I recommend them highly and was glad to find them
5,Love the brightness and how easy to use it is. But you need a power source to plug it.
3,The lighting that I needed will be a little brighter.
5,I can not say enough good things about these lights. When first starting out recording or live streaming the cost add up quickly and as I found out lights can be very expensive. This bundle is perfect for starting out the lights work great and the control over the intensity is not often found on less expensive equipment. The fact you get two lights two stands and films (which are not cheap pieces of paper they are actual thick plastic). Honestly I ordered another set just so I can have a light setup at my PC and at my Painting station and not have to move them.
5,Use for vblog. This set has everything you need as beginner.
5,Got it for my wife as she needed better lighting when teaching virtually. You can connect it via. USB on your computer so no need to have an outlet or an adapter for this piece. Just angle it where your eyes won't see it as it can be a bit blinding at the max setting.
3,Light is ok could not use on the date intended because no where in the title does it mention it’s a usb plug style . Lots of words in the product title just not the right ones.
5,I m using this as a “standing” lamps for my  children to read write doing homework…. Wherever they are.  It works so well now I own 2 sets (4 of them).  It is so bright to keep my kids away from darkness n prevent wearing eye glasses in the future… I use it as reading light too!
4,Everything worked as it's supposed too. Very bright lights. Able to power off a cheap battery pack. Tall tripods when extended but small enough to use on my work bench for extra lighting when not using for photos
3,These small lights may be bright enough when pointed directly at a subject but they are not bright enough to bounce off walls for indirect lighting. The main advantage of these lights is their daylight-like non-yellow color.It was possible for me to get brighter lighting by using a half-dome shop light with a clamp and an ordinary household LED bulb having 1500 lumens of brightness and a faint yellow tint. Cost of shop light setup - $14.
2,One of my tripods is not screwing all the way down and needs to be replaced
5,Aun no he usado espero q todo bien llego
3,This has to be for table top only. Not bright enough for what I bought it for but it definitely has its own uses
4,So far so good (Ubeesize warranty hasn't been impressive for their tripod o-ring light; hopefully this will be better if a problem arises)
4,Not super bright good as long as you're relatively close to the lights. Past about 4 feet away you might as well just use a regular lamp.
