rating,review
5,These are great little lights that pack a punch at their highest setting. The hardware's great quality for the price frankly — I've seen other reviews of similarly-priced products complain about cheap plastic. The tripods for these are metal.I bought these for better lighting for teaching meeting and streaming. I have one set up on each side of my dual-monitor set-up.A couple of notes:- The coloured inserts are fun but don't really work to "warm up" the light in a natural way. The colour is quite obvious and should be used with purpose (i.e. if you want to flood something in blue/yellow/red/orange light or some combo). The inserts could be used more subtly if you're in an environment with a similar colour (e.g. using the blue light as a fill if you have a blue backdrop).- The lights aren't especially high — 4-foot-something — so to put them behind or above an elaborate desktop setup you'd need to mount the USB lights independently of the tripods. As I said I have mine on either side of my monitors and that works fine.- This isn't necessarily a negative but note that the lights are quite small. They work absolutely fine for my purposes but to light a larger area you may need larger lights. Definitely work for Zoom/Twitch/Youtube purposes.If these were more expensive I'd rate them a 4: great but with some limitations (see above). Given their price though these are really a steal.
3,I was excited to receive the product the lights work well and easy to set up but one of the tripods was loose and I tried to contact the manufacturer but they said contact Amazon and then Amazon said they could only refund and not replace the tripod.I decided not to go ahead because of the time it would take but besides the loose tripod and not being able to replace it everything is fine.
5,The height of the 2 LED light kit is accurate and can provide a large range of movement and provide a great range of brightness depending on your needs. For me I uses mid range setting for photo shoots and easily adjust the angle of the LED lights using the ball joint.However if the switch is made closer to the LED box it will be best as I need to bend down to access the buttons on the switch. The switch will touch if its not fully extended. Fully extended its about 12" off the ground. So I coil the excess wire to the last nut so that I don't have to keep bending down.
4,Buena relación calidad precio  me funcionan bien para lo que las compré
5,Everything looks and works great
5,The media could not be loaded.                                                                                 This light is excellent for filming in low light conditions. It's really bright on the highest setting even with a coloured filter.The filters are easy to change.The light is extremely easy to operate and it only takes a minute to set up the tripod.The pivot bearing makes it really easy to aim this where you need it.I also tried this with a USB battery pack and it worked well so one of these lights is going in my car trunk for emergencies late nights at the beach or the day we're allowed to have family gatherings again.This is an extremely good and versatile light.My only complaint is that the cord is rather short. About 6 feet so you may want a USB extension cord to go with it.
5,I like the product to be honest for the price its highly recommended
4,Using the lights to complement the lights I already have for my light box that I use for product shots. The colored lenses will be a nice addition I think. The LED lights are bright but not as bright as I was hoping but should add to my existing setup. For 50 bucks you should expect an introductory product and for that it delivers.
5,Needed a video light and this was recommended. Very happy with the purchase and love the different colors I get with the light. I've made other purchases from this seller and recommend their product because of their excellent customer service.
5,The LEd lights worked really well. It has multiple sliders to provide different color combinations of the light as well.I mostly use the white/yellow light for my zoom call meetings. It is a great replacement for all the ring light users. :)
1,Both of the cables on each light eventually just tore off. Barely had them for that long
3,The media could not be loaded.                                                                                 I have just bought UBeesize LED Video Light Kit 2Pcs but one is not working ! Please watch the video. How can I change a new one while I don't keep a box? Thanks
5,It's great value for money. Would have been better to have a remote to control the power and brightness rather than an attachment to the wires.
5,I’ve had them for about 5 months but only started to use them for 2 months and one had the power cord come apart and show the wires and another one stopped working all together.  I bought two sets of 2 and I’m really disappointed in the quality.  The light isn’t bad though. If you want something really bright these aren’t the lights for you though.
5,Great little tool for a great value
3,I bought 2 of these and 1 of them just stopped working for no reason.  I tried different charging cubes and different outlets and it just won't work.  The other one i bought works fine though.
5,Great sturdy items. Great deal for this price!
5,I love these. They are smaller than in the pictures. The images are a bit deceiving and they should change that. No need to lie if your product is good. Anyway I bought it to light up my home made marble runs and it is great that they are a pair. They did a nice job. Although I bought them for my videoing of my marble runs I use it all the time. It is now beside my bed and I use it to read dim it to watch a movie on my laptop. I am basically using it as a lamp. The adjustable head is great. Puts the light exactly where you need it. They are light and easy to move around. I bought a usb extension cord so I can put them exactly where I need them.
5,Surprisingly good quality. A little wobbly because they're so lightweight but that's manageable. Best for localized lighting close to the subject as they are small and have narrow lightspans. Not the best for portraits but perfect for selfies and small product photography. Work well on a desktop or work surface for task lighting. All in all quite versatile and well worth the money.
1,So disappointed in this product. used it once for about 20 minutes. When  I went to go use it a second time it wouldn't turn on. Don't waste your money on this. Wish I could return
1,Quality of light is not good not bright
5,Awesome product what I expected
1,They do not give enough light and build with the worst quality plastic.  Returned them.  Stay away!!
5,Worked great for my product photography class! Great little lights with great brightness!
5,Fast shipping and really easy set-up! Works right out of the box. I like the different colour shades offered for different moods. I think it's a great addition to my streaming set-up as a DJ
4,Pour ajouter un éclairage lors de cours en ligne sur zoom. Lorsque je suis éloignée de ma web cam la lumière aide beaucoup
5,This package contains 2 lights 2 stands and some colour filters. The built quality is average and made out of plastic. The stands are metal yet they are lightweight and easy to transport. The package also includes two small ballheads which allows you to points the lights in any direction. The lights are fairly bright and have 4 different intensity settings. these lights are great for blogging and online meetings were you would like to have proper lighting. The lights are not the brightest for portrait shoots unless you can plant them fairly close to your subject. Overall I am happy with them these lights and a battery bank allows me to set up my blogging video anywhere I want.
1,This could be a good thing for specific purposes but is definitely not good for iluminating a background. :(
5,The work lights work quite well unfortunately are very very light weight so topple over easily yeah
5,Fast delivery great product!
1,Stands a bit unstable even when folded out cheap quality
5,Looks good
5,Recommend +++++very good quality satisfied:)
5,fast shipping excellent product
5,Very bright
5,This is a great choice for DIY photography lights as they are very light and easy to be adjusted in height and angles.The best thing is it's not a single light and you can create a focussed room for the photography or for brightening up the area as they are very bright and you can change to multiple colors with filters blue yellow orange red and white.Tripods are versatile and can reach up from 23.62" to 57.68" and can also be used for cameras or any other hinged support devices.These are USB-powered lights and can even be charged with a laptop or portable battery as they have very little consumption due to LED bulbs.Highly recommend the lights due to their excellent quality and price...!!!
2,It's a handy product since I use it for filming auditions while travelling. But it's quite cheaply made and the light temperature is only okay.
5,Fast delivery great product!
4,Simply and quick installation. Improved video quality instantaneously
1,You get what you pay for. Do not bother with this.
5,Buen producto excelente calidad meses de uso y aún funcionando con gran brillo y color uniforme. Lo recomiendo
5,The lights do everything I need them to do for recording myself with my phone. They're small but bright. The tripods aren't amazing quality but at the price it's more than good enough and you can always swap them out for different tripods if you prefer.
2,It’s certainly light weight and efficient for space saving.You definitely get what you pay for.All of this would have been fine but once I found my own extension cord and extra usb cube I plugged them both in but I still needed to plug in my ring light.I thought to myself “there needs to be a better way”.My intent is to use this for live fitness classes and all I got was shadows on each side - worse than it was with one ring light.Still good for smaller-use purposes whatever that may be: food blogging or something? But definitely not for live or recorded fitness classes.
1,I bought the Refurbished ones.On the box it says “Amazon Tested”.However….. neither lights work!!Unbelievable!  Couldn’t even test one of them.Will order a new set and test them out.
5,I like the product. I think it's good for the price. Uses USB port which is great.
4,Really great cheap light. Easy to use and can connect via USB so you can easily use it with a battery pack.
4,Use to make videos. Decent light for cheap product.
4,It was smaller than I expected but the light is very good.
5,très cool j'adore l'ajustement du niveau de lumière
4,Use to make videos. Decent light for cheap product.
4,Son ligeras y portátiles pero no iluminan tanto como esperaba.No me arrepiento pero podrían ser mejores
1,After reading all the good comments I ordered one then returned on the same day. This is a cheaply built Made in China Light Kit.  Even on maximum brightness it's still no where near the actual light and brightness we are looking for. Tripod Sticks are sturdy but light boxes are fragile made with very thin plastic. Not worth your money spend little more and get something better and more professional.
4,I use these lights for video conference and youtube video's.  Great value for the price.
5,Love them.. when I’m showing my jewelry online it’s absolutely amazing.. great lighting love the different colours that it comes with.. so I can change it up.. love the fact that I can make them table top useable or floor useable.. just a perfect products
5,Amazing lights very bright. Light and portable. Would be better if they come with a carry case
5,Amazing lights
5,One of the extension rod became a little loose but overall the quality and light plates are very good.
4,The mounts are too fragile however the lighting works well for shooting videos.
1,After reading all the good comments I ordered one then returned on the same day. This is a cheaply built Made in China Light Kit.  Even on maximum brightness it's still no where near the actual light and brightness we are looking for. Tripod Sticks are sturdy but light boxes are fragile made with very thin plastic. Not worth your money spend little more and get something better and more professional.
5,the price is very low
5,Cumple con la función y eso es excelente. La altura lo suficiente para alumbrar tanto interior como exterior además se puede regular la intensidad.
4,Por el costo son muy muy buenas. Los materiales de los tripiés son resistentes aunque la carcasa de los Leds no tanto. Está bien para rmpezar y tener luces de apoyo.
4,Easy to set up very bright and the colour filters are a lot of fun. I would recommend this if you need 2 sources of light and are looking for a budget option.
5,Fast shipping great product will highly recommend
5,Great
5,My only suggestion would be plugs for the USB ends on the lights
5,I bought this to take a pictures for my jewelry company and it’s Amazing!
5,Though these are budget items they are fairly decent quality especially when you want a simple solution to provide consistent lighting for (say) a green screen.The stand adjustments are what I would expect and they are stable. I was pleased to see that the lamps attach to a standard screw for photography mounts and this screw is on a good quality "ball" (sorry a better term doesn't come to mind) that provides range of angular adjustment.Each lamp is powered via a standard USB connector. So you either need to hook these to a USB hub or a power bar that has USB ports. Fortunately I already had a power bar with USB ports (that I never imagined I would use until now).Dimming the lights is easy using the buttons next to the on/off switch. For my use I need the lights at max but you have a range of illumination.
5,Great product for a great price !
5,It is good to use. It can change the color of the light.
2,These lights have just been a constant source of frustration for me. They're bright and all but the filters are absolutely useless and barely diffuse at all. You also have to be very careful with extending the stand because the rods pop out extremely easily and it's a nightmare to try and get them back in.
1,Just a little bit of movement the wire got snapped.
5,Loved these are great lights !
4,I make indoor videos for my YouTube channel which just started months ago. I don't want to invest big to get the Professional level of every piece of equipment for the moment and I'm happy to find this affordable one. It's very bright and adjustable. When I shoot I put them both on a table as I'm standing up. This is why I'm giving it only 4 stars as they are a bit short. I'm 5'4" BTW. But overall I'm happy with this product and it's a good starting point for your video shooting as a newbie.
5,decent lights for your bucks
4,Feels really cheap other then that they work well and they are bright. Came quickly.
5,Light is Pretty Bright and works as desired
5,Item that arrived was as described. Good value for the money.
5,Light is Pretty Bright and works as desired
3,There were no instruction manuals. There were no tripods. This renders it completely useless for what I need it for.
5,I needed to light up my desk area and they work great. The adjustable angle is helpful.
3,
3,They work well to fill some background shadows from your flash for photography. But they are no way near as strong as flash lighting. If you put them on your table directly to either side of you while you film from your webcam I would say they are an excellent choice. However for subject matter several feet away I would say they are going to be too weak.
5,Son de buena calidad
5,Cumple con su función al 100% y su calidad es impresionante vale lo que cuesta y mejor si lo agarras en promoción
5,Una maravilla por el dinero que pagas
2,same brightness when plugin 5w and 10w power source.
5,Light is Pretty Bright and works as desired
5,Wow!! Simplement parfait pour diverses situations! Love it.
3,not bright enough
5,Pretty bright tripods are sturdy.  The lights are lightweight and the gels work well!
5,I like that this is so compact and versatile. I didn't need full blown studio lights but needed something to brighten up areas for photos of products I was selling online. These work perfect for me and I can get the light exactly where I need it.
4,Una de las luces prende más que otra
4,These lights are pretty good. The amount of light that they emit seems to be about right and the filters work well. The stands adjust very easily but I think the tripod base could have been a little larger. Overall though they are good lights at a good price. On flat ground the stand bottom shouldn't be an issue either. If the ground is a little uneven you need to be careful since they can tip over easily. I would buy them again
5,The media could not be loaded.                                                                               Excelente producto por un buen precio.
4,Tiene un excelente brillo pero los filtros la verdad es que me decepcionaron un poco están muy feos se atoran a veces al entrar el filtro blanco es bastante transparente así que no se logra difuminar bien si le hubiesen puesto una lámina reflectante de fondo igual y obtenía más luminancia por lo que se regresa.
5,Bright lights adjustable height lightweight does a great job.  What else do you want for this price?
5,Arrived exactly as displayed. Easy to put together and worked exactly as described. They are light weight compact and easy to move around if you are looking for versatility for your home studio.
3,The product is ok first i was happy it was so light then i realized it was so light that it felt 2 times in 30min... Also during the day there's no point using it it's not showing at all. Good for a night usage.
5,Good quality for the price and is brighter than I expected!
5,The media could not be loaded.                                                                                 This is really good for the price! I tried to capture the light intensity in the video so hopefully it shows how bright it can get. The best thing about this is that you can plug it in on the go because the power cord end is a USB so you can plug it into your computer power bank etc def worth it !
4,Even though this is not a "High End" product it does the job and is decently priced.  The telescopic tripod is really nice however it is prone to tipping over fairly easily.  Bottom line not a professional product but worth the price for the amateur or beginning photographer.
5,Great lights and easy installation. The tripod is really great for multiple purposes. Perfect for adding lighting background or on a subject. I've been using it for zoom calls and basic video production.
5,These have a solid brightness to them so taking photos of food and content in general is made much better as these really light up the product out of the dark. The additional filters are good but you’ll probably only ever use the main white filter. Extremely easy to use if you have a power bank already this will be such a breeze. Just plug them into the power bank and that gives you the mobility to move them around and put them exactly where you want them! Satisfied!
5,Works as expected. I'm glad with the purchase.
1,The lights are okay but the cords are not durable
5,
4,Not as bright. Light part doesnt move so u have to make sure product is on the same height as light. Even after setting lights on opposite sides and product in between shadows are visible because the lights are not very bright.
1,The tightening mechanism is garbage after tightening a second time the gimble metal sheared apart due to poor design and materials. Lights are also not very bright.
5,
5,The media could not be loaded.                                                                                 The UBeesize video light with tripod kit was easy to set up easy to operate easy to change the lens and excellent value. The kit was securely packaged to ensure it arrived in perfect condition. The kit came with 2 light heads with 5 filters for each light head (white blue yellow red orange) and 2 tripods. The tripods were adjustable to accommodate any lighting height or angle that was required. Each light had its own individual USB cable with on/off switch that also allowed the intensity of the light to be adjusted.This is the perfect light kit for anyone starting their video presentation debut or experienced users. I give this product a 5 star review.
5,Son pequeños pero con buena iluminación. Estoy contento
5,the lights have a lot of power and can adjust the intensity
5,The lighting system came in time. As advertised. And I feel it is very sturdy. I am a starting youtuber and this exceeded my expectations. I use one tripod to hold my camera and the other for the light.
5,I used them once and was very pleased with the results. I loaned them to a friend and it lit his live video very nicely.
5,Perfect as described
5,These lights come with a power switch and adjustable brightness.  They include several filters (Red  Yellow Orange and Blue) as well. These are too thick to be used for minor lighting alterations but are great if you need something heavy.Stands are good and very adjustable. Can be used for other things (like mounting cameras or microphones that have a 1/4" screw mount). Only thing to be mindful of is the legs - they aren't very long so don't mount anything too heavy or it'll tip.I use it with a Woohoto cellphone holder a SmallRig 5.5 inch Adjustable Friction Power Articulating Magic Arm that I connect the UBeesize light to a Deity V-Mic D4 Duo and a Samsung S20 FE in a case. It's an extra couple of pounds and it's quite stable.Overall very happy - would recommend. Just don't expect studio quality lighting at this price point.
5,love the portability - use battery pack or plug in to usb chargers just great dimming is perfect colour panels great great ambient light for photos Great Crafting lights
5,I’m a photographer and was really skeptical about the price. But they are 100% worth it. Definitely need some dark natural light for full effect but these are great!
5,Great product and excellent output. Combine yellow and orange to have a great effect
1,Terrible. Not what is advertised. Pictures are very misleading. These tiny little lights don’t do anything.
5,The media could not be loaded.                                                                                 the lighting was really high quality and the colours was so cute. All my pictures look cute when using it
5,great product! arrived quickly simple set up and excellent quality!
4,The lights have been amazing for product shots videos and video conferences. My only issue with them to date is that the bolts on the tensioners to adjust height appear to become dethreaded quite easily this has left me unable to both keep the legs open and adjust the height as I can't tighten them in place.If bolts could be improved this would be a 10/10 recommendation.
1,No math with included pictures.
2,I expected more output from this size lEDs. It is basically adding some ambient light. Even if you put it on top of the object that you are filming it will not provide you with consistent illumination.
4,The construction is a little cheap (you have to wiggle the colour panels a little to get them in right). But they're fine for indoor photography. Note they are USB powered and do not come with a wall adapter.
4,These lights work very well for small scale photo shoots at an extremely affordable price. They work best close up and with little outside light. Adjustable brightness and 5 color jells for each light is a great addition. I wish the stands could go a little bit higher to reach face level and the plugs only come as USB so I need to use outlet adaptors. Other than that this product is a solid buy for entry level photographers.
4,The construction is a little cheap (you have to wiggle the colour panels a little to get them in right). But they're fine for indoor photography. Note they are USB powered and do not come with a wall adapter.
2,I expected more output from this size lEDs. It is basically adding some ambient light. Even if you put it on top of the object that you are filming it will not provide you with consistent illumination.
2,It’s a great light source and love the price on this but it
5,Stands are very sturdy. Lights feel cheap but what do you expect for the price. Surprisingly super bright also and the added colour filters are great.
4,The main reason I purchased this product was for the stands... the lights were a "bonus". I needed a couple lightweight stands for putting small cameras on to use throughout my studio and these stands are perfect for that. The lights are good but not as bright as you may think. You won't light up a large area with them but that said I have used them to light up some of my 3D printers while they print and I want to show them on a live or recorded stream. You won't get the 5V USB plugs you need to power them so make sure you have a couple of them on hand or have a power bar with USB ports on it. The only reason it lost one star overall was the brightness of the lights otherwise these are a great purchase.
5,These lights work great! I'm not a video or photography expert. I'm using them to take photos of my drag. I tested taking pictures inside with natural light (from the window) only the room light and these LED lights and the LED lights work almost as well as natural light and much better than the room light. I am very satisfied. The filters are also cool for different artistic colour themes.
