rating,review
2,First I am pretty sure I saw a lumens rating on this product when I purchased that was impressive.  Don't see it now so may have been updated.  Next the images you see in this ad show the light against background objects that have been manipulated to make the light panel look larger.  I have used a couple of times as a light weight portable option for interviews using a Sony Nexcam professional level camera.  When lighting a subject you will see about a 3 decibel improvement in lighting.  That is not much.  Effective use is probably lighting a subject with in about 2 to 3 feet max and then they will cook under the heat of the light. Can be useful for back lighting and shadow elimination.  Overall just too weak for any serious work.  Its what you get with two lights for $29.  My low review has mostly to do with the deceptive nature of the marketing images..
3,Joint at the top of one of the stands was broken.
4,Set your expectations to match the price and you will probably be happy (or at least unsurprised). These are working perfectly the light the green screen behind me for chromakey during streaming and video conferencing.
5,These lights are easy to use and provide great lighting
4,The lights were easy to set up and use. They also have a usb plug in and not a wall plug in so be careful if that’s what you’re looking for. They were perfect for what I needed which is lights for doing videos.
5,Perrfectttt like i bought these lights as a add on to my home photoshoot studio for my online boutique and I am impressed! I was wondering could I sue since the lights hit me right in the eye when I cut the switch on lol that was shockingly painful but shows me that those lights work. Oh yes how can I forget the colorful shades I loveee those so much it literally changed the lights I was so impressed by that.
5,Easy to set up. Don't take too much space. The lighting is perfect for what I want it. It's perfect. And you can't beat the price.
5,They’re a bit flimsy but definitely worth it if you’re just using them for personal pictures and such I’m sure could be put to better use by a better photographer
5,Probably the cable look too fragile but even tho it work great !
4,El producto se ve en buen estado aun no lo pongo a funcionar pero no llegaron los filtros que tengo que hacer?
5,We bought these for our church videos. So much better than the ring light that makes people's eyes look possessed. We use them off to the sides a bit to even out the shadows.These run on regular USB phone chargers or a battery pack if you don't have a handy power source. Very versatile. I've used mine as music stand lights reading lamps extra light at the sewing machine etc. I may buy more for the car emergency kits.
5,I purchased these lights to supplement the natural lighting in my office when streaming. great selection of colors and easy to setup which makes for a great experience. 100% would buy again if i needed to get more lights! Also the hight on them is great for setting up on my desk or next to it!
5,Lights are easy to set up. Brightness is adjustable but I have not tried color inserts. Tripods are a good height to use and height is adjustable to use from the floor or from the desktop.
5,I was looking for good budget lighting and im impressed you get 2 lights for $40 and it's definitely worth it. Works well and is cheap.
5,Great product for the price.
5,They definitely do a good job of lighting up a small space! Very worth it! The colors are very nice and you can definitely see a difference!
5,I've only had them for a couple of days.. but they are SUPER bright they work very VERY well..I was a little hesitant at first (because of the price). HOWEVER!With that being said these are absolutely WORTH the money if you're on the fence.. BUY THEM! you WILL NOT regret it! they're plug and play.  the little color filters they give you are great!the bang for your buck is incredible with these!
5,I have really liked my LED Video Light with 51” Adjustable Tripod Stand Kit. I am using it for workplace projects. We are expanding our internal marketing capabilities through photography & videography so we are creating our own studio space. These lights have done a great job so far meeting our lighting needs to keep our subjects (people & products) well lit. I would recommend getting these. They aren't huge but they will do the job in a smaller environment.
5,Love this light kit. I am photographing small products for a future web site.
5,Arrived when it said it would Love the tripod and versatility. If you leave them plugged in they do remember the settings and the filters are a very nice addition.
5,For this product being as cheap as it is I definitely wasn’t expecting such a good quality! not only is the lighting vibrant but being able to adjust into any height in angle is such a bonus! Highly recommended!
5,really like that the lights have tripods and will run on my phone battery packs. Runs almost 3 hours on a battery pack or plug it in the usb on the computer and it probably runs all day. I generally only use for 1.5 hours or so at a time.
5,Great for lighting if you are trying to do video content. It's very easy to put together.
4,i love the lights made a big difference for the project im working on but my only issue is the blue filter doesnt showe in blue but more white over all for the price it is really a cool device
5,This is a great product that works well for additional lighting. The leds are very bright and its a nice addition that extra colored gels are included with lights.
5,The tripods safe very durable and sturdy. I’m not a proficient photographer by any means but I can definitely see the impact on picture quality with the lighting. I like that these lights are portable and way to set up and use. It will take some creativity to use when an outlet not available to plug these in or your computer is not at full charge. Otherwise this is a solid tool.
4,Stands are good. Lights them self are cheap but bright as hell. Happy with them
3,Not as sturdy as I thought it would be. The light was not strong enough for what I was trying to do. The connections were not properly made.
5,For the price it is an awesome light! And the filters work great!
4,Una de ella alumbra menos.
5,The product was easy to assemble and gave off enough light for my projects. The price was not bad either. I love that you can change the lights to different colors
5,This product is good quality. It comes with multiple lighting colors and has a really easy set up. The lights are very bright. The only con if you can call it that is that It uses a usb for its power source but doesn’t come with the wall adapter. Other than that this product is really nice.
4,It's a good product if a little limited in its lighting ability.  Good value for your money.
4,Great value for the money. It will make my zoom meetings look crisp for sure!
5,My son loves it
5,Just get it!
5,It was perfect for what I needed and allowed for photos and videos to be twken
5,I LOVE THIS! The package comes in set of 2. So you can get lighting from more than just one angle. I love the levels of brightness it gives you. The tripods can stand very tall and short so that’s a plus as well! I love the color options of a light blue tint red white and orange. Highly recommend for photographers and videographers!!!
3,The order was missing one ball head and BOTH of the light stands making both of the lights essentially useless. The lights themselves are amazing but I have nothing to stand them on for my show. Really disappointed because if everything came with it they would have been perfect.
5,With these you don't have to sweat it out in a photo session.
2,First the stands are flimsy and tip over very very easily. Second the USB cords are short and when having to adjust the computer or lighting it pulls the stands over. The lights are bright and can be softened or less bright. The color inserts slide in and stay put very well.
4,Serves the purpose. you can use it for multiple jobs
5,Buena
4,Monitors are kind of small great value though.
5,Fast shipping and product as described. Couldn't be happier. Thank you.
5,These lights were easy to set up and use. The filters provided are great! With Filters I can actually point light toward me unlike others are returned. My only con is I would also like a plug-in option in addition w USB but that’s an easy fix Would definitely recommend!
5,Great quality for the Price. The filters are nice hard plastic and not flimsy at all. I like that you can power these lights off of a usb power bank wall plug or any USB port on your notebook/PC. The stands are decent quality as well. The base is sturdy.
5,Used it for a photo shoot & it gave great light. Even the photographer was impressed & chose it over the ring light. Since it comes with two lights for the price of one it's one of the best deals out there.
5,These are so lightweight easy to use & put off great light. As a Commercial Photographer it was important for me to have something that is easy to carry around with the rest of my equipment. These are compact enough to fit into my backpack.
2,Lights are WAY smaller than I thought
5,Very cool little lights camera pics up on everything now!
5,Perfect for video conference calls. Small and compact and easy to set up!
1,The light is bright enough for my need. However it is made of very cheap material. The head knob broke while assembling. I am not sure if it will even last a month. I am just returning it.
5,These lights work very good for lighting up items to resell and are super easy to use.
5,The reviews are spot on for these lights. They’re light-weight easy to assemble project low to high light levels include quality filters and are easily unassembled for compact storage. They light up my older photo tent for product shots perfectly. Great value! I’m very pleased.
1,The material for the mounts for these lights seem cheap and thin. I would say not the expect these to last.Buyer beware this might work for a little while but with something this cheaply made its possible it may break after the return window has lapsed
2,I’m not satisfied
3,These are not very bright lights. The cords are not very long either which makes using them inconvenient at times. I do not recommend these lights.
5,Si quieres empesar un canal o necesitas luces estás tienen buen presio y son suficientesYo les cambio los filtros de diferentes colores fenomeno da un vistazo en mi canal ministerio de enseñanza gracia y paz
5,I have several products by this vendor. All perfect for what I need it for.
5,Súper practico y hace excelente función
5,My daughter loves it!
5,Customer service from UBeesize has been outstanding. They were super helpful very communicative and helped with getting a replacement for the light that came with a defect. Not the first UBeesize product I’ve bought and definitely not the last!
3,cheap. not what I was looking for.
4,easy to use
5,El producto se ve de muy buena calidad. Cumple con lo prometido tiene 10 modos de iluminación y las paletas de color son de mucha utilidad. En cuanto a los vendedores ninguna queja todo en orden buena presentación.
5,Very Bright and effective great for zoom calls in low light rooms as well as photoshoot. If you're just starting out your career as a YouTuber and don't want to spend all of your money on a light that's stupid expensive. I recommend you try this light set up.
5,I needed good lighting for taking photos of my artwork. I gave this product a try and am very happy with it. Easy to set up and adjust. Can't believe it's so inexpensive!
3,They’re really cheap light and the usb chord is short so it’s hard to get an extension chord for it
1,The lights are bright—in fact too bright for most applications—and the dimmer switches are broken so one has to cover the lights with cloth to tone them down. Not a very reliable solution.
2,I do not recommend for a pro photographer but if you are just looking to add a bit of brightness to your photo I guess its ok. However I don't recommend at all!
5,The light is good!
2,this came with missing and broken pieces i sent it back.
1,Did NOT get the LED lights at ALL. Box is too big. my order looks opened and used.
5,I bought this set for my Facebook Lives. It gives the right amount of light and no shadows. My Facebook Lives look so much better now.
1,The lighting was decent when they both worked. One light stopped working a couple months after I got them. It was the wire. I went to move the light to see what was going on and I noticed if the wire was jiggled a certain way it would briefly turn on. I keep the lights in the same spot at my photography station. They don’t get banged around or moved a lot or anything like that. So I’m guessing it came with a crummy wire and now I’m down to one light for my product photos. When I replace them I’m going with a different brand. I understand you get what you pay for but it should have worked for more than a couple of months.
5,These lights are very bright easy to use and serves our  purpose of lighting up for Zoom meets.  They are of high quality especially for the price.  I’m very happy with this purchase!
5,I was able to use these lights for different purposes.
5,For being so small they do produce a very bright light ! Recommend for the money and quality
5,These are handy and bright! They did a great job of illuminating what I needed! I love the versatility and look forward to playing around with them in different configurations.
5,Exactly what I needed and expected.  Made my own personal green screen studio with light on a budget.  Looks nice work great and not bulky clunky or cluttered..
5,Easy to use and the lights are great and bright!
2,I recently purchased the set while they were on sale and I still feel like i way over paid for them. The lights are not that bright and everything on them is cheap light weight plastic. if you’re just looking for a cheap light set you’ll need 3 sets at least to get anything remotely usable for video and photography
5,Es una opcion interesante el brilo no es muy alto pero para usarlo en un escritobio va genial.
5,I love this product. It was so easy to set up and it is sturdy. I like the adjustable length. Easy to store away as well. You simply can't go wrong. Value for $$$ amazing!
1,The worst item I have bought it’s not bright at all the lighting sucks I was only sent one instead of 2I give it a big fat 0
5,This is a great product.  I only setup one and even that gave the light needed.  The color filters were perfect addition.  Quick and easy setup to use.
5,The light is very bright but the orange and blue aren’t as saturated as I thought they would be but still a great set of light for the price.
5,Most definitely will recommend this to people who love lightingwant to stream or just to make a tiktok! Wonderful product
5,
3,The lights are really small don't really know what you would use them for didn't work for me so I ended up returning them.
5,I was pleasantly surprised with the overall quality and features since I wasn't expecting such a high quality product at such a low price.
5,They work great and easy to maneuver
5,Not bulky and work great for my needs I use them behindy camera for live streaming
5,Value of moneyEasy to useIt versatile because the tripod can also be use as phone stand/ light Weight camera holder
5,Es un producto solido las bases tienen buenos acabados las luces son super poderosas y el precio es el mejor del mercado 100% recomendado!!
5,Lighting is awesome love the adjustment options to keep it short or make them taller. Definitely worth the price.
5,These are nice heavy duty lights that extend to 5'. I am very happy with the promptness of delivery and with the quality of the product
5,Purchased based on another review about the performance of the lights. Recieved my purchase very fast tested the lights and am very pleased.
3,Easy to use. Not the longest cords. Also after 4 uses one of them broke on one of the rod levels and won’t adjust.
5,Great product
5,Gets the job done! Love the changeable light filters. Gonna use for filming and photography.**Short stand but not a big issue.
5,Amazing product! Do the work!
5,This product is amazing and for the price! I thought it was only 1 light stand turns out its 2! Im so excited!!!!
3,For the price I paid I’m not upset about the investment but these aren’t what I expected.
5,Very easy to put together. I love the fact that it gives you color options!
2,The lighting is harsh and fluorescent. Not flattering at all for photography.
5,I was so happy to find lighting that is easy to transport and has a tall tripod. Also a great price!
5,This is my first set of external lighting and I love it. It really will make a difference in your pictures!
3,No es muy buena calidad pero usándolos correctamente son buena inversión!
5,Super easy to set up and goes pretty high. Nice and bright. Great value for the money
5,Very nice product for the price. It eliminates the shadows and reflections on old photos. Highly recommend it!
5,Small lamps but very bright. You can use lamps with or without stands. I am happy with my purchase.
5,So far so good with the lights.  Still getting used to using them.
5,Great lighting system. Used for a video shoot
5,The light our very bright I only have to use one and I’m fine
2,Cheaply made
5,Lightweight easy to maneuver and bright. I wish it came with a plug or an option to add it.
5,They came right away and they were exactly what I was looking for!!!
3,The light works great and it’s sturdy. The colors are hardly visible.
5,The lights work well and they came on time with no drama
5,This light is better then I thought they’re also very bright but can be adjusted
5,It’s well worth the money and although the sturdiness is a bit loose in one part I love it!
5,This was such a great find! I’m enjoying this light setup for alternative to professional lighting. Recommend!
5,La luz difuminada es excelente tiene filtros de varios colores
5,love them!!! so easy to use and the lights are pretty good.
5,Super nice lights and perfect for what I needed to use them for!
5,Very versatile I’ve been using this for streaming and photography and it’s perfect.
5,Great bargain and the lights work great! Exactly what I needed and was looking for!
5,Worth the money. Amazing tripod quality. Sturdy. Bright. Even the filters are quality.
3,Wish they came with the usb plug ins
2,The stands are way too short and extremely difficult to open.
5,Esta increíble es más de lo q esperaba alumbra bastante es excelente
5,Love it exactly what I needed for streaming
5,They work well for my home office!
5,Works great to take product pictures. Exactly what I bought it for!
2,There is a reason there is no lumen number listed: these arent very bright at all.  I'm very disappointed.
5,Very pleased with the quality for the price.
5,These lights are perfect for what I needed them for
5,Easy to use. Nice light. Compact
5,Using it for background fill light. Nice to have their own tripods.
5,Easy to use and great quality. I am pleased with my purchase.
2,The light isn’t as bright as I thought it would be. Could be used for very small areas.
5,Very sturdy! The lighting is great. Happy with the product
5,Live everything about them
5,Great product
5,I love it very sturdy light weight and easy to assemble.
1,I am a content creator on tiktok with over 480000 followers and am constantly making videos so obviously I would need lighting equipment.This product is so unresponsive and constantly doesn’t work I will plug it in with multiple different blocks and it still won’t power up. It only powers up when the cord is bent a certain way or just randomly works. So unreliable and annoying. Never in my life will I buy from this company again and I recommend you all don’t either. So disappointed.
5,Perfect for a simple startup kit. Works as expected.
5,no issues arrived fast worked fine.
2,Everything was fine for the first couple of times I used these lights. Then one of them randomly went out on me and never turned back on. These are cheap but unreliable
5,Good product overall easy to set up would definitely recommend
5,Very bright for being so little
2,Stands are nice quality. the lights are 4" x 6" . Dim junk. Not bright pretty much worthless
5,recomendado el nivel de brillo que da es excelente
5,Can adjust lighting and makes pictures pop.
1,The best way to describe it is.. you basically get the childrens play set version of what you’re expecting. The photos don’t match what you actually get. & for me they don’t light up the way I expected them to. They’d have to be really close to you to light up the way they look on the product pics. They also don’t come with the box thingy to plug into just the usb cord so that’s annoying too. My iPhone 13 is bigger than the actual light :/
5,I dislike it was smaller than I figured
1,Just received this UBeesize LED Video light kit about 20 minutes ago. It was $40 so I wasn't expecting the world however upon opening the box the plastic packaging inside was already ripped open. There were pieces missing scratches and the cords were wrapped around the lights and the color gels were already in the lights as though someone had been using it. In addition the cords were coming apart near the controls. I haven't even plugged it in I'm just going to return it to be exchanged for one that is new. I will post an update once I receive new product.
5,Great product
2,Very cheaply made was missing parts but was wtill usable definitely  I decent starting setup
1,There seems to be inconsistencies in product quality.  One light was nice and bright the other is only half as bright and both are set to their full brightness settings.  I cannot recommend as you may or may not get good lights.  There appears to be serious quality control issues here.
5,Great lights for shop while recording work.
5,Works as described. An excellent value!
5,These put out great light!
5,Works great!
5,Very nice for indoor photography. Good value.
1,I really wanted this product to work because it's light and doesn't take up much space. It failed big time and I had to return it.
5,Awesome product! Love it
2,I have to use both of them for the regular light to be bright enough
5,
5,They do the job
1,Didn’t receive many of the parts included. I did not receive light filter or light for that matter. Just the stands and bolts
2,The lights work but that’s it the stand is flimsy and falls over in the slightest breeze. The legs are pointless and don’t even hold it steady which is important if you need the lighting to stay in place.
2,The light stands fell apart on the first use
1,I bought two of these They do provide appropriate brightness for video shoots But they can't be used for hours as they over heat and shut after few minutes. Need to disconnect let the socket came back to room temperature and then connect them again :(
5,Very cool
5,Great value!
5,Amazing
5,Good lights
2,Isn’t as bright as they say. Stand is sturdy so I’ll keep them for maybe an accent light. I wanted these for backlights and they can’t even do that.
2,These stands were opened gently because I was demonstrating how if you use too much force you can break stands.The first time I loosened the stand the wing nut broke off completely...
1,UPDATED:  After no response from the seller and very little help from Amazon I conducted a full return of this defective product.  Buyer beware.*****While one of the lights works fine the other is defective and won't allow me to select a lower setting as advertised.  After multiple attempts to contact the seller I have not received a response.  I will update my review should that change.
1,It’s cheap was very disappointed
2,We received the item Wednesday. Hooked it up Thursday. Today one light doesn’t even work.
1,Rome 2-3 after first use. Very poorly made
1,After a week of using it one of the lights do not work any more.  It will turn on for 3-4 seconds and then completely shut off. Cheaply made
1,Sent it back the next day. Didn’t do anything for my photos. And the colors make for a cheap aesthetic
2,These lights are very cheaply made very poor quality easy to break or damage. They are not worth the money.
1,what a joke!. 60-watt bulb equivalent maybe I need to pour light on my green screen. this lighting was to be supplemental for my setup. nope. it is time to go back to clamp lights with 100-watt bulbs and find some way to position them. jeez. do I have to buy another light kit? I am returning this.
2,The base is too narrow and do it tips over easily.  Very dim lighting. The price is good though.
1,Parts are cheaply made and one of the ball heads came broken.
1,One of the tripods has a rusted screw!  Looks like it was wet when the cap was put on.  The other one looks okay but now I’m wondering how this happened and whether I should return both!
1,My flashlights have better light than this!
1,Both lights stopped working within 3 months of purchase. I originally thought they were great for the price but now I have to buy new ones. Purchase better lights from somewhere else.
1,This product was very inexpensive. I returned the lights as they were toy quality. You get what you pay for.
1,I expected too much from these the cords were too short the lights not bright enough the color shades are hard to change. You’re better off spending more on a quality light.
1,I thought it was much bigger and one of the lights broke during my first photo shoot. I looked at the core and saw that the wires were showing. Cheap product.
1,The lights are not very bright; the color filters do not result in very much color
1,I purchased  these lights based on the great reviews and the price-point. Unfortunately it's 6 days later and one of them already doesn't work. Pretty bummed - what a waste...
