rating,review
5,I have used 5 dash cam before and this is the one with best quality e.g  I cut the wire open and found out the wire is made of solid gauge of material instead of cheap slim cooper hair. Interface is friendly. The reminder sound is a little bit loud but you can turn it off
5,Muy buen producto
5,Clear picture and easy installation.
5,Easy to install and good quality.
5,We have been using this brand for several years now.  There are no complaints.  Great product durable easy to use and install.  Reliable.
5,I think this is the best dash cam. High quality video image easy to install just need some patient to install in the car very easy to control and smart ADA
5,Has dual channel camera support. Easy setup.Has a built in GPS a plus and can track your speed just in case a corrupt poly officer pulls you over.
5,The image is far clearer comparing to my other branded dash cam. Considering the price this is a great buy!
5,This camera was very easy to install. Seems to work great so far.
5,Worth 5Worth 5 stars
5,Ergonomic design high res. They give a spare film to stick to the window but i wish there is more or if they sell separately.
5,Works great easy to set up good app easy to update firmware.Feels and looks very well build all you need is a 128gb micro sd card.
5,I hired someone to install it. Other than that great dashcam for the price!
5,Interesante facil de instalar...La calidad de la imagen mejor de la que esperaba..El producto cumple con lo que promete....LO MALO-La dashcam posterior tiene un angulo que para ciertos parabrisas hace imposible que queden en un punto adecuado para grabar... concretamente mi C200-No tiene modo centinela como dice la publicación....
1,Amazon recommended this product to me when I bought the '70mai Dash Cam Pro Plus' (it's a great camera) it feels with quality materials good picture but it doesn't work with that GPS module it can't fit with the camera. Read well the model of dash cam you are going to buy to make it work with that module.
5,Only price is good when is on sale
5,Great quality for the price. I was surprised on how good it got the video. I recommend
5,Nice.
4,La cámara está excelente la calidad de la frontal también fácil de usar funciona excelente pero la camara trasera tiene mala calidad apesar de ser fulll HD no se distinguen las placas la app no funciona bien solo puedes ver la camara frontal una vez que entras a ver videos se suspende la grabación
4,Todo iba bien las primeras semanas buena calidad de imagen en la cámara delantera adecuado el uso de GPS para ver el recorrido del vehículo la camara trasera no tan buena pero cumple su función pero recientemente a un mes y medio de adquirirla estoy notando que cuando se calienta mucho se apaga y deja de grabar eso es molesto por que hay que esperar a que se enfríe y vuelva a prender que mal por eso apenas note que si no conecto la cámara trasera tarda mas en calentarse ya apagarse.
4,Se tarda en reproducir un vídeo desde el celular aún necesitan mejorar esa parte lo demás está exelente la dejé en el estacionamiento con una pila portátil y se mantuvo grabando todo el tiempo aún no descubro cómo apagar la luz verde y la pantalla cuando está encendida (en la mayoría de lugares es preferible que no sepan que estás grabando)
1,No funciona no lo pidan lo tuve que devolver
5,Excelente imagen no distorsiona con los defectos del camino soporta memorias de 128gb
4,Funciona muy bien tiene gran ángulo de grabación ambas cámaras funcionan como deberían. Califico con 4 estrellas porque en ocasiones he dejado la cámara colocada mientras el auto se encuentra en un estacionamiento sin techo durante periodos de 1 hora al regresar y comenzar el camino a mi siguiente destino se apaga después de unos minutos y hay que volverla a prender manualmente. Es raro porque hemos hecho viajes largos durante días muy soleados y no falla pero si se queda un rato apagada al sol después es cuando presenta esa falla.
5,Es muy buen producto que me ha funcionado muy bien en las dos semanas pasadas que llevo de uso cotidiano su interfaz es facil de usar y es facil de instalar.
1,I was brought front and rear camera. After I got for a weeks. They adjust price for rear only need add about 30dollars I was spending too much for rear cameras. Not worth
3,me encanto el producto su calidad y presentación pero la aplicación para wifi no funciona y la descargue en 3 celulares apple de diferente versión fue imposible de configurar compre una memoria clase 10 y en la configuración y uso previo para ver su funcionamiento e instalar no se por que razón me la quemo y por mas que intente borrar y recuperar ya no funciono.....me quede con la ilusión de utilizar esta camara y me ilusione mucho por que vi muchos videos y funcionaba bien...en la aplicación dice que desde la actualización del IOS de 2021 falla el proceso de conexión ......a mi no me dejo ni verla en el celular
5,Excelente producto justo lo que esperaba y llegó antes de lo indicado por UPS
5,Buena cámara pantalla chica pero no es necesaria si se maneja doble cámara y buen material
5,Esto deberia de ser obligatorio
5,Son excelentes y cumplen con su objetivo tiene buena nitidez
5,Ya había probado varias dashcam y la verdad esta me sorprendio ya que su calidad es muy buena la recomiendo.
5,Es un buen producto de muy buena calidad. Lo recomiendo mucho. El único inconveniente es que cuando detecta varias vibraciones fuertes seguidas se desconfigura el horario.
2,Funciona muy bien pero si está mucho tiempo expuesta al sol presenta fallas hay que quitarla para que si le de el sol directo.
5,Excelente producto no se arrepentirán el mejor costo beneficioCumple con creces
5,La cámara se siente de buenos materiales muy fácil de configurar y la calidad de video es muy buena.
4,Great little camera for the price.
5,Awesome dashcam with a lot of functions. Nice design and the app is easy to connected. Stay tuned for a review after using
