rating,review
5,UPDATE: WARNING this could drain your car battery if you have an older car. I left it in for 3 days and my car didn't start the first time during that whole time LOL. I was super worried but once I unplugged this charger my battery slowly recharged again and now my car starts every time with no issues. This is still a great car charger but beware if you have an old chrysler 300 2007 you're gonna have a headache. Just make sure you unplug it when the car is off. This issue is my cars problem and has nothing to do with the product but it's something to be aware of.-Original review:Does exactly what it's supposed to do and fits nice and sturdy. My husband can charge his phone super fast and I can charge my older phone in the other port. Haven't had a good car charger in years. (:
5,Got this because I game on my phone and my old charger would only keep me at my current % not charge my phone while playing. This charger works great and super fast
5,Most car chargers are so slow there not worth using! This was a great buy and it's a quick charge
5,Recommended
5,This is indeed a super fast charger. It charges my phone in the same time as my home charger.
5,Very good
5,Product stopped working properly after 2 weeks..
5,nice
5,A fast charger that really works in my car. I have a 5G Samsung smartphone.
5,Definitivamente el mejor que he comprado. La carga súper rápida es en el C. Comprare otro
5,Charges fast for a car charger best car charger I have ever had and it works for my Samsung galaxy s20 ultra just as good as my home charger
5,I have had this product for about two months. I have used it in my car once on a long distance trip to charge my phone. It is a fast charger as advertised. Seems to be strong and well made.
5,Absolutely a fantastic buy super fast charges my Galaxy S21+. Keep in mind you have to use USB C to USB C Cable!! Have one in both of my vehicles.
5,Best fast car charger I’ve ever had! Finally I can keep my phone charged on trips. If I stop to go for a hike or take pics I no longer worry about battery draining. I plug it in when I get back in car and it charges incredibly fast. Totally with it!
5,It charges your phone fast. I’m satisfied with this charger. So far so good.
5,Works great cuts my charge time in half!
5,I have a Samsung S22+ and I wanted a charger that would put it in superfast charge mode just like its wall charger does this charge does that. Works great for me.
4,Perfect for my vehicle love the durability and long cord. Easy to use
5,The first one worked so well I bought a second for our other car.  It charges as fast as any Super Fast wall charger.  A few months in and no issues.  Recommended.
5,This little charger with charge cable combo works so well we ended up buying 2nd one for my wife's car.It charges fast and the blue LED light is not too bright so the light doesn't impair night time driving.
5,Bought 2 of these one for car other for motorcycle super fast charging on my z fold 3
5,This product exceeded my expectations. Great product
5,I gotta say Ive been pleasantly surprised by this little charger. It Super Fast charges my Note 20 Ultra 5G no problem using any of my 2015 explorers DC charging ports. Im tempted to get a few more of these so that my wife and I can charge both phones at Super fast speeds if needed with out the need to move chargers from 1 vehicle to the other. I really like the USB C cable it came with. Its a good quality cable and will most likely last a long time especially if its left with the charger and not moved around a lot to be used for other things (I know people like to use cables for different purposes like connecting to a laptop or TV of they find a good cable Ive been guilty of it my self). This cable can probly stand up to being bounced around if need be but Ive become more of an advocate for having a quality cable for each task you need to help extend life of the cables. Im not hard on them but instead of getting 3 years Im not getting 5 to 6 (with the excption of the cables my 6 year old uses for her tablet lol). Overall this chargee does a great job. I go from 20% to 80% in no time at all. The cord that comes with it is more than long enough to reach passanger side or 2nd row bucket seats with out needing to move the charger to the rear DC charge port on the center console. I can keep it blugged into the the DC port inside the center consoles storage compartment. While charging can create a SMALL ammount heat whith the in CD phone mount I have I can point on of my vents at the phone if I feel the need (which I have yet to do) to cool it off. I would 100% reccomend buying this compact little car charger. For the price theres nothing out there that can beat it for quality and performance.
5,Love this
5,I've been using this dandy little dual USB/Type C car charger for about 3 months now and I am more than happy with it! Not only does the charging cable fit snuggly but my phone actually fast charges with it. The USB port works well. My only negative which is really more of a wish than a negative is that it had 2 of the C ports. I recommend 100%.
4,Not quiet as fast as home charger but still a lot faster then most about an 1.5 hours from a dead battery. Galaxy S22
5,Was just as advertised. Bought it for my new Samsung S7PLUS Tablet but I got the car charger 1st and tried it with my old tablet and it didn't charge it any fasterso I was ready to send it back because this is the 4th or 5th "FAST" charger I bought and none of them put out the promised 2 amps. But my new tablet came and 1st I charged it with the factory charger in the house and it was semi fast at charging the new tablet. Then the next day I had run it down to 35% power and hooked it to this new 12V charger and was completely charged in well under an hour and the cord and tablet never got hot or even warm. So I would recommend it to everybody. Was refreshing to buy the charger and it worked better than advertised. Worth twice what I paid for itBuy it with no reservations. Thanks......The Dude
5,Works great i have 1 in each of my cars
3,Bought this as a solution for work truck. Every going as expected. There was a decrease in charging  and eventually stopped working all together. Replaced the cord good as new. Ideally the cord would last more than a couple months
5,I usually travel a lot for my line of work and use my phone constantly. I'm one of those people that enjoy their phone being fully charged at all times in case of an emergency. This charger definitely charges my Samsung Galaxy Fold 3 quickly even on short trips. It beats my old car charger by a landslide.Pros:- Fast Charging- Blue light helps my see the plugs at night- Value for the moneyCons:- None that I can think of (Which says a lot considering I'm extremely picky)End Results:I would definitely recommend this charger to my friends/family/others seeing as I use it daily.
4,Real supercharger
5,I have had this for about 8 months now and initially it worked great! Lately I have noticed that my phone had not been charging.  The plug in is fine however the cable has randomly stopped working. I replaced the cable with one that I had in the house and all is good.
5,Best supercharger!
5,This charger works very well for my S21 Ultra phone an the price ain't bad either.
5,It looks very expensive and cool! It was worth the price and im glad I didnt pay an arm and a leg for a car charger. I recommend buying this to save money and if you want it to be for your Samsung galaxy s22 ultra! I know i did and it's a super charge. My phone charges really fast on the road. No issues at all.
5,Does what it says  supports Super Fast charging in one port and one fast charging. Ours came with a charger cable so Great value 👌 got a second one for our other car.
5,NOT A FAST CHARGER BUT GOOD DEAL FOR THE PRICE.
5,Very fast charge..love it
5,These are amazing initial numbers and it does activate "Super Fast Charging". It blew my older Samsung QC charger out of the water...but I do have questions about long term durability.The official Samsung one is sold out everywhere except on eBay it seems so I'm giving this a try. Will update if anything goes weird with it in the futureInterestingly the Ampere app detects this as a Samsung charger so not sure if it has a Samsung chip in it or why that is happening
4,The head charger works really good but the wire itself for some reason stop working after 2 weeks that I bought it no damage to it it just stop working.
5,Super fast charging as says and holds up had mine for months still works great.
5,Super fast charge samsung galaxy A72
5,I was so close to spending more money on the 45 watt samsung car charger and I'm so happy I went with this product instead. My main concern was getting super fast charging for my galaxy s22 ultra and this product does it. At no point did the charger or my phone get hot. Overall I'm very satisfied.
3,Takes a long time to charge the phone
5,I needed a car charging device that accommodates both a USB and USB-C and this device fits my needs.
5,'Nuff said.
5,Good quality charger.
3,Only the C port is fast changing
5,Fastest charger I've ever seen. Only issue is the rubber base is rather large. If the device case has a small port the large rubber end may not let it plug in. Other than that it's excellent.
5,Has to be the best car charger I have purchase in years! Cord is durable and perfect length A+ Product and seller Super fast delivery!
5,I like it all only took me 1 hour to charge my phone
3,Great charger. Charged super fast and then one day all of the sudden it stopped charging. Not very happy.
5,Extremely fast. Durable. Inexpensive. I got 2.b
4,If you have used multiple chargers on newer Android phones (specifically Samsung) you probably know there's a difference in charging ability. The newer phones are capable of "Super Fast" charging. The difference is significant. My previous car charger would only charge my Note 20 Ultra at the 'Fast' rate. This Binboubou (ridiculous name aside) charges 'Super Fast'. The difference is anywhere from 15-30 minutes from less than 10% to 100%.The charger was delivered quickly. It worked exactly as expected. And the blue light is cool looking. I'm happy with my purchase.
5,It works pretty good! I don'tget concern anymore if I forget to charge my phone at home
5,WORKS GREAT
5,I am very happy to report thisncharger is working well. The included cord is very sturdy and really nice
5,It super fast charge my Galaxy S21 ultra in less than 30 mins 70% from 20%.
4,No dislikes.
5,now that everything is going USB C its great to have both options in the car and the USB C cable with it is very good quality
5,I use this product in my vehicle so far its holding up well and charges superfast unlike other car chargers
5,very nice item works great
5,Amazing car charger. Super fast charges. Perfect for commuters
5,This charger is definitely worthwhile. Charges super fast!
5,This charger is awesome and fast...
5,Works great for our note 20 and Galaxy s21+
5,Charges my phone unbelievebly fast.
5,Buying electronics from unknown suppliers is always something of a gamble I think. In this case it paid off. This charger has worked perfectly. I like that it lights up so that I know immediately that I have plugged it in properly. (I always unplug it after completing a charge.) Furthermore when it said it was a fast charger it was absolutely telling the truth.
5,nice charger
3,It charges at standard fast speed ONLY; NOT Super-Fast as proclaimed in their ad along with my Samsung phone model which it should have charged at Super Fast.  Fast means a full charge at around 2 hours where Super Fast charges fully at about 1 hour 15 minutes.
5,Love the fact that the cable is heavy duty and the charger fits perfectly to the outlet have not needed to readjust at all
5,Product seems good. Looks as expected havent used it yet so I can't say how it works. Delivery was fast and packaged well.
5,This product is amazing and I would definitely purchase it again.
5,Been using this product everyday for 3 months and it's super fast charging would highly recommend
3,This product is great in the sense that is will fast charge. As a long distance driver. It will over heat and says it's charging but will not . You could be charging and lose charge at the same time. Have to unplug to let it reset and then it will charge.
5,This product is exactly as described.  I like it!
5,Quick charge it has a very nice blue glow.
5,A
5,Great charger. Does the job quick.
5,I bought this to charge my Galaxy A52 5G phone.  The charger works as specified.  Using the USB3 port the phone charges at 25 watts and using the USB2 port the charging rate is 15 watts.  The provided USB3 cord seems quite rugged and seems sturdy and well protected from accidental damage.  The idle power draw is only 10 Milliamperes when plugged in and not in use so it won't run down your car's battery is you accidentally forget and leave it plugged in for a couple of days.
5,So far I have not found anything that I dislike about the charger. It super fast charges my Samsung Note within 45 minutes. The cord is sturdy and comes with a rubber locking thing that wraps around the cord. The cord isn't that long but it's good enough for me. I suggest a longer cord but the one that came with it is good too.
5,I have had this charger two weeks. This charger is fast. Blue glowing light around the charger shows it's plugged in. When ordered didn't realize it had one USB port and one c- type port. The cord is c-type on both ends. Cord is sturdy braided cloth and long enough. Charged my phone super fast. So far so good. We'll see how well it holds up. I use it daily.
5,I have S22 plus works great
5,Me gusto mucho el producto en realidad SI carga en Super Fast Charger que es algo que otros productos te ofrecen y al final no se cumple.Recomendadisimo
2,Purchased less than 90 days ago and the cord has already stopped charging my phone. Not a happy camper. Will not buy again.
5,Cheaply made but serves its purpose. Charges as super fast on my A71 5G just like the original wall charger.
5,For the price well built and charged quickly.
5,I was so glad this came in time for our trip! It worked great in the car the length was long enough that I could use it from the dashboard or the back seat of the car which was nice so that when my husband had to charge his phone at the same time we could both do so. It also fits tight into my phone port which I was worried about so that's a great feature to the charger.
5,Love it and the charge is super fast!!
5,Exactly what I was hoping to relieve and it works perfectly well. Happy it came with a cord along with it to use.
5,I really needed small and slim charger that can charge my Nintendo switch doing driving.Also extra USB with quick charger for my iPhone to charge.I have been using for past 1 week andOverall it did charge switch and iPhone with no issue and it do glow in blue light which I thought it was handy using night to see.As bonus it comes with typeC cable which was very durable and thick cable which is very good quality than I thought.I would recommend this USB charger if you are looking for Type C port with USB for car use!
5,The first one was defective but the replacement works fine
5,That's what I was looking for and exactly what I got with this nice little charger.  Love it!  Ordered 3.Will update review in a few weeks/months.
5,Worked perfect plus it lights up blue to find it easier at night.
5,It was delivered quickly and it seems to be well made.
5,The absolute best car charger ever created. I can have my music playing using Bluetooth navigation running and still give me a full charge in about an hour from 15% (S21 ultra)
5,This is great! Charges super fast.
5,Charger works as described great buy
4,Better than what I had .
5,This is a very sturdy charger. My only complaint is that it's a bit hard to plug in and remove. But other than that very happy.
5,This guy does super fast charging on my S20 Ultra and the included usb-C cable is nice quality.A+ value for the price
5,Some people are complaining it doesn't work well that's because your phone doesn't support PD 3.0 or QC 3.0. So before purchasing this make sure your phone supports fast charging based on power delivery PD or quick charging QC.
5,This charger works well looks cool and charges everything really quickly.
5,As expected charges my Galaxy Note 20 Ultra with the same "Super fast" speed as the included wall charger does that my previous car charger does not.The cable feels durable so far appears to be a great value.The second port is traditional USB which is fine for my needs (other devices not same "quick charge" compatability).
5,Excellent Outlooking during the day time especially Cross Carbon Texture.  And Blue Illumination is very beautiful at night.  It is surely match in my Car.  Additionally there are both USB Type-C & Type-A.  USB Type-C built in "PD" function and USB Type-A built in "QC3.0" even "Compact Size".  Besides it is include USB Type-C Cable which looks Nice &Sturdy.  So it is just "Right" Car Charger for iPhone and other devices in my car!  So far I am satisfied!!
5,I like bcs it is fast charging which is very helpful. I like the design as well it looks pretty nice with the lights on blue.
2,Worked great super fast charging completely stopped working 31 days later. Shame was good while it lasted.
3,Sometimes work properly i mean sometimes provide fast and somethime regular charge
5,Perfecto justo lo que buscaba trabajo con el teléfono todo el día en doordash y nunca  aja de 100% compraré otro
2,The charger itself worked great. It had fast charging and would charge my phone fast. Unfortunately the durability was poor. I have only had it for a month or two and it broke down on me. I wouldn't recommend it for a long term charger.
5,The cords do not tangle. Super fast charges just like the Samsung-branded cables.
2,I drive a 2015 Toyota Avalon XLE Premium.... device wont stay in outlit..... have ro keep pushing in further in.... thats with all ports... Does super charge though! Using Samsung Galaxy S21 Ultra
4,Light is too bright I don't use it because it's distractingly bright at night
5,I really liked this charger it charges fast.!
5,This charger is a beast charges my note20 fast better than my last one I had..
5,Super fast charges my phone perfectly.
5,It's charging in 100% rate for my Samsung s21 ultra phone.
5,good fast car charger
5,This car charger has works great for 3 weeks it real super charge my galaxy S20 and much quicker than my previous car charger the blue light is soft and makes it easier for me to find it since I do a lot of night time driving. The included USB C cord is surprise it fits the car charger and my phone well love it
4,Works as described
5,Not really a complaint but I killed my friends battery. Although I leave it plugged in constantly in my car. I would recommend unplugging it if you have an older car.
5,Saying that I'm driving from client to client a lot now and using my phone more the charger works awesome on my Samsung Note 20 Ultra with the fast charging capability.
3,Used it for a month and the tip at the bottom broke. Not durable at all.
5,
5,Very good charger.  Just make sure you unplug it when not in use.  It will last a long time for a charger.
2,Cord doesn't work.I plugged in my phone and it didn't charge. I tried different boxes and still nothing. I've yet to try the car charger. Will review once I have.
5,Super fast charge from your vehicle. Pretty straight forward.
5,This charger is fastbut I especially like the ability to use the extra cable to charge more items either in the front or second row of my SUV.  When charging one phone I can store the other cable out of the way.
5,Still going strong after 1 month. Super fast charged for samsung s21 ultra
5,Great product! Bought this for a trip and would have been happy if it sort of worked. Instead it of mediocre  it was great! Charged my phone fast and I listened to audio books without running the battery down.  Highly recommend.
2,It worked great when I first started using it. It would be unfair to say it lasted 2 months bc that's not the whole picture. It literally last like for 12 uses.  I always took care of it never dropped it. I had it in my car the whole time and would unplug it when not in use. And now it stopped working
5,I love it...it's defenetly a fast charger!!
5,Product  detail was accurate works great. Would buy the product  again when needed.
5,Looks durable and works as described. I like the carbon fiber look as well as being lit blue. The cable is very good and looks very nice. I give this 5 stars.
5,Is an aweso.e product. I use it every day.
5,Super fast charges as stated. So far so good.
5,Really is super fast charging
5,It's a good durable car charger it charges just as good as a wall adapter and the coolest thing is the lights in it
5,Works fine
3,5/10
5,After several months if use...the cord that is attached stops wirking..working... 2nd time this has happened with this product
5,The main feature is Superfast Charging in the car  which I wanted and i am happy with the product.
5,It works great! Charges superfast and I love that!
5,Charges phone quickly and lovely blue light. Glad I purchased.
5,Works as advertised.  Very happy with DC Charger.
5,Appears to be well made with quality materials works very well.
1,First the cord didn't work immediately about 15 minutes into using for the first time the the whole charger quit working.
5,Nice item. Works well.
5,Great super fast charges my S20 quality durable looking cord.
5,This one actually works when you plug it into your cigarette lighter it actually shows up on the phone as fast charger
5,All is as described I'm very satisfied with my purchase.
5,Perfect addition to my car charges fast and doesn't need too much space
5,The charger works great and charges my devices super fast!
5,I have a Samsung S20 ultra and it works perfectly. Good quality product. The charger is fast.
5,Works as intended
5,Me asombró el poder de carga estoy feliz con esta compra felicidades a quienes la produjeron y a quienes la venden.
5,Great charger!  Never knew how slow my other charger was until I received this one!
5,This charges my Samsung s20 Plus at Superfast speed I'm completely happy with this product. No complaints whatsoever
5,Use it every day I am in the truck another one I keep in the tractor for long days.
5,It charges has it says it does
1,Charger stopped  working out of the blue. Literally had this for a month.
5,The charger charges real fast  and I love the blue ight when it's on Tj6 charge cable high quality.⁰
5,Charges my phone very quickly. Highly recommend it.
1,Worked great for a month. Super fast. Until the metal that connects on the end end pushed back into the charger and no longer got juice.
5,I totally recommend this product!!!!!
5,Carga rapido
5,Works great actually charges at the rate my wall charger does.
5,It's better in real life. Works perfect with Samsung S21ULTRA
1,I don't recommend this product after it cracked within the first 3 cracks
2,When it work gt wap a dream come true and then it just stopped working. . .
5,Poder de carga
5,Love it
5,Great product
5,This is a great charger for my S21 5G
5,Works great and charges my Galaxy S21 Ultra super fast.
1,I wanted a super fast charger for my phone to use in my car. I don't know if the one I got is defective but when I plug it in it says super fast charging but it charges slower than my non super fast charging charger. Currently I'm at 36% and it says "53 min until full" but at the rate that it charges it would probably take 8 to 12 hours.
5,Delivered on time. Great quality product. Thank you!
5,Easy to use
5,Durable fast charging adapter. Works perfect with my new Galaxy S21 Ultra. Must buy
5,Carga muy rápido y lo reconoce como original
5,Bright blue pretty cool sleek look! Great cable and the double port is awesome!
5,I loved it super fast change.
5,Bestt charger that I have ever purchased ... Very google quality
5,Worked great for Super Fast Charging for the Note 20 Ultra.
1,The cord failed after a week. The charger works great but I had to spend and additional $15 at a boslx store to be able to charge my phone.
5,The charger works as described
5,It gives a slow charge
5,it works well and fast
5,Good
5,Good product
5,Works as expected
1,This didn't last but just over 30 days so of course can't return it. It doesn't charge fast or hold a charge anymore. My husband's phone battery starting going down when plugged in
1,After about 6 charges the entire metal end of the charging cord came off! If that wouldn't have happened I probably would have rated 5 stars.....
5,Works great
1,broke eight weeks after purchase...connector comes loose. another garbage product sold by the new unfriendly Amazon. they refuse to return because the return window closed TWO  days ago. pathetic. Amazon is not focused on customer satisfaction anymore....too bad
1,I bought two of these. One quit working at 2-3 weeks the other lasted about a month. For a brief period it worked great with super fast charging then it just quit working.
1,Got it in January..stopped working in May. Used it sporadically so it wasn't overuse. Try another brand..maybe you'll have better luck.
4,Its sturdy
2,First times was charging properly then every time last longer to charge
1,I got it right out the box and plugged it into my car and it didn't work. Yes I've tried other cars as well.
2,Did not well while charging 2 phones on the sametime
1,Just use one month. Return window is 1 month .after 1 day return window closed is broken.
1,It only worked for a few hrs then it stop ... tried it in another car same thing maybe just the one I had didn't work but if it did it would have been perfect
1,Broke after 1 use
