rating,review
1,Let me start my review off by saying this camera was exactly what i wanted when searching for a dashcam.I have owned a few other dash cams and for the price this camera has lots of features and decent camera quality at a affordable price. The design is perfect its low profile still has a screen and has both front and rear cameras.My only complaint is the 70mai support. The camera I purchased died within 3 months of the purchase date. It started randomly rebooting while driving and then eventually just stopped booting at all. The camera would make it to the 70mai logo and then just crash. I figured everything would be fine as it was still under warranty but man was I wrong. Their support team is by email only and its absolutely abysmal. I went around and around trying all the things they suggested and after 30 something emails and multiple attempts at all their tasks they ended the support saying I needed to contact the original retailer for assistance.If you get a good camera and can live with rolling the dice on its long term quality the camera is great. However just pray you never need warranty support as even though my camera was under warranty I was never able to obtain a replacement and decided to buy a different unit from another manufacturer in hopes that they will provide better support over the warranty period.
4,I like the camera and all of the hardware but the software seems outdated and it kind of difficult top use. you can only look at the saved video's when you are connected on the cameras Wi-Fi hotspot and the videos save in weird increments.
3,The rear camera has to connect with the front camera also the rear camera doesn’t turn as much( 90 degree )If you have a SUV when the trunk pop open camera disconnect( due to short usb line)Camera works awesome though.
3,I’m very impressed on the quality of the video. Fairly easy to set up but ran in to an issue on mounting the front dash cam. Turns out it’s missing the mounting plate or base to mount the actual cam on. Not sure if this is something that’s available through their site yet so I’ll update this review as soon as I find out.
2,The app for this cam is completely unusable. I got it to connect twice for the time I had it which was really frustrating. I ended up returning it because while my phone connected to the cam's wifi it would not open the files on the app or show me what the camera could see. Why keep it if you can't view the files easily on the phone? Turns out several people have reviewed the 70mai app and have had the same exact problems. The sound and military time was not customizable either and the device is quite loud even with a low setting and the speaker covered with duct tape. The cam was low profile and easy to install but pass this one up. I returned mine and got a Rove instead that I can actually access the files. Trust the reviews of the Rove and shell out the extra $20 for it.  It may not have a rear cam but it is much more user friendly.
5,The media could not be loaded.                                                                                 This is a nice camera. I am ready to prove someone wrong!
3,The idea of dual camera front and back is great for the price. Image quality is great that being said 3 min clip takes 500MB for front camera so you can calculate how big SD card you need. I have returned it because of no parking monitor without extra cable you have to buy. Most newer cars comes with non-stop 12v power outlet to power the camera simple as that. Another issue I had is that camera was shutting down while parked possibly due to over heating. For the price the cam is great but with issues I have encountered it a no go for me.
4,La batería estaba dañada y es muy difícil cambiar y conseguir no hay técnico que las arreglen
3,refunded
5,Muy buena compra. La camara frontal tiene muy buena resolucion en cambio la trasera si le falta. Facil de instalar. Lastima que no tenga la funcion de voz que la mas basica si trae.
2,The dash cam always say low battery after 10 month use. Very disappoint!
2,It’s a cheap front and back dash cam. Except after about a month of use the back dash cam doesn’t work anymore so I’m not sure what that’s all about.
5,So far so good.  Easy to install.
4,Excellent video quality easy installation
2,I constantly get an error that the memory card is damaged.  I have tried 2 different cards that are made specifically for dash cameras.  It doesn't matter.  The system will work just fine for a little while and then will give the error.  I have tried resetting the camera unplugging and plugging it back in.  Re-seating the memory card doesn't get the error to go away either.  I am at my wits end.  The company website doesn't really provide support other than a half-hearted FAQ session that doesn't really address anything.
1,I purchased this camera with the highest of hopes. The camera appears to be amazing in every way upon delivery and installation. However minutes after starting the camera it rejected my microSD card. I removed the card and it was nearly too hot to hold on to. I replaced it with a different card. The exact same events followed. I tried to read the cards on my computer and they were destroyed. I exchanged the camera with Amazon. New camera brand new SD card. 5 days later the camera reported bad microSD card and shut down. I unplugged immediately. Reviewed SD card on my computer. Files were still good. SURPRISE!!! one must purchase an app to read the video codec. $.99 for a codec that due to failed camera can not be used. At least the SD card is not damaged. 70mai tech support is useless to say the least 2 day response time as you are dealing with tech in China. 2 separate cameras same issue. Highly recommend just moving on to another product as I will be.
2,I’m a fan of these Dashcams and have several in my vehicles. But this one malfunctioned after 5 months which is unacceptable. Will not be purchasing any more 70mai products.
5,So good
5,Es una DashCam de muy buena calidad. Fácil de instalar. Las grabaciones son excelentes. Entrega en Colombia en 4 días
1,Let's start with the pros:○ Compact design○ Great image quality and very saturated picture/video○ WiFi is toggled ON on demand  keeps my phone from getting connected to dead WiFi unlike my YI dashcamNow to the cons:○ Startup and shutoff sounds are annoying minor I know○ Rear camera is difficult to install properly with hiding the wiring on a hatchback.○ BIGGEST ISSUE the camera cannot withstand any heat. If you live in hotter climate think twice about a camera with battery. I had to replace my original purchase because it damaged three microsdxc u3 cards. It records for 10-15 seconds and then it gives error. I'm down close to $50 in cards so I'm hopeful that the replacement will perform better and as it should. I don't want to think about having to undo the wiring I spent several hours running properly.
5,Works wonderfully with affordable price. User-friendly menus wifi data transfer works well. To make it clear this product doesn't come with voice command feature.
1,I installed this camera on my MB GL550. The camera turns on then suddenly off. All my 12 volt socket wouldn't work. I have 4 12 volt sockets total in my car. Fuse was burnt. I have had my old Yi dash cam and other USB charging device without any problem. So I gave it a second try couple days later. I removed all my other charging devices only have this dash cam plug in.  It worked for 5 miinutes then off again.  My fuse burt again. I wouldn't want to try it again. So I package the item back and return it.Worst of all! I got charged $17 restocking fee!  For an item that's defective? I chatted with Amazon agent. First one said the item was shipped back damaged. Second agent promised me a full refund. Third agent admitted that it was the seller that charged customer restocking fee. This was listed as PRIME item but no PRIME guarantee because it was not sold by Amazon! I wouldn't buy an item from seller who charge restocking fee for defective item!  DON'T BUY!
5,I bought this dash cam because I got hit in a parking lot.  My nephew recommended it too me as he owns the same one. He won the court case thanks to this dash cam. It was easy to install!!!! Easy to use!!!! I am loving it!!!!
5,The cameras were easy to install and video looks really good.  Great price compared to other cameras that do the same things. The app on my phone works well and easy to use. Can’t say for longevity of product but have the same brand in my Jeep for a year now. Love it thanks
5,It’s easy to hide behind the mirror if it bothers you and u can turn off the screen if it distracts you
1,This set would get to hot and quit working and turn off or just beep with a black screen until you disconnected power.Do not waste your money if you live in a hot climate.Did not even last 90 days.
2,Rear camera quit working after about 2 weeks and still won’t display image I started a return and haven’t heard back from anyone
2,For you yo have parking surveillance it ask for a cable even that the system have a internal battery  it will no allow you to set up parking surveillance.The real reason why I change to this one  I will return it now.
1,Cons: Unreliable app and wifi hotspot features. Parking mode is deceptive because you would have to hardwire it to your vehicle’s battery. Wifi/app connectivity are widespread and customer service is a pain in the ass. As a matter of fact it’s like having a conversation with someone using Chinese translated to English via google translate. So annoying. Feel free to buy this if you have the time and patience to deal with getting the device to work or if you would be happy not using the wifi/app feature at all which is like 50% of the worthwhile features.Pros: Good concept packaging all these features in one compact device.
1,Bought this camera to record any accidents and  found out it not only did not record the accident but recorded here and there. Do not buy. Have a 64 gb sd card in it and hasn’t recorded anything for the past 2 days.
3,I couldn’t be able to connect though my iPhoneit said the Wi-Fi setting is on however didn’t load on my screenso wired!
2,Updated!I have not been able to make it work I have bought several class 10 memories and none of them work for me I do not know now whether to continue buying memories or spending more money or wait for someone to answer me which is the correct memory card.——-WellFor now I just opened box and all looks very good good quality and material
2,Camera is pretty slick.  Connected as instructed validated power for ACC and power for constant hot.  When car is on it allows me to set up parking surveillance.  When car goes off the camera switch’s to parking mode.  If I turn on while off says no cable found…does turn on in parking mode but only when I hit the camera itself moving the vehicle does not trigger the camera to turn on.  Emailed vendor for support and no response.
1,The picture quality is great but the app is an absolute nightmare to use. I went to download a clip to iPhone 11 followed all the steps and settings and when the app said "downloaded to local album" I clicked local album to find the clip so I could download it to my phone but nothing was actually saved into the local album. It's empty. I have tried several times. I wouldn't recommend this dashcam because how hard it actually is to retrieve footage when you need it.
5,Have purchased a few cheaper brands...  Buy this one...  Very good product...
1,La cámara no graba cuando esta estacionado.  No hay advertencia que debe comprar un cable adicional.  Lamentablemente por está falta de información me chocaron estacionado con un costo de más de usd$5.000.  Muy inteligentes !!!  Deberían advertirlo y destacarlo!!!
2,This dash cam will burn/damage sd card. I have tried quite few new sd cards sumsang nyx San disc. None of those brand works in this dash cam.
1,Installed and fired up but could not get it connected to I-phone.  Tried multiple times to send email and get help but got none.  Poor support
5,Thank you
5,Excelente producto.
1,It’s not easy to install doesn’t come with a memory card and won’t work without it. Rear camera never worked. Bought a memory card and about 5 hours into the trip it said the card wasn’t working and need to replace. Like it was damaged or something it said. Brand new card and largest amount of memory I could buy.I’ve been so busy I haven’t had time to return it.Waste of my money and time
1,Bought this as a Xmas gift and didn't install it for 2 months. Then when the unit was fired up it kept dying. Turns out the internal battery is no good.  Confirmed that by removing the internal battery then the unit works fine except it won't remember settings without the battery.70mai does not sell the battery so I'm going to have to source one from china.Buy something else.
1,All else remain at default settings except for ADAS and Parking Surveillance mode turn on. ADAS interferes with Parking Surveillance function by making Parking Surveillance remains in record mode indefinitely until the car battery runs out instead of going into sleep mode after one minute of recording. Both ADAS and Parking Surveillance modes are the major advertised functions of the Dash Cam Pro Plus+ A500S but the device could not even run properly. Major Defect in Design.
1,During the 5 days road-trip my camera has to upgrade software twice constantly warning I didn’t connect charging cable even tho I didn’t touch it at all. I was in an accident and I wanted to get the video but I found out it didn’t record at all and it start recording right after the crash. After the first day it constantly shows my SD card is damaged even though it’s brand new it also resets my SD card twice so I ended up getting no recordings at all. My friend’s seems worked fine so I’m very disappointed
1,I'm so disappointed with this dashcam I really liked it at first but after a few weeks of use it started failing... stops recording by it self turns off by it self and I have to reset the card very often or it won't work.I don't recommend this dashcam.Do not buy!!
5,excelente producto llego antes de lo indicado
1,Installed this dash cam about three months ago and it already stops working.  I thought this was a great dash cam due to all the good reviews but I have to admit the picture quality is very good for the price and I would give it a higher rating if it would’ve last longer.  If you want a longer lasting dash cam then you should look else where.
1,Don’t record don’t work properly
1,I was super happy with this dash cam but after a month a rear camera stopped working. It is recording but not capturing an image just a black screen.Any chance I get a replacement please?
1,Rear cam didn’t work after 3 months!
1,I bought it on May it’s system always down when it’s hot outside. If it cannot resist the hot how can I use it in the summer? So don’t buy it!
1,keep getting sd card damaged messages and the device wont record. Tried two different micro sd card (samsung brand). formatted it with the dash cam. The device is not reliable for day to day recording. returned it. look for something else.
1,Rear camera records but all is black background. I need to replace.
1,I have tried different memory cards and none of them work.
1,It's a good camera of car but I bought it for ease of use and to connect to my phone. But it didn't. When I connected my phone to the camera's Wi-Fi it didn't connect the phone to the camera.
1,I was hoping I had gotten a good cam. It worked for a while then it started turning off and on all the time. More Chinese garbage for the American people!
1,This camera seems to damage the SD card for some reason I am now on my 3rd one and as of today that is damaged as well over 3 different brand all high end quality.
1,This device is always very hot.
1,The media could not be loaded.                                                                                 I don't know what the problem is.  Since I installed it on my car and started recording the camera keeps restarting every minute or two and sometimes three minutes.  I tried searching in its settings but unfortunately I couldn't find anything to solve this problem.
1,I purchased a high end memory card (Samsung evo) and the camera would randomly fault on the card.  It’s GPS was extremely inaccurate.  I returned it within the time period.
1,It is easy to install. However used for three months and it stop working.
1,The media could not be loaded.                                                                                 Totally a trash do not buy it. Shutdown for no reason while driving.
1,Avoid - won’t work or connect in IOS
1,My phone can’t connect the rear camera only shows the front in app. And it says my memory card was damaged.
1,when i got this package the box was not new and was repackaged and taped back together. the screen of the camera was full of fingerprints and was dirty. Extremely disappointed.
1,The rear power wire is not even close to long enough. I guess I paid for 2 cams but can only use 1
1,Need I say more?
1,The camera I received is not brand new it been used. It has scratches on it.
1,The camera looks good but I have given up trying to install. Direction tiny booklet too difficult to read.
1,It’s so loss don’t accept memory card after few mins
1,Save your money but something else
1,The media could not be loaded.                                                                                 I have not been able to use it ever since I bought it…. It keeps going off & on all the time. Have not had the opportunity to even set it up.
1,What a waste of time.  Cheap ass company won't include SD card. So its useless to me. Return and never buy this brand again
1,Upon installation the USB port for the dash cam was defective and wouldn’t stay connected to power
1,Camara does not connect with the app. Emailed the customer service twice now and no response.
1,It does not work.  No funciona.DO NOT BUY THIS ITEM AND FROM THIS SELLER.
5,I spent a lot of time watching reviews on Dash Cameras before I decided to purchase the 70mai Dash Cam Pro . The 70mai got a lot of good reviews but you never know what you are going to get with these dash cam companies. My wifes car has the Vifo dash camera so I had another dual 1080p camera to compare it to and the 70mai blows it out of the water.The biggest win this camera has is the form factor. What I wanted most out of a dash camera was something I could hide out of the way while also having great video quality. This camera meets both of those needs without any compromises.For me I didn't need / want all the features nor want to pay extra to get parking mode lane departure etc. All i was concerned about was its video quality and if it would work reliably. I struggled and was tempted to purchase a higher resolution dash cam but realized that I just wanted a very simple small and reliable dash cam that I can place in my car and forget about it.After receiving the 70mai I was extremely pleased with the video quality. I wish it had a capacitor instead of a battery to be able to handle the heat during the summers but I haven't had any issues so far. Just make sure you keep it out of the direct sun and I think it will be fine.The one negative i did find with the camera is the app. I really didn't like that it needed access to all my phone information as who knows what its doing with that in china but you do have the ability to setup this and use it without the app if you use the local buttons on the camera. I ended up skipping the app and programming everything locally.Overall im extremely impressed with this camera and im considering buying another one of these for my wife's car to replace her VIFO.
4,La instalación en general es muy fácil y rápida trae las herramientas y accesorios necesarias para hacer una correcta instalación. El único problema que tuve fue la vinculación con un dispositivo iPhone 7 pues aunque se conecte a la misma RED de la cámara no se refleja un estado óptimo para su uso se realizó diferentes pruebas y en diferentes ocasiones y no se pudo vincular el dispositivo.
1,1st 2nd and 3rd don't waste your money on this camera. While the picture quality is good and it's easy to install the problem is in the software. Within 3 days of installing it I got an error message saying the SD card was damaged and needed to be replaced. First I tested the card on 2 laptops and found the card to be working fine. Next I tried a brand new SD card with greater memory AND speed. When I installed that one the camera told me the card's quality was too low even though it was higher in both capacities. I'm sending this one back to the manufacturer knowing full well they will give me every excuse in the book not to refund my money. And it wasn't cheap. In short this is a product made for foreigners who typically don't complain about garbage merchandise or who don't want the hassle of dealing with a Chinese company. Spend a bit more on a more reputable company and product.
1,This was a gift to me but unfortunately right out of the box the camera buttons would stick and not work making setting up the camera impossible. Also the beeps and sounds it makes are very loud and sharp. I'm extremely disappointed.  Back in the box it goes... Worst Christmas present this year.
5,I own three of these. I hard wired them without any problem. Both the front and rear cameras have good quality video but can’t compare to others because these are the first dash cams I’ve ever owned. Now for the bad part. It took a while to connect it to my phone. I kept trying and could not get the verification to show up on the dash cam to allow the phone to connect to it. I searched online for days before figuring it out. On the iPhone you have to allow gps and data connection to the app at all times before you can connect to the dash cam. I had it set to use gps only when the app was open. Other than that great camera. Easy to access videos on your phone.
4,Plastic film provided for mounting is super easy to use easy to remove yet very secure attachment.The only complaint is that the alert volume is too high even at the lowest setting.
5,this is much better than older versions with single camera easy installation and long enough cable connection between cameras but power cable is little short to run to middle console that left me with no option but to use an extension cord witch i don't like .previously i bought to cameras for front and back of my car by those cameras need two memory cards and you cant control them simultaneously on phone app but this version done a lot better job this one has GPS built in but older versions need to have GPS module separately.overall 70mai  done fantastic job on their dash cams no matter what's the model tombs up for the quality and user interface .
5,parking mode not working after connecting hardwire kit for same company. software saying. no cable for parking mode.but working non stop parkt. have power for parking mode .they have to fix software. or i have to return.update. that was wiring problem on parking mode. great camera. front and rear.
5,I love how the road looks when reviewing the videos on my computer. It is a quality product that is definitely worth the price. Installation instructions could be a little clearer - the clear plastic pieces that came with it for installation did not work so I just removed the adhesive on the back of the camera and stuck it on the inside of my windshield. When I tried to install the app by scanning the QR code that came in the box I got an error message that it cannot work in my country. One of my friends who has one said he just searched for the 70mai app in Google playstore and it worked for him so I will try that. Overall I am pleased with my purchase.
5,I have this installed in my jeep. Works exactly as advertised. My ONLY small complaint is that it's hard to see the black-on-black button to switch to rear facing. After a dozen times my finger knows where to push (when I am driving). Highly recommend.
4,The camera seems to have decent quality do not update the firmware cause the WiFi range will be much shorter.
5,Very easy to install and so far works perfectly. Nice quality. Print is small but online instructions much easier
5,Buena cámara se adapta bien al coche
4,Was not had to install. Little difficulty setting up parameters due to sloped screen after installing on windshield. Some setting not explained in the manual. Upgrade has been a total bi_ch installing and making it work. Techie daughter had to help with upgrade. Love rear camera views.
1,Overall is not satisfied from what I paid for ($90) the angle view is ok but not wide enough for me. I do expected vdo quality a little bit better than 1080p due to 2.7K ultra full HD but it’s about the same I still can’t see car tag. ADAS system is useless it’s not accurate i have to turn it off.Spend a little bit more money to get better quality it’s very important when you do need a evidence.
5,the front camera is perfect but the rear is fare and there is a problem with high temperature the camera is turned off but after cool down you can turn it on manually
5,Calidad excelente y muy fácil de instalar
5,I love product with one exception. I wish in description I had been told I would have to order parking surveillance mode cable separately. I had the 70mai without rear view and it worked fine in parking surveillance mode without such a cable. Otherwise excellent dash cam to own. ADAS system works very well. Rear view A OK.
5,Like I expected
4,Nice picture quality
