rating,review
1,Fresh out of the box and it doesn't work. I've tried it in different cars with different cords and nope it does nothing. Ticked off bc now I have to find another.  Save yourself a headache.
1,Very durable and sturdy will last forever as neither my hubby or I can plug it in.
2,Had it for 2 months and it won't hold a constant charge.
4,This car charger works fine and charges quickly. Haven't had it long just hope it lasts.
1,Worked great for a few days but then would disconnect and now will not super fast charge. Would not recommend
1,The cord will not stay in the phone.  The charger once paired with a different cord is fine.
1,Feels thick and sturdy but stopped working after only a few months of light use. Junk
1,No matter how hard I try the cord will not stay in the device that plugs into the cigarette lighter..as I am driving it always seems to either pop out after I hit a pothole or it becomes loose and slides out on its own. It is not worth the price.
1,It did not work.
5,A true fast charger! Charges my s21 ultra in 1 hour
1,The provided cable does not work. Save your time and look elsewhere.
1,Not sure what happened but it just stopped working after 2 months.
1,Not good the cord it came with stopped working the first day
5,I bought this for my husband. It's common for him to forget to charge his phone so having a well functioning car charger has been beneficial. Unlike other car chargers that I've used this one actually charges the phone!!
5,It fits better in the car over the older chargers.  It is definitely a fast charger.
5,This item really works really good and charge very fast asbit says.
1,The first few days it worked great. After that the cords stop working.
1,melted down after couple uses cord got shorts in it within a week
1,Worked once with my s21.  Do not attempt with this phone
1,Unfortunately it stopped working after only two months.
1,Is burning the fuse in the car 2 times and smoking Don't buy
1,Didn't last a week just quit working
1,Slow charge
1,Only had this charger for about a month and it no longer works. Waste of money.
1,I have a Samsung A71 and have been searching for a "super" fast charging usb-c to usb-c  car charger just like the wall charger that came with the phone and lights up turquoise. All this charger does is charge in "fast" charging.
5,Definitely a must have I love this car charger!!
5,After a lot of unfortunate trial and error with other purchases of other similar USB-C "PD" car charger devices unlike the others that cost more THIS one actually utilizes "Super Fast Charging" (as opposed to just "Fast Charging" on my Samsung Galaxy S20+.  I also like the fact that the device lights up when inserted into the 12V port confirming that it's getting power.
5,Seems to be very good quality and is very attractive. My Galaxy S20FE charges in super fast mode on the the USB-C port with the included cable. Adding a cable on the USB-A port my Galaxy Tab A 10.5 (2017) charges in fast mode. I replaced the USB-C cable only to double the length and no problems. Compared to 110 volt chargers this is a better value by far.
5,I looked extensively for an inexpensive FAST phone charger for my Pixel 3a XL and found it with this unit.  Biggest problem since has been to find a good phone holder.  Strongly recommend this charger.  WalMart had one for $20 more but my phone would never enter Rapid Charging mode.
1,Doesn't work as fast charging. Its Showing fast but never work. Its take forever to charge a phone. Beware of this product. Poor quality
5,Many of the newer Android phones do super fast charging & this charger does this even if 2 things are charging simultaneously. I purchased 3 of them & my brother also has. Definitely recommend
5,The quality of the product is amazing. The length of the cord is perfect and it charges my (S20 ultra) super fast! 👌If you're unsure I'm sure for you DO IT! BUY IT!
5,Excellent fast 45 watt charger. Strong enough to charge MacBook Air.
5,I got this item because of the superfast charging claim.  So far this item works as described.  I will charge my phone from 4% to 60% in about 20 minutes (my commute home on a normal day).  I will be buying one for my husband's car as well.
5,Would buy again
5,Works as intended. The braided cord is durable and long.
5,El mejor cargador que he tenido me sorprende la carga super rápida. Excelente compra.
5,Good Quality and super fast charge
5,Works great in a mobile environment charges fast. Used with a Samsung Fold. It doesn't charge as fast as having it plugged in a wall unit but definitely faster than my previous run-of-the-mill charger.
3,The cord stopped working after a few weeks
5,Fast charger
5,Works great charges my phone quickly
5,😊
5,No problems so far. Super fast
5,It charges both my fiancé's Android and my iPhone! And super fast! It's perfect for road trips while using GPS and Spotify. I usually have a drained battery when I get places and now it's always at 100%!
5,Exactly as described! Thank you!
5,Works great and not a blinding blue light just enough glow
5,El cargador funciona muy bien para cargar mi Celular  Samsung S21
5,Charging power is great!
5,At first I was skeptical a charger that charges just as fast as my regular charger. I'm glad to say that this product is everything it promised a high output charger that will charge your phone to its fullest capabilities.
5,Very fast charging speeds at an awesome price
5,I bought a 2nd vehicle and the standard plug in wasn't charging my phone very fast. This charger works fast and it's what I was looking for.
5,Excellent product worth the money.
5,Charges super fast! I love the two port option. Affordable. I recommend!
4,Works great for my Galaxy S22 ultra. Charges rapidly. Seems to cut off when full.
5,Car charger delivers superfast charging love it
5,Works as well as the fast house charger I have. Good price. Bought a second.
5,with my old car chargers playing music and using google maps navigation used to drain the phone battery even when the phone was plugged into the charger on long trips. With this fast charger it actually still charges the phone even with google navigation and music playing through the car stereo with bluetooth. I'm impressed. Heck it even charges my ipad at the same time too!
5,good~!!!!!!!!
4,This charger is amazing.  10-15 charge will do your phone good.  So happy I spent this money.  The only issue I have is that it doesn't work with all phone case.  I have to remove my phone case while using this charger in my vehicle.  Small price to pay for greatness I guess.
5,Works as described. I love the light indicator. Let's me know it is active
5,Very good quality and cord is good better quality than the rest and looks cool
5,Great for my truck
5,I was pleasantly surprised with the fact that it was able to charge my phone at the maximum rate available for my phone.  I have never found another that would do that.  In fact most of the wall chargers do not do that.
5,I tossed all my other ones.
5,Works great and charges my S22 Ultra very fast. Seems to be made very well and the charging cable that comes with it is very good quality. Not a cheap cable like you usually get with chargers and other accessories.I still think they are a bit pricey for what it is but the price is way better than any accessory items at any of the phone stores and I am happy with the quality.
5,perfect super fast charger durable & love the blue light
5,Great product!
5,I do not write reviews but this thing solved all my issues with car charging!!!  Fast charging works fantastic!  My internal charger in my vehicle cannot fast charge my phone and this was a necessity with the amount of traveling I do.  Excellent product!!!
2,Definitely not the greatest charger but it worked for a week. Then just stopped working all of a suden. Its not used very ofet maybe 20 minutes per day.
1,Love this car charger!! Update 6 days later won't even charge 😒
5,Super happy with this little charger. so much so I ordered a second one. you will be pleased with your purchase.
5,I can really charge up fast! I mean fast! Best car charger I've owned yet.
5,Faster than any other I've had
5,Great charger
5,Do far so good.  Charges at "super fast" speed on my S22+.
5,This was a pretty good deal. The charger is a rapid charger so it works well.
5,charges charges and super fast mode on a note 20 ultra plus very fast
5,Superfast charging. The only concern is that the light never turns off when you turn off your car you have to unplug it.
5,Love the dual functionalities.
5,Like the product
5,Great item phone charges super fast!
5,I liked that it worked
5,Muy buena buena relación calidad-precio carga muy rápido más de lo que esperaba. No puedo opinar sobre durabilidad porque tengo poco tiempo con el cargador
5,Tengo un S20+ y carga al mismo tiempo que el cargador del celular ( 1 hora aprox)
1,El equipo viene quebrado
4,Update: the company had sent me a new one and apologized so far this one has been working great and is my fastest charger I have I love itQuit working in 5 days... do not recommend
5,Un cargador que vale la pena comprar. Tengo carga rápida en el auto algo que no tenía con otros cargadores convencionales. La pontecia de carga que logra gracias a las especificaciones eléctricas que posee son justo las que necesitaba. Consejo: Yo pensaba que todos los cargadores de este tipo eran iguales y me darían el mismo rendimiento; estaba equivocado. Importante revisar las especificaciones de carga para que la compra valga la pena y funcione como uno espera.
4,Es útil y practico
1,It will not charge my phone.
5,This product charges tablets and cell phones in a much quicker manner than most on the market.  Great value.  Would recommend for anyone who wants a faster charge time for their electronics while on the road in the car.
5,Woks well
5,The product is very good .. cable of good quality and the thing charges my phone really fast .. a really good buy
5,This car charger comes with a regular USB port as well as a USB C port enabling superfast charging for your mobile device. It charges My phone very quickly as I can basically put my phone in at 20% and in no time is charged up to 100. Is the added feature of having the extra USB slot baseline is perfect for older phones that don't use a USB C connection.
