rating,review
4,I bought this dashcam for the following reasons:1: high resolution sensor2: Easy app access;3: dual camera support4: 70mai is a subsidiary of XiaoMi which is famous for making decent products much better than the other vendors with unknown reputations;I installed on my car just a couple of days ago in no way it's a longevity review so take my review with a grain of salt.Good:Image quality -- better than my older 1080p dashcam and I can see VERY clearly the license plante on vehicles 20 feet ahead and on neighboring lanes. The h.265 codec compression works excellently as well which only takes a relatively tiny space on mSD card;The app -- The app connection is VERY easy and smooth and reliable. App is easy to use. So absolutely no complain here!So-so:Please know the 1944p resolution gives you a 4:3 ratio video which in dashcam use case the vertical space doesn't mean much;Also the lens distortion is pretty bad. But I know I cannot use the DSLR standard to judge a dashcam and the license plate on the left/right extreme is clearly visible which is the bottom line.Concerns:The dashcam doesn't have any ventilation slots/holes and it does get quite WARM even when working under room temperature. I installed it under the cover of the pedestrian detection box so the unit doesn't receive much direct sunlight but it still feels uncomfortably hot under normal drive/recording conditions. I live in Houston so the summer vehicular heat can potentially kill it quite quickly. Knowing it will most likely void the warranty I am going to drill some holes on the body and hope that helps.
4,Update it suddenly started working properly. But what i said Below this is also true. Because it’s seems it can be immensely unreliable i would tread light.Read the questions about memory cards being killed it’s a common problem and it’s too late for me to get my money back.I’ve been through multiple SD cards of extremely high quality. Bought from the micro center with a warranty because they keep getting killed by this device. I have A Samsung evo plus 256GB  130 mbs micro SD xc (3) 10 A2 v30 .  I have A 128 that got killed instantly. If they could get this issue fixed I’d say this is beyond a bargain. But they can’t and you never know when your memory card will just fail leaving you in some of the worse possibly situations. I live I’m nyc and driving here is not easy in the slightest nor parking and leaving your car. I have this for insurance and safety and it utterly useless because of this SD card issue.  Save your self the trouble.
5,I just got it all installed formatted a new sd card and updated the firmware.  Everything seems to be working perfectly.  Some people stated that the time lapse function was gone but it was there in both versions of the firmware that I tried.  The only thing that seems weird is the rear camera integration.  I can't figure out how to have both cameras on the display or my phone at the same time.  The video files are separate as far as I can tell.  I am very pleased so far with this dash cam.
5,I had a car accident recently. I still can't believe how could this happen. An idiot Korean (women) hit my car and said she didn't see my car. That's rediculous. I showed the police my dash cam video immediately and we run through the insurance very easy thanks to this dash cam. It is awesome you can download the video thru the app. Very convenient.
2,The media could not be loaded.                                                                                 June 14 2022 edit: Annoying start-up sound still exists. I do not recommend that the average user buy this camera.I used this dash cam for five minutes and was going to return it. The issue is the boot sound that can't be turned off in settings. I found a hack online (for Androids and maybe for iPhones) which worked and I've decided to keep it because of the great video and ease of use of the device. Also the sub-$100 value for front and rear cameras is superb! In short if you can tolerate this start-up sound or use the hack (instructions below) to disable it I think you will really like this device.When I turn on my car the dash cam powers up and plays an extremely audible and short jingle. It is very loud and there's no option to turn this off without downloading an app to "hack the system." [See end of review for steps] Even if the volume were low I still wouldn't want it. I drive almost every day and prefer quiet so I get annoyed extremely easily. I've read accounts of other people who don't like this as well. However some people may want to know that their dash cams are turning on and working... but the sound is still way too loud. [The company is going to update firmware for future products but this one is stuck with this issue.] In addition when you set up this camera there's a deafening beep when you toggle through options. I've never heard anything this loud. I don't know what the product people were thinking!I have several other quibbles. This dash cam takes 19 seconds from boot up to start recording. Seriously??? This is 10 seconds longer than my cheaper dash cam. Also the cables are on the right side of the dash cam - I prefer that they be center or on the left so that they are more concealed in my car and less visible to the passenger. Your mileage may vary.What do I like about this dash cam? It is well designed. It looks fine in a minimalistic way - nothing too pretty about it but nothing hideous. The buttons are an absolute joy to press and operate. I've owned three dash cams and these buttons are by far the best. The video quality is fantastic. I played some videos on my computer and I could see houses and cars pretty sharply. I'm sure 4K will be nicer (and at least twice as expensive) but the current resolution is more than sufficient for me.In order to view the videos on your computer  you may need to download a codec (Microsoft.HEVCVideoExtension_1.0.43421.0_x64__8wekyb3d8bbwe) or a free video player like VLC otherwise the footage will be black and you will only be able to hear audio. Newer computers probably don't need this.I haven't used GPS but it's one thing I was excited about. The price: you get a front and rear camera for under $100. This is remarkable and I applaud the company for this. The rear camera is 1080p and isn't amazing but it's good enough.If you don't want to go through the below steps and disable the sound (some people who aren't tech savvy or don't have Androids may be screwed) you can spring for a different dash cam. There are many out there to choose from - many cheaper ones. Even if the quality is lesser these cheap cameras will still work and not have the annoying start-up sound. The main purpose of the dash cam is to prove that you are not at fault and most dash cams will do this. Secondary is capturing license plates.The bottom line: I've decided to keep this dash cam set because I found out how to fix the initial deal-breaker. It's not hard but you do need to connect to your dash cam and be a little patient. I have an Android and I'm good with tech so this took 10 minutes for me. I'm not sure if the app is available for the iPhone. When you update the firmware the dash cam settings are factory reset so you'll have to go through this process again which is very frustrating.1. Connect to the camera via hotspot with your phone's wifi.2. Download the "Mobile Telnet" app from the Play Store3. Telnet settings ---> Remote host name: 192.168.0.1 port: 23 (this is the default)4. ConnectShould display the NVTEAM login labelType "root" and then ENTERThen type this command (in one "sentence" and press ENTER at the very end) with a space between "mv /" and "raw /mnt":mv /mnt/app/res/voice/public/bootsound.raw /mnt/app/res/voice/public/bootsound_1.rawThen ENTERIMPORTANT:If you want to put the sound back you must type this:mv /mnt/app/res/voice/public/bootsound_1.raw /mnt/app/res/voice/public/bootsound.raw
4,I just had car accident and come back to review this it helps a lot for me to say words to police for car accident. really strong words to help me speak out
4,This is THE best value you'll get for a dual dashcam setup at this price point. Lots of features and decent camera quality at a relatively affordable price. Only reason for 4 stars instead of 5 was because it was a pain for me to setup the app that goes along with this camera. Eventually got it working after about a week but I've had no issues to report aside from that.
4,Overall the quality of camera is good. Look and feel high built quality. The front camera is good with high resolution with driving speed and GPS location. The color dynamics isn't good enough sky is washed out and trees are too dark in a not very sunny day. The back camera isn't good even though having1080p resolution it has very soft focus and details. The color temperature of front camera and back camera are not calibrated in sync the back camera is too color saturated comparing to the front camera.
5,Great looking product that is small and easy to set up (albeit a little tedious if you want the wires hidden but worth it).Hopefully I’ll never need it’s function but gives me peace of mind.
3,It looks good but only one camera can view in the screen at a time. Also it always shows the front camera view in the Mobile application. I did not see any option to switch to rear camera in the mobile app. Also it requires the hardwire kit for parking survivalance that is of additional cost and you might have to connect to your cars battery (I did not buy). There are several cheap dash cam that doesn't require a hardwire kit for parking survivalance; instead they use internal battery to automatically turn on and capture the pictures if something happened when you parked your car.Pros:- Easy to use- Good user interface- good picture quality- Good audio quality- additional electrostatic films for mounting- good packaging- looks a standard deviceCons:- memory card is not included- requires hardwire kit for parking survivalance- hardwire kit not included in the package- screen size is very small (2in) but okay- Poor batter backup- only Front cam is showing live in the mobile app- The live view in the mobile app is super slow and lag.- The camera is not flat it is more or like fish angle lens.
5,I did a lot of research into dash cams and found this to be the best. The cameras are small unobtrusive and provide great quality and a lot of preference options. The access to the camera footage through their own app on my phone is vital and much easier than trying to access the camera itself or having to go through the card when moved to a computer.  Very happy with this purchase.
4,I tried multiple different SD cards with the device as well as updating the firmware nothing works. It always says sd card damaged. Really unfortunate because i loved the previous 70mai cams and this one has failed me.Edit: 70mai has reached out to me and graciously sent me a replacement. Updated from one star to four because when it works it's great. Lets hope this one works out!
4,Buen producto
5,I left my camera on with the option to turn off after 10 minutes if no displacement is detected. Well it stayed on for 4 hours and my car started up normally. (I did this while I was working and normally work around 4 hours) I didn't even realize it had stayed on til I turned on the car. My car is a 2007 ford mustang coupe. Not much drain going on with that car in general so if your car doesn't have a lot of drain you could try out leaving it on. Just have a method to charge your battery if it drains too much that you can't start your car.Also if you care there doesn't seem to be a widescreen 16:9 option but I don't really care myself.I might eventually go with the hardwire kit for the 24/7 parking monitor option but for now those few hours is all I need.I might update later with how much it drained the battery. I just didn't check the volts before starting it up.
4,Among many nice dash cam and digital mirror I bought this one for a particular purpose Lane keeping assist. I was not sure when I bought this it made by Chinese though. I love this buy because It works pretty well. It tells me when front car moves and it alert when I change my lane and it also warns me if some car cut my suddenly.. good enough camera.. only missing part are these two. 1 not enough setting (I cant put permanently on back camera. 2 no digital mirror.. why they don't sell extended digital mirror with this dash cam.. I am happy with it but still missing digital mirror with it..🥲
5,No problems with it easy installation.
4,It has useful features for the price but some parts need to be fixed. In particular it is difficult to cleanly install the rear camera. The connection part of the electric cord is thick so it is impossible to install it hidden
5,It really was quite easy to install and set up. One gets used to the on off alarm.  I'm not taking it apart like others suggest just to shut it up.  After a while I just ignore it.  It is very sensitive.  I slammed the door and the emergency recording started.  I go through pot holes and the emergency recording starts.  I don't like the rounded view of the recordings and I didn't let the system run 24/7 because I worry about battery drainage.  I know it says it's not much but I owned a Kia/Hyundai in the past and those batteries die if you leave something connected to it. So far I like it well enough.  Just wish the view wasn't as rounded as it is.  More like a fish eye wide angle than a square wide angle.
5,El producto es muy bueno tiene una excelente calidad de video lo único que no me gusto es el sticker no lo pude pegar y me los gaste todos
4,this is a solid dash cam. its small enough to not really stand out from the front of the vehicle and the cables are plenty long to have the front and rear cams attached in a full sized jeep with cable slack to spare. the biggest drawback of the unit is the startup sound that can't be disabled and volume of the sound can't be adjusted. i followed the instructions on another user's review to "move" the sound file from the internals of the device by telnet'ing into the unit (it runs linux internally). after the "hack" it is basically one of the best dash cams i've used for the money.
4,La cámara se ve de buena calidad tiene una excelente imagen y no es complicado la instalación ( preferible que l instale un técnico)
5,This dashcam is absolutely incredible for the price. I really wanted to get a blckvue but couldn't justify spending that much money on an addition that I hope I'll never actually need to use. This one does the job for a fraction of the price feels solid and very well-made is easy to use connects seamlessly to the phone app no complaints. I am pleased with the quality of the footage. The front camera has higher resolution so naturally the footage quality is better but the back one isn't bad too. The only thing they could do better is offer a battery pack option where the dashcam could connect to the battery pack so that I don't have to hardwire into the car to utilize 24/7 parking mode. Installing the dashcam was a breeze for the most part. The rear was a bit tricky to install because I have a convertible and don't have a rear windshield to secure the rear unit permanently. I ended up using velcro and securing it onto a headrest. Not perfect but works! I was so pleased with the quality of this dashcam that I ended up ordering one for my boyfriend's CR-V too. The installation of the dashcam was much more straightforward with his car. It comes with everything you need to install the dashcam with ease!
4,Have a 18 Rav 4 tried to install the rear cam broke the wire had to call AAA to tow the car to dealer to fix the rear gate. Installation of rear cam is NOT for DIY. Front cam and overall is a good product.
5,There seems to be a growing issue of hit and runs in my area so I decided a dash cam would be a good idea. I friend has the 70mai Dash Cam Pro Plus and I was impressed with the rear video quality and he seemed to like the camera system. I did some extra research and the 70mai got great reviews based on quality and price. The cam went on sale and I purchased. I received yesterday and had installed in less than an hour. The cables are tucked inside of headliner and routing was simple to the back hatch for the rear camera. The side of the front camera is of a very small size. The rear camera is much smaller and not intrusive when mounted. The install I did looks very clean minimal wires are seen and I am happy with the out come. I am still learning the features and so far this is a 2 thumbs up 5 star purchase
4,Lo unico es que para que funcione el sensor de parqueo necesita un accesorio mas de resto esta genial.
5,I have a larger new suv it took a while to install so that the cables are hidden but otherwise good. Also for me would have been better to order 2 separate cameras since the rear camera cord has to reach from rear door to windshield..
5,Super fácil de instalar y discreta
4,Dashcam keeps saying out loud sd card damaged. The sd card is not damaged and is samsung class 10 32gb micro sd and has been formatted in the dashcam. This item is defective and has been like this since the first day it was installed.  Past 30 day return so is waste of money and hardwire kit cost also.  Update Seller kindly sent me a new camera and it has been working good now.
5,The media could not be loaded.                                                                                 This is my first ever dash camera and sometimes I am good with technology and sometimes I am not. This is a wonderful dash camera for the money! I got a 65GB SD card since it doesn’t have one. I got it all set up in around 45 Minutes I was making sure to tuck all the wires away. The rear cameras cable just barley reached the back window in the 2017 Toyota Corolla. I like having the button to push if there’s a incident and the camera put it in a lovely folder and you can download the video to your phone from the app. It’s a really cool system.I really like the look of the camera it’s sleek and fits out of the way. I was able to hid the camera out of my sight behind the mirror.I although have not tested out park mode or the Driver assistance stuff.
5,Works great. I received one for Christmas. 4 months later a car comes into my lane and sideswipe me. Cops came to write up accident. The other guy spent 25 mins showing the officer his car and very animated telling him how I came over into him. After he was done the officer came to asked me my side. The first thing I did was pull up the clip from my 70mai app and show it to him. He said that's all I need. Thank you. The other guy was charged with  contributing to the accident. Not me. EVERYONE NEEDS ONE OF THESE.  I BOUGHT 3 FOR MY KIDS AND GIRLFRIEND.
5,I have bought this camera 2 times for my 2 cars and I have recommended it to my friends and family it records very well the app that it comes with is super easy to use and has a lot of image quality and the best thing about it is that it comes in several languages and is easy to install in the car.
3,All of the sudden the micro SD card started being ejected from the device.. Would you go flting and cross the vehicle and I'm able to find it now.
5,Had to buy a dashcam since drivers are crazy out there and went with this one because of its low profile look and extra rear cam. I've been using it for almost 2 months now and like it a lot. It was actually fairly easy to install however the cord for the rear cam is very long so you will have to manage that somehow. Good video quality and visibility during the day and night license plates are easily readable at certain distances. I don't use the app it doesn't seem to be needed for my uses at least. This dashcam does have a startup sound that you get used to so that shouldn't be a deal breaker either
3,good dash cam garbage app.....it wont cconnect...which means you will not be able to check the footage from your phone..
5,Got this for my friend birthday since there is a gps tracker. Good way to track your car whenever you drop off your car for service and you don't know if they took your car for a joy ride or not.This is what happen to my friend he drop his car off to service and it was suppose to be ready within couple hours. We went to pick up his car at the end of the day and they told my friend the car isn't far yet. We went back the end of the day the following day they don't know where the car went.It took them 3 days to figured out the car was actually in the lot. When he get his car back he noticed the mileage was higher then usual.With this product he can find out where has his car been whenever he drop it off to service
4,I the description was written that camera has parking control function. Why it's not described in the title? I thought that it's already in the camera but I have to buy additional supply for this function working.
3,I used to use this company's basic dash cam. It was ok but it only had a front cam. Thought this one (pro + A500s) could be an upgrade of the old dash cam and did not need to rewire.The images captured by the front cam were very clear. They were super clear even if they were taken at night. The rare cam was okay. But the app is so horrible. There is no way I can connect the cam to my iPhone. I googled the problem and some reviews suggested to turn off cellular first before connecting to the cam. I followed the steps but still could not connect to the cam.The second problem is the beep sound when I start my car. The beep is so loud and cannot be turned off.Even though there is a built-in battery but it does not support parking surveillance.  Some other brands can still capture picture or film a video without hardwiring the cam.Will be returning it.
5,The media could not be loaded.                                                                                 This dash cam quality is amazing in my opinion. Because I have a tint on my rear glass it shows dark on the rear can. And the rear dash cam doesn't mirrored which is great. Catching near accidents.
4,This seems to be a very high quality dash cam for the price.  It was fairly easy to install and came with extra static cling stickers for your windshield in case you mess up the mounting location.  (Which I did.)  I am seriously considering returning it however because I cannot the app open or work properly with the wifi.  This device serves me no purpose if I cannot get the data back in case of an accident.  70mai has no customer service number.  Not everyone is 20 something and tech savvy.  It would be nice to talk to a human being instead of waiting days for an answer via email.  If I can get the app to work I will update my rating.
5,Talk about timing. I was going away for a month for a work so I installed this camera a day before I left on my wife's car. 2 days later she was involved in a hit and run. No she didn't  do the hitting and running but we did manage to get the plate from the a hole that did it. Can't really compare to other dash cams but the quality and frame rate is awesome. For the price it's a must get for anyone. I would get one but I do too many dumb things so the less evidence the better lol
5,Me encantó
3,It's a great dash camera and a good price. The image looks good and the voice prompts are a nice feature. However I had to modify the rear camera because it wouldn't swivel enough to mount to the angled rear window of my civic.
5,Buena calidad buena imagen y buen producto en general
5,So far except for the serious fever no problems hindering the use have been found. The electrostatic film is easy to fall off. The use of double-sided tape will be very firm but it will make it difficult to remove. The front and rear cameras are very clear. The emergency recording mode is sensitive and will be activated under a certain degree of vibration. It is recommended to manually clean the video regularly. Compared with the dual camera devices with more than $200 on the market (they may not be real 4K) I think this one has a higher cost performance.
2,I have installed this with their park mode cable. The timelapse works good but the parking incidence mode does not get triggered easily. Yesterday I had my camera in a service center and timelapse mode recorded everything when car was off including being jacked up 5 feet high and parking incidence mode did not get triggered. Is this software bug? If I see fix on this I will change the rating. To make sure this incidence recording mode works I have removed the camera from mount physically and  shake it vigorously to trigger it. It did trigger and recorded video but I don’t think I am going to get that kind of movement in any kind of parking incidences. Please note that the parking mode sensitivity is set to high.
3,We arranged this dashcam based on price and reviews.While installation and performance is amazing make yourself a favor and do not spend extra for the rear dashcam. Yes you can just have the front one.In our case the rear cam never worked or has "woken up" to record anything.
5,No issues with it. Quick and easy to install. One thing I might suggest is on the rear camera cord to add a coiled cable for those of us who have suv's/vans/hatchbacks. I have to keep the cable dangling in order to be able to open the cargo space so it doesn't rip out the cable from the baseboards. It's just an asthetic issue. But everything else was great
