rating,review
3,The media could not be loaded.                                                                               Las pocas veces que lo he usado hasta ahora ha funcionado bien pero el otro día la entrada para la tarjeta SD se conectaba y desconectaba. Al final conseguí que funcionase pero tuve ese pequeño problema.
5,good for extend monitor and card reader
5,I've used this with my MacBook Pro (13-inch M1 2020) and it works great!  I haven't tried ALL of the ports yet but the USB ports charging port and HDMI port all work well!  (I haven't had an opportunity to use the card readers.)  Overall great product!  Would definitely recommend it for newer MacBook users!
5,Un adaptador súper útil y bueno ya que cuenta con dos usb 3.0 que son mas avanzados y el detalle que te da. Una funda para poder guardarlos.Gracias excelente producido
5,All included ports in this dock work with Dell P-045352 Intel Core i7 1.80Ghz. It also works with Samsung Galaxy Note 10+
5,Recently replaced my MacBook Pro with a MacBook Air. I didn’t realize it doesn’t have any outlets. Bought this adapter to access my camera and external hard drive with my MacBook. Works great and has plenty of accessory points. My Macbook Air had no trouble discovering it and opened it immediately. Popped in my SD card and easily accessed my photos. The device is small which makes it easy to toss in a pocket of a backpack purse or laptop case. It’s really well made also.
5,Works great - the power throughput works and charges my laptop and the HDMI-out works and shows up on the monitor without any issues.
5,The product is very simple to use and exactly as described. I use with a Macbook Air which I purchased in 2020.
5,Not only are there many options to plug items in but it is also very compact and portable and comes in a duster carrier.
5,I purchased this adaptor to use in my MacBook Pro 2020 A2251 and works great
5,Using it with a Mac Studio for second monitor. Works great.
5,No problems at all.  Good value for the money and looks nice to boot.
5,I have macbook air 2021 and this item worked for me.Nice design and it has non-slip pad on the bottom of its body.
5,Works great love all the ports it has
5,The product is completely different than anything else available here very fast connection on USB and USB-C ports and the material quality is so good it feels like it is way more expensive than it actually is. Would 100% recommend.
5,It works with my Mac and windows very goodEasy to use and the aloof the money is off course is excellent
5,works with MacBook Air 2022 Model A2337
5,I got this and it is a great for my boys on their computer MacBook air! They love the sleek design!!
5,Great Product. Really enjoy this product. Got a great quality for the HDMI.
5,Love the convenience for the PC multiple ports to connect.
5,I have tried different ways to have double monitors connected to my laptop. This one works. One of my monitor was not HDMI output yet it still connects via an adapter.
5,This adapter is great I saved a lot of money because other stores sell for over $40 and it works perfectly. I use it on my 2020 MacBook Pro and can easily download straight from camera SIM cards and plug in hard drives all through this adapter. I am really happy with the results and they even include a little pouch for you to keep it safely stored. Great deal!
5,Works 100% with a Lenovo Thinkpad.If you need just one extra monitor and extra USB ports this is your product for a fair price.
5,Works great with my Dell XPS 13 9310 laptop
5,Works with my Macbook Air (2020). Small and sleek. Great value
5,Fast delivery works well with my MacBook Air 2020 (M1). Sleek design and has all the functionalities I need. Would recommend.
5,Works with Macbook Air M1 perfectly!
5,Works with Chromebook CB314-1H-C9XV and Nintendo Switch OLED version
5,I picked this up for a Samsung Galaxy S10 with a broken screen. The HDMI port let's me connect it to a monitor. The hub also let's me connect a keyboard mouse and power source. This device transformed my broken phone into a Chromebook using Samsung DeX. Thanks!
5,Easy to use.
4,Bought for reading SD card for gen 5 iPad Pro with M1 chip and it works.However it cannot work as a second display with iPad Pro only laptop can.
2,I purchased this hub to use with my new 2022 M2 MacBook Air. It connected to my tv via HDMI cable just fine. However when I tried to connect my SuperDrive using USB-A it would not power up. Unfortunately I am not very technically minded so perhaps I missed this information in the product description.
5,Great product. Bought to connect my imac monitor to a second monitor. Allows to connect my imac to practically anything
1,Used it 2 times only and it not working anymore
5,Works well with MacBook Air 2018 and has its own travel pouch to keep it dust free.
5,works with M1 macbook air. vert convenient for cs students.
5,Exactly what I expected. Works well.
2,Good size however if your laptop is placed on a computer stand (like mine) then its connection wire is too short.The usb-c channel does not work. The others seem to be okay.
5,Works well with mac/windows. good build quality . UBC / C / HDMI  all in one makes it perfect docking system
5,Delivered quickly and works well with my MacBook Pro
5,I use this with an ASUS ROG Strix Scar G773 on Windows 11. I just plugged in the device plugged my HDMI monitor keyboard Logitech Webcam and it works like a charm!
5,Easy to use plug and play used on s10 for a keyboard and mouse
5,Great product for a good price! Came fast and works perfectly with my MAC. I love it and recommend it to everyone
5,The media could not be loaded.                                                                                 No issues so far and works fine with my MacBook air.
5,Worked fine on my MacBook Air M1 2020 and also on my iPad Air 4.Solid build small in size and light in weight.
