rating,review
5,The USB C Hub HDMI Adapter is great! I misplaced my old one and this one works better and was cheaper than the one I misplaced. I love how lightweight it is it doesn't tangle and has 5 inserts for different plug ins. I love it! 5 starts!
5,I did try others and quite frankly they didn’t have the same heft or that sense of “quality” however subjective that may actually be. But I can say after only using it for a few hours and I did try and put it through that paces of my needs I have to say that I was quite pleased with how it held up.I am using this with a 2020 MacBook Air 8GB and 512GB. This is used heavily for photography. I use a Lenovo 32” monitor and I wanted the 4K HDMI connection. I tried other and though they worked I say again that just didn’t feel like quality pieces even though I paid more for them.Point is I was skeptical for something at this price point but I took the chance and I am glad that I did. Considering the quality of others your needs and then think on this one. Like me you may find that this one is exactly what you need.
5,I got a new MacBook and was very excited until I went to plug in a USB and there were no ports for a USB. This provides ports for up to 2 USB devices 1 Sport device card readers and 1 HDMI port. It is lightweight not really chunky provides what I need and works well. There's not glitching or easy disconnect on cords.
5,I purchased this for my MacBook Pro M1 2020 Model. I’ve tested this hub for HDMI SD Card USB 2.0 and USB 3.0 Port. It’s small enough to fit in my Laptop bag. Easy to use. Doesn’t require any installation. Works as intended with no issues. Also tested on a Dell Inspiron Windows 10 Device and Hub worked with no issue. The Micro SD card slot didn’t work on my 1st unit however unit got replaced with no problems. Good product for the price.
5,I love my MacBook Air but it has only two USB C ports and most of my peripherals are USB 3. This little adapter provides two USB 3 ports plus a charging port for USB so I can connect three USB 3 devices and still charge my MacBook. It works perfectly with my Brother laser printer my Fujitsu ScanSnap scanner and my WD external hard drive. Also it is very light and portable so I can move it with no problem. For less than $25 this adapter is one of the best purchases I have ever made. Definitely worth five stars.
5,This product works exactly as intended. Gives me the extra ports I need on my Lenovo Yoga 7i. Being able to use a HDMI is reason enough but I've found that I use the additional USB ports more often than I expected as well.
5,There are many of these in the market... but what I love about this one is if you have a case like I do I don't have to take it off to connect it; I can have more than 1 USB at the same time. It is wonderful the quality is great too. And it the price is excellent too.I HIGHLY recommend it.
5,It works on Macbook M2 2022! It is great!
5,Works perfectly for MacBook Air since it doesn't have a USB port.  Very nice design with a bag for it for storage.
4,Unfortunately it doesn’t actually come with any cords to attach to your TV so I couldn’t give 5 stars (especially when I wasn’t even sure I’d have one myself). But I found an old one at home attached it to the adapter and it was smooth sailing from then on. I really like this and wish I had gotten one sooner during the peak of the pandemic to watch movies on the big screen! But even still I enjoy having this adapter! Works well with my latest MacBook Air.
5,I am very pleased with my purchase of an adaptor for my laptop computer. It has an HDMI slot two USB slots and a camera card one too. This is perfect for all my needs as a marketing and communications coordinator. The card slot is especially handy for when I take video and photographs. The adaptor plugs into my new macbook pro via the USB -C cable. Now I can seamlessly make use of all my devices on my new laptop. Thank you very much.
5,Purchased a new MacBook Air 2021 for work and needed to be able to connect to a larger monitor to run dual monitors and still be able to connect stuff by usb and this product has worked perfectly.
5,This works well with MacBook Pro 2020.  I have found it very versatile for connecting different devices.  Since it has a cord it also lets me have a hard shell cover for my laptop
5,Serves the purpose handles the number of connections I need with my MacBook Pro.  So far satisfied.
5,At this price point it's hard to argue with!  Seems to do exactly what I want it to which is give me usb access to the back of my iMac without having to turn the computer around on the desk.  My only complaint is that it seems to have to be sitting just right as if it's not the usb's on the device seem to lose contact with the flash drive and it ejects it.  also wish maybe the usb-c chord was about a 1/4 inch longer.  But all in all definitely recommend a good product at a great price.
4,The actual product is beautiful and sleek. Fits as it should into the C-drive and several USB ports are available as well as a memory card slot. However when connected into the MacBook Pro 2020 the computer is unable to find it. The dockling light of the B3 turns on and shows that it is working the computer knows that something is there but it is unable to read and process the information.
5,Works great with my MacBook Pro
5,Used this product to connect macbook to large monitor.  this product works with the 2020 m1 macbook air and HP VH240a 23.8-Inch monitor.
5,This product is exactly what I was looking for! It looks just like the picture and works great. Very good price too! Works great with my MacOS Monterey 2021. I definitely recommend for anyone needing an adapter for their Mac!
4,This works on the MacBook Air (M1 2020). The device is actually smaller than I expected but that's probably good as its lightweight. It's simple to use: just plug it in and it's ready to go. (A little blue light comes on to tell you the power is on.)I bought this so I could access files from a SanDisk Cruzer Glide USB Flash Drive (I looked it up and it's 2.0. This device has ports for 2.0 and 3.0 USBs). I also like that it has two slots for memory cards. The only thing is this didn't recognize a Memory Stick ProDuo from an old Sony digital camera that I had laying around. The slot was too wide for it. It would've been a cool bonus to have that work.You can also hook this up to your smart TV via a HDMI cable (not included). I still haven't hooked it up however as I have a bunch of stuff connected to the TV already and haven't had the time to mess around with it back there.Also once I plugged in the USB it worked pretty fast and smooth.Hope this helps.
5,I love that I can have multiple devices plugged in. The device is sleek and very portable. It comes with a little bag for storage and it’s perfect. I wish it had MORE ports but it’s definitely a great product as is!
5,I love how convenient this USB C adaptor is for the MackBook Air. It is easy to use and carry with me when I have to do presentations. I also loved that fact that it has multiple slots such an HDMI USB and a camera.
5,i like the comfortability of the product .easy to use and very nice as well so much good features .
5,I used this to connect my Macbook Air to a variety of other tools. Frankly I had to return a couple of other products because either they didn;t work or they were too flimsy. This B3 USB C Hub Adapter has proven reliable and efficient.
5,I bought similar kind product from Amazon for $30 and did not have a wire connection to the laptop n caused loose connection I’ve to hold it to make it work but this product does have the wire and works totally fine. Totally happy with the purchase.
5,Works with Hp Pavilion 15 Samsung Galaxy Tab S6 Lite
5,I was worried about compatibility but this adapter worked with my brand-new McBook Air M1! Now I can have two USB flash drives going at the same time when archiving my photos and files.
5,This is awesome for the price. Good value.  Sturdy and can be used for different things.
5,Hooks up easily. Works great for usb as well as helping upload pictures from our camera directly!
5,Just received the product and it is exactly as described.  I have my MacBook connected to a TV and Apple monitor and the TV picture is very clear. I had previous bought a few others but they wouldn't work with the TV so glad this one did.
5,Purchased the hub for my new MacBook Air m1. Just plugged in and was able to connect it with my external monitor which has an hdmi port. It's lightweight and also comes in with a nice black case. Perfect for the price you pay. Highly recommend!
4,Much smaller than I anticipated but I'm happier with this size. Versatile and works well with my IMac (M1 2021) so that I can have multiple things plugged in at once.
5,Works well with iPad Pro. I'm using it to hook up an audio interface to stream live to Facebook.
5,Plugged it in and it worked with no issue! Connects fine to devices and even SD cards.Great little device for my MacBook Pro (13-inch M1 2020)!
4,Works with my Macbook Pro 2019 well. There are times though when my mouse and keyboard stop working and I have to restart computer. Not often but still an issue.
5,I like the design of this adapter. It keeps my cords from bending in ways that would damage them. Overall a very effective product for Macs.
5,Exactly what you could’ve asked for. Fits in 2 usb 1 usb-c and even an HDMI. great product
5,It works plus for my MacBook Air and iPad mini - it just does its job.
5,the product is as described and seems to have no negative affect on battery.
5,I needed this in order to transfer my photo files from my Nikon D7000. Looking forward to finding other ways to incorporate this into my daily computer needs.
5,This hub suits my needs perfectly. Pairs easily with MacBook air doesn't need a lot of space solid connection. The entire process was seamless quick easy. Wished I bought this years ago before I got rid of memory cards.....  A superb Prime Day purchase. Everyone with only a C port on their laptop needs one of these hubs.
5,I use it for my dj controller and it works perfect
5,Using on Macbook Pro 2022; works great for wired keyboard and mouse
5,I like the small bag that comes with the adapter since I travel for work sometimes.  Also it was easy to set up quickly with my Mac and even charge my phone at the same time.
5,Great product. Easy to use
5,I bought this to use with my new 2022 M2 MacBook Air. Every port works great to access all of the features. Compact enough to keep with me in my backpack so I can have access to the different ports on the go. Must have for Mac users!
5,Very easy to use. Works perfectly with M2 MacBook Air. I am happy with it.
4,I have used many of these before and this is a solid one. I usually get issues with loose ports but do not foresee that happening. I have a mic computer and keyboard connected. HDMI not working but it may be my computer configuration
5,Perfect for a tablet.
5,So easy to use -- plugged it in to Macbook and used the HDMI input for a second monitor ... worked perfectly with a few setting adjustments on my macbook. Perfect for what we needed for a collage student to use a larger monitor with Macbook.
4,2 of my 3 USB ports stopped working and my HDMI port was acting up as well. I was looking for a workaround. This looked like it would work. It is very nice out of the package light and sleek. However the cab;e is only about 6 inches long(see pic). I use my laptop on my lap and the unit kept falling off. My computer an Acer Swift 3 using windows 11 kept saying it was unrecognized. When I hooked up the HDMI it didn't work. This may be due to a defect in the unit I got. I returned it mostly because of the cable length.
5,Compatible with my MacBook Pro! I love how versatile this product is (hdmi compatible usb b usb c hdmi memory card)
5,This product is very useful for interfacing with MacAir. I used for data transfer .Very fast and easy .It's very light weight. easily portable and simple to operate. it's simple to work with any medium for data transfer.
5,Works will dell xps 15 9520
4,This USB-C Adapter works great! I use it with my 2019 16-Inch Macbook Pro. The adapter works when using both Mac OS and Windows. There is little to no delay when using the HDMI port on the adapter. The USB ports also work great with my keyboard and mouse. The only thing I'm wary about is the Micro SD Reader. When inserted correctly the Micro SD Card reads flawlessly. Moving data to and from the card is quite quick as well. The problem is that you really need to make sure you put your Micro SD in the reader very carefully. Certain Micro SDs could possibly get stuck if put in the wrong way. This adapter is great but be very careful when using the Micro SD reader.
5,I like this USB hub. It has just the connectors that I need. I know there are others that have 10 11 or even 12 connectors but for me this one is perfect. It is small compact lightweight and just works. I am using it with a 13 inch MacBook Pro with the M1 processor without any issues. I would recommend this to anyone who is looking for a USB hub and doesn’t want to spend $20 $30 or more dollars.
5,works with Macbook Air M2 and Cintiq13HD
5,Small in size and dies the job
5,I havent tried the hdmi yet but it's compatible with my MacBook Pro 2017 and the SD cards and the USB works really well :) I'm happy it comes with a little bag :)
4,works with macbook pro like i expected but i was also able to use it on my 2021 ipad pro
5,Works great!
5,Perfect compatibility for my new Mac Book M2 2022 13in. I enjoy having this so I can still use my HDMI and flash drives! The quality with connection is perfect. Highly recommend.
5,Lo he utilizado con Lenovo Yoga Surface pro8 MacBook Air y Asus GL502 sin dificultades.
5,Works with MacBook Pro well
5,
5,The adapter works with my Macbook Pro 2020 model and my HP display. Everything looks good to me!
5,This device works great with Steam Deck.  Outputting had some major input and audio lag with 4k tv when playing games  however it ran seamlessly on my 1080p tv and monitor which are the ones I mostly use.
4,This device works as advertised. I have tested all the outputs except the HDMI. The only problem was SD cards want to miss the socket and slide inside the case of the device.
5,Works well with MacBook Air 2021
5,Fantastic port and worked great with my 3rd monitor hdmi cord
5,Finally don’t  have to have 5 different gadgets to do one job!  Love it .. transferee pictures easily!!👍
5,wanted to be able to have more adapters and have something that I could hook up to my computer monitor and this worked great for a really good price works with 2022 MacBook Pro
5,This was great for my MacBook Pro 2019. It allows me to plug my hdmi cord and charger in through the same single port!
5,Sleek and efficient =) Recommend! Works with MacBook Air
5,I've had this for about a day and it works great with the M2 MacBook Air 2022.  Helps free up ports and doesn't get in the way of the MagSafe charging port.  Pretty fast reading also.
5,Light weight with solid looking.  Works perfect for my MacBook Air.  When you carry a backpack for a day every gram adds up.
5,I love/hate my Apple laptop; it's a superior product but of course you have to buy extra adapters for everything. I didn't even look at how much the official Apple adapter costs (I'm sure it's a lot!). I found this on Amazon and after reading it's almost universally positive reviews for a really affordable price I got it myself. It's great! I've personally tested every single plug-in and they all work flawlessly. This is a great product at a great price!
3,When this is plugged into the port it causes problems when trying to save (program can get hung up and become unresponsive) until I unplug it.  After I unplug it the program saves whatever I was working on. It also prevents the computer from restarting.  I am past the return window but will look for a different one to use.
5,Works with iPad Air 5th generation. Exactly what we needed
5,Works great with my MacBook Air M1.  The video USB power and USB ports work perfect.  I haven't tried out the memory card readers yet.  I even have a USB hub plugged into one of the USB ports and they all work.  Great value for the price.  I'm going to buy another one to use in my RV.
5,Loved getting this product in and having it work right away with my Macbook air (2018). I had recently bought a monitor and this allowed for connectivity between the two. The HDMI output is great and the rest of the ports work as advertised!
5,I have a Macbook Pro and it works seamlessly with it.Tried microsd and USB and works smoothly so far..Value for Money
5,works with Mac book air 2020. and the HDMI adapter works great and the monitor responds in real time. I would recommend to anyone on a budget.
5,This has been a reliable and versatile connector for my M1 MacBook Air.  HDMI works great and it’s just the right combo of connections including USB-C that I need.
5,works with MacBook Air seemlessly.  No install or set up...it just works
5,Just what I needed!  This works with my new MacBook Pro A2485.  The internet in my kitchen is very slow so I wanted to plug my MacBook into the internet.  I also wanted a wired mouse.  My MacBook has none of these plugs.  This adapter works for all my needs.  I can also view sd cards!  Very happy with this purchase.
5,Works just fine for MacBook Pro. Can finally plug in USB’s with ease.
5,Easy to use. Works great. Hooked my MacBook air up to my hp monitor with it. Everything works as should. Would definitely recommend!
5,This product is great! I used it get photos from my camera on a micro SD card onto my 2021 MacBook Air and it works great! Though sometimes my computer had a hard time recognizing the item but it served it purpose and is the cheapest one I’ve seen so I would recommend this!
5,I have purchased this adapter for my newmac and i’m more than satisfiedIt’s very easy to use and maintain.You can use it not only for HTMI.Quality is great.Highly recommend this product to everyone
5,Works with the new MacBook I just got and needed for school. I really needed a way to connect my camera so I love the SIM card adapter.
5,Perfect tool for using a projector in a venue where I just brought my computer and the docking station. Portable small and efficient.  Great product.
4,- very light & portable- works well with MacBook Air
5,Works with MacBook Pro 2022
5,Placed the order with same day delivery because I was in a pinch. It arrived by 2:30PM and I plugged it right in. Worked flawless on my Dell XPS which only has the USB-c ports. I have a couple devices with regular USB ends so this is great to have. Another great feature which I will be using is the SD card reader. I still use an old shock proof digital camera while out onsite and this is a great way to zip my photos over to my laptop. Overall best bang for your buck with value and performance!
4,I like how its small. Works well with macbook pro 2020
4,Received in June 2022. Works with MacBook Pro 14” . Easy and intuitive. I can recommend!
4,I bought this to use with my MacBook Air. I use it for the charger mouse and HDMI cord. So far so good and worth the value.
4,Just purchased so review isn’t from a long term use perspective. But the packing was tamper proof yet easy to open. Once I plugged it into my laptop and inserted my usb I was able to use the additional apparatus and a good plus was that I didn’t have to take the backing from my laptop off to use it like others (helps with scratch protection).
4,I bought this to use with my MacBook and it works well and as intended.
5,I bought this for use with my new MacBook Pro 13". I wanted something with many different ports and something slim that would be easy to carry with me. I chose the c wired end because I thought dongles that plugged directly into the 2 ports on my computer might get easily bent. This one gives me more flexibility to set my computer on different surfaces.
5,Very versatile. Works with MacBook Air 2019. I also use it to plug my HDMI and watch movies on a bigger screen. Doesn’t look cheap fits the aesthetic. I would recommend!
5,My Microsoft surface only has one usb-c port and this allows me to do more and have more connections !
5,Flexibility and compact it serves a variety of configurations that handles any form of outlet whether it’s an old Mac… A new Mac… Or any other Mac!
5,I like it. Good Quality. It’s works for my MacBook.
5,Great extention compatible with MacBook Air 13 inch with M1 chip. Very smooth user experience - easy to setup and get the device working
4,Does the job; however if you plug in too many things at once it makes everything lag. I can't use my mouth and dual screen because the mouse is incredibly delayed. Otherwise it's good to go.
4,It works well and is super easy to access the ports would recommend.
4,Easy to use as described. Works well work my MacBook Air. Light weight and can fit in my laptop sleeve easily.
5,It seems you have to change the options to the mouse settings. It might scroll in the inverse order.
5,Exactly what I needed.
5,Works with my MacBook like I needed it too. Also worked with our iPad which was great! I’m always a sucker for a knock off brand that works just like name brand.
5,I bought this dongle as a Hail Mary because I'd tried everything else to get my monitor to respond effectively when I awakened my computer.  I have a 2019 MacBook Air.  This B3 was incredibly simple to use -- easy to insert the cords into the appropriate ports -- and immediately my monitor came to life.  Sleeping Beauty awakens!  5 stars.
5,This adapter made it easy to control the tangle of cords required for my extended display set up when using my macbook air. It is small sleek and the extended cord allows for better cord management for a neater set up in your workspace. Very happy with the overall plug and play usability as well as the numerous ports for easier use with my apple products with only the fraction of the cost for the same products provided by apple!
5,Was looking for a 4k HDMI adapter to connect a MacBook Air 2021 and a Lenovo 4k IPS UHD monitor and this one works perfectly. Easy to hook up and looks more compact in person than the picture shows. Used the spare USB-3 ports for mouse and keyboard all without issues.
5,I just needed a way to hook up another monitor to my 2017 iMac and I purchased this one because it had several other ports. I’ve already found uses for the ports I thought I didn’t need 💜 Works exactly as needed/promised. 🙌🏻
5,Very light weight slick compatible with most Mac books ready to use at any time. Does not take long periods of time to load. Very efficient for your money. Will buy in future.
5,works with my Macbook Pro 2019 Dell P2415H.i really enjoy it and it has a HDMI port which is perfect!! love this USB c type HUB
5,Everything works well with my macbook pro. Good product for a good price!
5,Great product - been using it for a month now. Hopefullly will last long
5,Easy plug and play. Compatible with MacBook Pro
5,es compatible con MacBook Pro 2020 es liguero y tiene todos los puertos de entrada descrito
5,At this price point it's hard to find another product that compares. $20 or below and you get basically an additional four ports for the price of one USB-C port. I use this hub mainly to connect a Ledger crypto wallet that utilizes micro USB to my Macbook Pro which only has USB-C ports. I've also used it to connect USB 3.0 flash drives to my Mac and it has worked perfectly thus far.
5,Came in handy when I was in Germany to charge my Apple Watch and ear buds. Also worked with USB storage stick. I just bought new 2022 MacBook Air.
5,I just bought a new laptop and was struggling with the lack of ports and needed an adapter. When I started to look many did not have the SD card reader and the ones that did were pretty expensive. I was happy to find this one at a price I felt comfortable paying. It's easy to use - light but not so light that if feels cheap. I am very happy with the product.
5,I have been using this everyday for a little over a month now with my m1 macbook pro and have 0 problems. I highly recommend this purchasing this port.
5,I am happy with this product thanks
5,I have a Dell XPS 15'' (XPS 9320). This USB C Hub works great! I use the HDMI/USB/SD ports daily and they work great.
5,I am using this with a MacBook Pro 14-inch 202 and it works well for the USB the smaller ones and it also works very well for charging devices.
5,This hub works well with the MacBook Air.  I bought it to connect my new laptop with my current home office setup and it integrated the laptop seamlessly.
5,Does exactly what is mentioned in the description.Product is so compatct and light weight.I like the product.
5,Great build quality - a huge upgrade from the dongle that cam with my computer with way more ports and better quality parts
