rating,review
3,Used this to restore windows on an HP x360.  It worked to add a USB network card since windows wasn't picking up a driver for the internal card- which impressed me.  I also was able to use it to copy files to various media from my HP Zbook 14u.***Update***Returned - luckily I tested the data transfer speeds before my return window closed.  The advertised rate of speed for TF card data transfer was not met.  I never got data to transfer at above 15MB/s (85%+ slower than advertised is significant).Also- the USB C port on this is power pass through only.  If you read the description with this in mind you can tell that it's advertised this way.  However I think most people will assume you can connect a USB C device (a phone hard drive etc.) and have it recognized and work.  That is NOT the case.  It supplies power pass-through only- NO data.It does some things well but ultimately did not live up to what is advertised so I've reduced my rating to three stars and I have returned the product. I primarily wanted this to move large files to a micro SD (TF) card at high speed and it does not do that.
5,Works with MacBook Pro 2019 Dell P2415HIts light weight so you can carry it around easily it has great quality of material and it’s not expensive at all
5,The product is lightweight and sturdy. I'm able to connect thumb drives to my MacBook Air and also connect my extra monitor to my MacBook via HDMI.
5,6 in 1 hub works great.
5,This is exactly what I expected it to be. Works flawlessly and I love the charge through feature. I can leave this hooked up to my MacBook and charge whenever I need to without needing to take up another valuable port. Definitely recommend. Shoulda bought sooner.
5,It works with my MacBook Air perfectly
5,I’m using this for my projector and it connects really well to my MacBook Pro. Love the little bag it comes in too.
4,ease ofuse
5,Todo muy adecuado y funcional
5,Light weight does not heat up like the others I’ve tried but only 5 out of the 6 ports work. The USB-C port doesn’t as it neither charges devices nor access device data.Update: The one delivered had only 5 ports working but the supplier provided me with excellent customer service and sent me a new device with all the 6 ports working perfectly fine. i recommend.
5,Works well on my Mac
5,Works great for all the stuff I need to hook up to my laptop in the office
5,Love the SD slot. Super convenient Cord so I can plug other things along with it
4,works fine with macbook pro 2019! 🙂
4,Works fine with MacBook Air. Worth what it costs. Only issue I’ve encountered so far is that when plugging in the HDMI cord to connect to the TV it transferred the image but not the sound. But in all fairness I’ve only tried once.
4,It took a lot of messing around to get the USB ports to recognize my mouse receptor. but onces it got working it worked well.
4,This product is simple and easy to use and the price is right.  I also like that the connection to my Macbook Air does not block the power port like some USB C Hub adapters do.
5,Works perfectly with my new surface pro 8! Will make it easy to project and use my flash drives etc.
5,Works great with MacBook Pro. Super versatile! Makes giving presentations easier and is compact for travel. Happy with my purchase!
3,I have an HP monitor with a usb c adapter that works fine when plugged directly into my macbook but plugging into this adapter it doesn't work.  The other usb a ports seem to be working and didn't test the memory card slots.
5,This product was perfect for the work that I needed to do from home. It made it possible for me to attach to a large monitor still using my own Mac laptop. This made my work so much easier. And delivery was fast.
4,Works with mac book pro 2022
5,I used this to connect my MacBook Air to my Cricut Air machine.  Worked perfectly.
5,(I use a MacBook Air M1)Personaly I only needed it for usbs but the HDMI is great to have. I have used it for Netflix works great and honestly charging with works great too. I did not notice a difference when charging through the extension cable. The 2 USB ports work and I don’t really need anything else from the cable and does the job for what I need it.
5,Works great with MacBook Air 2022.
5,Hands down this is the best option for your SteamDeck it works flawlessly. I absolutely love how fast and how perfectly discrete it is. Perfect for full PC compatibility.
5,It works good with my Macbook Air.
5,I recently bought a new Apple MacBook that does not have a traditional USB port. I use various items that connect to my old MacBook but needed a new connector to help with my HDMI and SD needs. I was able to find this adapter which works perfectly. It’s great having one adapter too!
5,Ordered this adapter when we purchased a new 13" MacBook Air with thunderbolt ports and USB-C ports. Since USB ports were no longer available we needed an adapter and this works great with our new MacBook!
5,Works as advertised with all type of connections - great product
5,Hooked it up to my MacBook and monitor it was super easy to use and works great. Love the way I can hide it for a cleaner desk setup.
5,Works great with my lenovo duet 5 it was not too pricey either. I'm enjoying all the accessories that I can use now because of this USB C-Hub
5,I think this product is great. It does what I need it to do.
5,Annoying that apple has gotten rid of all the ports on their computers. Luckily this little device allows you do all the things you used to be able to do on an old desktop. I use mine with my mac book air. Works great!
5,I love this device because it works well with my MacBook and I don't have to have a million dongles :O)  I also like that I can use this and still have my charging port
5,Using on MacBook Air for work to connect a 2nd screen charge my laptop and connect my wireless mouse/keyboard.  Works great and not having any issues. Definitely worth the money!
5,Exactly what I needed to quickly disconnect one plug and go mobile. I have my USB mouse keyboard Bluetooth headset dongle and HDMI monitor plugged in and it works perfect.
5,Multiple ports are well made no problems connecting my Macbook Pro with my Dell Monitor and sleek design make it nice to fit on my desk.
5,Works great with MacBook Air M1 2020. It is easy detected when inserted or taken out
4,Works greatperfect size to throw in bag and go
5,Easy to use. Plug and go. Could not be easier. Thanks for the GREAT product.MacBook Air is my machine and it is fantastic
5,I wanted an adapter that I could use to give me an extra port as I am using an external monitor with my laptop.  Although I could not run the monitor through the extra port I was able to charge through with the charger so it ultimately worked for exactly what I wanted to accomplish.  I am now able to charge run my external monitor and still have other available USB ports without having to disconnect the power or extra monitor. Great product.  Recommend.  Also made solid.
5,I bought this product so I could use my trackball mouse with my new MacBook. It is plug-and-play compatible and works well with my 2017 MacBook Pro. I would definitely recommend it to anyone who needs the expanded capabilities it can provide for your Apple laptop.
5,Works great with HP EliteBook 845 and Desk monitors happy about it
5,This was a nice quick solution to be able to plug into my Mac that only has c-ports. It worked with one screen but trying to do dual screens didn’t work. I would recommend this product
5,Very easy to assemble and connect to my computer. Sleek and compact. We’ll worth the money. I was flabbergasted by the product. My dreams have come true. I can now utilize all of my products with ease because of this! 10/10 would recommend.
5,works with MacBook Pro also doesn't happen in overheating
5,Love the sleek look and that it has every port imaginable to fit my needs. I have had great success with this product and have used it to connect multiple devices including my 3d printer.
5,Works with macbookpro
4,It works great with my MacBook Air I mainly used it to get pictures off of an SD Card. Sometimes it was Glitchy or turned off a few times but overall it was great. it give an great options of USB ports for my Mac and also HDMI.
5,Whenever I opened the box I did not think that the material would feel so nice. It is almost the same material as my macbook. Very satisfying to hold and a great product.
5,Really glad that I purchased the B3 USB C Hub HDMI Adapter for my new MacBook Air. It works perfectly and it's simple and compact allowing me to charge my Ihpone run my HDMI cable to my second monitor and use my SD Card at the same time. And when I travel it fits in my backpack with ease.
5,Worked right away! Packed great!
5,Worked well with my mac book pro 2018
5,Great tool! Easy to use!
5,I've been using with my MacBook Pro. I travel for work at times and it's great to have something so compact to work with.
5,Very good quality ships fast?
5,Bought two of these to use communally in our office. They work well with all of the different MacBooks to which they have been connected.
5,Works with imac 24 .Very gooD
5,Works great and has multiple options for outlets.
5,Works with Lenovo Thinkpad and Yoga very convenient!
5,Worked well with my Samsung Galaxy S My Tablet and my Nintendo Switch you have to have the power cord connected for the switch to work a lot better than using the dock. When using it form my phone I used it with Dex I had a full PC on my screen I also used a USB mouse and keyboard all worked well.
5,Multiple ports for all your needs. Attach multiple devices simultaneously. Same day delivery for a small fee was totally worth it when I needed to migrate all my data to a new MacBook.
3,Cheap product from China with a logo printed on it. Works for what I needed tho. Careful of your micro sd cards if you insert it wrong you may jam it into the device and not be able to retrieve it.
5,Bought it for connecting macbook and HP VH240a monitor works well
5,I recently purchased a new MacBook Pro and had to transfer data from my old MacBook and this was a needed purchase as the new MacBooks do not have USB ports. This adapter worked very well! Transfered my items at a good speed and I love that it comes w a small carrying bag and a cover on the actual insert to the computer to prevent dust entering it. Would recommend.
5,This is exactly what I needed. All I had to do is plug everything in and it started working right away.
5,Awesome product.
5,I've used this brand before and was happy to see the quality the same with this new device.Works with my 2021 MacBook Pro with M1 chip
5,Works with MacBook Air 2020
5,Small and very easy to use. Works well if you want to add a second monitor for a MacBook.
4,The media could not be loaded.                                                                                 I have an older MacBook Air and it didn't fit my computer but the shipping was really fast and it was a good quality product.
5,works with my 2021 MacBook Air and its price is great!
5,This is a great product and is super affordable. It does exactly what I need it to do. I am very happy I bought it. Would recommend!!!
5,I bought 2 of these adapters.  This one and one that plugs directly into my MacBook Pro M1.I like this one better with the flexible cable.  This is better quality and better price!!Love that this is all-in-one with usb sd cards hdmi & power input!Very happy with purchase
5,The item I received works beautifully I have no complaints about it. I would give this product 5 stars all around!
5,School just upgraded to MacBook Air (M1 2020) and I lost all of my USB and SD card slots from my previous laptop.  The B3 is as simple as it gets just plug and play!  1 device and I have all of my ports back that I need!
5,I've been using it for about a week now with my 2022 Macbook Air and it's been great. I've used the HDMI and USB ports and haven't encountered any problems. Hopefully it'll be able to withstand years of use.
4,Fairly decent quality for the price.
5,Product worked great with a Macbook Air!!  Loved It
5,Works well with Macbook Pro 2020 and HP VH240a
5,Great product works perfectly with my MacBook Air M1 model.
5,Haven't tried HDMI yet but the other connectors work great for me!  MacBook Pro m1
5,This ISB-C Docking station works wonderfully well right away without fuss or a hitch. Just plug it in to your MacBook and plug your usb products into the docking station and you're in business. No need to discard your USB devices. This station updates their compatibility immediately. So helpful and a really inexpensive solution.
4,It works very efficiently.
5,It's Awesome product works with the mac book pro.
5,Good price good build quality no complaints. Comes with a small travel pouch as well.
3,This product if your using HDMI it will only work on modern TVs but any tv within the last 6-7 years will not work on. Maybe Apple TV or better.
5,It is a fantastic product at such a low price. It works perfectly with my Macbook air M1 2020 and Nintendo Swtich. The video is very stable.
5,I was a little hesitant to buy it because of so many options online however I liked the price and the features it offers it works perfectly with my macbook air and now I can use usb which I needed a lot it is light but of good quality it comes with a protective cover and it is the right size I recommend it :)
5,Very happy with this product. It's perfect for my MacBook Pro which doesn't offer a standard USB port. I like the multiple ports and the aesthetic of this hub.
5,I can  use  keyboard  monitor  external monitor with my MacBook Air .
5,So far so good this works with a MacBook Pro 2020. A lot more compact than my impression from the website. Was able to plug in and charge my laptop and trackpad and tested out old video cards. Worked like a charm.
5,It works very well light weight and useful! I'm happy with my purchase!
5,This product works with Mac and Windows and is very easy to use.
5,Used this on a Mac Air M1 2020 model to connect to HD computer monitor and a usb 2.0 flash thumb drive. So far is working well for what it is supposed to connect. Mainly purchased it to connect a Sceptere HD computer monitor using an HDMI cord.
3,Came in fast but As soon as we got the adapter we put the SD card in and it went all the way in. It’s now stuck inside the adapter loose. Not even sure what to do now.Update: emailed Amazon for the defective adapter and will get a replacement. This product is new so it hasn’t been tested well yet. I will update again once we get the replace my.
4,Works with surface pro 7. Really good quality for a cheap price
5,This product works great especially for the price! (Don’t waste your money on a more expensive one.) I use this on my Macbook Air and have had no issues!
5,This adapter is fantastic! I have no issues using a variety of thumb drives and downloading all the information quickly onto my computer. I have a collection of work and photos on different drives and this adapter works great with every one of them. Great purchase at a reasonable price.
5,Easy to install. Works well to connect MacBook Pro to LG monitor.
5,Works perfectly fine. Easy to carry and connect
5,Technology moves so fast and this little device is such a simple solution to connecting my new Mac Book Air with older printer and Nikon camera. Keeps everything communicating easily.
5,The product works great! I use it to connect my iPad to my projector.
5,Installed and worked with my Mac Air just purchased.
5,This is a really good adapter!I had bought an adapter when I first got my mac two years ago and it quickly started to malfunction.I ordered another one but it didn't come with an HDMI slot so I had to return it.This cord has everything I need so it's great!
5,It’s value for money and easy to install. I was able to attach a big screen via HDMI using this.  There are additional USB ports too. It is light and easy to take along during travel
5,Got this item for my new Macbook Air M1 2020 and it works excellently. Has all the ports I need for my day to day activities highly recommend getting this device. Wasn't expensive and it works perfectly.
5,Had it for a month now and still love it
5,this product is very good for the price is just like the one you see in the picture and I works perfectly. totally recommend.
4,Works with Samsung Galaxy Go laptop.
5,Works great with Macbook Pro 2020. I use this on the road to hook up my laptop with an HDMI cable to hotel TVs. Great Value.
5,works great with mac book air 2020 had no issues with it.
5,Works great! Definitely worth the price.
5,I am very happy with the product especially for how much I paid. It was very easy to use and very self explanatory. The only complaint I have is that I can only use screen mirroring with it and it doesn’t play sound. Worked well with my MacBook Air and Insignia tv.
5,It's small and easy to connect my HP Spectre to an external monitor when I need it.
5,I tried it with my Asus and my wife's Macbook Air it worked great on both computers. I will surely buy another.
5,I was afraid to purchase products that are not produced by Apple for my MacBook Air. But the competitive price of this product attracted me. It works so good with my laptop that I can teach my classes unencumbered and  share my screen. I absolutely recommend it.
5,Works great. Same color as the slate gray which is nice.
5,Haven't had a chance to try every port but it's obviously a quality item.  I'm using it with my MacAir Pro 2022.
5,The product works exactly as I imagined and did wonderfully to connect my wireless mouse as well as my USB so now I can easily transfer data from one place to the other! It's really handy and I will be using this all the time!
5,All the USB ports and the HDMI work perfect a normal pc mouse and keyboard can be used with the usb ports
5,Works with MacBook Air 2015. Happy with the product.
5,This works great for what I needed it for. I hated not having a USB port on my MacBook because I couldn’t plug in my phone charger or Cricut machine. Now I can! Works perfectly.
5,it’s very light weight & worth the price
5,My mac has hard to get to ports on the backhand side. I tried an adapter that fell apart while trying to use it. Very poor design. Then I got this one. GREAT construction. Woks as expected.
5,Bought this so I could connect things to my phone while charging it. Seems most of the lower priced ones don't support charging but this one does. Tried with Pixel 5a and Galaxy A50 and both work well.
5,Works great omg youll love it
5,Works amazingly with chrome book and mac m1 2020 8gb 256gb.
5,The camera to my MacBook Pro broke so I had to order a new camera and an adapter to connect to my laptop. This adapter is very efficient and has a great price. I recommend buying this quality product!
5,This product is what I wanted for my Macbook Pro 2019 (16 inch )version. I don't need to connect my adapter in order for my mac to connect to the external monitor
5,We used it with a Mac book pro and it worked well no issues so far
5,Works well for Steam Deck Very nice
5,I really like that this product connects various types including USB C Hub SD card reader USB and Type C ports all in one device.
5,Works as described thank you ! Will buy more
5,Works perfectly with Samsung Galaxy S10e
5,It is easy to use on my MacBook Pro. Just plug and play method which I like.
5,Really good value for money very simple to use small and easy to store. All in a all a great purchase. I use this with my new MacBook Air and my Kingston USB drive.
5,I was looking for an USB-C adapter that would match my MacBook Pro’s Space Gray color. It works great well built and speedy. I recommend it.
5,I use this with my MacBook Pro. I have used the SD card slot and the USB slots .... both work super fast. I am very happy with this purchase!
5,Works great. Used it to save files from my Samsung S20 when the screen broke.
5,USB C Hub HDMI Adapter for MacBook Pro works really well with my new Epsom ES200 portable scanner. I had no issues connecting the scanner to my laptop via this hub.
5,
5,tested with M1 air switch (use switch charger for power) samsung tab.
5,Good value!
5,Works great with my 2021 MacBook Pro!!! Worth the money.
5,A real bargain it works great.  This product is comparable to products that cost twice as much.  I currently am using the hub with an external monitor and a flash drive.  I have no issues.
5,Used it to connect our Mac to our TV and display a slideshow for a party. It worked easily and very well.
5,Product works well with Macbook Air. I use it with to display my screen on a monitor and connect a bluetooth keyboard and mouse. Good purchase for work from home.
5,Works well with the new MacBook! Just plug in and you’re ready to go.
5,This product is exactly what i needed. It works great on my 2021 Apple Macbook Air to have more usb ports and an hdmi port to connect my extra monitor!
5,
5,I was able to hook up my projector computer and zip into the docking  hub and it worked splendidly with my MacBook Pro.
5,It works well with my Macbook air m1 2020. And I can connect to one external monitor while charging my device without any issue.
5,Works great for my new MACORO
5,It's compatible with my MacBook Pro has a sleek design the wire isn't too long and it serves its purpose.
5,No issues with this product and you can't beat the price.I would recommend.
5,It was received quite soon in Chile and fit and worked perfect
5,I got this in hopes that I would be able to charge my phone with it as the MacBook Pro does not have a USB slot and come to find out it works PERFECTLY.! I started testing it by plugging in my phone and my computer charger and it worked. I am excited to use this more often!
5,I have a new Mac Pro which no longer has any USP ports.  This device worked like a charm even allowed me to use an external hard drive to watch a movie DC.  I have not tried the ports for the SD/TF readers but everything else works great!!
5,The design of the adapter is very sleek and very easy to use. The connections aren't loose so you won't have to worry about any disconnections.
5,This was a great choice for my MacBook Pro since it only accepts the C-port usb. It also allows you to use several other adapters as well I would definitely recommend this device.
5,It works with MacBook Air 2019
5,The construction is solid and all connectors work as intended. I have no complaint about this product and would recommend purchasing. I use this with a MacBook Air 13-inch 2020 model no compatibility issues at all.
5,Just plugged this USB C to my laptop then attached my USB drive and transferred pictures. Off to the store to print my photos.
5,Ordering was easy. Product description met performance. Delivered on-time Works perfectly with my mac and accessories
3,I bought this product to use with my MacBook but it only works sometimes. lightweight product.
5,Great Price All ports work good quailty I have a 10.1 inched windows tablet. i just attached it to the back. Prefect size as you can see from the picture. I would pruchase again.
5,This product is amazing the flexibility and options it offers has really improved my productivity.  Would recommend it to everybody.  Also incredibly sleek design.
5,The media could not be loaded.                                                                                             Plugged in the adapter with my MacBook Air (2020) to my HP printer (6950) and it worked with the first strike of the enter key!  Since I am not tech savvy technology this easy is so appreciated.  If I can make it work you can too.  Highly recommend this product for it's seamless integration.
5,Our IT team could not get their screen to work through their docking system because I use a Macbook Air and not a PC. With this affordable adapter (USB C Hub HDMI Adapter for MacBook Pro) the "problem" was solved.
5,This is lightweight and works great with the latest MacBook Air.
5,It's handy and reliable. Definitely recommend!
5,Easy to use. Works well with MacBook Air!
5,Works good with my Mac book Air and Xp-Pen.Since xp-pen requires to have hdmi connection besides for mac usb-c as well.
5,Works great. I realized that I needed more USB ports but it gets the job done.
5,Works with the macbook air 2020 m1. So far the USB work. The ident key works and the PD charge pass through works.
5,Works with MacBook Air and Dell 11th Gen Intel(R) Core(TM) i5.
5,I like the size and ports it have alot for usb and hdmi perfect for public or on the go use
5,I bought this to  connect my new Macbook Air to an additional monitor. So far it has been working well and has the added benefit of additional USB ports since the Air does not have any on the computer itself. These connected to my wireless mouse and keyboard without issue.
5,The product arrived on time and it fits perfectly with Macbook Pro 2021 (M1). All ports are working fine and it seems the ports given are tighter to fit in. Overall a decent product.
5,Ordered this product for work worked like a charm for what I needed it for.Currently using with a M1 MacBook Pro.
5,It works amazing with MacBook 2018 I used to have another one and it was not working at all.
5,I just received my hub today and I love this product. It's a big help with me working from home
5,Came in very fast. I ordered the space gray and it true to it’s color. It’s very convenient and flexible because it is not directly plugged in to your computer it works with my new MacBook Pro. Super happy
5,Works with 2021 M1 MacBook Pro 14-inch. Lightweight sturdy durable.
5,It works with MacBook Pro M1 2021 I do love the Appearance and the colour and it’s work smoothly and I didn’t face any issue
5,alot better than the devices that connect straight to the Mac. Also so glad that it has an HDMI port.
